name,description,image,perfumeHouse,notes,product_url
Gaueko,"The Basque God of Night and all the perils of the darkness. Though he is the God of the Danger that Lurks in the Gloom, he is kind to men and warns them against the nighttime hazards and sets rules of conduct for both the living and the dead as they travel through his domain. It is said that since the warm, vibrant daylight is for the living, the abodes of night are reserved for the dead. All who heed his counsel are protected, but woe be to any man that disobeys the laws of Gaueko: he is swift to punish those that would scorn his advice. Blackened sandalwood and misty lavender, with curling wisps of smoky tobacco, nag champa, and labdanum.",https://blackphoenixalchemylab.com/wp-content/uploads/2013/07/GAUEKO-1-600x467.jpg,Black Phoenix Alchemy Lab,"[""Incense - Nag Champa"", ""Gods/ Goddesses - Basque"", ""Sandalwood"", ""Labdanum"", ""Dangerous"", ""Darkness"", ""Lavender"", ""Death - The Dead"", ""Night"", ""Gloomy""]",https://blackphoenixalchemylab.com/shop/general-catalog-perfume-oils/excolo/gaueko/
Hunter’s Moon: Tonka and Fossilized Amber,$29.00,https://blackphoenixalchemylab.com/wp-content/uploads/2024/10/tonka-and-fossilized-amber-lunacy-duets-2024-WEB-600x600.jpg,Black Phoenix Alchemy Lab,"[""A Little Lunacy"", ""Tonka Bean"", ""Amber - Fossilized""]",https://blackphoenixalchemylab.com/shop/a-little-lunacy-limited-edition/lunacy/hunters-moon-tonka-and-fossilized-amber-perfume-oil/
"Dead Leaves, Chocolate, and Toasted Hazelnut",$29.00,https://blackphoenixalchemylab.com/wp-content/uploads/2023/10/DEAD-LEAVES-CHOCOLATE-AND-TOASTED-HAZELNUT-pile-of-leaves-2023-WEB-600x473.jpg,Black Phoenix Alchemy Lab,"[""Chocolate"", ""Leaves - Dead"", ""Halloween 2023"", ""Pile Of Leaves 2023"", ""Hazelnut - Toasted""]",https://blackphoenixalchemylab.com/shop/in-memoriam/halloween/halloween-2023/pile-of-leaves-2023/dead-leaves-chocolate-and-toasted-hazelnut-perfume-oil/
Womb Furie,"In the middle of the flanks of women lies the womb, a female viscus, closely resembling an animal; for it is moved of itself hither and thither in the flanks, also upwards in a direct line to below the cartilage of the thorax and also obliquely to the right or to the left, either to the liver or spleen; and it likewise is subject to falling downwards, and, in a word, it is altogether erratic. It delights, also, in fragrant smells, and advances towards them; and it has an aversion to fetid smells, and flees from them; and on the whole the womb is like an animal within an animal.",https://blackphoenixalchemylab.com/wp-content/uploads/2024/02/womb-furie-lupercalia-2024-WEB-600x473.jpg,Black Phoenix Alchemy Lab,"[""Snake Oil"", ""Honey""]",https://blackphoenixalchemylab.com/shop/in-memoriam/lupercalia/lupercalia-2024/womb-furie-perfume-oil-3/
The Harlot’s House,"We caught the tread of dancing feet,We loitered down the moonlit street,And stopped beneath the harlot’s house.",https://blackphoenixalchemylab.com/wp-content/uploads/2018/11/BPAL_logo_circle_Placeholder_T.jpg,Black Phoenix Alchemy Lab,"[""Death"", ""Tea - White"", ""Sandalwood - White"", ""Violet"", ""Copaiba Balsam"", ""Oakmoss"", ""Angelica"", ""Death - The Dead"", ""Oud"", ""Olibanum""]",https://blackphoenixalchemylab.com/shop/general-catalog-perfume-oils/bewitching-brews/the-harlots-house/
Xiuhtecuhtli,"Patron of the Aztec pantheon, he is the personification of light within darkness, warmth in the cold, and life in, and after, death. He is a creative and destructive God of Fire and Light, and is appeased only by sacrifice, trial, and the slaughter of his people’s enemies. Copal, plumeria and sweet orange and the smoke of South American incense and crushed jungle blooms.",https://blackphoenixalchemylab.com/wp-content/uploads/2013/07/XIUHTECUHTLI-600x467.jpg,Black Phoenix Alchemy Lab,"[""Orange"", ""Copal"", ""Light"", ""Sacrifice"", ""Jungle"", ""Plumeria"", ""Gods/ Goddesses - Aztec"", ""Incense - South American"", ""Element - Fire""]",https://blackphoenixalchemylab.com/shop/general-catalog-perfume-oils/excolo/xiuhtecuhtli/
Collapsing Mosquito Netting,"Morning glory petals, twining dew-covered vines, and lilac butter.",https://blackphoenixalchemylab.com/wp-content/uploads/2024/02/collapsing-mosquito-netting-shunga-2024-WEB-600x419.jpg,Black Phoenix Alchemy Lab,"[""Vines"", ""Morning Glory Petals"", ""Lilac Butter""]",https://blackphoenixalchemylab.com/shop/in-memoriam/lupercalia/novel-ideas-for-secret-amusements-2024/collapsing-mosquito-netting-perfume-oil/
Sloth,"Thick, dark, sluggish and heavy with indolence: vetiver over black myrrh.",https://blackphoenixalchemylab.com/wp-content/uploads/2013/07/Sloth-600x467.jpg,Black Phoenix Alchemy Lab,"[""Dark"", ""Myrrh - Black"", ""Indolence"", ""Vetiver"", ""Sluggish"", ""Myrrh"", ""Black Myrrh""]",https://blackphoenixalchemylab.com/shop/general-catalog-perfume-oils/sin-and-salvation/the-seven-deadly-sins/sloth/
The Fox Sisters 2024,"For the sake of continuity the subsequent history of the Fox sisters will now be given after the events at Hydesville. It is a remarkable, and to Spiritualists a painful, story, but it bears its own lesson and should be faithfully recorded. When men have an honest and whole-hearted aspiration for truth there is no development which can ever leave them abashed or find no place in their scheme.For some years the two younger sisters, Kate and Margaret, gave séances at New York and other places, successfully meeting every test which was applied to them. Horace Greeley, afterwards a candidate for the United States presidency, was, as already shown, deeply interested in them and convinced of their entire honesty. He is said to have furnished the funds by which the younger girl completed her very imperfect education.During these years of public mediumship, when the girls were all the rage among those who had no conception of the religious significance of this new revelation, and who concerned themselves with it purely in the hope of worldly advantage, the sisters exposed themselves to the enervating influences of promiscuous séances in a way which no earnest Spiritualist could justify. The dangers of such practices were not then so clearly realized as now, nor had it occurred to people that it is unlikely that high spirits would descend to earth in order to advise as to the state of railway stocks or the issue of love affairs. The ignorance was universal, and there was no wise mentor at the elbow of these poor pioneers to point the higher and the safer path. Worst of all, their jaded energies were renewed by the offer of wine at a time when one at least of them was hardly more than a child. It is said that there was some family predisposition towards alcoholism, but even without such a taint their whole procedure and mode of life were rash to the last degree. Against their moral character there has never been a breath of suspicion, but they had taken a road which leads to degeneration of mind and character, though it was many years before the more serious effects were manifest.",https://blackphoenixalchemylab.com/wp-content/uploads/2024/11/the-fox-sisters-evening-with-the-spirits-2024-WEB-600x484.jpg,Black Phoenix Alchemy Lab,"[""Mahogany Wood"", ""Vanilla Bourbon"", ""Tea Roses"", ""Apple Peel"", ""Rose Geranium""]",https://blackphoenixalchemylab.com/shop/yule-2024/an-evening-with-the-spirits-2024/the-fox-sisters-2024-perfume-oil/
Pallid Bat,"I want my rooftop filled with Pallid Bats. Not only are they cute as hell, but their favored meal is the Arizona bark scorpion, whose sting is the most venomous to be found in North America.",https://blackphoenixalchemylab.com/wp-content/uploads/2018/10/GLbatsWEB-pallid.jpg,Black Phoenix Alchemy Lab,"[""Bergamot - Italian"", ""Ginger - White"", ""Tea Leaf"", ""Amber"", ""Incense"", ""Los Angeles Fires"", ""Bourbon""]",https://blackphoenixalchemylab.com/shop/the-city-of-angels/genius-loci-bats-of-los-angeles-the-city-of-angels/pallid-bat/
Rakshasa,"This haunting, exotic scent is named in honor of the shapeshifting demons from Hindu mythology. Sandalwood with rose and patchouli.",https://blackphoenixalchemylab.com/wp-content/uploads/2012/12/Rakshasa-1-600x467.jpg,Black Phoenix Alchemy Lab,"[""Exotic"", ""Rose"", ""Folklore - Hindu"", ""Sandalwood"", ""Shapeshifting"", ""Haunting"", ""Biblical - Demons"", ""Patchouli""]",https://blackphoenixalchemylab.com/shop/general-catalog-perfume-oils/bewitching-brews/rakshasa/
Jabberwocky,"And, as in uffish thought he stood,The Jabberwock, with eyes of flame,Come whiffing through the tulgey wood,And burbled as it came!",https://blackphoenixalchemylab.com/wp-content/uploads/2013/07/Jabberwocky-600x467.jpg,Black Phoenix Alchemy Lab,"[""Earthy"", ""Orange"", ""Pine"", ""Eucalyptus"", ""The Tulgey Wood"", ""Mad Tea Party""]",https://blackphoenixalchemylab.com/shop/general-catalog-perfume-oils/mad-tea-party/jabberwocky/
Aquae Massage,"In alchemy, the archetype of water represents cleansing and purification, emotion and intuition. We express that essence here through our blend of Roman chamomile, frankincense, sandalwood, helichrysum, davana, geranium, and lavender. This massage oil helps release emotional trauma, alleviates stress, and imparts a sense of tranquility and well-being.",https://blackphoenixalchemylab.com/wp-content/uploads/2019/05/Aquae.jpg,Black Phoenix Alchemy Lab,"[""Helichrysum"", ""Sandalwood"", ""Chamomile"", ""Lavender"", ""Geranium"", ""Massage Oil"", ""Davana"", ""This Massage Oil"", ""Frankincense""]",https://blackphoenixalchemylab.com/shop/body-beauty/massage-oil/aquae-massage-oil/
"Dark Chocolate, Coffee Bean, and Labdanum",$29.00,https://blackphoenixalchemylab.com/wp-content/uploads/2024/02/DARK-CHOCOLATE-COFFEE-BEAN-AND-LABDANUM-box-of-chocolates-2024-WEB-600x600.jpg,Black Phoenix Alchemy Lab,"[""Coffee Bean"", ""Labedanum"", ""Chocolate - Dark""]",https://blackphoenixalchemylab.com/shop/in-memoriam/lupercalia/lupercalia-2024/box-of-chocolates-2024/dark-chocolate-coffee-bean-and-labdanum-perfume-oil/
Snow-Covered Cathedral,Ecclesiastical incense wafting behind candlelit stained glass and icicles thrusting from stone archways.,https://blackphoenixalchemylab.com/wp-content/uploads/2023/11/SNOW-COVERED-CATHEDRAL-Snow-On-Snow-web-600x452.jpg,Black Phoenix Alchemy Lab,"[""November 2023"", ""Yule 2023"", ""Snow On Snow 2023""]",https://blackphoenixalchemylab.com/shop/in-memoriam/yule/yule-2023/snow-on-snow-snow-on-snow-yule-2023/snow-covered-cathedral-perfume-oil/
Hexennacht 2024,"A Walpurgisnacht delight since 2005!The Night of the Witches. In the Teutonic calendar, April 30, not October 31, was the night that the witches congregated to celebrate their Work through ecstatic dance, wild music and revelry. The witches fêtedwith spirits, fairies, and a bevy of otherworldly creatures atop Brockenberg peak in the Harz region of Germany, where they lit an enormous bonfire and cavorted naked until midnight… at which point they donned their robes, boarded their brooms, flying rams and sacred goats, scooped up their cat familiars, and sped off into the night. In later days, it was believed that on this night the witches conjured the devil, who would then select one of them for his bride. This perfume is the scent of the witches’ revel: German fir and forest herbs, incense and bonfire smoke, and the wet, glimmering scent of skin warmed by dance.",https://blackphoenixalchemylab.com/wp-content/uploads/2024/04/hexennacht-2024-WEB-600x443.jpg,Black Phoenix Alchemy Lab,"[""Fir - German"", ""Smoke - Bonfire"", ""Incense"", ""Herbs - Forest""]",https://blackphoenixalchemylab.com/shop/in-memoriam/a-little-lunacy/hexennacht-2024-perfume-oil/
Ladon,"The hundred-headed dragon that guards the garden of the Hesperides: dragon’s blood resin, golden apple, apple blossom, white musk and hyacinth.",https://blackphoenixalchemylab.com/wp-content/uploads/2018/11/BPAL_logo_circle_Placeholder_T.jpg,Black Phoenix Alchemy Lab,"[""Musk - White"", ""Resin"", ""Musk"", ""Apple Blossom"", ""Apple"", ""Golden Apple"", ""Dragon'S Blood"", ""White Musk"", ""Apple - Golden"", ""Hyacinth""]",https://blackphoenixalchemylab.com/shop/general-catalog-perfume-oils/ars-draconis/ladon/
Pumpkin Spice Everything  Soap,"Literally everything. Pumpkin spice it all. This soap is gently sprinkled with traditional spices: cinnamon, cardamom, allspice, and clove.",https://blackphoenixalchemylab.com/wp-content/uploads/2020/03/bpalsoap2020-pumpkin-spice-everything-600x640.jpg,Black Phoenix Alchemy Lab,"[""Allspice"", ""Vegan"", ""Cinnamon"", ""Clove"", ""Soap"", ""Cardamom""]",https://blackphoenixalchemylab.com/shop/bath/soaps/pumpkin-spice-everything-soap/
Malinconia,Domenico Fetti,https://blackphoenixalchemylab.com/wp-content/uploads/2023/04/MALINCONIA-february-2023-art-WEB-600x808.jpg,Black Phoenix Alchemy Lab,"[""Ambergris Accord"", ""Chrysanthemum"", ""April 2023"", ""April 2023 Lunacy"", ""Paper"", ""Myrrh Resin"", ""Orris Root"", ""Frankincense - Oman"", ""Smoke"", ""Violet Leaf""]",https://blackphoenixalchemylab.com/shop/in-memoriam/limited-edition-in-memoriam/paintings-curated-by-someone-living-through-their-first-actual-winter-ode-to-february/malinconia-perfume-oil/
"Pomegranate, Kyphi, and Oud",$29.00,https://blackphoenixalchemylab.com/wp-content/uploads/2023/11/POMEGRANATE-KYPHI-AND-OUD-pomegranate-grove-2023-WEB-600x473.jpg,Black Phoenix Alchemy Lab,"[""Pomegranate"", ""Kyphi"", ""Yule 2023"", ""Oud"", ""November 2023""]",https://blackphoenixalchemylab.com/shop/in-memoriam/yule/yule-2023/grove-of-pomegranates-2023/pomegranate-kyphi-and-oud-perfume-oil/
"Red Amber, Orange Blossom, and Pink Pepper",$28.00,https://blackphoenixalchemylab.com/wp-content/uploads/2023/11/RED-AMBER-ORANGE-BLOSSOM-AND-PINK-PEPPER-menage-WEB-2023.jpg,Black Phoenix Alchemy Lab,"[""Orange Blossom"", ""Menage A Trois 2023"", ""Amber - Red"", ""A Little Lunacy"", ""Pepper - Pink""]",https://blackphoenixalchemylab.com/shop/in-memoriam/a-little-lunacy/menage-a-trois/red-amber-orange-blossom-and-pink-pepper-perfume-oil/
Vintage Snow Clown Blow Mold,"Chase away the sads with a sip from a cheery snowglobe filled with slushy grenadine and lemon-lime soda, topped with a maraschino cherry and illuminated from within by 40 watts of glowing amber.",https://blackphoenixalchemylab.com/wp-content/uploads/2024/11/Vintage-Snow-Clown-Blow-Mold-WEB-600x473.jpg,Black Phoenix Alchemy Lab,"[""Cherry - Maraschino"", ""Cherry"", ""Activism"", ""Grenadine"", ""Lemon-Lime Soda"", ""Amber"", ""Lemon"", ""Amber - Glowing""]",https://blackphoenixalchemylab.com/shop/yule-2024/transanta/vintage-snow-clown-blow-mold-perfume-oil/
Aasimar,"A scent infused with celestial power: radiant white amber, earthy cardamom, orris root, celestial incense, and diaphanous vanilla silk.",https://blackphoenixalchemylab.com/wp-content/uploads/2025/01/aasimar-WEB-600x471.jpg,Black Phoenix Alchemy Lab,"[""Rpg"", ""Vanilla Silk"", ""Amber - White"", ""White Amber"", ""Amber"", ""Vanilla"", ""Orris Root"", ""Incense - Celestial"", ""Cardamom"", ""Artists - Julie Dillon""]",https://blackphoenixalchemylab.com/shop/general-catalog-perfume-oils/rpg-series/races/aasimar-perfume-oil/
Snaky-Hair’d Moirai Many-Form’d,"Tobacco-threaded incense smoke, labdanum, red benzoin, and blackened vanilla.",https://blackphoenixalchemylab.com/wp-content/uploads/2018/01/SNAKY-HAIR’D-MOIRAI-web.jpg,Black Phoenix Alchemy Lab,"[""Benzoin - Red"", ""Labdanum"", ""Red Benzoin"", ""Vanilla"", ""Incense"", ""Tobacco"", ""Benzoin""]",https://blackphoenixalchemylab.com/shop/activism/hymn-to-the-erinyes/snaky-haird-moirai-many-formd/
Persephone,"Daughter of Jove, almighty and divine, come, blessed queen, and to these rites incline:Only-begotten, Pluto’s honor’d wife, O venerable Goddess, source of life:‘Tis thine in earth’s profundities to dwell, fast by the wide and dismal gates of hell:Jove’s holy offspring, of a beauteous mien, Praxidike, with lovely locks, infernal queen:Source of the Eumenides, whose blest frame proceeds from Jove’s ineffable and secret seeds:Mother of Eubouleos, Sonorous, divine, and many-form’d, the parent of the vine:The dancing Horai attend thee, essence bright, all-ruling virgin, bearing heav’nly light:Illustrious, horned, of a bounteous mind, alone desir’d by those of mortal kind.O, vernal queen, whom grassy plains delight, sweet to the smell, and pleasing to the sight:Whose holy form in budding fruits we view, Earth’s vig’rous offspring of a various hue:Espous’d in Autumn: life and death alone to wretched mortals from thy power is known:For thine the task according to thy will, life to produce, and all that lives to kill.Hear, blessed Goddess, send a rich increase of various fruits from earth, with lovely Peace;Send Health with gentle hand, and crown my life with blest abundance, free from noisy strife;Last in extreme old age the prey of Death, dismiss we willing to the realms beneath,To thy fair palace, and the blissful plains where happy spirits dwell, and Pluto reigns.",https://blackphoenixalchemylab.com/wp-content/uploads/2013/10/persephone-600x467.jpg,Black Phoenix Alchemy Lab,"[""Pomegranate"", ""Rose"", ""Lovely"", ""Beautiful"", ""Hades"", ""Goddess - Demeter""]",https://blackphoenixalchemylab.com/shop/general-catalog-perfume-oils/excolo/persephone/
Chocolate Stout Cupcake Hair Gloss,Bittersweet chocolate cupcakes whisked with stout and topped with inky dark chocolate frosting.,https://blackphoenixalchemylab.com/wp-content/uploads/2024/11/chocolate-stout-cupcake-2024-yule-hair-gloss-WEB-600x600.jpg,Black Phoenix Alchemy Lab,"[""Dark Chocolate Frosting"", ""Stout"", ""Chocolate"", ""Cupcake""]",https://blackphoenixalchemylab.com/shop/yule-2024/yule-hair-gloss/chocolate-stout-cupcake-hair-gloss/
Samhain,"Truly the scent of autumn itself — damp woods, fir needle, and black patchouli with the gentlest touches of warm pumpkin, clove, nutmeg, allspice, sweet red apple and mullein.",https://blackphoenixalchemylab.com/wp-content/uploads/2024/09/samhain-halloween-2024-WEB-600x473.jpg,Black Phoenix Alchemy Lab,"[""Allspice"", ""Red Apple"", ""Pumpkin - Warm"", ""Apple - Red"", ""Apple"", ""Mullein"", ""Clove"", ""Patchouli - Black"", ""Nutmeg"", ""Fir Needle""]",https://blackphoenixalchemylab.com/shop/in-memoriam/halloween-2024/samhain-perfume-oil-4/
Women of Leisure,"Red currant, white honey, coconut milk, and amber.",https://blackphoenixalchemylab.com/wp-content/uploads/2024/02/women-of-leisure-shunga-2024-WEB-600x434.jpg,Black Phoenix Alchemy Lab,"[""Coconut Milk"", ""Honey"", ""Amber"", ""Honey - White"", ""Red Currant"", ""Currant - Red"", ""White Honey"", ""Coconut""]",https://blackphoenixalchemylab.com/shop/in-memoriam/lupercalia/novel-ideas-for-secret-amusements-2024/women-of-leisure-perfume-oil/
Headless,"To the extent that it still had a mind, or a face, both glowed with an unholy menace.",https://blackphoenixalchemylab.com/wp-content/uploads/2023/09/headless-drew-23-WEB-600x750.jpg,Black Phoenix Alchemy Lab,"[""Peppercorn - Red"", ""Amber - Blood"", ""Brimstone"", ""Nightmare Novellas 2023"", ""Halloween 2023"", ""Leather - Black""]",https://blackphoenixalchemylab.com/shop/in-memoriam/halloween/halloween-2023/nightmare-novellas/headless-perfume-oil/
A Doll’s Doll,"Something to hold and play with during the solitude imposed by winter: cool porcelain cheeks glowing with a blush of spun sugar, lacy carnation frills delicately strung with pearlescent snowberries, and the faintest dusting of chimney soot.",https://blackphoenixalchemylab.com/wp-content/uploads/2023/11/A-DOLLS-DOLL-GC-Yule-web-600x473.jpg,Black Phoenix Alchemy Lab,"[""Yule 2023"", ""Soot"", ""November 2023"", ""Yule Main 2023"", ""Sugar - Spun"", ""Cool Porcelain"", ""Carnation"", ""Snowberries""]",https://blackphoenixalchemylab.com/shop/in-memoriam/yule/yule-2023/a-dolls-doll-perfume-oil/
Nymph in a Goldfish Pond,"Franz HeinBloop! White and pink lotus, calla lilies, and freshwater pearls in a swirl of apricot, tangerine, mimosa, and mandarin.",https://blackphoenixalchemylab.com/wp-content/uploads/2024/05/nymph-in-a-goldfish-pond-may-art-WEB-600x900.jpg,Black Phoenix Alchemy Lab,"[""Lotus - Pink"", ""Mimosa"", ""Tangerine"", ""Orange - Mandarin"", ""White And"", ""Freshwater Pearls"", ""Lotus - White"", ""Apricot"", ""Calla Lilies"", ""Pink Lotus""]",https://blackphoenixalchemylab.com/shop/in-memoriam/a-little-lunacy/nymph-in-a-goldfish-pond-perfume-oil/
Blossoms,Albert Joseph Moore,https://blackphoenixalchemylab.com/wp-content/uploads/2023/04/blossoms-february-2023-art-WEB-600x1932.jpg,Black Phoenix Alchemy Lab,"[""March Paintings 2023"", ""Tulips - March"", ""April 2023"", ""April 2023 Lunacy"", ""Rose - White"", ""Vanilla - Madagascar"", ""Musk - White Silk"", ""Peonies"", ""Hyacinth""]",https://blackphoenixalchemylab.com/shop/in-memoriam/limited-edition-in-memoriam/oml-its-finally-march/blossoms-perfume-oil/
The Rice Field,"Rice milk, hay absolute, Oolong tea, honey dust, champaca, frankincense smoke, golden sandalwood, and heliotrope.",https://blackphoenixalchemylab.com/wp-content/uploads/2024/02/the-rice-field-shunga-2024-WEB-600x372.jpg,Black Phoenix Alchemy Lab,"[""Heliotrope"", ""Hay Absolute"", ""Frankincense Smoke"", ""Sandalwood"", ""Tea"", ""Rice Milk"", ""Honey"", ""Tea - Oolong"", ""Oolong Tea"", ""Golden Sandalwood""]",https://blackphoenixalchemylab.com/shop/in-memoriam/lupercalia/novel-ideas-for-secret-amusements-2024/the-rice-field-perfume-oil/
Fleur de Citronnier Hair Gloss,$5.50–$30.00,https://blackphoenixalchemylab.com/wp-content/uploads/2024/07/FLEUR-DE-CITRONNIER-hair-gloss-WEB-600x612.jpg,Black Phoenix Alchemy Lab,"[""Lemon Blossom"", ""Squirt"", ""Lemon""]",https://blackphoenixalchemylab.com/shop/body-beauty/hair-gloss/fleur-de-citronnier-hair-gloss/
Skelemingo,Increasingly common to North America as various decorative customs have been blown off-course by year-round Halloween revelry.Pink grapefruit and black licorice.,https://blackphoenixalchemylab.com/wp-content/uploads/2023/10/halloween-2023-Skelemingo-web-600x473.jpg,Black Phoenix Alchemy Lab,"[""Licorice - Black"", ""Halloween 2023"", ""Grapefruit - Pink"", ""Halloween Main 2023"", ""Black Licorice"", ""Pink Grapefruit""]",https://blackphoenixalchemylab.com/shop/in-memoriam/halloween/halloween-2023/skelemingo-perfume-oil/
Pirates!,"Gunpowder and salt-crusted leather, casks of scorched spices, sweet rum, and a clink of golden amber.",https://blackphoenixalchemylab.com/wp-content/uploads/2019/09/7hells-WEB-pirates-600x473.jpg,Black Phoenix Alchemy Lab,"[""Spice"", ""Perfume Oil"", ""Amber - Golden"", ""Amber"", ""Golden Amber"", ""Rum"", ""Gunpowder"", ""Leather""]",https://blackphoenixalchemylab.com/shop/collaborations/7-hells/pirates-perfume-oil/
Fleurs D’Oranger Hair Gloss,$5.50–$30.00,https://blackphoenixalchemylab.com/wp-content/uploads/2024/06/fleurs-doranger-HAIR-GLOSS-WEB.jpg,Black Phoenix Alchemy Lab,"[""Squirt"", ""Hair Gloss"", ""Orange Blossom""]",https://blackphoenixalchemylab.com/shop/body-beauty/hair-gloss/fleurs-doranger-hair-gloss/
Fancy Pups,"I am his Highness’ dog at Kew,",https://blackphoenixalchemylab.com/wp-content/uploads/2024/02/FANCY-PUPS-Lupercalia-Main-2024-WEB-600x473.jpg,Black Phoenix Alchemy Lab,"[""Tobacco Leaf - Rich"", ""Papaya"", ""Patent Leather"", ""Mango Cream"", ""Sugar - Pink"", ""Black Silk""]",https://blackphoenixalchemylab.com/shop/in-memoriam/lupercalia/lupercalia-2024/fancy-pups-perfume-oil/
The Witches Have a Fire Again,Smoldering spiced oak boughs and pine pitch crackling with golden sap.,https://blackphoenixalchemylab.com/wp-content/uploads/2023/09/THE-WITCHES-HAVE-A-FIRE-AGAIN-DUSK-IN-AUTUMN-2023-WEB-600x473.jpg,Black Phoenix Alchemy Lab,"[""Sap - Golden"", ""Pine Pitch"", ""Spice"", ""Golden Sap"", ""Pine"", ""Halloween 2023"", ""Smoldering"", ""Dusk In Autumn 2023"", ""Oak Boughs"", ""Oak""]",https://blackphoenixalchemylab.com/shop/in-memoriam/halloween/halloween-2023/dusk-in-autumn/the-witches-have-a-fire-again-perfume-oil/
Pericles,"Whereby I see that Time’s the king of men,He’s both their parent, and he is their grave,And gives them what he will, not what they crave.",https://blackphoenixalchemylab.com/wp-content/uploads/2019/07/indyshakes-pericles-WEB-pericles-2-600x473.jpg,Black Phoenix Alchemy Lab,"[""Oudh"", ""Rust"", ""Sea Salt"", ""Metal"", ""Pericles"", ""Sea Water"", ""Shakespeare"", ""Leather"", ""Armor""]",https://blackphoenixalchemylab.com/shop/collaborations/independent-shakespeare-company/pericles-perfume-oil/
"Dead Leaves, Shortbread, and Crystallized Ginger",$29.00,https://blackphoenixalchemylab.com/wp-content/uploads/2023/10/DEAD-LEAVES-SHORTBREAD-AND-CRYSTALLIZED-GINGER-pile-of-leaves-2023-WEB-600x473.jpg,Black Phoenix Alchemy Lab,"[""Leaves - Dead"", ""Halloween 2023"", ""Ginger - Crystallized"", ""Pile Of Leaves 2023"", ""Shortbread""]",https://blackphoenixalchemylab.com/shop/in-memoriam/halloween/halloween-2023/pile-of-leaves-2023/dead-leaves-shortbread-and-crystallized-ginger-perfume-oil/
Vigil for the Harvest Suitors,Power of the Witch lies in her respect and direct communication with nature. She may choose to give favor to those who can see her wisdom as authentic and beneficial.,https://blackphoenixalchemylab.com/wp-content/uploads/2022/02/vigilfortheharvestsuitorsBPAL-darla-WEB-600x809.jpg,Black Phoenix Alchemy Lab,"[""Bone"", ""Darla Teagarden"", ""Lilac"", ""Broomcorn"", ""Beeswax""]",https://blackphoenixalchemylab.com/shop/collaborations/darla-teagarden-altars/vigil-for-the-harvest-suitors-perfume-oil/
