name,description,image,perfumeHouse,openNotes,heartNotes,baseNotes,detailURL
Kaff,"KaffAttar 13 mlCollection:Tiziana Terenzi, Luna Star AttarThe work contained in this beautiful hand-made glass bottle is inspired by one of the brightest stars of the Cassiopea Constellation: Kaff means a fertile oasis of palm trees and like an oasis it embraces and revitalises us as we dive into a refreshing pool of harmony and cosmic plenitude.
Again on a quest for style, which began with the dreamlike journey towards the constellations and then the stars connected to them, here the olfactory pyramid of Cassiopea is again broken down and reformulated in an innovative, unique creation, capable of pushing itself beyond the furthest stylistic frontiers we know.
A trip along the tightrope, in hot pursuit of the emotional vertigo unleashed by the hypnotic opulence of White Iris, lashed sharply by the fresh citrus notes of bergamot, but immediately contrasted by the bold, concerted action of pink Pepper and ginger.
An unprecedented balance of essences generate this explosion of top notes that almost confuses us at first, as if it were a powerful drug, then carries us off in an amazing vortex.",https://terenziboutique.com/wp-content/uploads/2020/06/TTATT_KAF_A-600x635.jpg,Tiziana Terenzi,[],"[""iris"", ""magnolia"", ""sandalwood"", ""cedar"", ""vetiver"", ""amber"", ""leather""]","[""cedar"", ""tonka bean""]",https://terenziboutique.com/en/product/kaff-2/
Al Contrario,"Al ContrarioExtrait de Parfum 50 mlCollection:Classica Black, Tiziana TerenziThe Tiziana Terenzi collection has always been inspired by travel and experiences related to fire.",https://terenziboutique.com/wp-content/uploads/2020/06/TTPROF_ALC_A-600x635.jpg,Tiziana Terenzi,"[""sandalwood"", ""ebony"", ""benzoin"", ""vanilla"", ""sugar"", ""powder""]","[""sandalwood"", ""benzoin"", ""vanilla"", ""sugar""]","[""sandalwood"", ""benzoin"", ""sugar""]",https://terenziboutique.com/en/product/al-contrario/
Hyakutake,"HyakutakeExtrait de Parfum 100 mlCollection:Tiziana Terenzi, CometTiziana and Paolo’s intergalactic journey to discover the celestial emotions produced by
magical stellar fires continues.
Stars, in fact, are luminous fires that shine in the celestial vault, lighting up our nights.
Comets boast a distinctive, legendary charm, with their light able to bring gifts of joy, hope and
good fortune to mankind and those who have eyes to see them.
The creation is inspired by the world-famous Comet Hyakutake, which passed close to earth
on its endless journey in January 1996.
Known for its long, very bright tail, it was discovered by a Japanese amateur astronomer, Yuji
Hyakutake, sparking great astonishment in the scientific community.
Just like this fragrance dedicated to it, full of mystery and charm, it is capable of revealing itself
to pure eyes only, those able to look where most cannot see.
In the darkness of the deepest night, a powerful light pierced the sky on that cold January day,
and now this perfume warms the heart of whoever wears it, giving them an aura of mystery
and wild charm.
Hyakutake opens with a ‘hesperidian’ accord dominated by the effervescence of Sorrento
Lemon and Reggio Calabrian Bergamot, enriched by the spicy aromas of highly sophisticated
Malabar Cardamom and the balsamic reverberations of Greek Eucalyptus.
The head folds gently into an embrace given by the heart of the creation, where the delicacy of
Italian Wild Pansy and the strength of Tuscan Orris blend with the persuasive combination of
Ambergris and Omani Incense.
The base is characterised by an acrobatic balance of woods, where the trilogy of Japanese Larch,
Australian Sandalwood and African Iroko reverberate powerfully, softened and emphasised
by the scent of Virginian Tobacco and Haitian Vetiver.
This creation is imbued with mystery and seductive elegance, capable of ravishing and
bewitching, seducing and conquering, but above all capable of warming hearts with the joy
of its stately, timeless aroma, because its irresistible charm is suspended in the timeline, just
like travelling comets floating in the celestial sphere.More informationLess informationOlfactory PyramidTop Notes:Sorrento Lemon,
Reggio Calabrian Bergamot,
Malabar Cardamom,
Greek EucalyptusHeart Notes:Italian Wild Pansy,
Tuscan Orris,
Ambergris,
Oman IncenseBase Notes:Japanese Larch,
Australian Sandalwood,
African Iroko,
Musk,
Virginian Tobacco,
Haitian VetiverIngredientsIngredienti/Ingredients: Alcohol Denat, Parfum (Fragrance), Alpha-Isomethyl Ionone, Limonene, Hydroxycitronellal, Linalool, Farnesol, Geraniol, CitralWarningsFlamable.",https://terenziboutique.com/wp-content/uploads/2023/05/TTPROF_HYA_A-1-600x635.jpg,Tiziana Terenzi,"[""bergamot"", ""lemon"", ""sandalwood"", ""cardamom"", ""musk"", ""ambergris"", ""eucalyptus"", ""tobacco""]","[""sandalwood"", ""musk"", ""ambergris"", ""tobacco""]","[""sandalwood"", ""musk"", ""tobacco""]",https://terenziboutique.com/en/product/hyakutake/
Ursa,"UrsaExtrait de Parfum 100 mlCollection:Tiziana Terenzi, LunaThe story of this fragrance starts around Lake Como.",https://terenziboutique.com/wp-content/uploads/2020/06/TTPROF_URS_A-600x635.jpg,Tiziana Terenzi,"[""vetiver"", ""patchouli"", ""oud"", ""nutmeg"", ""elemi"", ""leather"", ""vanilla"", ""tobacco""]","[""vetiver"", ""patchouli"", ""oud"", ""leather"", ""vanilla"", ""tobacco""]","[""oud"", ""leather"", ""vanilla""]",https://terenziboutique.com/en/product/ursa/
O’Vesù,"O’VesùExtrait de Parfum 100 mlCollection:Tiziana Terenzi, VulcaniTiziana Terenzi’s new ‘Vulcani’ collection is a primordial creation that captures the essence of the indomitable Vesuvius.
This fragrance is not just an essence, but a journey, a liquid epic that encapsulates the mystery and grandeur of Italy’s most famous volcano.
The craftsmanship of Paolo and Tiziana Terenzi is evident in the way the perfume evolves on the skin, at times a warm, enveloping embrace, at others a cool breeze reminiscent of early morning on the rocky slopes.
The creation encapsulates a piece of land scorched by the sun and enriched by history.
O’ Vesù appeals to those who dare to approach fire without fear of being consumed, to those who wish to carry with them the echo of a powerful and ever-changing land.
The design of the bottle itself is a tribute to the beauty of Vesuvius, with lines that evoke its majesty and grandeur, and a cap texture that seems to capture the hardness and darkness of the volcano’s ash.
It is a collector’s item, as precious as the fragrance it contains.
The creation opens with citrus notes, with Neapolitan Grapefruit shining through thanks to its vibrant citrus acidity.
Alongside, Peruvian Pink Pepper dances with a spicy and slightly sweet touch, while Amalfi Rhubarb adds an unusual, almost crystalline acidic freshness that teases the senses in a delicious prelude.
This captivating head rests on an opulent, sweet heart.
Indian Jasmine Petals unfurl their opulent floral sweetness to weave a ribbon of fragrance that envelops and seduces.
Italian Leather introduces a rich, earthy texture that evokes craftsmanship and tradition, while Ambergris adds a mysterious, deep warmth.
Finally, Vesuvius Lava Stone carries with it a primordial force, a fiery reminder of its wild, volcanic origins.
The strength of this creation is built on a very structured foundation.",https://terenziboutique.com/wp-content/uploads/2024/09/TTPROF_VULOVE_A-600x635.jpg,Tiziana Terenzi,"[""jasmine"", ""grapefruit"", ""sandalwood"", ""cedar"", ""vetiver"", ""birch"", ""pepper"", ""pink pepper"", ""ambergris"", ""leather""]","[""jasmine"", ""sandalwood"", ""cedar"", ""vetiver"", ""birch"", ""ambergris"", ""leather""]","[""sandalwood"", ""cedar"", ""vetiver"", ""birch""]",https://terenziboutique.com/en/product/ovesu/
Bigia,"BigiaExtrait de Parfum 100 mlCollection:Anniversari Gold, Tiziana TerenziThis extrait originates from the creativity of Grandpa Gumìn and is dedicated to Donna Luigia, his beloved wife.",https://terenziboutique.com/wp-content/uploads/2020/06/TTPROF_BIG_A-600x635.jpg,Tiziana Terenzi,"[""rose"", ""magnolia"", ""oud"", ""agarwood"", ""saffron"", ""amber"", ""musk"", ""passion fruit""]","[""rose"", ""magnolia"", ""oud"", ""agarwood"", ""amber"", ""musk""]","[""oud"", ""agarwood"", ""amber""]",https://terenziboutique.com/en/product/bigia/
Foconero,"FoconeroExtrait de Parfum 100 mlCollection:Classica Black, Tiziana TerenziThe creation contained in the black bottle of the classic collection is inspired by a journey to one of the most beautiful gulfs in Italy.",https://terenziboutique.com/wp-content/uploads/2020/06/TTPROF_FOC_A-600x635.jpg,Tiziana Terenzi,"[""lily"", ""lily of the valley"", ""bergamot"", ""lemon"", ""lime"", ""sandalwood"", ""patchouli"", ""cardamom"", ""thyme"", ""lavender"", ""moss""]","[""cardamom"", ""musk""]","[""sandalwood"", ""patchouli"", ""moss""]",https://terenziboutique.com/en/product/foconero/
Tabit,"TabitExtrait de Parfum 100 mlCollection:Tiziana Terenzi, Luna StarThe work enclosed in this Extrait de Parfum is molded while traveling on the wings of a dream.",https://terenziboutique.com/wp-content/uploads/2020/06/TTPROF_TAB_A-600x635.jpg,Tiziana Terenzi,"[""coconut"", ""leaves""]","[""musk"", ""vanilla"", ""coconut"", ""peach""]",[],https://terenziboutique.com/en/product/tabit-2/
Cassiopea,"CassiopeaExtrait de Parfum 100 mlCollection:Tiziana Terenzi, LunaThis composition was born from a trip in the family holiday home, where, in the company of the whole family, Tiziana and I spent happy days running in the woods, listening to Grandfather's stories about plants and flowers, playing at recognising their scents.",https://terenziboutique.com/wp-content/uploads/2020/06/TTPROF_PEA_A-600x635.jpg,Tiziana Terenzi,"[""lily"", ""passion fruit""]","[""lily"", ""lily of the valley"", ""carnation"", ""sandalwood"", ""tea""]","[""sandalwood""]",https://terenziboutique.com/en/product/cassiopea/
Saiph,"SaiphAttar 13 mlCollection:Tiziana Terenzi, Luna Star AttarThe creation contained in this attar was born from a journey of exploration, which the mind accomplishes through memories that come together in the childish dream of a fairy country.",https://terenziboutique.com/wp-content/uploads/2020/06/TTATT_SAI_A-600x635.jpg,Tiziana Terenzi,"[""rose"", ""bergamot"", ""lemon"", ""cedar"", ""vetiver"", ""patchouli"", ""musk"", ""vanilla"", ""passion fruit""]","[""cedar"", ""vetiver"", ""patchouli"", ""musk"", ""vanilla"", ""passion fruit""]","[""vetiver"", ""patchouli"", ""musk"", ""vanilla""]",https://terenziboutique.com/en/product/saiph-2/
Dubhe,"DubheExtrait de Parfum 100 mlCollection:Tiziana Terenzi, AssolutoThe third chapter of the Assoluto Collection is Dubhe, star of the Ursa Major constellation and rich in history and secrets.",https://terenziboutique.com/wp-content/uploads/2020/06/TTASS_DUB_A-600x635.jpg,Tiziana Terenzi,"[""rose"", ""geranium"", ""sandalwood"", ""cedar"", ""oud"", ""saffron"", ""amber"", ""musk"", ""vanilla""]","[""sandalwood"", ""cedar"", ""oud"", ""amber"", ""musk"", ""vanilla""]","[""sandalwood"", ""amber"", ""musk""]",https://terenziboutique.com/en/product/dubhe/
Siené,"SienéExtrait de Parfum 100 mlCollection:Classica Black, Tiziana TerenziDuring a journey of discovery of the most beautiful places in Italy and, above all, of the marvels of Tuscany, we came across one of
the oldest and most important cities of the Renaissance - Siena.",https://terenziboutique.com/wp-content/uploads/2020/06/TTPROF_SIE_A-600x635.jpg,Tiziana Terenzi,"[""iris"", ""sandalwood"", ""patchouli"", ""cypress"", ""amber"", ""myrrh"", ""musk"", ""leather"", ""honey""]","[""iris"", ""sandalwood"", ""patchouli"", ""amber"", ""myrrh"", ""musk"", ""leather"", ""honey""]","[""sandalwood"", ""amber"", ""musk"", ""honey""]",https://terenziboutique.com/en/product/siene/
Arrakis,"ArrakisExtrait de Parfum 100 mlCollection:Tiziana Terenzi, Luna StarThe journey continues amidst the stars of the constellations of Paolo and Tiziana's memories.
 Drops of pure emotion encapsulated by the Luna collection expand into a deeper cosmos to meet the brightest, remotest stars, exploring new frontiers of artistic perfumery and pursuing the dream of Icarus to turn the fantasies of children into feathered wings.
 Arrakis, a binary star system in the Draco constellation, was the inspiration for this exploration into the varied spectrum of an olfactory pyramid conceived to create new light and unpredictable emotive sensations.
Just as the Arrakis system is made of two counterpoised, equal stars, this fragrance has two distinct characters of contrasting intensity that reveal themselves to only the most expert connoisseur.
 The creation opens with an explosion of precious, elegant citrus notes predominated by the potent fragrance of grapefruit from Sicily’s Conca d’Oro.",https://terenziboutique.com/wp-content/uploads/2020/06/TTPROF_ARR_A-600x635.jpg,Tiziana Terenzi,"[""bergamot"", ""lemon"", ""grapefruit"", ""vetiver"", ""patchouli"", ""guaiac wood"", ""saffron"", ""amber"", ""musk"", ""tonka bean"", ""rosemary"", ""thyme"", ""tobacco""]","[""vetiver"", ""patchouli"", ""guaiac wood"", ""amber"", ""musk"", ""tonka bean"", ""tobacco""]","[""amber"", ""musk"", ""tonka bean""]",https://terenziboutique.com/en/product/arrakis/
Casanova,"CasanovaExtrait de Parfum 100 mlCollection:Anniversari Gold, Tiziana TerenziThe most romantic stop on this wonderful journey is Venice, where the fire of seduction still burns in the fireplaces of the beautiful eighteenth-century buildings, mysterious villas of undiminished charm, frequented by the famous Casanova whose presence can still be felt, if you pay proper attention to small signs.
The memory of a winter's evening during the famous Carnival in Venice, inspired by a mysterious and ethereal Muse, the City of Doges.",https://terenziboutique.com/wp-content/uploads/2020/05/TTPROF_CAS2021_A-600x635.jpg,Tiziana Terenzi,"[""jasmine"", ""bergamot"", ""guaiac wood"", ""cardamom"", ""pepper"", ""pink pepper"", ""amber"", ""myrrh"", ""musk"", ""ambergris"", ""leather"", ""vanilla"", ""tonka bean"", ""powder""]","[""guaiac wood"", ""cardamom"", ""pepper"", ""pink pepper"", ""amber"", ""myrrh"", ""musk"", ""ambergris"", ""leather"", ""vanilla"", ""tonka bean""]","[""guaiac wood"", ""amber"", ""musk"", ""tonka bean""]",https://terenziboutique.com/en/product/casanova/
Hao,"HaoExtrait de Parfum 100 mlCollection:Anniversari Gold, Tiziana TerenziHao is a poetic tribute to eternal love, a delicate and poignant commemoration of the 700th anniversary of Marco Polo’s death.
This fragrance tells  the mysterious legend of a love born within the ancient walls of Imperial China, where destiny intertwined the lives of Marco Polo and the sweet Hao Dong, daughter of Emperor Kublai Khan and granddaughter of the feared Genghis Khan.
The story chronicles a magical encounter, a case of love at first sight that occurred when, on hearing Hao’s melodious voice as she sang from the balcony, Marco was enraptured by a passion that left a lasting mark on his heart.
With her ethereal beauty and enigmatic charm, Hao Dong became the love of Marco Polo’s life.
Their strong, deep bond led them to live together in the court of Kublai Khan, joining together two distant worlds.
Hao followed Marco when he returned to Venice, leaving behind her homeland forever.
But their love story came up against misunderstanding and prejudice in the Italian city.
Hao could only find solace in her voice, singing softly to evoke memories of her beloved land.
To this day, their love remains shrouded in mystery, a bridge between two cultures and a testament to a bond that stood the test of time.
Hao opens with bright, delicate notes, Sicilian Orange Blossom lends a citrusy freshness, Chinese Lotus Flower evokes the serenity of oriental lakes, while Florentine Iris adds a touch of elegance and mystery.
In the heart of the fragrance, Australian Sandalwood and Madagascar Vanilla blend in a warm and enveloping embrace.",https://terenziboutique.com/wp-content/uploads/2024/09/TTPROF_HAO_A-600x635.jpg,Tiziana Terenzi,"[""orange blossom"", ""orange"", ""sandalwood"", ""musk"", ""ambergris"", ""vanilla"", ""caramel""]","[""sandalwood"", ""musk"", ""ambergris"", ""vanilla"", ""caramel""]","[""musk""]",https://terenziboutique.com/en/product/hao/
Il Piacere,"Il PiacereExtrait de Parfum 100 mlCollection:Anniversari Gold, Tiziana TerenziIl Piacere is considered the greatest work of Poet Gabriele D'Annunzio
It tells the story of Andrea Sperelli, a wealthy and aristocratic devotee of art in all its facets, prone to the pleasures of everyday life, imbued with the conviction that ""onemust make one's life into a work of art.""
In this work, the poet breaks the conventional moulds of the time, as does this fragrance, which celebrates pleasure in all its facets without ever losing the focus on beauty in the fulfilment of a great aesthetic quest.
The refined seduction of Rose combines with the fresh vitality of Bergamot and the more daring green notes of Artemisia and Mediterranean Hedychium, to combine with the warm power of Saffron and the sweetness of Peach...",https://terenziboutique.com/wp-content/uploads/2024/03/TTPROF_PIA_A-600x635.jpg,Tiziana Terenzi,"[""jasmine"", ""lily"", ""peony"", ""orange blossom"", ""lily of the valley"", ""orange"", ""guaiac wood""]","[""jasmine"", ""violet"", ""peony"", ""ylang ylang"", ""orange blossom"", ""orange"", ""sandalwood"", ""guaiac wood"", ""musk"", ""ambergris"", ""vanilla""]","[""ylang ylang"", ""sandalwood"", ""musk"", ""ambergris"", ""vanilla""]",https://terenziboutique.com/en/product/il-piacere/
Deriva,"DerivaEXTRAIT DE PARFUM LINEA TT 100 ML DERIVACollection:Tiziana Terenzi, Sea StarsIn the world of seafaring, the Italian word ‘deriva’ means drift, and refers to the motion of a vessel without a course, moving at the mercy of the waves and the current.
An uncontrolled movement, in other words the loss of control over our will, without a precise direction, floating towards an unknown destination.
At times, this travelling is relaxed like on sunny days, in the absence of wind and with calm waters.",https://terenziboutique.com/wp-content/uploads/2023/06/TTPROF_DER_A-1-600x635.jpg,Tiziana Terenzi,"[""gardenia"", ""geranium"", ""bergamot"", ""lemon"", ""sandalwood"", ""patchouli"", ""cardamom"", ""pepper"", ""pink pepper"", ""vanilla"", ""tonka bean"", ""raspberry"", ""lavender"", ""leaves"", ""tobacco""]","[""gardenia"", ""geranium"", ""sandalwood"", ""patchouli"", ""pepper"", ""pink pepper"", ""vanilla"", ""tonka bean"", ""raspberry"", ""leaves"", ""tobacco""]","[""sandalwood"", ""vanilla"", ""tonka bean"", ""leaves"", ""tobacco""]",https://terenziboutique.com/en/product/deriva/
Lince,"LinceExtrait de Parfum 100 mlCollection:Tiziana Terenzi, LunaOn a particularly dark, cold, late winter night on the very cusp of spring, Paolo and Tiziana were in Palermo with their grandfather Guglielmo and the whole family.",https://terenziboutique.com/wp-content/uploads/2020/06/TTPROF_LIN_A-600x635.jpg,Tiziana Terenzi,"[""rose"", ""jasmine"", ""iris"", ""orange blossom"", ""bergamot"", ""orange"", ""grapefruit"", ""sandalwood"", ""ambergris"", ""vanilla"", ""fig"", ""tea"", ""green tea""]","[""rose"", ""jasmine"", ""iris"", ""orange blossom"", ""orange"", ""sandalwood"", ""ambergris"", ""vanilla"", ""fig""]","[""sandalwood"", ""ambergris"", ""vanilla""]",https://terenziboutique.com/en/product/lince/
Draconis,"DraconisExtrait de Parfum 100 mlCollection:Tiziana Terenzi, Luna StarDraconis, the most sun-like star known in the heavens, is a tantalizing mystery for scientists all over the world, who have always wondered whether it may harbor the extra-terrestrial life they are searching for.
A star as magical and mysterious as the fragrance that it has inspired.
The olfactory pyramid of Draco is yet another star in the Tiziana Terenzi collection, exploring the infinite marvels of many possible combinations of its precious natural essences!
A heady equilibrium between contrasting, complementary fragrances which opens with ebullient, fresh top notes of potent Calabrian bergamot and precious Sicilian grapefruit accentuated by Matera Lemon and Basilicata neroli.",https://terenziboutique.com/wp-content/uploads/2020/06/TTPROF_DRAS_A-600x635.jpg,Tiziana Terenzi,"[""neroli"", ""bergamot"", ""lemon"", ""grapefruit""]","[""geranium"", ""vetiver"", ""patchouli"", ""pepper"", ""black pepper"", ""amber"", ""frankincense""]","[""vetiver"", ""patchouli"", ""amber"", ""frankincense""]",https://terenziboutique.com/en/product/draconis/
Spirito Fiorentino,"Spirito FiorentinoExtrait de Parfum 100 mlCollection:Luna Special, Tiziana TerenziOne of the most fascinating cities in the Bel Paese (Italy) is extraordinary Florence.",https://terenziboutique.com/wp-content/uploads/2020/06/TTPROF_SPI_A-600x635.jpg,Tiziana Terenzi,"[""jasmine"", ""lily"", ""magnolia"", ""ylang ylang"", ""orange"", ""sandalwood"", ""saffron"", ""amber"", ""musk"", ""oakmoss""]","[""magnolia"", ""ylang ylang"", ""sandalwood"", ""amber"", ""musk"", ""oakmoss""]","[""sandalwood"", ""musk"", ""oakmoss""]",https://terenziboutique.com/en/product/spirito-fiorentino/
Arethusa,"ArethusaExtrait de Parfum 100 mlCollection:Classica Gold, Tiziana TerenziThe most carefree and joyful stop on this incredible journey is the beautiful Sicily, where History, Art and Nature are intertwined in an enchanting sea of emotions.",https://terenziboutique.com/wp-content/uploads/2020/05/TTPROF_ARE_A-600x675.jpg,Tiziana Terenzi,"[""rose"", ""jasmine"", ""orange blossom"", ""orange"", ""grapefruit"", ""sandalwood"", ""vetiver"", ""patchouli"", ""ginger"", ""saffron"", ""plum"", ""fig"", ""marine""]","[""rose"", ""jasmine"", ""orange blossom"", ""orange"", ""grapefruit"", ""sandalwood"", ""vetiver"", ""patchouli"", ""saffron"", ""marine""]","[""vetiver"", ""patchouli"", ""marine""]",https://terenziboutique.com/en/product/areth/
Rivèa,"RivèaExtrait de Parfum 100 mlCollection:Classica Black, Tiziana TerenziOn a trip to the Ligurian Riviera, Paolo and Tiziana were inspired by a place of natural beauty that combines the elegance and uniqueness of Italian style: Portofino.
Strolling along the shores of this magnificent village, remembering the energy and magic of the dancing flames of the San Giorgio bonfire and thinking back to their childhood memories and the sea, which had always been a fundamental element in the most important moments of their lives and an endless source of inspiration for creativity, the idea for a new perfume was born.
The Terenzi siblings were fascinated by one of the most recognisable features of Portofino: its crescent-shaped bay, framed by green hills that offer awe-inspiring views and a spectacle of beauty that takes your breath away.
The Riviera of the 1960s was characterised by the elegance of the Italian dolce vita and the life of the all-Italian playboys, known as Les Italiens, who were taking over the Riviera at that time to the cry of “Bare feet, jeans, hair in the wind and go!”
The picturesque bays and golden beaches became places where you could live out the dream of la dolce vita.",https://terenziboutique.com/wp-content/uploads/2023/10/TTPROF_RIV_A-600x635.jpg,Tiziana Terenzi,"[""rose"", ""lemon"", ""saffron""]","[""sandalwood"", ""vetiver"", ""patchouli"", ""cypress"", ""ambergris"", ""seaweed""]","[""sandalwood"", ""cypress"", ""ambergris""]",https://terenziboutique.com/en/product/rivea/
Ixbeta,"IxbetaExtrait de Parfum 100 mlCollection:Tiziana Terenzi, Luna StarIxbeta was born on a night of magic and wonder under a crystal clear May sky.
On that enchanted evening, Paolo and Tiziana looked out over the flower-filled hills of their land, lost in the silent dance of the Lynx constellation.
The star Beta shone with unexpected strength in a dark region of the sky, where stars are shy and rare..
This celestial spectacle inspired the two siblings to create Ixbeta, a fragrance that embodies the brightness and tenacity of a star struggling to shine in the darkness of the night.
Ixbeta is a tribute to those who never give up, to those who find their inner light even in the blackest darkness.
Like the star Beta in the Lynx constellation, this fragrance shines with intensity and determination.
It is an invitation to explore new olfactory combinations: Ixbeta can be combined with other Lynx constellation fragrances to create even more fascinating, surprising symphonies of light.
Journey to the Lynx constellation and you will discover the art of intergalactic layering through the stellar alchemy of perfumes inspired by the constellation: Lince, Uxalpha, Ixbeta and Lincys.
The top notes of Ixbeta open with an explosion of citrusy freshness: Calabrian Bergamot, Sicilian Orange and Sorrento Lemon intertwine their sun-kissed essences, while Indian Cardamom adds a sophisticated, intriguing spice.",https://terenziboutique.com/wp-content/uploads/2024/09/TTPROF_IXB_A-600x635.jpg,Tiziana Terenzi,"[""bergamot"", ""lemon"", ""orange"", ""cardamom""]","[""rose"", ""jasmine"", ""violet"", ""geranium"", ""sandalwood"", ""pepper"", ""pink pepper"", ""musk"", ""ambergris"", ""peach"", ""raspberry"", ""oakmoss""]","[""ambergris"", ""oakmoss"", ""talc""]",https://terenziboutique.com/en/product/ixbeta/
