name,description,image,perfumeHouse,openNotes,heartNotes,baseNotes,detailURL
Borelli,"BorelliExtrait de Parfum 100 mlCollection:Tiziana Terenzi, CometTiziana and Paolo’s intergalactic journey to discover the celestial emotions produced by magical
stellar fires continues.",https://terenziboutique.com/wp-content/uploads/2023/05/TTPROF_ELLI_A-1-600x635.jpg,Tiziana Terenzi,"[""rose"", ""lily"", ""violet"", ""tuberose"", ""ylang ylang"", ""lily of the valley"", ""bergamot"", ""mandarin"", ""sandalwood"", ""ebony"", ""birch"", ""musk""]","[""rose"", ""lily"", ""violet"", ""tuberose"", ""ylang ylang"", ""lily of the valley"", ""sandalwood"", ""ebony"", ""birch"", ""musk""]","[""sandalwood"", ""ebony"", ""birch"", ""musk""]",https://terenziboutique.com/en/product/borelli/
Vele,"VeleExtrait de Parfum 100 mlCollection:Tiziana Terenzi, LunaThis work was inspired by the discovery of a Constellation, that of the Vela, visible from a faraway country, on the other side of the Atlantic Ocean, in the southern hemisphere.
It tells the tale of a land that appears exotic and mysterious in the eyes of two children who, for the very first time, prepared to face a long, adventurous journey.",https://terenziboutique.com/wp-content/uploads/2020/06/TTPROF_VEL_A-600x635.jpg,Tiziana Terenzi,"[""rose"", ""jasmine"", ""amber"", ""musk"", ""fig"", ""leaves""]","[""rose"", ""jasmine"", ""amber"", ""musk""]","[""amber"", ""musk""]",https://terenziboutique.com/en/product/vele/
Akragas,"AkragasExtrait de Parfum 100 mlCollection:Classica Black, Tiziana TerenziThis creation was created as a result of the emotional inspiration gained during a long trip to Italy, in search of the scent of salt and its infinite facets.
The Bel Paese is surrounded by the sea, rich in precious salt, and this element has always aided the development of civilisations.
Salt has many facets and is not only obtained from seawater evaporation, but is also extracted from the famous salt pans, which Sicily has in abundance.
Akragas was the ancient name for what is now Agrigento, a very famous city in southern Sicily, known for its enchanting natural beauty and the beautiful Valley of the Temples, a priceless heritage site that has been admired since the days of Magna Graecia and has been impeccably preserved to this day.
The Greek poet Pindar called Agrakas the 'most beautiful city in the world' and this breathtaking beauty is the inspiration for this creation.
In its lengthy history, Agrigento has been influenced by various peoples, from the Magna Graecia to the Carthaginians, from the Arabs to the Normans, bringing together all the cultural facets able to coexist in peace and harmony, offering a beauty that teaches us all.
Akragas seeks to portray the beauty of this crossroads of cultures and wonders through the salt of its most famous quarry, surrounded by Mediterranean scrub and enchanting landscapes.
The creation opens with a pungent bouquet that immediately evokes the Mediterranean maquis, where we perceive Sicilian Myrtle and Mediterranean Seaweed, intensely embraced by the citrus fruits typical of the island, dominated by Royal Grapefruit and the unmistakable persuasiveness of Neroli.
This top note rests on a heart note as strong as the Sicilian land, robust and generous, where Agrigento Salt is the dominant and reverberating note, emphasised by Atlas Cedar, strongly scented by Red Thyme and Bulgarian Geranium.
The entire creation is founded on a powerful and aromatic base, capable of echoing the breezes of the Sicilian sea, thanks to Benzoin driven by Musk, in counterpoint to Singapore Patchouli and Madagascar Vanilla Berries.
The spirit of the wonder of the Agrigento region, in a drop of salty, fascinating perfume.More informationLess informationOlfactory PyramidTop Notes:Sicilian Myrtle, Mediterranean Seaweed, Grapefruit & Sicilian NeroliHeart Notes:Sicilian Salt, Atlas Cedar, Red Thyme & Bulgarian GeraniumBase Notes:Musk, Benzoin, Patchouli from Singapore & Madagascar Vanilla BerriesIngredientsIngredienti/Ingredients: Alcohol Denat., Parfum (Fragrance), Benzyl Salicylate, Coumarin, Hexyl Cinnamal, Citronellol, Linalool, Geraniol, Limonene, Alpha-Isomethyl Ionone, Citral, Benzyl Benzoate, Benzyl Alcohol, Eugenol, Benzyl Cinnamate, Farnesol, Anise AlcoholWarningsFlamable.",https://terenziboutique.com/wp-content/uploads/2022/08/TTPROF_AKR_A-6-600x635.jpg,Tiziana Terenzi,"[""neroli"", ""geranium"", ""grapefruit"", ""cedar"", ""patchouli"", ""benzoin"", ""musk"", ""vanilla"", ""thyme"", ""seaweed""]","[""geranium"", ""cedar"", ""patchouli"", ""benzoin"", ""musk"", ""vanilla"", ""thyme""]","[""patchouli"", ""benzoin"", ""musk"", ""vanilla""]",https://terenziboutique.com/en/product/akragas/
Lillipur,"LillipurExtrait de Parfum 100 mlCollection:Classica Gold, Tiziana TerenziOne stop in this journey was Nepal, in search of a more intimate and solitary spirituality in an ancient capital renowned for its marvellous, mystical, higher state of being.",https://terenziboutique.com/wp-content/uploads/2020/06/TTPROF_LIL_A-600x635.jpg,Tiziana Terenzi,"[""carnation"", ""cyclamen"", ""lemon"", ""cedar"", ""patchouli"", ""birch"", ""cinnamon"", ""pepper"", ""amber"", ""benzoin"", ""frankincense"", ""musk"", ""tonka bean"", ""thyme""]","[""carnation"", ""cyclamen"", ""cedar"", ""patchouli"", ""birch"", ""cinnamon"", ""pepper"", ""amber"", ""benzoin"", ""musk"", ""tonka bean"", ""thyme""]","[""cedar"", ""patchouli"", ""birch"", ""amber"", ""benzoin"", ""musk"", ""tonka bean""]",https://terenziboutique.com/en/product/lillipur/
Mirach,"MirachAttar 13 mlCollection:Tiziana Terenzi, Luna Star AttarMirach is one of the most famous stars of the constellation of Andromeda, notably for its incredible dimensions that exceed those of our sun by four times.",https://terenziboutique.com/wp-content/uploads/2020/06/TTATT_MIR_A-600x635.jpg,Tiziana Terenzi,"[""rose"", ""neroli"", ""sandalwood"", ""patchouli"", ""oud"", ""nutmeg"", ""saffron"", ""amber"", ""benzoin"", ""styrax"", ""musk"", ""vanilla""]","[""rose"", ""sandalwood"", ""patchouli"", ""oud"", ""amber"", ""benzoin"", ""styrax"", ""musk"", ""vanilla""]","[""sandalwood"", ""benzoin"", ""styrax"", ""vanilla""]",https://terenziboutique.com/en/product/mirach-2/
Adhil,"AdhilExtrait de Parfum 100 mlCollection:Tiziana Terenzi, AssolutoThe second fragrance of the Assoluto collection is Adhil, famous star of the constellation Andromeda.",https://terenziboutique.com/wp-content/uploads/2020/06/TTASS_ADH_A-600x635.jpg,Tiziana Terenzi,"[""jasmine"", ""sandalwood"", ""amber"", ""vanilla""]","[""jasmine"", ""sandalwood"", ""amber"", ""vanilla""]","[""sandalwood"", ""amber"", ""vanilla""]",https://terenziboutique.com/en/product/adhil/
Afrodite,"AfroditeExtrait de Parfum 100 mlCollection:Anniversari Gold, Tiziana TerenziThe beautiful goddess represents the wild and uncontrollable power of love, passion and seduction, capable of uniting and embracing elements of opposing natures, man and woman, strength and kindness, passion and sweetness.",https://terenziboutique.com/wp-content/uploads/2020/06/TTPROF_AFR_A-600x635.jpg,Tiziana Terenzi,"[""lily"", ""iris"", ""tuberose"", ""neroli"", ""lily of the valley"", ""geranium"", ""sandalwood"", ""patchouli"", ""ebony"", ""pepper"", ""pink pepper"", ""amber"", ""musk"", ""vanilla"", ""peach""]","[""lily"", ""iris"", ""tuberose"", ""neroli"", ""lily of the valley"", ""geranium"", ""sandalwood"", ""patchouli"", ""ebony"", ""amber"", ""musk""]","[""sandalwood"", ""patchouli"", ""ebony"", ""amber"", ""musk""]",https://terenziboutique.com/en/product/afrodite/
Eclix,"EclixExtrait de Parfum 100 mlCollection:Luna Special, Tiziana TerenziAt the end of a warm, sun-kissed summer, in the month of September (6 September 1978), Paolo and Tiziana encountered the Black Moon for the very first time.",https://terenziboutique.com/wp-content/uploads/2020/06/TTPROF_ECL_A-600x635.jpg,Tiziana Terenzi,"[""lily"", ""violet"", ""petitgrain""]","[""lily"", ""iris"", ""violet"", ""lemon"", ""petitgrain"", ""sandalwood"", ""cedar"", ""musk""]","[""iris"", ""sandalwood"", ""cedar"", ""musk""]",https://terenziboutique.com/en/product/eclix/
Tyrenum,"TyrenumExtrait de Parfum 100 mlCollection:Classica Gold, Tiziana TerenziThe creation is inspired by the famous city in Puglia now known as Trani, once known as Tyrenum, a land bathed by the sea and lashed by the wind, where for centuries sailors from all over the world have loved to take refuge, captivated by its enchanting beauty.
Paolo and Tiziana's search for the scent of salt continues.",https://terenziboutique.com/wp-content/uploads/2022/08/TTPROF_TYR_A-6-600x635.jpg,Tiziana Terenzi,"[""bergamot"", ""orange"", ""patchouli"", ""cardamom"", ""pepper"", ""black pepper"", ""pink pepper"", ""musk"", ""ambergris"", ""vanilla"", ""caramel"", ""tea"", ""green tea""]","[""patchouli"", ""cardamom"", ""pepper"", ""black pepper"", ""pink pepper"", ""musk"", ""ambergris"", ""vanilla""]","[""patchouli"", ""musk"", ""ambergris"", ""vanilla""]",https://terenziboutique.com/en/product/tyrenum/
Cielo Blu,"Cielo BluExtrait de Parfum 100 mlCollection:Anniversari Black, Tiziana TerenziCielo Blu was created as a tribute to Marco Polo, the legendary explorer who revealed the secrets of the Orient.
It is a celebration of the 700th anniversary of his death, a vivid reminder of a man who opened up new horizons and brought together distant worlds through his extraordinary adventures.
With his indomitable spirit, Marco Polo showed us that the world is a book and he, a tireless reader, pored over each of its pages with wonder and curiosity.
We are indebted to him for the millions of pieces of knowledge he revealed to us through his adventures, but above all through his skilful mastery as an attentive observer and patient listener to others.
His teaching evokes brotherhood and the inclusion of diversities and contrasts; qualities that belong to special, chosen souls, capable of recognising in other strangers a brother or a sister, because all are children of the same Blue Sky, benevolent creator of so many miracles, today encapsulated in a drop of sky!
Cielo Blu evokes the spirituality of the Great Blue, inspired by the most ancient of Chinese deities, symbolising infinity and a love of boundless space.
This fragrance embodies the harmony between man and creation, a perfect balance between the wild and majestic scents of nature.
The fragrance opens with the sunny brightness of Sicilian Grapefruit and Sorrento Lemon, releasing a citrusy freshness that dances with the vibrant spices of Indian Cardamom.
Tuscan Laurel and Italian Rosemary add a herbaceous note that evokes the scent of the Mediterranean coast.
At the heart of Cielo Blu we find gently blossoming Lake Como Lavender  that lends a floral serenity, while Terenzi Oxygen adds an ethereal, celestial freshness.
Tuscan Acacia and Bulgarian Rose come together in a delicate embrace, a sophisticated bouquet that transports the soul to the enchanted gardens of the Orient.
The base notes offer a robust, enveloping foundation of Chinese Oak Wood, injecting depth and strength.
Indian Ambrette Seeds add a balsamic sweetness, while White Musk envelops the fragrance in a soft, velvety caress, echoing the spiritual connection to the vast Blue Sky.
Cielo Blu tells a story of discoveries and connections, making it an ode to the meeting of East and West.",https://terenziboutique.com/wp-content/uploads/2024/09/TTPROF_CIE_A-600x635.jpg,Tiziana Terenzi,"[""rose"", ""lemon"", ""grapefruit"", ""cardamom"", ""rosemary"", ""lavender""]","[""rose"", ""lavender""]",[],https://terenziboutique.com/en/product/cielo-blu/
XIX March,"XIX MarchExtrait de Parfum 100 mlCollection:Classica Black, Tiziana TerenziLa Focarina di S.",https://terenziboutique.com/wp-content/uploads/2020/06/TTPROF_XIX_A-600x635.jpg,Tiziana Terenzi,"[""jasmine"", ""orange"", ""sandalwood"", ""vetiver"", ""cinnamon"", ""nutmeg"", ""clove"", ""musk"", ""mint"", ""leaves""]","[""jasmine"", ""sandalwood"", ""vetiver"", ""cinnamon"", ""nutmeg"", ""clove"", ""musk""]","[""sandalwood"", ""vetiver"", ""nutmeg"", ""musk""]",https://terenziboutique.com/en/product/xix-march/
Cabiria,"CabiriaExtrait de Parfum 100 mlCollection:Anniversari Gold, Tiziana TerenziCabiria is an angel who has fallen to earth.",https://terenziboutique.com/wp-content/uploads/2024/03/Tiziana-Terenzi-Cabiria-profumo-600x635.jpg,Tiziana Terenzi,"[""rose"", ""jasmine"", ""ambergris"", ""vanilla"", ""apple"", ""pear"", ""mint"", ""grass""]","[""rose"", ""jasmine"", ""ambergris"", ""vanilla""]","[""vanilla""]",https://terenziboutique.com/en/product/cabiria/
Uxalpha,"UxalphaExtrait de Parfum 100 mlCollection:Tiziana Terenzi, Luna StarUxalpha, another wonder from the Luna collection, came to life on a May night when the pristine skies of Paolo and Tiziana’s hills revealed the secret of a shining star to them.
The Alpha star in the Lynx constellation, the brightest in its celestial realm, shone with the energy of 700 suns, illuminating the darkness with a vibrant, infectious light.
This enchanted experience provided the inspiration to create a fragrance that celebrates the vitality and radiance of souls that never cease to shine.
Uxalpha is an ode to power and brilliance, dedicated to those who radiate light and vitality at all times.
This essence captures the power of the Alpha star, taking the wearer on an olfactory journey that explores the energy and luminosity of the Lynx constellation.
ThLikeits companion Ixbeta, the uniqueness of Uxalpha lies in its ability to blend with other fragrances in the constellation to create unique, inimitable combinations.
When exploring the Lynx constellation, you will have the opportunity to discover the art of intergalactic layering, enjoying the astral fusion of the fragrances it inspired: Lince, Uxalpha, Ixbeta and Lincys.
The top notes of Uxalpha open with a fresh explosion of Calabrian Bergamot, Sicilian Orange and Pink Grapefruit.",https://terenziboutique.com/wp-content/uploads/2024/09/TTPROF_UXA_A-600x635.jpg,Tiziana Terenzi,"[""bergamot"", ""orange"", ""grapefruit""]","[""labdanum"", ""musk"", ""ambergris"", ""vanilla"", ""caramel"", ""coconut""]","[""ambergris"", ""vanilla"", ""caramel""]",https://terenziboutique.com/en/product/uxalpha/
Iddu,"IdduExtrait de Parfum 100 mlCollection:Tiziana Terenzi, VulcaniThe Iddu creation is dedicated to Stromboli, the island of primordial power, where earth and fire dance in an eternal embrace.
This fragrance captures the indomitable spirit of a wild paradise, suspended between the blue sky and the crystal clear waters of the Mediterranean, a silent witness to the ancient tales of sailors and gods.
At its heart is the passion of a land that never sleeps, evoking the majesty of the volcano, whose presence is as reassuring as it is imposing.
The fragrance is like the warm breath of a breeze whispering secrets dating back thousands of years, carrying with it the echo of myths buried in the depths overflowing with history.
Each spray unfolds a veil of mystery, an invitation to explore the inaccessible, to get lost among the rugged cliffs and black beaches, under a starry sky that seems to defy time.
Iddu is a tribute to the island of Stromboli, a symphony of elements coming together in timeless harmony, a promise of eternity.
We find the composition opening with the enveloping sweetness of Madagascan Vanilla, juxtaposed with the floral freshness of Sicilian Magnolia and the delicate purity of Chinese Lotus.
The generous head sits atop an equally rich and seductive heart, where the regal depth of Ambergris blends with Sicilian Tobacco to create a rich, slightly smoky aroma, while Cambodian Oudh adds a note of exotic and complex wood, reinforcing the fragrance’s unique character.
The base of this seductive creation is intensely robust, enriched by Madagascan Bourbon Vanilla, which enhances the initial sweetness with heightened intensity.
Rounding off the fragrance, Sicilian Birch Moss adds a final touch of earthy, woody elegance, giving Iddu a sensual and enveloping persistence.
Iddu evokes starry nights under the vast sky of Stromboli, capturing the essence of a place suspended between the blue sky and the crystal clear waters of the Mediterranean, a theatre of ancient legends told by sailors and gods.More informationLess informationOlfactory PyramidTop Notes:Madagascan Vanilla, Sicilian Magnolia and Chinese LotusHeart Notes:Ambergris, Sicilian Tobacco and Cambodian OudhBase Notes:Madagascan Bourbon Vanilla, Sicilian Birch MossIngredientsIngredienti/Ingredients: Alcohol Denat., Parfum (Fragrance), Benzyl Benzoate, FarnesolWarningsFlamable.",https://terenziboutique.com/wp-content/uploads/2024/09/TTPROF_VULIDD_A-600x635.jpg,Tiziana Terenzi,"[""magnolia"", ""birch"", ""ambergris"", ""vanilla"", ""tobacco""]","[""birch"", ""ambergris"", ""vanilla"", ""tobacco""]","[""birch"", ""vanilla""]",https://terenziboutique.com/en/product/iddu/
Chiron,"ChironExtrait de Parfum 100 mlCollection:Tiziana Terenzi, CometOne of the most formidable comets in our solar system is Chiron, a prototype of the centaur class; bright, brilliant and beautiful!
Forever shrouded in mystery, comet Chiron brings with it a precious cargo of good fortune and positive influence with each passing over the heavens.",https://terenziboutique.com/wp-content/uploads/2021/04/TTPROF_CHN_A-600x635.jpg,Tiziana Terenzi,"[""sandalwood"", ""musk"", ""ambergris"", ""vanilla"", ""tonka bean"", ""tobacco""]","[""sandalwood"", ""ambergris"", ""vanilla"", ""tobacco""]","[""sandalwood"", ""vanilla""]",https://terenziboutique.com/en/product/chiron/
Orionis,"OrionisExtrait de Parfum 100 mlCollection:Tiziana Terenzi, AssolutoFrom the constellation of Orion here is one of the most wonderful journeys ever taken, in the wake of the Terenzi family’s olfactory library, to create a unique and unrepeatable Absolute.
A limited edition perfume because of the limited availability of its essences and priceless molecules that once finished will no longer be obtainable.
 These are in fact ingredients belonging to the family library with over 50 years of maceration.
Some of them are completely prohibited today.
They can only be used by established companies that have official proof of being in possession of them since before 1968 as in the case of the Terenzi family.
With 40% of pure natural and very rare oils, it is a very high concentration fragrance, inspired by one of the most brilliant stars in the famous constellation of Orion.",https://terenziboutique.com/wp-content/uploads/2020/06/TTASS_ORI_A-600x635.jpg,Tiziana Terenzi,"[""patchouli"", ""saffron"", ""musk"", ""ambergris"", ""vanilla""]","[""patchouli"", ""musk"", ""ambergris"", ""vanilla""]","[""musk"", ""vanilla""]",https://terenziboutique.com/en/product/orionis/
Chi,"ChiExtrait de Parfum 100 mlCollection:Tiziana Terenzi, Luna StarPaolo and Tiziana's intergalactic journey continues, as they discover the stars that make up the constellations of the Luna collection.
This journey takes us through the beauty of artistic perfumery, in an expression capable of transforming beauty into wonder, through the reverberation of its pyramid of origin amplified towards brighter and more luminous echoes of a new pyramid, also offering ample space for the art of layering.
'Chi' is one of the brightest stars in the constellation Ursa Major, whence the Ursa perfume takes its inspiration.",https://terenziboutique.com/wp-content/uploads/2022/08/TTPROF_CHIS_A-6-600x635.jpg,Tiziana Terenzi,"[""patchouli"", ""vanilla"", ""coffee"", ""caramel"", ""almond"", ""tonka bean""]","[""patchouli"", ""vanilla"", ""caramel"", ""tonka bean""]","[""vanilla"", ""caramel"", ""tonka bean""]",https://terenziboutique.com/en/product/chi/
Alioth,"AliothExtrait de Parfum 100 mlCollection:Tiziana Terenzi, AssolutoTiziana and Paolo’s stylistic exploration into artistic perfumery continue to push the limits towards horizons never before reached in the alchemy of emotion.",https://terenziboutique.com/wp-content/uploads/2020/06/TTASS_ALIO_A-600x635.jpg,Tiziana Terenzi,"[""rose"", ""ylang ylang"", ""patchouli"", ""oud"", ""cardamom"", ""pepper"", ""black pepper"", ""saffron"", ""ambergris"", ""vanilla""]","[""rose"", ""ylang ylang"", ""patchouli"", ""oud"", ""ambergris"", ""vanilla""]","[""oud"", ""ambergris"", ""vanilla""]",https://terenziboutique.com/en/product/alioth/
Torpè,"TorpèExtrait de Parfum 100 mlCollection:Classica Gold, Tiziana TerenziThis creation originates from the memory of a trip to the heart of the French Riviera, between the shimmering blue of the Mediterranean and the hills dotted with olive trees, in Saint-Tropez.
Paolo and Tiziana visited this town with its timeless lifestyle of gentleness and freedom and were inspired by the joyful and vibrant character of this seaside resort.
Saint-Tropez was a fascinating journey through the golden age of life on the Riviera in the 1960s.
In those years, the Italian and French Rivieras were the protagonists of an extraordinary cultural transformation: the life of the all-Italian playboys, known as Les Italiens, who were taking over the Riviera in the 1960s to the cry of “Bare feet, jeans, hair in the wind and go!”
This iconic image perfectly captures the defiant attitude and desire for freedom of the time.
These young people took over the Riviera with a daring spirit and a liberating attitude, embracing a lifestyle of relaxation and fun, while a blazing fire of passion burned within them, driving them to live every moment to its fullest.
When the film ‘And God Created Woman’ hit the big screen, it captured the hearts of audiences around the world thanks to the unforgettable young Brigitte Bardot.
Torpè is a tribute to the timeless glamour of that period, when Saint Tropez became a popular destination for the international jet set.
Torpè, on the other hand, was the name used by the resort’s trendiest ‘rebels’ in the 1960s.
This creation is a fresh, vibrant fragrance whose marine notes remind us of unforgettable summer evenings full of laughter with not a care in the world.
Each note is dedicated to the sea and its magic, a journey of the senses to one of the most fascinating places in the world.
Anyone wearing it can close their eyes and find themselves transported to the cobbled streets of Saint Tropez, amidst the laughter of children at play, the scent of the salty air and the warmth of the sun on their skin.
The fragrance opens with a fresh, citrusy bouquet, thanks to Reggio Calabrian Bergamot, Sorrento Lemon and Sicilian Mandarin, and combines with Marine notes, which add depth to the perfume.
The heart of the fragrance, the true essence of this creation, opens with the muted scents of Bulgarian Rose, Côte d’Azur Lavender, French Iris and Provençal Violet, intertwined with the delicate elegance of Saint Tropez Peony, the sweetness of Sicilian Orange and juicy Romagna Peach.
The entire creation is built on a solid foundation of fine woods such as African Ebony and Australian Sandalwood combined with Musk, Ambergris, Indian Patchouli and Tuscan Oakmoss, creating a beguiling and sensual base that envelops the wearer like a lasting embrace.
Torpè captures the vibrant, lush essence of the Mediterranean coastline.
Its accords are reminiscent of when the turquoise sea meets the sun-kissed olive groves, creating an unforgettable olfactory experience.More informationLess informationOlfactory PyramidTop Notes:Bergamot of Reggio Calabria, Mandarin of Sicily, Lemon of Sorrento, Marine NotesHeart Notes:Bulgarian Rose, French Riviera Lavender, French Iris, Provence Violet, Saint Tropez Peony, Sicilian Orange Blossom, Romagna PeachBase Notes:Ambergris, Musk, African Ebony, Australian Sandalwood, Indian Patchouli, Tuscan OakmossIngredientsIngredienti/Ingredients: Alcohol Denat., Parfum (Fragrance), Limonene, Linalool, Citronellol, Geraniol, Citral, Hydroxycitronellal, Eugenol, Amyl CinnamalWarningsFlamable.",https://terenziboutique.com/wp-content/uploads/2023/10/TTPROF_TOR_A-600x635.jpg,Tiziana Terenzi,"[""rose"", ""iris"", ""violet"", ""peony"", ""orange blossom"", ""bergamot"", ""lemon"", ""orange"", ""mandarin"", ""sandalwood"", ""patchouli"", ""ebony"", ""musk"", ""ambergris"", ""peach"", ""lavender"", ""marine""]","[""rose"", ""iris"", ""violet"", ""peony"", ""orange blossom"", ""orange"", ""sandalwood"", ""patchouli"", ""ebony"", ""musk"", ""ambergris"", ""peach"", ""lavender""]","[""sandalwood"", ""patchouli"", ""ebony"", ""musk"", ""ambergris""]",https://terenziboutique.com/en/product/torpe/
Poggia,"PoggiaExtrait de Parfum 100 mlCollection:Tiziana Terenzi, Sea StarsPoggia comes from the Italian verb for to rest.",https://terenziboutique.com/wp-content/uploads/2020/10/TTPROF_POG_A-2-600x635.jpg,Tiziana Terenzi,"[""rose"", ""bergamot"", ""lemon"", ""orange"", ""musk"", ""vanilla"", ""apple"", ""peach"", ""passion fruit"", ""rosemary""]","[""rose"", ""musk"", ""vanilla"", ""apple"", ""passion fruit"", ""rosemary""]","[""musk"", ""vanilla""]",https://terenziboutique.com/en/product/poggia/
