name,description,image,perfumeHouse,openNotes,heartNotes,baseNotes,detailURL
Talitha,"TalithaPerfume Extract 13 mlCollection:Tiziana Terenzi, Luna Star AttarFrom the constellation Ursa Major, we recognise a bright star, with an exotic and mysterious name, that has always fascinated dreamers who love to scan the vault of heaven in search of the fire of the stars, just as Paolo and Tiziana loved to do as children with their grandfather, Guglielmo.",https://terenziboutique.com/wp-content/uploads/2024/03/TTATT_TAL_A-600x635.jpg,Tiziana Terenzi,"[""rose"", ""ylang ylang"", ""bergamot"", ""lemon"", ""grapefruit"", ""cedar"", ""vetiver"", ""guaiac wood"", ""cinnamon"", ""cardamom"", ""nutmeg"", ""ambergris"", ""leather"", ""leaves""]","[""rose"", ""ylang ylang"", ""cedar"", ""vetiver"", ""guaiac wood"", ""cinnamon"", ""cardamom"", ""nutmeg"", ""ambergris"", ""leather""]","[""cedar"", ""vetiver"", ""guaiac wood""]",https://terenziboutique.com/en/product/talitha-3/
Cubia,"CubiaExtrait de Parfum 100 mlCollection:Tiziana Terenzi, Sea StarsIn naval jargon the ""cubia eyes"" indicate the hole located in the bow area of the ship, through which both the anchor chain and the mooring lines pass.",https://terenziboutique.com/wp-content/uploads/2020/10/TTPROF_CUB_A-7-600x635.jpg,Tiziana Terenzi,"[""bergamot"", ""lemon"", ""orange"", ""cedar"", ""patchouli"", ""peach""]","[""cedar"", ""patchouli"", ""peach""]","[""cedar"", ""patchouli""]",https://terenziboutique.com/en/product/cubia/
Tempel,"TempelExtrait de Parfum 100 mlCollection:Tiziana Terenzi, CometJust like these grandiose mysteries, the creation to which this comet offers the name, opens with a delicate, yet at the same time, opulent head.",https://terenziboutique.com/wp-content/uploads/2020/06/TTPROF_TEM_A-600x635.jpg,Tiziana Terenzi,"[""lily"", ""magnolia"", ""lily of the valley"", ""oud""]","[""lily"", ""lily of the valley"", ""oud""]","[""lily"", ""lily of the valley"", ""oud""]",https://terenziboutique.com/en/product/tempel/
Borea,"BoreaExtrait de Parfum 100 mlCollection:Classica Gold, Tiziana TerenziThe delightful City of Flowers, as it is known in Italy, is encircled by terraces where every known variety of flower is grown, such as
jasmine, magnolia, lily of the valley, freesia, countless varieties of rose and the highly prized and practically unique tuberose.
This magical city is embraced by the towering Maritime Alps, which contribute to the special climate of this place and convey a
sense of raw beauty in the contrast between the immensity of the mountain peaks and the immensity of the sea.
The city is also renowned for its villas, with their extravagant, unique architecture and Italian gardens bursting with opulent, rare
and intensely scented flowers.
Delightfully manicured hedges create romantic labyrinths in which seductive scents pervade the air.",https://terenziboutique.com/wp-content/uploads/2020/06/TTPROF_BOR_A-600x635.jpg,Tiziana Terenzi,[],"[""rose"", ""jasmine"", ""lily"", ""iris"", ""magnolia"", ""freesia"", ""tuberose"", ""lily of the valley"", ""sandalwood"", ""musk"", ""vanilla"", ""oakmoss""]","[""sandalwood"", ""musk"", ""vanilla"", ""oakmoss""]",https://terenziboutique.com/en/product/borea/
Ecstasy,"EcstasyExtrait de Parfum 100 mlCollection:Classica Black, Tiziana TerenziThe most intense journey into the “sacred fire”of the soul, in search of total authenticity in the suspended gravity of absolute beauty.",https://terenziboutique.com/wp-content/uploads/2020/06/TTPROF_ECS_A-600x635.jpg,Tiziana Terenzi,"[""frankincense""]","[""rose"", ""violet"", ""sandalwood"", ""patchouli"", ""amber"", ""tonka bean""]","[""sandalwood"", ""amber"", ""tonka bean""]",https://terenziboutique.com/en/product/ecstasy/
Draco,"DracoExtrait de Parfum 100 mlCollection:Tiziana Terenzi, LunaThis journey starts in one of the most amazing and mysterious places that Italy hosts or perhaps I should say hides: Matera is known as the city of the Stones, because of the peculiar and unique nature of its historical centre.",https://terenziboutique.com/wp-content/uploads/2020/06/TTPROF_DRA_A-600x635.jpg,Tiziana Terenzi,"[""jasmine"", ""magnolia"", ""bergamot"", ""lemon"", ""orange"", ""cedar"", ""patchouli"", ""musk"", ""vanilla"", ""pear"", ""peach""]","[""jasmine"", ""magnolia"", ""cedar"", ""patchouli"", ""musk"", ""vanilla"", ""pear"", ""peach""]","[""musk"", ""vanilla"", ""pear""]",https://terenziboutique.com/en/product/draco/
Orion,"OrionExtrait de Parfum 100 mlCollection:Tiziana Terenzi, LunaAs children during the hot, sunny days of summer, Tiziana and I spent most of our time with our grandfather in the countryside.",https://terenziboutique.com/wp-content/uploads/2020/06/TTPROF_ORI_A-600x635.jpg,Tiziana Terenzi,"[""jasmine"", ""bergamot"", ""patchouli"", ""oud"", ""agarwood"", ""birch"", ""amber"", ""musk"", ""apple"", ""thyme""]","[""jasmine"", ""patchouli"", ""oud"", ""agarwood"", ""birch"", ""amber"", ""musk"", ""thyme""]","[""oud"", ""agarwood"", ""amber"", ""musk""]",https://terenziboutique.com/en/product/orion/
Sirrah,"SirrahAttar 13 mlCollection:Tiziana Terenzi, Luna Star AttarSirrah is a very famous star in the constellation of Andromeda whose regal destiny is soon to become a Red Giant.",https://terenziboutique.com/wp-content/uploads/2020/06/TTATT_SIR_A-600x635.jpg,Tiziana Terenzi,"[""rose"", ""sandalwood"", ""patchouli"", ""birch"", ""cardamom"", ""saffron"", ""amber"", ""leather"", ""passion fruit""]","[""rose"", ""sandalwood"", ""patchouli"", ""birch"", ""cardamom"", ""amber"", ""leather""]","[""sandalwood"", ""patchouli"", ""birch"", ""leather""]",https://terenziboutique.com/en/product/sirrah-2/
Abbrivio,"AbbrivioEXTRAIT DE PARFUM LINEA TT 100 ML ABBRIVIOCollection:Tiziana Terenzi, Sea StarsIn the nautical world, the Italian word ‘abbrivio’ means headway and refers to the inertial motion of a boat.
When a boat starts to move, in fact, its thrusters have to overcome an immense inertia, generated by the weight and shape of the boat itself, immersed in the water.
Let us imagine Telea’s unfurled sails swelling to pull the mast fixed to its deck forward, thanks to the sheer power of the wind, but in moments that sometimes seem eternal, nothing happens and the boat remains motionless; then suddenly and with a momentum of its own, not governed by man, the boat generates motion.
This thrust is the headway: difficult to get going, but then almost unstoppable.
There are two types of headway, increasing and decreasing, both of which are daughters of the same mother and which a good sailor must come to terms with in order to sail safely.
The headway is a magic trick of motion that has always fascinated seafarers because of its beauty that is not fully revealed and is ever changing and fickle depending on the weather conditions.
Every boat has its own soul and therefore its own headway, which can never be the same as any other.
A kind of inimitable, unique fingerprint, just as the creation inspired by it is inimitable and unique.
This magical and unpredictable, mysterious and inexplicable force is fully encapsulated in the Starfish Collection bottle.
Just like the force of the unstoppable headway that can only be controlled by expert hands, this creation can be discovered by profound connoisseurs of the art of perfumery.
Abbrivio opens with a fresh, frothy, fruity bouquet, thanks to the scent of Brazilian Orange with Dolomite Blackcurrant and Romagna Strawberry, emphasised by the aromatic hint of Mediterranean Santolina.
The unpredictable and evolving head settles into an even more trembling and untamed heart where, from the outset, the seductive force of Ambergris is felt, combined with the contrast of Coumarin and Adriatic Seaweed, softened by the persuasiveness of Amazonian Tonka Bean and Cuban Cane Sugar.
The base of this mysterious creation is firmly rooted in the strong notes of Atlas Cedar and Singapore Patchouli, strengthened by the regal presence of Tuscan Oak and Australian Sandalwood, then emphasised by the persuasive combination of Romagna Oak Moss and Musk.
Abbrivio encapsulates the mysterious force of motion generated by obscure forces that reverberate in the lapping water like magical effluvia capable of seducing and bewitching, for those who are not afraid to venture into the coral blue of life.More informationLess informationOlfactory PyramidTop Notes:Brazilian Orange, Dolomite Blackcurrant, Mediterranean Santolina and Romagna StrawberryHeart Notes:Ambergris, Coumarin, Adriatic Seaweed, Amazonian Tonka Bean and Cuban Cane SugarBase Notes:Singapore Patchouli, Atlas Cedar, Tuscan Oak, Australian Sandalwood, Romagna Oak Moss and MuskIngredientsIngredienti/Ingredients: Alcohol Denat., Parfum (Fragrance), Limonene, Coumarin, Geraniol, Hydroxycitronellal, Alpha-Isomethyl Ionone, Farnesol, Citral, Citronellol, Anise Alcohol, LinaloolWarningsFlamable.",https://terenziboutique.com/wp-content/uploads/2023/06/TTPROF_ABB_A-1-600x635.jpg,Tiziana Terenzi,"[""orange"", ""sandalwood"", ""cedar"", ""patchouli"", ""ambergris"", ""tonka bean"", ""sugar"", ""strawberry"", ""moss"", ""seaweed""]","[""sandalwood"", ""cedar"", ""patchouli"", ""ambergris"", ""tonka bean"", ""sugar"", ""moss"", ""seaweed""]","[""sandalwood"", ""cedar"", ""patchouli"", ""moss""]",https://terenziboutique.com/en/product/abbrivio/
Nero Oudh,"Nero OudhExtrait de Parfum 100 mlCollection:Luna Special, Tiziana TerenziThis creation tells of a marvelous discovery that Tiziana and Paolo made during a fascinating childhood journey to the much loved and unique Italian city, Milan.",https://terenziboutique.com/wp-content/uploads/2022/08/TTPROF_NERO_A-600x635.jpg,Tiziana Terenzi,"[""rose"", ""magnolia"", ""geranium"", ""sandalwood"", ""cedar"", ""patchouli"", ""guaiac wood"", ""saffron"", ""amber"", ""musk"", ""vanilla""]","[""sandalwood"", ""cedar"", ""patchouli"", ""guaiac wood"", ""amber"", ""musk"", ""vanilla""]","[""sandalwood"", ""patchouli"", ""amber"", ""musk"", ""vanilla""]",https://terenziboutique.com/en/product/nero-oudh/
Leonis I,"Leonis IExtrait de Parfum 100 mlCollection:Tiziana Terenzi, AssolutoThe Assoluto collection is growing, thanks to an extraordinary essence: Leonis I, named after a distant star that rises from the constellation of Leo.",https://terenziboutique.com/wp-content/uploads/2024/04/TTASS_LEO_A-600x635.jpg,Tiziana Terenzi,"[""jasmine"", ""orange"", ""sandalwood"", ""cedar"", ""nutmeg"", ""pepper"", ""black pepper"", ""saffron"", ""myrrh"", ""ambergris"", ""vanilla""]","[""jasmine"", ""sandalwood"", ""cedar"", ""nutmeg"", ""myrrh"", ""ambergris"", ""vanilla""]","[""sandalwood"", ""ambergris"", ""vanilla""]",https://terenziboutique.com/en/product/leonis-i/
Lyncis,"LyncisExtrait de Parfum 100 mlCollection:Tiziana Terenzi, AssolutoTraveling to the constellation Lynx you come across the brightest star in the group, Lyncis.
A very luminescent and mysterious star of intense color.",https://terenziboutique.com/wp-content/uploads/2020/06/TTASS_LYN_A-600x635.jpg,Tiziana Terenzi,"[""rose"", ""jasmine"", ""iris"", ""orange blossom"", ""bergamot"", ""orange"", ""grapefruit"", ""mandarin"", ""sandalwood"", ""cedar"", ""vetiver"", ""patchouli"", ""pepper"", ""pink pepper"", ""musk"", ""ambergris""]","[""rose"", ""jasmine"", ""iris"", ""orange blossom"", ""orange"", ""sandalwood"", ""cedar"", ""vetiver"", ""patchouli"", ""musk"", ""ambergris""]","[""sandalwood"", ""cedar"", ""vetiver"", ""patchouli"", ""musk""]",https://terenziboutique.com/en/product/lyncis/
Andromeda,"AndromedaExtrait de Parfum 100 mlCollection:Tiziana Terenzi, LunaWe met Andromeda for the first time, wrapped in His infinite beauty, thanks to a trail of bright, fascinating stars, while trekking on the Sibillini Mountains, located in a little-known, but charming, area of ​​our beautiful country.",https://terenziboutique.com/wp-content/uploads/2020/06/TTPROF_AND_A-600x635.jpg,Tiziana Terenzi,"[""rose"", ""jasmine"", ""violet"", ""ylang ylang"", ""bergamot"", ""ebony"", ""amber"", ""vanilla"", ""coconut"", ""tonka bean"", ""pear"", ""peach"", ""grass"", ""leaves"", ""water"", ""powder""]","[""rose"", ""violet"", ""ebony"", ""amber"", ""vanilla"", ""coconut"", ""tonka bean"", ""pear"", ""peach"", ""leaves"", ""powder""]","[""ebony"", ""amber"", ""vanilla"", ""coconut"", ""tonka bean"", ""powder""]",https://terenziboutique.com/en/product/andromeda/
Atlantide,"AtlantideExtrait de Parfum 100 mlCollection:Tiziana Terenzi, Sea StarsAtlantis is a legendary and mysterious island, its myth mentioned for the first time by Plato in the works Timaeus (17-27) and Critias, in the fourth century BC.",https://terenziboutique.com/wp-content/uploads/2020/10/TTPROF_ATL_A-4-600x635.jpg,Tiziana Terenzi,"[""rose"", ""tuberose"", ""orange blossom"", ""bergamot"", ""orange"", ""benzoin"", ""musk"", ""passion fruit""]","[""tuberose"", ""orange blossom"", ""orange"", ""benzoin"", ""musk""]","[""benzoin"", ""musk""]",https://terenziboutique.com/en/product/atlantide/
Tyl,"TylExtrait de Parfum 100 mlCollection:Tiziana Terenzi, AssolutoHere comes Tyl, rising star of the constellation Draco.",https://terenziboutique.com/wp-content/uploads/2020/06/TTASS_TYL_A-600x635.jpg,Tiziana Terenzi,"[""rose"", ""jasmine"", ""bergamot"", ""lemon"", ""amber"", ""musk"", ""vanilla"", ""lavender""]","[""rose"", ""jasmine"", ""amber"", ""musk"", ""vanilla""]","[""musk"", ""vanilla""]",https://terenziboutique.com/en/product/tyl/
Gumin,"GuminExtrait de Parfum 100 mlCollection:Anniversari Black, Tiziana TerenziThis fragrance is dedicated to Guglielmo, the founder and pillar of our artisan perfumery, which from generation to generation continues his journey in search of wonder.
The most noble and timeless fragrance of the collection.",https://terenziboutique.com/wp-content/uploads/2020/06/TTPROF_GUM_A-600x635.jpg,Tiziana Terenzi,"[""rose"", ""jasmine"", ""violet"", ""bergamot"", ""orange"", ""mandarin"", ""sandalwood"", ""oud"", ""amber""]","[""rose"", ""jasmine"", ""violet"", ""sandalwood"", ""oud"", ""amber""]","[""sandalwood"", ""oud""]",https://terenziboutique.com/en/product/gumin/
Orza,"OrzaExtrait de Parfum 100 mlCollection:Tiziana Terenzi, Sea StarsOrza from the Italian verb for to luff.
To luff means to move the bow of a sailing boat towards the direction of the wind.",https://terenziboutique.com/wp-content/uploads/2020/10/TTPROF_ORZ_A-2-600x635.jpg,Tiziana Terenzi,"[""rose"", ""lily"", ""magnolia"", ""lily of the valley"", ""mandarin"", ""sandalwood"", ""benzoin"", ""musk"", ""ambergris"", ""vanilla"", ""apple"", ""plum"", ""raspberry"", ""blackberry""]","[""rose"", ""lily"", ""lily of the valley"", ""sandalwood"", ""benzoin"", ""musk"", ""ambergris"", ""vanilla""]","[""sandalwood"", ""benzoin"", ""musk"", ""ambergris"", ""vanilla""]",https://terenziboutique.com/en/product/orza/
Struo’,"Struo’Extrait de Parfum 100 mlCollection:Tiziana Terenzi, VulcaniIn the sublime realm of fragrances, where the art of perfumery rises as a divine sculptor of atmospheres, an incomparable olfactory creation has been born, christened Struò and dedicated to the Volcano.
This fragrance is a fiery homage to the majestic telluric power that resides in the beating heart of the earth, a tribute to those smoking peaks that rise imperiously into the clear sky.
Struò, shrouded in mystery like the dense clouds of ash that dance around the smoking crater, evokes the indomitable spirit of an earth that burns in perpetual renewal.
Its aura is an invitation to contemplate the eternal cycle of destruction and creation, a cycle that pulsates in the glowing heart of the world.
The sensations that ensue from encountering these olfactory notes are comparable to the experience of observing the seething magma pouring forth with unbridled fervour from the bowels of the earth.
There is a sense of sublime terror and admiration, a tension between reverent awe and attraction to the infinite power of the Volcano.
I therefore invite the most ardent fans of the olfactory world to immerse themselves in this unique sensory experience, where strength and beauty coexist in a dance of elements that only the art of artistic perfumery can translate into a symphony for the sense of smell.
With this creation, the mystery and magnificence of the Volcano come to life in a tangible form, enveloping the being in a cloak of enigmatic splendour.
Struò opens with a ‘hesperidian’ accord dominated by the effervescence of Calabrian Bergamot and Sicilian Mandarin blending with the depth and complexity of Sicilian Saffron.
The head gently folds into an embrace from the heart of creation, where Lebanese Cedar emerges with its robustness, perfectly balanced by Sri Lankan Green Tea, which introduces a gentle, purifying freshness.Indian Cloves and Himalayan Cardamom enrich the heart with their exotic, penetrating spices, while Cambodian Oudh weaves a rich, mysterious aroma that invites contemplation.
The base is characterised by an acrobatic balance of woods.",https://terenziboutique.com/wp-content/uploads/2024/09/TTPROF_VULSTR_A-600x635.jpg,Tiziana Terenzi,"[""bergamot"", ""mandarin"", ""saffron"", ""labdanum""]","[""cedar"", ""cardamom"", ""tea"", ""green tea""]","[""birch"", ""ambergris"", ""leather""]",https://terenziboutique.com/en/product/struo/
Zubenel,"ZubenelExtrait de Parfum 100 mlCollection:Tiziana Terenzi, AssolutoOne of the most important and famous stars is Zubenel in the constellation of Libra.",https://terenziboutique.com/wp-content/uploads/2024/04/TTASS_ZUB_A-600x635.jpg,Tiziana Terenzi,"[""sandalwood"", ""patchouli"", ""frankincense"", ""ambergris"", ""vanilla"", ""chocolate""]","[""sandalwood"", ""patchouli"", ""ambergris"", ""vanilla"", ""chocolate""]","[""sandalwood"", ""patchouli""]",https://terenziboutique.com/en/product/zubenel/
Porpora,"PorporaExtrait de Parfum 100 mlCollection:Luna Special, Tiziana TerenziThe stylistic pathway of the Moon Collection continues in its many forms, geared to explore confines never reached before in the art of perfume-making, driving us in this dreamlike journey towards cosmic spaces that are ever more mysterious and secret Porpora is the name of the work contained in this precious passion red bottle, decorated with a gilded jewel-shaped cap and depicting the lunar phases with fine lacquers in fiery red.",https://terenziboutique.com/wp-content/uploads/2020/05/TTPROF_POR_A-600x675.jpg,Tiziana Terenzi,"[""rose"", ""patchouli""]","[""rose"", ""patchouli"", ""amber"", ""musk""]","[""amber"", ""musk""]",https://terenziboutique.com/en/product/porpora/
Gemini,"GeminiExtrait de Parfum 100 mlCollection:Tiziana Terenzi, LunaThe magical journey of the youngsters Paolo and Tiziana, together with their beloved grandfather Guglielmo, continues with the observation of the celestial sphere on the ridges of the hills of their homeland, warmed by a crackling fire on an early spring night.",https://terenziboutique.com/wp-content/uploads/2024/07/TTPROF_GEM_A-600x635.jpg,Tiziana Terenzi,"[""rose"", ""jasmine"", ""patchouli"", ""nutmeg"", ""saffron"", ""ambergris"", ""sage"", ""lavender"", ""oakmoss""]","[""jasmine"", ""patchouli"", ""nutmeg"", ""ambergris"", ""oakmoss""]","[""patchouli"", ""ambergris"", ""oakmoss""]",https://terenziboutique.com/en/product/gemini-2/
Bianco Puro,"Bianco PuroExtrait de Parfum 100 mlCollection:Luna Special, Tiziana TerenziThis magic creation is born from an enchanted place, deeply connected to the ancient traditions of the Bel Paese and its wonderful coasts.",https://terenziboutique.com/wp-content/uploads/2022/08/TTPROF_PURO_A-600x635.jpg,Tiziana Terenzi,"[""bergamot"", ""lemon"", ""mandarin"", ""sandalwood"", ""vetiver"", ""patchouli"", ""saffron"", ""myrrh"", ""musk"", ""vanilla"", ""caramel"", ""lavender""]","[""sandalwood"", ""vetiver"", ""patchouli"", ""saffron"", ""myrrh"", ""musk"", ""vanilla"", ""caramel"", ""lavender""]","[""sandalwood"", ""vetiver"", ""patchouli"", ""myrrh"", ""musk"", ""vanilla""]",https://terenziboutique.com/en/product/bianco-puro/
Cas,"CasExtrait de Parfum 100 mlCollection:Tiziana Terenzi, Luna StarLaunched to accompany the newly created CAS Attar and inspired by one of the most famous stars of Cassiopea, the Cas extrait de parfum is in sync with the stylistic design attributed to the celestial bodies in the Constellations of the Moon Collection.",https://terenziboutique.com/wp-content/uploads/2020/06/TTPROF_CASAT_A-600x635.jpg,Tiziana Terenzi,"[""rose"", ""oud"", ""pepper"", ""black pepper"", ""pink pepper"", ""amber"", ""vanilla""]","[""oud"", ""pepper"", ""amber"", ""vanilla""]","[""amber"", ""vanilla""]",https://terenziboutique.com/en/product/cas/
Chimaera,"ChimaeraExtrait de Parfum 100 mlCollection:Anniversari Black, Tiziana TerenziThis unforgettable journey starts in a sail boat in the Gulf of Fethiye, known in history as the ""land of light and fire"", stopping at the amazing and surreal Olympus, where, from the heart of the mountain, huge tongues of fire are released and are visible even from the sea in the warm summer nights.
Like Phoenician sailors, transported from Maltemi, we headed on toward the ruins of the Lycian civilization, between untouched coves and pine-covered hills reach down to the sea, surrounded by slopes covered in thyme, sage, bay trees and rare, almost extinct, Günlük, ""Incense trees"" that perfume the air in a breathtaking explosion of colours and essences.",https://terenziboutique.com/wp-content/uploads/2020/05/TTPROF_CHI2021_A-600x635.jpg,Tiziana Terenzi,"[""iris"", ""peony"", ""magnolia"", ""carnation"", ""lemon"", ""patchouli"", ""agarwood"", ""pine"", ""pepper"", ""black pepper"", ""saffron"", ""labdanum"", ""leather"", ""caramel"", ""honey"", ""sage"", ""thyme"", ""tobacco""]","[""iris"", ""peony"", ""magnolia"", ""carnation"", ""patchouli"", ""agarwood"", ""pine"", ""pepper"", ""labdanum"", ""leather"", ""caramel"", ""honey"", ""sage"", ""tobacco""]","[""patchouli"", ""agarwood"", ""pine"", ""labdanum"", ""leather"", ""caramel"", ""tobacco""]",https://terenziboutique.com/en/product/chimaera/
Libra,"LibraExtrait de Parfum 100 mlCollection:Tiziana Terenzi, LunaLibra is a constellation of the zodiac that shows its majestic beauty in the months of April to July in the boreal hemisphere, while it remains visible for a few more months in the austral hemisphere.
Maximum visibility is reached on fine spring days, when the hours of light also increase considerably, meaning that admiring this constellation is very complicated and exclusive to experienced observers, because to fully understand all the facets of a Libra requires a great deal of experience.
Those born under the sign of Libra can be distinguished by their harmonious and balanced nature, which leads them to get along well with almost everyone.
Gifted with a lively intelligence, they can take an interest in many fields, especially the arts.
They deeply cherish the sense of beauty in every artistic expression, from sculpture to painting, music to dance, basing the measuring standard on the impeccable parameters of aesthetics.
They are eager to live in harmony, which they seek in every aspect of their lives.",https://terenziboutique.com/wp-content/uploads/2022/08/TTPROF_LIB_A-6-600x635.jpg,Tiziana Terenzi,"[""rose"", ""jasmine"", ""tuberose"", ""bergamot"", ""lemon"", ""grapefruit"", ""cedar"", ""vetiver"", ""patchouli"", ""benzoin"", ""musk"", ""ambergris"", ""vanilla""]","[""jasmine"", ""cedar"", ""vetiver"", ""patchouli"", ""benzoin"", ""musk"", ""ambergris"", ""vanilla""]","[""vetiver"", ""patchouli"", ""benzoin"", ""musk"", ""vanilla""]",https://terenziboutique.com/en/product/libra/
Halley,"HalleyExtrait de Parfum 100 mlCollection:Tiziana Terenzi, CometThe perfume opens with a magical and graceful bouquet, but with a hint of hypnotic fatalilty.",https://terenziboutique.com/wp-content/uploads/2020/06/TTPROF_HAL_A-600x635.jpg,Tiziana Terenzi,"[""rose"", ""iris"", ""tuberose"", ""lemon"", ""petitgrain"", ""cedar"", ""oud"", ""cinnamon"", ""amber"", ""musk"", ""vanilla"", ""peach"", ""raspberry"", ""passion fruit""]","[""iris"", ""tuberose"", ""petitgrain"", ""cedar"", ""oud"", ""cinnamon"", ""amber"", ""musk"", ""vanilla"", ""peach"", ""raspberry""]","[""cedar"", ""oud"", ""amber"", ""musk"", ""vanilla""]",https://terenziboutique.com/en/product/halley/
Wirtanen,"WirtanenExtrait de Parfum 100 mlCollection:Tiziana Terenzi, CometThe beauty of this celestial mystery gives its name to our creation, which opens with a bouquet of citrus fruits, where echoes of Calabrian Bergamot are combined with the delicate touch of the Ylang Ylang flower from the Philippines and the strength of Bulgarian Rose.
This head, intense and decisive, lies on a complex and effervescent bed, where the freshness of Indian Black Pepper is strengthened by a precious blend of two Oudhs with different characteristics.",https://terenziboutique.com/wp-content/uploads/2020/06/TTPROF_WIR_A-600x635.jpg,Tiziana Terenzi,"[""rose"", ""jasmine"", ""peony"", ""ylang ylang"", ""bergamot"", ""sandalwood"", ""pepper"", ""black pepper"", ""ambergris"", ""vanilla"", ""caramel""]","[""jasmine"", ""peony"", ""sandalwood"", ""pepper"", ""black pepper"", ""ambergris"", ""vanilla"", ""caramel""]","[""sandalwood"", ""ambergris"", ""vanilla"", ""caramel""]",https://terenziboutique.com/en/product/wirtanen/
