name,description,image,perfumeHouse,openNotes,heartNotes,baseNotes,detailURL
Tuttle,"TuttleExtrait de Parfum 100 mlCollection:Tiziana Terenzi, CometTuttle is a periodic comet in our Solar System, belonging to the Halley cometary family.
Because of this origin, in keeping with Paolo and Tiziana's design project, the Tuttle fragrance also clearly echoes and resonates with the Halley creation from the same Comete collection.
Tuttle is among the comets with the greatest beneficial influence on our universe, thanks to its orbit being one of the closest to the earth and, like all comets, it brings people joy, wonder, amazement and immense hope!
A precious tribute to happiness, addressed to those who are able to gaze at these comets with the dreamy eyes of a child.
The creation opens with a sparkling and joyful bouquet of fruits and citrus notes, dominated by Sicilian Grapefruit, embraced by the characteristic wild strength of Cassis and the revolutionary Romagna Peach, used for the first time in perfumery and a world exclusive of the Terenzi olfactory library.
This luxuriant head settles on a rich and opulent heart, where the echoes of regal white flowers can also be sensed, with lush Tuberose, Magnolia and Iris excelling, skilfully blended with Lily of the Valley and Royal Jasmine, thanks to the aphrodisiac overtones of precious and rare Ambergris.
The base of the creation rests on a foundation that is imposing and precious, but at the same time light and effervescent, capable of ensuring a long persistence and at the same time increasing its projection to impressive distances.
The intensity of Red Patchouli combined with the sweetness of Indian Sandalwood contrasts with the wild, woody scent of Italian Birch, accentuated by the Caribbean freshness of Cuban Cedar.
This majestic rush of woods is enveloped by the exotic scent of Haitian Vetiver, which lends an unpredictable and innovative touch to the entire creation.
The Tuttle comet will deliver to your souls a shimmering happiness and joy that will make the light in your eyes shine brightly once again, leaving you wonderfully fascinated and irresistible.
The wake of the comet, in a drop of unique and inimitable perfume.More informationLess informationListen to your essenceOlfactory PyramidTop Notes:Sicilian Grapefruit, Cassis, Romagna PeachHeart Notes:Tuberose, Iris, Magnolia, Lily of the Valley, Royal Jasmine & AmbergrisBase Notes:Red Patchouly, Indian Sandalwood, Cuban Cedarwood, Italian Birchwood & Haitian VetyverIngredientsIngredienti/Ingredients: Alcohol Denat., Parfum (Fragrance), Limonene, Linalool, Coumarin, Geraniol, Citronellol, Citral, Amyl Cinnamal, Benzyl Salicylate, EugenolWarningsFlamable.",https://terenziboutique.com/wp-content/uploads/2021/04/TTPROF_TUT_A-600x635.jpg,Tiziana Terenzi,"[""jasmine"", ""lily"", ""iris"", ""magnolia"", ""tuberose"", ""lily of the valley"", ""grapefruit"", ""sandalwood"", ""ambergris"", ""peach""]","[""jasmine"", ""lily"", ""iris"", ""magnolia"", ""tuberose"", ""lily of the valley"", ""sandalwood"", ""ambergris""]","[""sandalwood""]",https://terenziboutique.com/en/product/tuttle/
Hale Bopp,"Hale BoppExtrait de Parfum 100 mlCollection:Tiziana Terenzi, CometThe fragrance opens with a persuasive and irreverent head, thanks to the biting composition of spices, in which echoes of Nutmeg from the Moluccan Islands and Sri Lankan Cinnamon are lashed by the energizing force of bitter Sicilian lemon.
This innovative head rests on a strong and wild heart where the echoes of African Geranium combined with Tuscan Sage can be perceived, supported by the regal force of Red Patchouli from India and Vanilla from Tahiti.
This combination making for a rich heart with a limitless bouquet, is grounded on an imposing base that is the true center of the creation.",https://terenziboutique.com/wp-content/uploads/2020/06/TTPROF_BOPP_A-600x635.jpg,Tiziana Terenzi,"[""geranium"", ""lemon"", ""sandalwood"", ""patchouli"", ""cinnamon"", ""nutmeg"", ""musk"", ""ambergris"", ""vanilla"", ""sage""]","[""geranium"", ""sandalwood"", ""patchouli"", ""musk"", ""ambergris"", ""vanilla"", ""sage""]","[""sandalwood"", ""musk"", ""ambergris""]",https://terenziboutique.com/en/product/hale-bopp/
Burdèl,"BurdèlExtrait de Parfum 100 mlCollection:Anniversari Black, Tiziana TerenziBurdél is a typical dialectal word of our city that means ""boys"" and ""girls"" but with the peculiarity of people full of life and joy in their hearts, that carefree youth in search of happiness, as we all are throughout our lives! The poetic emotions that reverberate on the notes of this perfume evoke unique feelings that can make any moment magical.",https://terenziboutique.com/wp-content/uploads/2021/02/TTPROF_BUR2021_A-600x635.jpg,Tiziana Terenzi,"[""lily"", ""bergamot"", ""guaiac wood"", ""cardamom"", ""cumin"", ""musk"", ""ambergris"", ""vanilla""]","[""lily"", ""guaiac wood"", ""musk"", ""ambergris"", ""vanilla""]","[""musk"", ""ambergris"", ""vanilla""]",https://terenziboutique.com/en/product/burdel/
Idnà,"IdnàExtrait de Parfum 100 mlCollection:Tiziana Terenzi, VulcaniA creation that pulsates to the rhythm of a volcano’s heart, embodying an essence that envelops you like the heat that emanates from the depths of the earth.
Its aura of mystery and power evokes the sublime dance of flames intertwining under a starry night sky.
Inspired by the majestic and untamed nature of Etna, this fragrance arouses the deepest emotions and transports each individual to the place where earth meets fire in an eternal celebration of rebirth and creation.
Each drop contains an invitation to explore the immense beauty of creative destruction, a reminder of the ancient rituals that celebrate life and its perpetual regeneration.
Idnà is not just a fragrance, but a secret passage to a world where the elements merge in a fiery embrace, leaving the soul suspended between the divine and the earthly, between an immortal past and a present full of promise.
Here, in the echo of an ancient force, lies the true essence of passion, sculpted over time like lava rock shaped by the invisible hands of nature.
The essence opens with Indian Cardamom offering a spicy introduction, accompanied by fresh Catania Pine and sweet Drops of Pine Resin, both reminiscent of Sicilian mountain landscapes.
Etna Chamomile adds a touch of herbaceous serenity, preparing the senses for the heart of the fragrance.
This captivating head sits atop an opulent and compelling heart of hypnotic power, where Sicilian Jasmine echoes with a floral bouquet of Lake Garda Lavender and Sicilian Broom, while Italian Artemisia carries a slightly bitter and complex aura.
The entire creation is underpinned by warm, solid foundations, with exquisite woods such as Australian Sandalwood blending perfectly with Etna Fig Milk, which adds a subtle, inviting sweetness.
Madagascan Vanilla and Brazilian Tonka Bean round off the fragrance with a sweet, enveloping finish, leaving a lingering, seductive trail.
Idnà is a fragrance that evokes the pulsating heat of the earth’s depths and the mystery of Etna, taking the most complex souls on a journey between the divine and the earthly, between past and present, through the celebration of life and its eternal rebirth.More informationLess informationOlfactory PyramidTop Notes:Indian Cardamom, Catania Pine, Etna Chamomile and Drops of Pine Resin.Heart Notes:Sicilian Broom, Italian Artemisia, Lake Garda Lavender and Sicilian JasmineBase Notes:Australian Sandalwood, Etna Fig Milk, Madagascan Vanilla and Brazilian Tonka BeanIngredientsIngredienti/Ingredients: Alcohol Denat., Parfum (Fragrance), Coumarin, Linalool, Limonene, Eugenol, Benzyl Alcohol, Benzyl Salicylate, Farnesol, Cinnamyl Alcohol, Citral, Benzyl Benzoate, Geraniol, Benzyl Cinnamate, HydroxycitronellalWarningsFlamable.",https://terenziboutique.com/wp-content/uploads/2024/09/TTPROF_VULIDN_A-600x635.jpg,Tiziana Terenzi,"[""pine"", ""cardamom""]","[""jasmine"", ""sandalwood"", ""vanilla"", ""fig"", ""lavender""]","[""sandalwood"", ""vanilla"", ""fig""]",https://terenziboutique.com/en/product/idna/
Delox,"DeloxExtrait de Parfum 100 mlCollection:Classica Gold, Tiziana TerenziThis creation is inspired by the journey by sailing boat around the Cyclades islands of the Greek archipelago and its bouquet contains all the colours and flavours of the most genuine and southernmost Mediterranean.
The essence of summer, without a care in the world, and full of inebriating scents blown into the area by the “Meltemi” (typical wind of these latitudes), with its warm, sensual embrace, is magically contained in this fragrance inspired by the unspoiled, ancestral beauty of the Mediterranean.
The strong aroma of coffee, made in an ancient “moka” (typical coffee-making machine) floats through the crisp morning air, penetrated by the iridescent light reflected in the sea.",https://terenziboutique.com/wp-content/uploads/2020/06/TTPROF_DEL_A-600x635.jpg,Tiziana Terenzi,"[""rose"", ""iris"", ""cedar"", ""amber"", ""myrrh"", ""musk"", ""vanilla"", ""coffee"", ""honey""]","[""rose"", ""cedar"", ""amber"", ""myrrh"", ""musk"", ""vanilla"", ""honey""]","[""cedar"", ""amber"", ""musk"", ""honey""]",https://terenziboutique.com/en/product/delox/
Kristina,"KristinaExtrait de Parfum 100 mlCollection:Anniversari Gold, Tiziana TerenziTiziana Terenzi's Anniversary Collection is inspired by events and people who have positively influenced the lives of Tiziana and Paolo.",https://terenziboutique.com/wp-content/uploads/2024/04/TTPROF_KRI_A-600x635.jpg,Tiziana Terenzi,"[""iris"", ""bergamot"", ""grapefruit"", ""mandarin"", ""sandalwood"", ""patchouli"", ""tea"", ""green tea""]","[""iris"", ""sandalwood"", ""patchouli"", ""tea"", ""green tea""]","[""sandalwood"", ""patchouli""]",https://terenziboutique.com/en/product/kristina/
Laudano Nero,"Laudano NeroExtrait de Parfum 100 mlCollection:Classica Black, Tiziana TerenziThe most bohemian stop of this unforgettable journey takes us to mythical Paris during a rainy autumn, warm with watercolor hues, sinuous and blurred like a Renoir canvas.",https://terenziboutique.com/wp-content/uploads/2020/06/TTPROF_LAU_A-600x635.jpg,Tiziana Terenzi,"[""rose"", ""iris"", ""sandalwood"", ""vetiver"", ""agarwood"", ""amber"", ""musk"", ""vanilla"", ""honey"", ""rosemary"", ""tobacco""]","[""rose"", ""iris"", ""sandalwood"", ""vetiver"", ""agarwood"", ""musk"", ""vanilla"", ""honey"", ""rosemary""]","[""vetiver"", ""agarwood"", ""musk"", ""vanilla""]",https://terenziboutique.com/en/product/laudano-nero/
Vittoriale,"VittorialeExtrait de Parfum 100 mlCollection:Anniversari Black, Tiziana TerenziThe Vittoriale degli Italiani is one of the most evocative places in the world, almost a city within a city, a verdant and scenic space on Lake Garda, created by the genius of the great writer Gabriele D'Annunzio .
It is made up of many spaces: the park, the amphitheatre and many rooms inside the huge villa where relics, mementos, memorabilia and traces of his 'extravagant' lifestyle are kept.
The poet-soldier's goal was to make the place a kind of memorial to his 'inimitable life.'
The fragrance narrates these spaces where everything is unusual and mystical: in particular, our attention is drawn to the Music Room, where every detail is imbued with an unsettling sensuality.
From the very first moment, the fragrance immerses us in a surreal atmosphere, generated by a special play of contrasts, where Cardamom Seeds and the decisive scent of Italian Leather intertwine and chase each other with the decisive essence of Peat and Tobacco, like the rush of a vertigo that quickly becomes mysterious and exotic, thanks to the Jasmine Flowers and Garda Violet, narrating the precious drapes of blood red and black silk that adorn the walls of the room.
The perturbing brutal notes, emphasised by Laudanum and precious Musk, accompany us in the visual and dreamlike tale through the precious fabrics, embroidered in gold with wild and majestic beasts, tamed by the song and music vibrating in the room.
The untamed power of Patchouli continues to narrate an inexhaustible desire to live outside all convention, following only the refined aesthetic quest for wonder.
“One must make one's life into a work of art."" The life of a man of intellect must be his work.",https://terenziboutique.com/wp-content/uploads/2024/03/TTPROF_VIT_A-600x635.jpg,Tiziana Terenzi,"[""jasmine"", ""violet"", ""patchouli"", ""cardamom"", ""musk"", ""ambergris"", ""leather"", ""leaves"", ""oakmoss"", ""tobacco""]","[""jasmine"", ""violet"", ""patchouli"", ""musk"", ""ambergris"", ""leaves"", ""oakmoss""]","[""ambergris"", ""oakmoss""]",https://terenziboutique.com/en/product/vittoriale/
Verna,"VernaExtrait de Parfum 100 mlCollection:Luna Special, Tiziana TerenziThere is a village hidden between the Ligurian sea and mountains that has been sculpted by time and shaped by the wind: Vernazza, one of the Cinque Terra’s most precious gems.
Here, in a place where the waves break gently on the rocks, and the colourful houses are reflected in the crystal-clear water, each corner has a story to tell about a past that still resides in those that live there.
In this place full of charm, under the silent shadow of the Black Moon, Paolo and Tiziana found themselves surrounded by a mysterious, spellbinding aura.
This is the place where inspiration for Verna came to life, an olfactory tribute that contains the most authentic soul of this timeless village.
The Black Moon, a symbol of rebirth and the search for new horizons, appears when the sky turns pitch black and the moon dissolves into a shadowy ring.
During a summer stroll in Vernazza, while the village was settling into the peaceful evening, Paolo and Tiziana stopped off in the square by the harbour, where the scent of the sea was merging with that of the land, and where every alleyway seemed to hold an ancient secret.
The wind, overflowing with stories and traditions, was blowing like a prophesy, guiding brother and sister towards a new creation.
This is how Verna was born, like a tribute to the strength of new beginnings, celebrating the authentic essence of Vernazza and the transformative energy of the Black Moon.
Verna opens with the spicy, luminous notes that conjure up the lively nature of the village.",https://terenziboutique.com/wp-content/uploads/2025/03/TTPROF_VER_A-1-600x635.jpg,Tiziana Terenzi,"[""rose"", ""jasmine"", ""tuberose"", ""pepper"", ""pink pepper"", ""saffron"", ""musk"", ""ambergris"", ""leather"", ""vanilla"", ""coconut"", ""peach""]","[""jasmine"", ""tuberose"", ""musk"", ""ambergris"", ""leather"", ""vanilla"", ""coconut"", ""peach""]","[""musk"", ""ambergris"", ""vanilla""]",https://terenziboutique.com/en/product/verna/
Gold Rose Oudh,"Gold Rose OudhExtrait de Parfum 100 mlCollection:Classica Gold, Tiziana TerenziBarefoot amidst the charm and mystery of Fire in a desert camp.",https://terenziboutique.com/wp-content/uploads/2020/06/TTPROF_GRO_A-600x635.jpg,Tiziana Terenzi,"[""rose"", ""bergamot"", ""sandalwood"", ""patchouli"", ""fir"", ""pepper"", ""black pepper"", ""amber"", ""musk""]","[""rose"", ""sandalwood"", ""patchouli"", ""pepper"", ""black pepper"", ""amber"", ""musk""]","[""sandalwood"", ""amber"", ""musk""]",https://terenziboutique.com/en/product/gold-rose-oudh/
Dionisio,"DionisioExtrait de Parfum 100 mlCollection:Anniversari Black, Tiziana TerenziOn a warm evening in late summer, walking along the thousand year old cobblestones of the Imperial Forum towards the Colosseum, surrounded by the inebriating beauty of the eternal city, one of the oldest in the world, rich in history and legends, we came across a group of actors sitting around a small campfire.",https://terenziboutique.com/wp-content/uploads/woocommerce-placeholder-600x600.png,Tiziana Terenzi,"[""jasmine"", ""lily"", ""lily of the valley"", ""musk"", ""ambergris"", ""vanilla""]","[""jasmine"", ""lily"", ""lily of the valley"", ""musk"", ""ambergris"", ""vanilla""]","[""vanilla""]",https://terenziboutique.com/en/product/dionisio/
Leo,"LeoExtrait de Parfum 100 mlCollection:Tiziana Terenzi, LunaLeo is a large zodiacal constellation in the northern hemisphere, which is easily identifiable in the months between December and June; in the boreal hemisphere, its presence in the east after sunset indicates the imminent arrival of spring, while in the austral hemisphere it becomes a typical constellation for late summer and autumn skies.
Its unmistakable form, hurled into the celestial vault, immediately instils us with strength and elegance.",https://terenziboutique.com/wp-content/uploads/2022/08/TTPROF_LEO_A-2-600x635.jpg,Tiziana Terenzi,"[""rose"", ""jasmine"", ""violet"", ""magnolia"", ""bergamot"", ""orange"", ""mandarin"", ""sandalwood"", ""benzoin"", ""myrrh"", ""musk"", ""ambergris"", ""leaves""]","[""rose"", ""jasmine"", ""violet"", ""magnolia"", ""sandalwood"", ""benzoin"", ""myrrh"", ""musk"", ""ambergris"", ""leaves""]","[""sandalwood"", ""benzoin"", ""musk""]",https://terenziboutique.com/en/product/leo/
Telea,"TeleaExtrait de Parfum 100 mlCollection:Tiziana Terenzi, Sea StarsTelea is the name of a very distant and magical star shrouded in mystery.",https://terenziboutique.com/wp-content/uploads/2020/10/TTPROF_TEL_A-4-600x635.jpg,Tiziana Terenzi,"[""rose"", ""jasmine"", ""bergamot"", ""orange"", ""vetiver"", ""patchouli"", ""agarwood"", ""musk"", ""ambergris"", ""pear""]","[""jasmine"", ""vetiver"", ""patchouli"", ""agarwood"", ""musk"", ""ambergris""]","[""vetiver"", ""agarwood"", ""musk"", ""ambergris""]",https://terenziboutique.com/en/product/telea/
Rosso Pompei,"Rosso PompeiExtrait de Parfum 100 mlCollection:Luna Special, Tiziana TerenziPaolo and Tiziana’s never-ending journey brings them to a city suspended in the time of the Roman Empire.",https://terenziboutique.com/wp-content/uploads/2022/08/TTPROF_POM_A-600x635.jpg,Tiziana Terenzi,"[""jasmine"", ""lily"", ""magnolia"", ""tuberose"", ""lily of the valley"", ""lemon"", ""grapefruit"", ""sandalwood"", ""cedar"", ""patchouli"", ""ambergris"", ""grape""]","[""jasmine"", ""lily"", ""magnolia"", ""tuberose"", ""lily of the valley"", ""sandalwood"", ""cedar"", ""patchouli"", ""ambergris""]","[""sandalwood"", ""cedar"", ""patchouli""]",https://terenziboutique.com/en/product/rosso-pompei/
Pisces,"PiscesExtrait de Parfum 100 mlCollection:Tiziana Terenzi, LunaPaolo and Tiziana’s wonderful magical journey of discovering the constellations and the stars continues, together with their grandfather Guglielmo, in the discovery of Pisces.",https://terenziboutique.com/wp-content/uploads/2024/07/TTPROF_PIS_A-600x635.jpg,Tiziana Terenzi,"[""rose"", ""lemon"", ""sandalwood"", ""patchouli"", ""saffron"", ""musk"", ""ambergris"", ""leather"", ""thyme"", ""lavender""]","[""sandalwood"", ""patchouli"", ""musk"", ""ambergris"", ""leather"", ""thyme"", ""lavender""]","[""sandalwood"", ""musk"", ""ambergris"", ""thyme""]",https://terenziboutique.com/en/product/pisces-2/
Kirké,"KirkéExtrait de Parfum 100 mlCollection:Classica Gold, Tiziana TerenziAn enchanting place is found just south of Rome.",https://terenziboutique.com/wp-content/uploads/2020/06/TTPROF_KIR_A-600x635.jpg,Tiziana Terenzi,"[""lily"", ""lily of the valley"", ""sandalwood"", ""patchouli"", ""vanilla"", ""passion fruit""]","[""lily"", ""lily of the valley"", ""sandalwood"", ""patchouli"", ""vanilla""]","[""sandalwood"", ""patchouli"", ""vanilla""]",https://terenziboutique.com/en/product/kirke/
Moro di Venezia,"Moro di VeneziaExtrait de Parfum 100 mlCollection:Luna Special, Tiziana TerenziA trip to the most mysterious city in beautiful Italy, Venice.",https://terenziboutique.com/wp-content/uploads/2021/02/TTPROF_MOROV_A-600x635.jpg,Tiziana Terenzi,"[""jasmine"", ""lily"", ""violet"", ""lily of the valley"", ""bergamot"", ""grapefruit"", ""musk"", ""ambergris"", ""moss""]","[""jasmine"", ""lily"", ""violet"", ""lily of the valley"", ""musk"", ""ambergris"", ""moss""]","[""musk"", ""moss""]",https://terenziboutique.com/en/product/moro-di-venezia/
Smeralda,"SmeraldaExtrait de Parfum 100 mlCollection:Luna Special, Tiziana TerenziAmidst the endless blue skies and bright green waters of Sardinia, there is a place that enchants every single person that sets foot there.
It is the Emerald Coast, a stretch of land that has been sculpted by the wind and sea, where wild nature intertwines with timeless elegance.
This unique scenario is where the Mediterranean’s allure is evident in its purest form.
It is the enigmatic gaze of the Red Moon, the magical moon that fills the sky with scarlet hues each month, that offered Paolo and Tiziana the inspiration to create a new pearl for their Luna Special collection: Smeralda.
The Red Moon, a symbol of mystery and power, guiding dreams and spells, just like waves guide the sea.
While spending a summer’s evening on a hidden beach of the Emerald Coast, brother and sister were enraptured by a sunset that could have been sculpted by the universe.
The water glinted with emerald hues, dancing to the rhythm of the waves, while the air was filled with the enveloping scent of the Mediterranean scrub.
At nightfall, as the moon turned red and the place vibrated with a unique magic, the idea of transforming that very landscape into a fragrance  that could contain the eternal essence of this coast and its timeless beauty took shape.
Smeralda opens with a sparkling freshness that conjures up the first breath of sea air.",https://terenziboutique.com/wp-content/uploads/2025/03/TTPROF_SME_A-1-600x635.jpg,Tiziana Terenzi,"[""rose"", ""iris"", ""grapefruit"", ""mandarin"", ""sandalwood"", ""vetiver"", ""patchouli"", ""cinnamon"", ""ginger"", ""pepper"", ""black pepper"", ""labdanum"", ""ambergris"", ""leather"", ""vanilla"", ""mint"", ""leaves"", ""tobacco""]","[""rose"", ""iris"", ""sandalwood"", ""vetiver"", ""patchouli"", ""cinnamon"", ""labdanum"", ""ambergris"", ""leather"", ""vanilla"", ""leaves"", ""tobacco""]",[],https://terenziboutique.com/en/product/smeralda/
White Fire,"White FireExtrait de Parfum 100 mlCollection:Classica Gold, Tiziana TerenziThe silence of the snow; its dazzling white brought alive and sparkling by the flickering flames.",https://terenziboutique.com/wp-content/uploads/2020/05/TTPROF_WFI_A-600x635.jpg,Tiziana Terenzi,"[""jasmine"", ""sandalwood"", ""amber"", ""leaves""]","[""jasmine"", ""sandalwood"", ""amber""]","[""sandalwood"", ""amber""]",https://terenziboutique.com/en/product/white-fire/
Velorum,"VelorumExtrait de Parfum 100 mlCollection:Tiziana Terenzi, AssolutoThe Absolute collection expands, like the stars migrate in the heavens, with the Velorum creation: the brightest star in the Vela Constellation.
From this magic fragrance that extols the echoes of distant samba rhythms, mixed with the lapping of the waves of the powerful ocean on the contrast of exotic fruit, a new oneiric voyage opens up through the mysterious trail of the perfume of stardust.
An extremely pure and bright essence, like the candid light that the Velorum star gives off in the sky: subtle and ethereal, delicate and gentle, but at the same time powerful and reverberating, brimming with its imposing beneficent energy and harmonious persistence.",https://terenziboutique.com/wp-content/uploads/2020/06/TTASS_VELO_A-600x635.jpg,Tiziana Terenzi,"[""rose"", ""mandarin"", ""guaiac wood"", ""cinnamon"", ""cardamom"", ""nutmeg"", ""clove"", ""ginger"", ""pepper"", ""black pepper"", ""saffron"", ""musk"", ""vanilla"", ""chocolate"", ""almond"", ""passion fruit"", ""tea""]","[""guaiac wood"", ""cinnamon"", ""nutmeg"", ""clove"", ""musk"", ""vanilla"", ""chocolate"", ""almond"", ""passion fruit"", ""tea""]","[""guaiac wood"", ""musk"", ""vanilla"", ""chocolate""]",https://terenziboutique.com/en/product/velorum/
Maremma,"MaremmaExtrait de Parfum 100 mlCollection:Classica Black, Tiziana TerenziThe other stop on this wonderful journey is in Tuscany: the perhaps less romantic and less well-known hills and valleys of Maremma.",https://terenziboutique.com/wp-content/uploads/2020/06/TTPROF_MAR_A-600x635.jpg,Tiziana Terenzi,"[""jasmine"", ""bergamot"", ""sandalwood"", ""patchouli"", ""agarwood"", ""rosewood"", ""cumin"", ""amber"", ""labdanum"", ""honey"", ""powder""]","[""sandalwood"", ""patchouli"", ""agarwood"", ""rosewood"", ""cumin"", ""amber"", ""labdanum"", ""honey"", ""powder""]","[""sandalwood"", ""patchouli"", ""rosewood"", ""amber"", ""labdanum"", ""powder""]",https://terenziboutique.com/en/product/maremma/
