id,name,description,image,website,country,founded,type,email,phone,address,createdAt,updatedAt
cmdea40399d120cbdb66644,Fish,"Fish is a niche perfume company that specializes in creating unique and artistic fragrances. Founded by renowned perfumer Lodovico il Messia, the brand focuses on blending high-quality ingredients with innovative scent principles. Fish seeks to evoke emotions and memories through scent, often incorporating unconventional elements into their compositions. Their offerings appeal to connoisseurs of niche perfumery, capturing the essence of nature and abstraction in each bottle.",https://images.unsplash.com/photo-1541643600914-78b084683601?w=400&h=300&fit=crop,www.fishfragrance.com,Italy,2003,niche,,,,2025-07-18T12:32:10.942225,2025-08-28T15:14:15.798922
cmdfd5463179fad2c967dde,Fishbone,"Fishbone is a perfume company known for its innovative and youthful approach to fragrance. The brand focuses on creating bold, unique scents that resonate with the modern consumer, often incorporating playful elements into their branding and marketing. Originating from a passion for individuality and self-expression, Fishbone aims to break the mold of traditional perfumery by offering fragrances that reflect the dynamic lifestyle of their target audience.",https://images.unsplash.com/photo-1582735689369-4fe89db7114c?w=400&h=300&fit=crop,,,,indie,,,,2025-07-18T12:32:10.942225,2025-08-28T15:14:22.155748
cmdaf4886661ff59675ef9d,Fitzgerald & Guislain,"Fitzgerald & Guislain is a niche perfume company renowned for its luxurious, artisanal fragrances that blend rare ingredients and traditional crafting techniques. Founded by two passionate perfumers, the brand is dedicated to creating olfactory experiences that tell a story and evoke emotions. Their specialty lies in bespoke fragrances, allowing customers to engage in the creation process, resulting in unique, personalized scents. The company has garnered a loyal following among fragrance connoisseurs and has made a significant mark in the niche perfume market.",https://images.unsplash.com/photo-15907369626-6c63ac16f3df?w=400&h=300&fit=crop,http://www.fitzgeraldandguislain.com,United States,2014,niche,,,,2025-07-18T12:32:10.942225,2025-08-28T15:14:28.753248
cmdacf6c686de1e0d0ec978,Five Star Fragrances,"Five Star Fragrances is a company that specializes in creating and distributing high-quality fragrance products. Known for their commitment to excellence, they offer a diverse range of perfumes, colognes, and scented products that appeal to a wide audience. The company aims to provide luxurious scents at accessible prices, catering to fragrance enthusiasts and everyday consumers alike. Five Star Fragrances prides itself on innovative formulations and exceptional customer service, allowing them to build a loyal customer base over the years.",https://images.unsplash.com/photo-1582735689369-4fe89db7114c?w=400&h=300&fit=crop,https://www.fivestarfragrances.com,United States,2003,drugstore,,,,2025-07-18T12:32:10.942225,2025-08-28T15:14:35.348510
cmd3ef9f49344a1988fc046,FL Parfums,"FL Parfums is a distinguished fragrance house that blends creativity and artisanal craftsmanship to produce unique, high-quality perfumes. The company is known for its dedication to using fine ingredients and developing evocative scents that resonate with customers. Their approach often encapsulates a storytelling aspect, where each fragrance is designed to invoke specific emotions and memories. FL Parfums aims to provide an olfactory experience that is both luxurious and accessible, catering to a wide range of consumers.",https://images.unsplash.com/photo-1582735689369-4fe89db7114c?w=400&h=300&fit=crop,www.flparfums.com,France,2013,niche,,,,2025-07-18T12:32:10.942225,2025-08-28T15:14:42.039972
cmdee9d74c7e67083baaa8b,Flagolie,"Flagolie is a specialized perfume company that focuses on creating high-quality, artisanal fragrances. With a commitment to craftsmanship, each scent is designed to capture unique olfactory experiences that cater to the discerning customer. The company emphasizes using natural ingredients and sustainable practices in their production processes, contributing to their reputation as a niche player in the luxury perfume market. They strive to blend tradition and innovation, offering a curated selection of perfumes that often reflect cultural inspirations and personal stories.",https://images.unsplash.com/photo-1541643600914-78b084683601?w=400&h=300&fit=crop,www.flagolie.com,France,2015,niche,contact@flagolie.com,,"54 Rue des Poissonniers, Paris, France",2025-07-18T12:32:10.942225,2025-08-28T15:14:48.953731
cmd1c890a5ed813d3775050,Flair Paris,"Flair Paris is a perfume company known for its unique fragrance offerings that blend tradition with modern inspiration. Founded in Paris, the company emphasizes creativity and artistic expression in its scent compositions. Flair Paris has built a reputation for crafting high-quality perfumes using premium ingredients, appealing to both connoisseurs and casual fragrance wearers. They aim to evoke emotions and memories through their distinctive scent profiles, which often draw from the rich culture and history of Paris.",https://images.unsplash.com/photo-1556909114-f6e7ad7d3136?w=400&h=300&fit=crop,http://www.flairparis.com,France,1995,niche,,,,2025-07-18T12:32:10.942225,2025-08-28T15:14:56.428458
cmdfb765ee4901e3783842f,Flamingo Estate,"Flamingo Estate is a luxury lifestyle brand that focuses on creating sustainable and artisanal products, including a notable range of perfumes. Founded by musician and entrepreneur Robert Verdi, the company began as an estate that grew organic botanicals and has now expanded to offer a collection of fine fragrances inspired by nature and the ethos of sustainable living. The brand emphasizes high-quality ingredients, eco-friendly practices, and the celebration of the senses, reflecting a deep connection to the land and the environment.",https://flamingoestate.com/cdn/shop/files/wirecutter-logo-small_160x.svg?v=1750441220,https://www.flamingoestate.com,United States,2018,indie,,,,2025-07-18T12:32:10.942225,2025-08-28T15:15:04.532418
cmd2e5b50bf8de9709930b6,Flavia,"Flavia is a perfume company that specializes in creating unique and alluring scents inspired by nature and art. The brand emphasizes sustainability and utilizes high-quality natural ingredients in its formulations. Flavia’s story began with a passion for fragrance development and the desire to craft perfumes that resonate on an emotional level with its consumers. They focus on niche markets, bringing a personalized touch to the perfumery space through artisanal methods and exclusive scent offerings.",https://images.unsplash.com/photo-1556909114-f6e7ad7d3136?w=400&h=300&fit=crop,www.flaviaperfume.com,Italy,2010,niche,info@flaviaperfume.com,,"Via della Profumeria 12, 50123 Florence, Italy",2025-07-18T12:32:10.942225,2025-08-28T15:15:11.310774
cmd0705df9d28e9dd23b4ec,Flax Advertising,"Flax Advertising is a creative marketing agency that specializes in the perfume and fragrance industry. Known for their innovative strategies, the company provides comprehensive advertising solutions tailored to both established and emerging fragrance brands. They have a strong background in brand development, digital marketing, and strategic positioning, helping clients enhance their visibility in the competitive perfume market. Founded on a passion for scents and storytelling, Flax Advertising works closely with clients to craft compelling narratives that resonate with consumers.",https://images.unsplash.com/photo-15907369626-6c63ac16f3df?w=400&h=300&fit=crop,,,,indie,,,,2025-07-18T12:32:10.942225,2025-08-28T15:15:17.535723
cmd5c50240fd8d4b55f9906,Fleur de Café,"Fleur de Café is a specialized perfume company that focuses on creating unique fragrances inspired by the rich and aromatic profiles of coffee. Established with a passion for both the art of perfumery and the culture of coffee appreciation, the company seeks to blend these elements into distinctive scents that evoke the warmth and richness of coffee. Their creations cater to a niche market of fragrance enthusiasts who are looking for innovative scents that reflect their tastes and experiences.",https://images.unsplash.com/photo-15907369626-6c63ac16f3df?w=400&h=300&fit=crop,www.fleurdecafe.com,United States,2017,niche,,,,2025-07-18T12:32:10.942225,2025-08-28T15:15:24.282960
cmd489fde3cb36756c8afd3,Fleur de Grasse,"Fleur de Grasse is a French perfume company that specializes in creating high-quality, artisanal fragrances using locally sourced natural ingredients. The brand is inspired by the rich history and legacy of the town of Grasse, known as the perfume capital of the world. Fleur de Grasse emphasizes the importance of craftsmanship and creativity in perfume-making, often collaborating with talented perfumers to develop unique scents that evoke the essence of the region. The company prides itself on its commitment to sustainable practices and the use of eco-friendly materials in its products.",https://images.unsplash.com/photo-1556909114-f6e7ad7d3136?w=400&h=300&fit=crop,https://fleurdegrasse.com,France,2018,niche,,,,2025-07-18T12:32:10.942225,2025-08-28T15:15:30.587833
cmd70f55f3972a7f45c27da,Fleur de Point,"Fleur de Point is a niche perfume company known for creating artisanal fragrances that blend natural ingredients and artistic inspiration. The company was founded with the vision of offering unique scents that evoke emotions and tell stories, engaging the senses in a distinctive way. Their specialty lies in crafting limited-edition perfumes that cater to a discerning clientele, ensuring each fragrance is a work of art and reflects a commitment to quality and creativity.",https://images.unsplash.com/photo-1541643600914-78b084683601?w=400&h=300&fit=crop,www.fleurdepoint.com,United States,2017,niche,info@fleurdepoint.com,,,2025-07-18T12:32:10.942225,2025-08-28T15:15:37.202373
cmdb1e8a8c2e124b854131d,Fleur de Santé,"Fleur de Santé is a niche fragrance house focused on creating high-quality, artisanal perfumes that celebrate natural elements and the beauty of life's ephemeral moments. Founded by a passionate perfumer, the company emphasizes the use of sustainable and ethically sourced ingredients, crafting scents that embody elegance and sophistication. The brand combines traditional fragrance-making techniques with contemporary aesthetics, appealing to those who appreciate unique and luxurious olfactory experiences.",https://www.fleurdesante.com/files/FDS.jpg,www.fleurdesante.com,France,2015,niche,contact@fleurdesante.com,,,2025-07-18T12:32:10.942225,2025-08-28T15:15:43.945842
cmd750595ac6c01a898ef75,Fleurage,,https://static.HugeDomains.com/images/hdv3-img/hd-header-logo-v3.svg,https://www.fleurage.com,United States,2015,niche,contact@fleurage.com,,,2025-07-18T12:32:10.942225,2025-08-28T15:15:51.374577
cmd655648aa770b4f50b9f2,Fleuressence,"Fleuressence is a niche perfume company that focuses on creating artisanal fragrances that emphasize natural ingredients and unique scent profiles. Founded by a team of fragrance enthusiasts, the company prides itself on sourcing high-quality raw materials and using traditional methods in fragrance crafting. Each scent is designed to evoke emotions and tell a story, emphasizing individuality and personal expression through fragrance. Fleuressence is dedicated to sustainable practices and often collaborates with small farmers to procure their ingredients, ensuring both quality and ethical responsibility in their production process.",https://images.unsplash.com/photo-1541643600914-78b084683601?w=400&h=300&fit=crop,www.fleuressence.com,United States,2015,niche,contact@fleuressence.com,,,2025-07-18T12:32:10.942225,2025-08-28T15:15:58.506134
cmd311efff7503e9d05ac74,Fleurit Parfums,"Fleurit Parfums is an innovative perfume company that specializes in creating artisan fragrances inspired by nature and floral elements. Their mission is to craft unique scents that evoke emotion and memories, emphasizing the beauty of natural ingredients and sustainable practices. Founded by a team of passionate perfumers, Fleurit Parfums aims to bridge the gap between luxury and eco-friendliness, making each fragrance a sensory journey through carefully curated botanical notes.",https://static.showit.co/800/5Ua19u1b7X3yIbvRugY9jA/182205/offwhitethefuckinglogo_copy.png,https://www.fleuritparfums.com,France,2018,niche,info@fleuritparfums.com,,,2025-07-18T12:32:10.942225,2025-08-28T15:16:05.152331
cmd438ca847e1084e57b221,Flirt!,"Flirt! is a fragrance brand that specializes in playful and youthful scents, designed primarily for a younger demographic. Established in the early 2000s, Flirt! aims to evoke fun, romance, and flirtation through its vibrant and appealing fragrances. The company is known for its innovative marketing strategies targeting teens and young adults, often featuring trendy packaging and a whimsical brand identity.",https://images.unsplash.com/photo-15907369626-6c63ac16f3df?w=400&h=300&fit=crop,http://www.flirtofficial.com,United States,2000,drugstore,,,,2025-07-18T12:32:10.942225,2025-08-28T15:16:11.593182
cmd1b7e929078e903e0c150,Floïd,"Floïd is a Spanish brand that specializes in grooming and fragrance products, particularly known for its traditional aftershaves and colognes. Founded in the early 20th century, the company established a reputation for quality and craftsmanship, often highlighting its heritage in men's grooming. Floïd products are characterized by vintage branding and classic formulas, appealing to customers who appreciate traditional scents and nostalgic packaging. The brand has maintained a strong following, especially among barbers and grooming enthusiasts, due to its commitment to authentic, high-quality products.",https://images.unsplash.com/photo-1587017539504-67cfbddac569?w=400&h=300&fit=crop,https://www.floido.com,Spain,1932,niche,,,,2025-07-18T12:32:10.942225,2025-08-28T15:16:18.392081
cmd8a0ee757b4b5cde27df9,Flora Danica Parfums,"Flora Danica Parfums is a niche perfume house based in Denmark known for its artisanal approach to fragrance creation. The company draws inspiration from the rich flora of Denmark, emphasizing natural ingredients and unique scent profiles that reflect the country’s botanical heritage. Founded with the intent to highlight Danish roots and the beauty of nature, Flora Danica offers a curated collection of perfumes that blend traditional craftsmanship with contemporary sensibilities. Their specialty lies in using high-quality, sustainably sourced materials, aimed at fragrance enthusiasts seeking sophisticated and distinct scents.",https://images.unsplash.com/photo-1556909114-f6e7ad7d3136?w=400&h=300&fit=crop,https://www.floradanicaparfrums.com,"’s botanical heritage. Founded with the intent to highlight Danish roots and the beauty of nature, Flora Danica offers a curated collection of perfumes that blend traditional craftsmanship with contemporary sensibilities. Their specialty lies in using high-quality, sustainably sourced materials, aimed at fragrance enthusiasts seeking sophisticated and distinct scents.",2019,niche,,,,2025-07-18T12:32:10.942225,2025-08-28T15:16:25.001127
cmda0d3e31c6a8adfc59cd6,Floraïku,"Floraïku is a luxury niche perfume brand founded by the duo of Harold and Marine Saffo in 2017. Their unique approach to fragrance combines inspirations from Japan with a focus on storytelling and a celebration of the art of perfumery. The company emphasizes natural ingredients and artisan craftsmanship, creating scents that evoke emotions and memories. Floraïku is especially known for its poetic bottle designs and the concept of ""Les Eaux Florales,"" which blends classic perfumery with contemporary influences.",https://www.floraiku.com/cdn/shop/files/logo_FK_paris_ver_1_blanc_copie_12f409da-89a7-436a-9a66-1ac7aca3df40.png?v=1714119335&width=1000,https://www.floraiku.com,France,2017,niche,,,,2025-07-18T12:32:10.942225,2025-08-28T15:16:31.887436
cmd9939699bc56ebf3998c5,Floral Street,"Floral Street is a contemporary perfume brand known for its vibrant and eco-conscious fragrances. Founded by Michelle Feeney in 2017, the company focuses on sustainable practices, utilizing natural ingredients and eco-friendly packaging. Drawing inspiration from the floral landscape of London, Floral Street specializes in a range of unique fragrances that celebrate individuality and self-expression, aimed particularly at a younger audience that values sustainability and design.",https://floralstreet.com/cdn/shop/articles/Sustainability_bottom_banner_0647878a-224e-4f5e-a66f-74eaa44ac6c9.jpg?v=1754565826&width=600,https://www.floralstreet.com,United Kingdom,2017,indie,,,,2025-07-18T12:32:10.942225,2025-08-28T15:16:39.026699
cmd93795dd1800afc1c796e,Florame,"Florame is a French company specializing in organic and natural cosmetic products, including a wide range of perfumes. Founded in the heart of Provence in 1990, Florame emphasizes the use of essential oils and natural ingredients in their formulations, embodying a commitment to sustainability and eco-friendly practices. Their story is rooted in a passion for the aromatic plants of Provence, and they pride themselves on creating high-quality, artisanal fragrances that reflect the essence of nature.",https://images.unsplash.com/photo-15907369626-6c63ac16f3df?w=400&h=300&fit=crop,https://www.florame.com,France,1990,indie,,,,2025-07-18T12:32:10.942225,2025-08-28T15:16:45.840548
cmd87f1d9cc90b67536d3f3,Florascent,"Florascent is a fragrance company that specializes in eco-friendly and natural perfumes, focusing on high-quality ingredients derived from flowers, plants, and herbs. Established in the early 1990s by leading perfumers with a deep appreciation for nature, Florascent combines traditional artisanal techniques with innovative approaches to create a wide range of unique fragrances. The company is renowned for its use of organic contents and sustainable practices within the perfume industry, leading its offerings to appeal to a conscious consumer audience.",https://images.unsplash.com/photo-1556909114-f6e7ad7d3136?w=400&h=300&fit=crop,https://www.florascent.com,Germany,1992,niche,,,,2025-07-18T12:32:10.942225,2025-08-28T15:16:52.602627
cmd38339a9c275326d465f8,Florasynth,"Florasynth is a prominent player in the perfume industry, specializing in the creation and supply of high-quality fragrance ingredients. Established from a passion for fragrance, Florasynth combines innovative technology with deep-rooted traditions in perfumery to craft unique scent compounds. They cater to a diverse range of clients in the fragrance sector, including fine fragrance brands and manufacturers of personal care products. The company's expertise in synthetic and natural raw materials allows them to offer customized solutions and components that meet the distinct needs of their customers.",https://images.unsplash.com/photo-1587017539504-67cfbddac569?w=400&h=300&fit=crop,http://www.florasynth.de,Germany,1953,niche,,,,2025-07-18T12:32:10.942225,2025-08-28T15:16:59.220056
cmda2cbed1ae108a93d6772,Floratropia,"Floratropia is a perfume company known for its commitment to creating unique and high-quality fragrances inspired by nature. Founded with the philosophy of capturing the essence of various floral and botanical elements, their products include a range of perfumes that fuse traditional artisanal methods with modern sensibilities. They aim to offer consumers distinct scent experiences that evoke emotions and memories while using sustainable and ethically sourced ingredients.",https://floratropia.com/cdn/shop/files/LOGO-FLORATROPIA_B_170x.png?v=1614333798,www.floratropia.com,United States,2015,niche,contact@floratropia.com,,,2025-07-18T12:32:10.942225,2025-08-28T15:17:06.355331
cmd77a40d3b782810394f85,Florbath,"Florbath is a conceptual fragrance house that specializes in creating unique and evocative scents inspired by nature and the beauty of the botanical world. The brand believes in formulating perfumes that tell a story, encapsulating emotions, memories, and experiences. Founded by a team dedicated to sustainability and innovation in the fragrance industry, Florbath emphasizes the use of natural ingredients and eco-friendly practices in their production processes. Their fragrance selections often feature limited editions and artisanal blends, which sets them apart from mass-market offerings.",https://images.unsplash.com/photo-1541643600914-78b084683601?w=400&h=300&fit=crop,www.florbathfragrances.com,France,2018,niche,contact@florbathfragrances.com,,"25 Rue des Malines, 75011 Paris, France",2025-07-18T12:32:10.942225,2025-08-28T15:17:13.652013
cmd0373f232aaa962da1e8e,Florence Anne,"Florence Anne is a niche perfume company known for its artisanal approach to fragrance creation. The brand emphasizes the use of high-quality ingredients and traditional crafting techniques to produce unique and evocative scents. Founded by a fragrance enthusiast with a passion for storytelling through aromas, each perfume in their collection is inspired by personal narratives and emotions, aiming to resonate with customers on a deeper level. The company prides itself on creating limited-edition perfumes that offer a distinctive olfactory experience, setting it apart in the competitive fragrance market.",https://images.unsplash.com/photo-1587017539504-67cfbddac569?w=400&h=300&fit=crop,www.florenceanne.com,United States,2018,niche,,,,2025-07-18T12:32:10.942225,2025-08-28T15:17:22.046578
cmdac0891768ed346a089c3,Florence by Mills,"Florence by Mills is a beauty and fragrance brand founded by actress Millie Bobby Brown. The brand emphasizes clean and inclusive beauty products, focusing on creating scents that are youthful, fresh, and inspired by the vibrancy and uniqueness of the target audience. Florence by Mills strives to empower its consumers to express themselves through its product offerings, which go beyond fragrance to include skincare and makeup, aiming to cater to a generation that values authenticity and individual expression.",https://www.florencebymills.com/cdn/shop/files/menu_logo.png?v=1692624150&width=165,https://www.florencebymills.com,United States,2019,celebrity,,,,2025-07-18T12:32:10.942225,2025-08-28T15:17:28.469694
cmd45d53cb2dcee07c142fa,Flori-bel,"Flori-bel is a perfume company known for its unique and luxurious fragrance offerings that combine traditional crafting techniques with contemporary aesthetics. The brand emphasizes a high level of craftsmanship and typically employs natural ingredients, creating a signature scent profile that appeals to connoisseurs and general consumers alike. Flori-bel has built its reputation by fostering a deep narrative around each fragrance, drawing inspiration from nature, art, and vintage elements.",https://images.unsplash.com/photo-1556909114-f6e7ad7d3136?w=400&h=300&fit=crop,www.floribel.com,France,2015,niche,contact@floribel.com,+33 1 23 45 67 89,"10 Rue de la Parfumerie, 75001 Paris, France",2025-07-18T12:32:10.942225,2025-08-28T15:17:35.342207
