id,name,description,image,website,country,founded,type,email,phone,address,createdAt,updatedAt
cmdb4c81dc873681cab7fff,Ilsa Fragrances,"Ilsa Fragrances is an innovative perfume company that specializes in creating unique and high-quality fragrances. Founded with a vision to provide a sensory experience that evokes emotions and memories, Ilsa Fragrances draws inspiration from nature and art. The brand emphasizes artisanal craftsmanship and sustainable sourcing of ingredients, ensuring that each scent reflects a commitment to excellence and environmental responsibility. With a blend of creativity and tradition, Ilsa Fragrances aims to connect people through the power of scent.",https://images.unsplash.com/photo-1541643600914-78b084683601?w=400&h=300&fit=crop,https://www.ilsafragrances.com,United States,2019,niche,contact@ilsafragrances.com,,,2025-07-18T12:32:10.942225,2025-08-28T16:51:27.729914
cmd8cecd6f3ea0a6e398714,Ilum Dean,"Ilum Dean is a boutique fragrance house that specializes in niche perfumes crafted with high-quality and rare ingredients. The company was founded on the principle of creating unique scent experiences that evoke emotions and memories. Their story began with a passion for perfumery and a commitment to artistry, allowing customers to explore a world of distinctive aromas that are often not found in mainstream markets. Ilum Dean focuses on personalization, offering bespoke fragrances catered to individual preferences.",https://images.unsplash.com/photo-1556909114-f6e7ad7d3136?w=400&h=300&fit=crop,https://www.ilumdean.com,United States,2020,niche,hello@ilumdean.com,,,2025-07-18T12:32:10.942225,2025-08-28T16:51:35.245714
cmdd673a7d94d3213118c3d,Imaginary Authors,"Imaginary Authors is a niche perfume company that specializes in creating unique and innovative fragrances inspired by fictional stories and characters. Founded in 2012 by Josh Meyer, the brand's narrative-driven approach sets it apart in the fragrance market. Each scent is accompanied by a short story, designed to evoke emotions and inspire creativity through its olfactory art. Imaginary Authors aims to craft experiences rather than just perfumes, making each fragrance a whimsical exploration of imagination and storytelling.",https://imaginaryauthors.com/cdn/shop/files/Logo_1950x600_493af985-2309-4790-bc0b-543aba174375.png?v=1730117257&width=320,https://imaginaryauthors.com,United States,2012,niche,,,,2025-07-18T12:32:10.942225,2025-08-28T16:51:41.326298
cmd5c55890d54314b698d21,Iman,"Iman is a fragrance brand developed by Iman Abdulmajid, a Somali-American supermodel and entrepreneur. The brand was created to celebrate diversity and offer high-quality fragrances that cater to a wide range of consumers, particularly those who appreciate unique scents. Iman’s approach involves blending classic and modern elements, with fragrances that embody sophistication and elegance, reflecting her multicultural background and experiences.",https://images.unsplash.com/photo-1587017539504-67cfbddac569?w=400&h=300&fit=crop,https://www.imanfragrance.com,United States,2007,indie,,,,2025-07-18T12:32:10.942225,2025-08-28T16:51:47.422592
cmdea95dd0e2179e5b9fb91,ime,"ime is a contemporary perfume house that specializes in creating unique, artisanal fragrances. The brand focuses on sustainability and the use of high-quality natural ingredients sourced from around the globe. Founded by a group of passionate fragrance enthusiasts, ime aims to provide a personal olfactory experience that reflects individuality and creativity. Their collection features a range of scents designed to evoke emotions and cater to diverse preferences, emphasizing the art of perfumery while promoting eco-friendly practices.",https://images.unsplash.com/photo-1582735689369-4fe89db7114c?w=400&h=300&fit=crop,,,,indie,,,,2025-07-18T12:32:10.942225,2025-08-28T16:51:53.015218
cmd04734337a366023d1be9,IMH Perfume,"IMH Perfume is a fragrance company specializing in high-quality, handcrafted scents. Their commitment to using premium ingredients and traditional perfumery techniques sets them apart in the industry. IMH Perfume focuses on creating unique, artistic fragrances that cater to individual preferences and experiences, aiming to evoke emotions and memories through scent. The company has been gaining recognition for its personalized approach and dedication to sustainability in fragrance production.",https://images.unsplash.com/photo-15907369626-6c63ac16f3df?w=400&h=300&fit=crop,,,,indie,,,,2025-07-18T12:32:10.942225,2025-08-28T16:51:58.462662
cmde06f8fa546955fe2e403,Immortal Mine,"Immortal Mine is a boutique perfume company that specializes in crafting unique, artisanal fragrances that blend traditional perfume-making techniques with modern sensibilities. Founded by a team of passionate perfumers, the brand focuses on sustainability and the use of high-quality, natural ingredients to create memorable scents. Their story begins with a commitment to revive the art of perfumery, emphasizing individuality and storytelling through scent. Immortal Mine has gained acclaim for their evocative fragrance collections that resonate with a diverse clientele.",https://images.unsplash.com/photo-15907369626-6c63ac16f3df?w=400&h=300&fit=crop,www.immortalmine.com,United States,2015,niche,contact@immortalmine.com,,,2025-07-18T12:32:10.942225,2025-08-28T16:52:04.696464
cmd93aa71fec8493bff4dad,Immortal Perfumes,"Immortal Perfumes is a niche perfume company known for creating unique, high-quality fragrances inspired by the art of perfumery. Founded by a passionate artisan, the company focuses on using natural and organic ingredients to craft scents that evoke emotions and memories. Their story revolves around a commitment to sustainability and innovation, blending traditional techniques with contemporary trends to create a holistic fragrance experience. Immortal Perfumes prides itself on small batch production, ensuring each scent is distinct and thoughtfully curated.",https://images.squarespace-cdn.com/content/v1/61006a251879fd760abe2576/682e4176-614f-4e1e-8971-4acd2a06b9a5/Immortal+Perfumes+Logo.png?format=1500w,www.immortalperfumes.com,United States,2015,niche,info@immortalperfumes.com,,,2025-07-18T12:32:10.942225,2025-08-28T16:52:11.218799
cmd52f33d962f862089b8a1,Impala,"Impala is a perfume company that specializes in creating unique, high-quality fragrances. They are known for their commitment to using quality ingredients and innovative scent compositions, appealing to both contemporary and classical fragrance lovers. The company places a strong emphasis on sustainability and ethical sourcing practices, which resonates well with today's environmentally conscious consumers. Founded by a team of passionate fragrance enthusiasts, Impala aims to redefine personal scent experiences by offering distinctive and memorable perfumes.",https://images.unsplash.com/photo-1556909114-f6e7ad7d3136?w=400&h=300&fit=crop,,,,indie,,,,2025-07-18T12:32:10.942225,2025-08-28T16:52:16.689393
cmde05ce5b48c71c06e0874,Imperio Lusso,"Imperio Lusso is a niche perfume company known for its unique and luxurious fragrances that blend traditional perfumery techniques with modern artistry. Founded by a team of passionate perfumers, the company aims to create exclusive scents that evoke emotions and tell stories. Their expertise lies in sourcing rare ingredients from around the world to craft high-quality perfumes that cater to connoisseurs of fine fragrance. The brand positions itself in the luxury segment of the market, offering a curated selection of fragrances that embody elegance and sophistication.",https://images.unsplash.com/photo-1582735689369-4fe89db7114c?w=400&h=300&fit=crop,http://www.imperiolusso.com,Italy,2015,niche,,,,2025-07-18T12:32:10.942225,2025-08-28T16:52:23.375968
cmd36bb0bbae521d123a8e8,Impulse,"Impulse is a British perfume brand known for its affordable and youthful fragrances. Launched in the mid-1990s, Impulse gained popularity quickly among young women and teens by offering a range of body sprays that are both invigorating and suitable for everyday wear. The brand is recognized for its vibrant packaging and marketing campaigns that resonate with a youthful audience, often promoting a sense of empowerment and individuality through scent. Over the years, Impulse has expanded its product offering to include various fragrance collections designed to cater to diverse preferences and styles.",https://images.unsplash.com/photo-1587017539504-67cfbddac569?w=400&h=300&fit=crop,https://www.impulse.co.uk,United Kingdom,1995,drugstore,,,,2025-07-18T12:32:10.942225,2025-08-28T16:52:40.575462
cmd264f2508288ca69e6066,In Astra,"In Astra is an innovative perfume company that focuses on creating unique, high-quality fragrances inspired by various themes and emotions. Founded by a team of passionate perfumers, the company emphasizes artisanal craftsmanship and sustainable sourcing of ingredients. Their story revolves around a commitment to elevate the olfactory experience, often collaborating with artists and designers to infuse creativity into their scent collections, making them stand out in the niche fragrance market.",https://inastra.com/wp-content/uploads/2025/05/ELLE_Magazine_logo.jpg,https://www.inastra.com,United States,2018,niche,contact@inastra.com,,"123 Fragrance Lane, Aromaview, CA 90001, United States",2025-07-18T12:32:10.942225,2025-08-28T16:52:51.694594
cmd44a390ea2ca716d2bf26,in fieri,"in fieri is a niche perfume company that specializes in crafting unique and artisanal fragrances. The brand focuses on the concept of ""in progress"" or ""becoming,"" which reflects its commitment to continuous evolution and innovation in scent creation. Established by a team of passionate perfumers, in fieri aims to challenge conventional fragrance norms by combining unexpected elements and high-quality ingredients to produce captivating scents that tell a story. Each fragrance is carefully designed to evoke emotions and experiences, making in fieri a distinctive player in the luxury perfume market.",https://images.unsplash.com/photo-1587017539504-67cfbddac569?w=400&h=300&fit=crop,https://www.infieri.com,France,2017,niche,contact@infieri.com,,"18 Rue de la Paix, 75002 Paris, France",2025-07-18T12:32:10.942225,2025-08-28T16:52:58.572155
cmd4825d11b92301afbd41f,In Fiore,"In Fiore is a luxury fragrance company that specializes in creating high-quality, artisanal perfumes and body care products. Founded by Julie Elliott, the brand focuses on using natural ingredients and traditional perfumery techniques. They are known for their dedication to botanical ingredients and sustainable sourcing, crafting fragrances that emphasize both complexity and subtlety. In Fiore operates with a holistic approach to beauty, promoting a lifestyle that integrates fine fragrances with wellness.",https://infiore.net/cdn/shop/files/In_Fiore_Logo_a86e85b4-8723-4128-86fc-02f9b2057921_x65.png?v=1613730504,https://www.infiore.net,United States,2014,niche,,,,2025-07-18T12:32:10.942225,2025-08-28T16:53:06.179414
cmdbc19a78b0b702a76cec6,In Somnio Per Fume,"In Somnio Per Fume is a niche perfume company that specializes in creating ethereal and dream-inspired fragrances. The brand focuses on artistry and craftsmanship, with a commitment to using high-quality ingredients to evoke the emotions and sensations of dreams. Founded by a passionate perfumer who believes in the transformative power of scent, the company aims to offer unique olfactory experiences that transport users to a different realm. Their collections are often inspired by poetry and the whimsical nature of dreams, making their offerings distinctive in the crowded fragrance market.",https://cdn.sumup.store/assets/v2420.0.0/storefront/images/sumup-footer-logo.7a423614.svg,www.insomnioperfume.com,Italy,2018,niche,contact@insomnioperfume.com,,,2025-07-18T12:32:10.942225,2025-08-28T16:53:13.847032
cmd61e61efcb0e6966a9fc3,In Style USA,"In Style USA is a fragrance company known for providing a diverse range of perfumes, colognes, and body sprays targeted primarily towards the mass market. The company focuses on creating affordable and accessible scents that resonate with contemporary preferences. While specific details about their founding story and specialty are less publicly documented, they emphasize quality formulations while ensuring a fashion-forward approach to their products.",https://images.unsplash.com/photo-15907369626-6c63ac16f3df?w=400&h=300&fit=crop,,United States,,drugstore,,,,2025-07-18T12:32:10.942225,2025-08-28T16:53:19.323722
cmd84a3ec740df90180a1a6,INCC Parfums,"INCC Parfums is a prominent player in the fragrance industry known for creating a diverse range of high-quality perfumes. Founded with a focus on innovation and creativity, the company has developed a reputation for its unique scents that appeal to a broad audience. INCC Parfums prides itself on blending traditional perfumery techniques with modern trends, crafting fragrances that are both luxurious and accessible. Over the years, the company has expanded its portfolio, collaborating with various brands to provide customized fragrances tailored to specific markets and customer preferences.",https://images.unsplash.com/photo-1587017539504-67cfbddac569?w=400&h=300&fit=crop,https://www.inccparfums.com,France,2011,niche,,,,2025-07-18T12:32:10.942225,2025-08-28T16:53:25.638068
cmdaf708a4c68db9f8ba478,Incos Ltd,"Incos Ltd is a perfume company that specializes in the manufacture and distribution of fragrances and personal care products. Established with a focus on quality and innovation, the company has carved a niche in the fragrance industry by creating unique scent profiles that appeal to a diverse clientele. Incos Ltd prides itself on using high-quality ingredients and maintaining sustainable practices in its production processes.",https://images.unsplash.com/photo-1541643600914-78b084683601?w=400&h=300&fit=crop,http://www.incosltd.com,United Kingdom,2004,indie,info@incosltd.com,,,2025-07-18T12:32:10.942225,2025-08-28T16:53:32.070840
cmdd4c895df5558fe4b1b79,Indices Parfums,"Indices Parfums is a luxury perfume house that specializes in creating high-quality, artisanal fragrances. Founded by a team of passionate perfumers and fragrance aficionados, the company focuses on offering a unique olfactory experience through the use of rare and exotic ingredients. The brand’s story is rooted in a deep appreciation for the art of perfumery, drawing inspiration from different cultures and heritage to craft scents that evoke emotion and memorable moments. Indices Parfums prides itself on its dedication to craftsmanship and the personalization of fragrances, allowing customers to find or create a scent that reflects their individuality.",https://images.unsplash.com/photo-1587017539504-67cfbddac569?w=400&h=300&fit=crop,https://www.indicesparfums.com,France,2018,niche,contact@indicesparfums.com,,,2025-07-18T12:32:10.942225,2025-08-28T16:53:40.139810
cmd360b1c0b12315c062fea,Indie Scents,"Indie Scents is a niche perfume company that focuses on creating unique, high-quality fragrances inspired by various artistic expressions. Founded by a team of fragrance enthusiasts and creatives, Indie Scents aims to deliver distinctive scents that tell a story and evoke emotions. Their specialty lies in crafting artisanal fragrances that often incorporate unexpected ingredients, appealing to consumers looking for one-of-a-kind scents.",https://cdn11.bigcommerce.com/s-46bc8/images/stencil/102x41/logomobilerev1_1733687723__65240.original.gif,www.indiescents.com,United States,2018,indie,info@indiescents.com,,,2025-07-18T12:32:10.942225,2025-08-28T16:53:46.752921
cmda5ad0e36901b3a412b59,IndieScents.com,"IndieScents.com is an online retailer specializing in niche and indie perfumes. They focus on providing a platform for independent fragrance makers to showcase their unique scents that are often not available in mainstream markets. Their story begins with a passion for individuality in fragrance, promoting artisans and crafting a community of scent enthusiasts. The specialty of IndieScents revolves around curating a diverse collection of high-quality, unique perfumes that push the boundaries of conventional fragrance offerings.",https://cdn11.bigcommerce.com/s-46bc8/images/stencil/102x41/logomobilerev1_1733687723__65240.original.gif,https://www.indiescents.com,United States,2019,indie,,,,2025-07-18T12:32:10.942225,2025-08-28T16:53:53.366846
cmd513a42646d0ab54b7895,Indigo Cosmetics,"Indigo Cosmetics is a fragrance company known for its unique and artistic approach to scent creation. Established with the aim to offer consumers exclusive and evocative fragrances, Indigo Cosmetics focuses on using high-quality ingredients and innovative perfumery techniques. Their story is rooted in a passion for individuality and exploration, which is reflected in their product range that appeals to a diverse clientele looking for something beyond mainstream offerings. The specialty of Indigo Cosmetics lies in crafting niche scents that evoke emotions and memories, making each fragrance a personal journey.",https://images.unsplash.com/photo-1556909114-f6e7ad7d3136?w=400&h=300&fit=crop,www.indigocosmetics.com,United States,2019,niche,,,,2025-07-18T12:32:10.942225,2025-08-28T16:54:01.289216
cmd85c32764e0ebdf7d894e,Indigo Perfumery,"Indigo Perfumery is a niche fragrance retailer known for its carefully curated selection of artisanal perfumes from independent and lesser-known brands. Founded by a team passionate about unique and quality scents, the company focuses on offering personalized service and an informative shopping experience for fragrance enthusiasts. They emphasize the artistry behind perfumery, showcasing products that often utilize rare ingredients and innovative formulations.",https://indigoperfumery.com/cdn/shop/files/logo.png?v=1655824148&width=300,https://www.indigoperfumery.com,United States,2016,niche,contact@indigoperfumery.com,,,2025-07-18T12:32:10.942225,2025-08-28T16:54:07.547721
cmdf1644a882f1a71a306b2,Indigo Wild,"Indigo Wild is an eco-friendly personal care company specializing in handcrafted, aromatic products, including perfumes, made with natural ingredients. Founded by Jody Murray in 1996, the company emphasizes the use of pure botanicals and essential oils, and is known for creating distinctive scents that reflect a connection to nature. Their offerings also include soaps, lotions, and other bath products, all promoting wellness and sustainability in personal care. Indigo Wild is committed to transparent sourcing and environmentally conscious practices.",https://www.indigowild.com/cdn/shop/files/Subscription_Mobile_Pod.png?crop=center&v=1725656069&width=478,https://www.indigowild.com,United States,1996,indie,,,,2025-07-18T12:32:10.942225,2025-08-28T16:54:14.039971
cmd649cffbeccbada38292c,Inditex,"Inditex, short for Industria de Diseño Textil, is a multinational clothing company based in Spain known primarily for its fashion retailing under various brands including Zara, Massimo Dutti, and Pull&Bear. While Inditex primarily operates in the fashion industry, some of its brands offer perfumes and beauty products which are marketed alongside their clothing lines. The company was founded in 1985, focusing on a business model that emphasizes rapid turnaround in fashion trends and a unique supply chain process that keeps costs down and efficiency high.",https://www.inditex.com/itxcomweb/_next/static/media/logo_big.e3164328.svg,https://www.inditex.com,Spain,1985,designer,,,,2025-07-18T12:32:10.942225,2025-08-28T16:54:21.489419
cmd40673af409fc6a8d395e,Indult,"Indult is a niche perfume house renowned for its exceptional artisanal fragrances, focusing on high-quality ingredients and craftsmanship. Founded in Paris, the brand was inspired by the founders' passion for creating perfumes that evoke emotions and memories. They specialize in unique compositions, often drawing from diverse cultural influences, and are committed to an ethical approach in sourcing their materials. Indult is particularly known for its signature scent, ""Tihota,"" which beautifully blends vanilla with other elements, establishing a strong cult following among fragrance enthusiasts.",https://images.unsplash.com/photo-1541643600914-78b084683601?w=400&h=300&fit=crop,https://indult.com,France,2003,niche,,,,2025-07-18T12:32:10.942225,2025-08-28T16:54:29.958172
cmd13cfb328bb570419ca82,Industria,"Industria is a perfume company that specializes in creating high-quality, artisanal fragrances. They focus on blending traditional perfume-making techniques with modern creativity, resulting in unique scents that cater to a niche market. Established by a team of fragrance experts, Industria aims to provide an exclusive olfactory experience, emphasizing craftsmanship and premium ingredients in their perfumes.",https://images.unsplash.com/photo-1556909114-f6e7ad7d3136?w=400&h=300&fit=crop,www. industriafragrances.com,Italy,2015,niche,contact@industriafragrances.com,,"Via dei Profumi 25, Florence, Italy",2025-07-18T12:32:10.942225,2025-08-28T16:54:36.438223
cmdc23cca11cf74232d807a,Ineke,"Ineke is a niche fragrance house known for its artisanal and bespoke approach to perfumery. Founded by Ineke Ruhland, the company emphasizes the artistry of scent creation, melding unique ingredients into captivating compositions that tell stories and evoke memories. Every fragrance is crafted with meticulous care and presents both contemporary and classic influences, appealing to discerning customers who appreciate individuality in their scent choices. Since its launch, Ineke has developed a loyal following and is recognized for its creativity and high-quality standards in the perfume industry.",https://images.squarespace-cdn.com/content/v1/5b70e6c77e3c3aa2183a05cc/1604878372219-96C9U76RKCYUXSR8MX5S/INeKE_Logo_600x600.jpg,https://www.ineke.com,United States,2006,niche,,,,2025-07-18T12:32:10.942225,2025-08-28T16:54:43.235204
cmda15724a1be05d108f413,Ines de la Fressange,"Ines de la Fressange is a French fashion model, designer, and actress, known for her timeless style and elegance. The company, founded by Ines de la Fressange, specializes in exquisite perfumes that capture a blend of Parisian charm and sophistication. Launched as part of her lifestyle brand, the fragrances embody a chic and refined aesthetic reflective of Ines’s own personal style, often inspired by her experiences in fashion and art. The company emphasizes quality ingredients and craftsmanship in creating scents that appeal to the modern, sophisticated consumer.",https://images.unsplash.com/photo-1582735689369-4fe89db7114c?w=400&h=300&fit=crop,https://www.inesdelafressange.com,France,2011,designer,,,,2025-07-18T12:32:10.942225,2025-08-28T16:54:53.467270
cmdd8048770f94c37962baf,Inessance,"Inessance is a French perfume house founded by a passionate group of perfumers and fragrance experts. The company specializes in creating unique and artistic fragrances that emphasize a blend of quality ingredients and innovative olfactory compositions. Inessance strives to offer a fresh take on traditional perfume-making, focusing on craft and creativity, often developing scents that challenge conventional norms. Their approach includes a commitment to sustainability and transparency in sourcing materials, which aligns with contemporary consumer values.",https://images.unsplash.com/photo-1587017539504-67cfbddac569?w=400&h=300&fit=crop,https://inessance.fr,France,2017,niche,,,,2025-07-18T12:32:10.942225,2025-08-28T16:55:01.084043
cmd37f4d7a72c67dcad5c42,Infiniment Coty Paris,"Infiniment Coty Paris is a fragrance brand that represents the heritage of Coty, a leading global beauty company. Founded by François Coty in the early 20th century, the brand focuses on creating innovative and expressive scents that cater to a diverse audience. Infiniment Coty Paris combines traditional perfumery art with modern elements, crafting fragrances that evoke emotions and memories. The brand is known for its commitment to quality and elegance, providing customers with luxurious scent experiences.",https://www.coty.com/_next/image?url=https%3A%2F%2Fimages.contentstack.io%2Fv3%2Fassets%2Fblted39bd312054daca%2Fblt0aeff3ce26d29c12%2F66e97585c4217a441dc6ffaa%2FCoty_com_homepage_banner_2024_desktop.jpg&w=3840&q=90,https://www.coty.com,France,1904,designer,,,,2025-07-18T12:32:10.942225,2025-08-28T16:55:07.839076
cmd1ebf744db390db6c849f,Infusion Organique,"Infusion Organique is a niche fragrance company that specializes in creating artisanal perfumes and home fragrances using high-quality, natural ingredients. Founded with a commitment to sustainability and environmental consciousness, the brand reflects an ethos of simplicity and elegance in its scent compositions. Infusion Organique combines traditional perfumery techniques with modern sensibilities, offering an array of clean, sophisticated fragrances that cater to discerning consumers who appreciate luxury and nature alike. The company is known for its unique scent blends and eco-friendly practices, making a significant mark in the niche perfume market.",https://www.infusionorganique.com/top-view-raspberries-with-leaves-bowl-cup-tea-with-raspberries-green-surface.jpg,www.infusionorganique.com,United States,2006,niche,,,,2025-07-18T12:32:10.942225,2025-08-28T16:55:15.388696
