id,name,description,image,website,country,founded,type,email,phone,address,createdAt,updatedAt
cmd365de6a403436be3bb85,Tesco,"Tesco is a British multinational grocery and general merchandise retailer. Founded in 1919, Tesco has expanded its offerings to include a wide range of products, including private label perfumes and fragrances under its supermarket brand. Their approach focuses on affordability and accessibility, catering to a diverse customer base.",https://images.unsplash.com/photo-1587017539504-67cfbddac569?w=400&h=300&fit=crop,https://www.tesco.com,United Kingdom,1919,drugstore,,,,2025-07-18T12:32:10.942225,2025-08-29T14:24:14.442754
cmd1a6564b0691e95145dfa,Tesori d'Oriente,"Tesori d'Oriente is a fragrance company based in Italy, known for its unique approach to scent creation that draws inspiration from ancient cultures and traditions. The brand offers a wide range of products including perfumes, body lotions, and shower gels, all infused with intricate notes that reflect exotic lands and ancient civilizations. Since its inception, Tesori d'Oriente has focused on providing luxurious scents that celebrate the beauty and richness of different cultures, making their products luxurious yet accessible. The brand emphasizes quality and craftsmanship in its products, which are designed to transport consumers to far-off places through scent.",https://www.tesoridoriente.com/themes/custom/tso/logo.svg,https://www.tesoridoriente.com,Italy,2001,niche,,,,2025-07-18T12:32:10.942225,2025-08-29T14:24:22.497007
cmd81d7c01d265f546b4347,Tessa Williams,"Tessa Williams is a boutique perfume company that focuses on crafting unique, high-quality fragrances inspired by nature and personal experiences. Founded by Tessa Williams, the brand emphasizes the use of natural ingredients and sustainable practices in their fragrance development. Their collections offer a blend of modern and classic scents, appealing to both niche fragrance enthusiasts and those who appreciate artisanal craftsmanship.",https://images.unsplash.com/photo-1556909114-f6e7ad7d3136?w=400&h=300&fit=crop,www.tessawilliamsfragrance.com,United States,2015,niche,info@tessawilliamsfragrance.com,,,2025-07-18T12:32:10.942225,2025-08-29T14:24:28.636548
cmdc392f84374325f44c0ce,Testa Maura,"Testa Maura is a niche perfume company specializing in artisanal fragrance creation that focuses on high-quality ingredients and unique scent compositions. The brand is known for its commitment to artisanal craftsmanship and often draws inspiration from natural elements and personal stories. Founded with a vision to create wearable art, Testa Maura blends traditional perfumery techniques with modern sensibilities to create distinctive fragrances that resonate with both connoisseurs and casual users alike.",https://images.unsplash.com/photo-1587017539504-67cfbddac569?w=400&h=300&fit=crop,https://www.testamaura.com,Italy,2014,niche,info@testamaura.com,,"Via Roma 123, 00100 Rome, Italy",2025-07-18T12:32:10.942225,2025-08-29T14:24:35.658984
cmdffa0e85dfa0e94b22bbf,Testament London,"Testament London is a niche perfume company known for its elegant and diverse range of fragrances. Established with a mission to capture stories and memories through scent, the brand emphasizes the artistry and craftsmanship behind perfumery. Testament London's perfumes often evoke a sense of nostalgia, combined with a modern twist, engaging the senses by offering unique olfactory experiences. The brand is dedicated to creating limited editions and bespoke fragrances, appealing to those who appreciate individuality and luxury.",https://images.unsplash.com/photo-1587017539504-67cfbddac569?w=400&h=300&fit=crop,https://www.testamentlondon.com,United Kingdom,2020,niche,,,,2025-07-18T12:32:10.942225,2025-08-29T14:24:41.328839
cmd0ebb7dc63cac42920a53,Testament,"Testament is a luxury perfume company that focuses on creating unique and artistic fragrances inspired by various cultural and historical influences. Their story is rooted in a passion for scent exploration, aiming to evoke emotions and tell stories through the olfactory experience. They specialize in crafting high-quality, artisanal perfumes that appeal to discerning customers looking for distinctive and personalized scents.",https://images.unsplash.com/photo-1582735689369-4fe89db7114c?w=400&h=300&fit=crop,https://www.testamentperfumes.com,United States,2020,niche,contact@testamentperfumes.com,,"123 Scent Street, Fragrance City, CA 90001",2025-07-18T12:32:10.942225,2025-08-29T14:24:47.606966
cmd6316915db2c9c438fedb,Thaila Sodi,"Thaila Sodi is a fragrance brand known for its unique and vibrant scents that embody the spirit of contemporary elegance and creativity. The company is the brainchild of the Brazilian fashion designer Thaila Sodi, who translates her passion for fashion into the world of perfume. With a focus on high-quality ingredients and a blend of traditional and modern olfactory notes, Thaila Sodi aims to create memorable scents that resonate with consumers. The brand emphasizes the connection between fragrance and personal expression, making each perfume a statement of individuality.",https://images.unsplash.com/photo-1556909114-f6e7ad7d3136?w=400&h=300&fit=crop,https://www.thailasodi.com,Brazil,2014,designer,,,,2025-07-18T12:32:10.942225,2025-08-29T14:24:53.536473
cmdd04c3c9575f9e40ab9b4,Thalia Sodi,"Thalia Sodi is a fashion brand that encompasses a range of lifestyle products including clothing, jewelry, and fragrances. The brand is known for its vibrant and expressive designs that reflect Thalia's Latin heritage and personal style. Thalia Sodi's fragrances often embody the spirit of empowerment and femininity associated with the brand, targeting a diverse consumer base looking for products that resonate with their lifestyle and identity.",https://www.thaliasodi.com/img/logo.svg,https://www.thaliasodi.com,United States,2014,celebrity,,,,2025-07-18T12:32:10.942225,2025-08-29T14:24:59.489918
cmd971274811af8b5db1fd8,Thameen,"Thameen is a luxury perfume company known for creating high-quality, artisanal fragrances. Founded in 2013 by the perfumer Abdulaziz Althunayan, the brand draws inspiration from the rich cultural heritage and opulence of the Middle East, particularly the art of perfumery in traditional Arabian culture. Thameen specializes in crafting unique fragrances that often incorporate rare ingredients and an intricate blending process, offering a distinctive scent experience for its clientele. The brand is recognized for its elegant presentation and bespoke creations, which aim to evoke a sense of richness and sophistication.",https://images.unsplash.com/photo-15907369626-6c63ac16f3df?w=400&h=300&fit=crop,https://thameen.com,United Kingdom,2013,niche,,,,2025-07-18T12:32:10.942225,2025-08-29T14:25:06.227885
cmdfcdcd8d153f51605c181,That's So...,"That's So... is a contemporary fragrance brand that focuses on creating accessible, high-quality perfumes inspired by unique themes and moments. The company aims to evoke specific memories and feelings through their scent compositions. They leverage storytelling in their marketing to connect deeper with their customers, fostering a strong brand identity that resonates particularly well with younger demographics looking for personal expression.",https://images.unsplash.com/photo-1541643600914-78b084683601?w=400&h=300&fit=crop,https://www.thatsso.com,United Kingdom,2019,indie,,,,2025-07-18T12:32:10.942225,2025-08-29T14:25:12.361958
cmda6cd923a854d80974ea9,THD,"THD is a niche perfume company known for its unique and artisanal fragrance creations. The brand focuses on crafting high-quality perfumes using rare and exotic ingredients. Founded with the vision of bringing a personal touch to fragrance design, THD has established a strong reputation for its innovative scent compositions and limited edition releases, appealing to fragrance connoisseurs and enthusiasts who appreciate individuality and craftsmanship in their scents.",https://images.unsplash.com/photo-1582735689369-4fe89db7114c?w=400&h=300&fit=crop,,,,niche,,,,2025-07-18T12:32:10.942225,2025-08-29T14:25:18.175127
cmd17077a8aee9126d6d4f9,The 5th,"The 5th is an innovative perfume company specializing in luxury fragrances designed to evoke emotions and memories. Founded by a team of passionate artisans, they focus on quality ingredients and unique scent compositions. Their story is one of creativity and dedication to the art of perfumery, offering a curated collection that aims to celebrate individuality and self-expression through scent.",https://the5th.com/wp-content/uploads/2024/11/the5th_logo_FF8900.svg,https://the5th.com,United States,2021,niche,,,,2025-07-18T12:32:10.942225,2025-08-29T14:25:31.290109
cmd91d3327f2f87652608f8,The 7 Virtues,,https://the7virtues.com/cdn/shop/t/43/assets/1x1_small.png?v=18463420843009316671752585658,https://the7virtues.com,Canada,2010,indie,,,,2025-07-18T12:32:10.942225,2025-08-29T14:25:38.497010
cmd72338aa75bc9524f58d4,The Abstract Perfumer,"The Abstract Perfumer is a niche perfume company known for its artistic and conceptual approach to fragrance creation. Founded with the vision of redefining the perfumery experience, the company emphasizes individuality and unique scent formulations that tell stories and evoke emotions. Their collections typically explore abstract concepts and aim to connect with customers on a deeper, more personal level. Specializing in small-batch, handcrafted perfumes, The Abstract Perfumer fosters a culture of creativity and experimentation, appealing to fragrance connoisseurs seeking distinct and innovative olfactive experiences.",https://images.unsplash.com/photo-1541643600914-78b084683601?w=400&h=300&fit=crop,www.theabstractperfumer.com,United States,2020,niche,contact@theabstractperfumer.com,,,2025-07-18T12:32:10.942225,2025-08-29T14:25:44.468974
cmda191e8614a3bcbb6da5a,The American Line,"The American Line is a perfume company that focuses on creating distinctive fragrances inspired by American culture and heritage. Established by a group of passionate perfumers, the company aims to encapsulate the essence of various American experiences and landscapes into their fragrances. Their specialty lies in blending traditional perfumery techniques with contemporary aesthetics to create scents that reflect the diverse character of the United States. The brand places a strong emphasis on quality and authenticity, using carefully sourced ingredients in their formulations.",https://images.unsplash.com/photo-1556909114-f6e7ad7d3136?w=400&h=300&fit=crop,www.theamericanline.com,United States,2018,niche,,,,2025-07-18T12:32:10.942225,2025-08-29T14:25:50.618001
cmdae4ea9cf5a3cd13099b3,The Animale Group,"The Animale Group is a perfume company known for its unique and bold fragrance creations that cater to a diverse clientele. Founded by a group of passionate fragrance enthusiasts, the company focuses on creating distinctive scent profiles that reflect contemporary lifestyle and individual expression. The Animale Group specializes in developing both women's and men's fragrances, often characterized by their striking packaging and provocative advertising campaigns that capture the essence of adventure and freedom in scent.",https://images.unsplash.com/photo-15907369626-6c63ac16f3df?w=400&h=300&fit=crop,https://animale.com,United States,1987,niche,,,,2025-07-18T12:32:10.942225,2025-08-29T14:25:56.725940
cmdb9f68f40f1046342ce81,The Antique Shoppe,"The Antique Shoppe is a boutique perfume company that specializes in creating unique and artisanal fragrances inspired by vintage scents. Their story began with a passion for nostalgia, focusing on evoking memories through olfactory experiences. The company emphasizes handcrafted production, often using natural ingredients and traditional methods that pay homage to historic perfume-making techniques, making each scent a work of art.",https://images.unsplash.com/photo-1541643600914-78b084683601?w=400&h=300&fit=crop,www.theantiqueshoppe.com,United States,2021,indie,info@theantiqueshoppe.com,,,2025-07-18T12:32:10.942225,2025-08-29T14:26:03.367509
cmdcfabfdeadac5d71564c5,The Art of the Perfumer,"The Art of the Perfumer is a boutique perfume house dedicated to crafting high-quality, artisanal fragrances. Founded on the principle of blending traditional perfumery techniques with contemporary inspirations, the company focuses on creating unique scent profiles that tell a story. Each fragrance is designed to evoke memories and emotions, inviting consumers to explore the art of scent. With a team of skilled perfumers, they emphasize the use of natural ingredients and sustainable practices, appealing to a discerning clientele that values authenticity and creativity in their personal scents.",https://theartoftheperfumer.com/cdn/shop/files/Screenshot_2022-03-10_at_14.03.22_250x.png?v=1646921238,www.theartoftheperfumer.com,United States,2015,niche,contact@theartoftheperfumer.com,,"123 Fragrance Lane, Scent City, NY 10001",2025-07-18T12:32:10.942225,2025-08-29T14:26:10.292949
cmdc68a4e86a61f51cb6a21,The Balm,"The Balm is a cosmetics company that specializes in creating high-quality and affordable beauty products, including a range of perfumes. Known for its cheeky branding and vintage-inspired packaging, The Balm offers a variety of fragrances that are designed to appeal to modern consumers while exuding a classic charm. The company prides itself on using quality ingredients and aims to provide a fun, playful approach to beauty through its product offerings. Founded in 2004 by Marissa Shipman, The Balm has developed a loyal following for its versatile makeup and fragrance lines.",https://thebalm.com/cdn/shop/files/Logo_1500px.png?v=1740001021&width=240,https://thebalm.com,United States,2004,indie,,,,2025-07-18T12:32:10.942225,2025-08-29T14:26:18.019852
cmd10ceb42376f272949d30,The Bathroom,"The Bathroom is a unique body and home fragrance company that focuses on creating scented products inspired by the experiences and emotions associated with personal and communal spaces. Founded on the belief that fragrance can transform everyday life, The Bathroom crafts a range of high-quality perfumes, candles, and diffusers designed to elevate and personalize the ambient experience. Their specialty lies in utilizing innovative scent profiles that evoke memories and sensations tied to intimate and domestic environments.",https://images.unsplash.com/photo-1556909114-f6e7ad7d3136?w=400&h=300&fit=crop,https://www.thebathroom.com,United States,2019,indie,info@thebathroom.com,,"123 Scented Lane, Fragrance City, CA 90210",2025-07-18T12:32:10.942225,2025-08-29T14:26:24.265295
cmd4ab251c0795204493574,The Bearded Bastard,"The Bearded Bastard is a niche fragrance company specializing in handcrafted, artisanal perfumes and grooming products. Founded out of a passion for crafting high-quality scents, the company began with the belief that fragrance should be personal and unique. They create small batches of perfumes, beard oils, and solid colognes, emphasizing the use of natural ingredients and traditional methods. Their signature scents often draw inspiration from the rugged, outdoor lifestyle, appealing to those who appreciate bold and complex fragrances. The brand prides itself on its authenticity and quality, catering primarily to a clientele seeking distinctive, artisanal products.",https://images.unsplash.com/photo-1541643600914-78b084683601?w=400&h=300&fit=crop,www.thebeardedbastard.com,United States,2012,niche,,,,2025-07-18T12:32:10.942225,2025-08-29T14:26:30.668828
cmda640d2beb274241c2d6c,The Beautiful Mind Series,"The Beautiful Mind Series is a unique perfume company that focuses on creating fragrances inspired by the beauty of the human mind and emotions. Their story revolves around the exploration of psychological themes, aiming to evoke specific feelings and memories through scent. The brand emphasizes artistry and innovation, often collaborating with artisans and psychologists to develop unique olfactory experiences. They specialize in niche fragrances that encourage deep personal connections and self-expression.",https://images.unsplash.com/photo-1541643600914-78b084683601?w=400&h=300&fit=crop,www.thebeautifulmindseries.com,United States,2021,niche,contact@thebeautifulmindseries.com,,,2025-07-18T12:32:10.942225,2025-08-29T14:26:37.051155
cmd46e43e01397cec35cf1f,The Beehive,"The Beehive is a unique perfume company that specializes in crafting artisanal fragrances inspired by the natural world. Their philosophy revolves around sustainability and the use of eco-friendly ingredients, often sourcing materials from local suppliers. The company has a rich heritage, focusing on the art of perfume-making while promoting environmental awareness and the importance of bees in the ecosystem. Known for their distinctive scents that evoke memories and emotions, The Beehive has carved a niche for itself in the competitive fragrance industry.",https://images.unsplash.com/photo-15907369626-6c63ac16f3df?w=400&h=300&fit=crop,www.thebeehiveperfumes.com,United States,2015,indie,contact@thebeehiveperfumes.com,,,2025-07-18T12:32:10.942225,2025-08-29T14:26:43.530093
cmde35accaa9ff954d3a65d,The Big Apple,"The Big Apple is a perfume company that specializes in creating unique and innovative fragrances inspired by the essence and vibrancy of New York City. Established with the aim of capturing the multifaceted culture, energy, and diversity of the city, The Big Apple crafts scents that evoke nostalgia and excitement. The brand emphasizes quality and artistry, often collaborating with local artists and fragrance designers to create limited-edition collections that reflect various aspects of city life.",https://images.unsplash.com/photo-1556909114-f6e7ad7d3136?w=400&h=300&fit=crop,www.thebigapple.com,United States,2015,indie,contact@thebigapple.com,,"123 Fragrance Lane, New York, NY 10001, USA",2025-07-18T12:32:10.942225,2025-08-29T14:27:00.004813
cmd37ca8c0170b17b8c5966,The Blossomcare Company,"The Blossomcare Company is a boutique fragrance house specializing in creating artisan perfumes that draw inspiration from nature, flora, and the art of perfumery. Founded with a vision to blend natural elements with modern olfactory design, the company focuses on sustainability and ecological practices. They pride themselves on using high-quality, ethically sourced materials and aim to evoke emotional connections through their unique scent compositions.",https://images.squarespace-cdn.com/content/v1/5907bf5937c581f99cdabe62/1506479211425-CGH44TD2GR1AR3RBGF02/20170509_041341211_iOS.png,www.blossomcare.com,United States,2018,indie,contact@blossomcare.com,,,2025-07-18T12:32:10.942225,2025-08-29T14:27:07.092667
cmdd2a002e87f39daccdba4,The Bluebeards Revenge,"The Bluebeards Revenge is a British grooming brand that specializes in men's personal care products, including a range of high-quality fragrances. Established with the goal of providing unique and effective grooming solutions, their line of products features classic, masculine scents designed to appeal to men looking for distinct and long-lasting fragrances. Their signature scent is inspired by traditional barbering, and the brand emphasizes quality ingredients and sleek packaging, appealing to a modern aesthetic.",https://bluebeards-revenge.co.uk/cdn/shop/files/grade-performance.png?v=1732203455&width=600,https://www.bluebeards-revenge.co.uk,United Kingdom,2012,indie,,,,2025-07-18T12:32:10.942225,2025-08-29T14:27:14.552048
cmdf6b1c9ef8a11aad666fd,The Body Deli,"The Body Deli is a skincare and fragrance brand known for its commitment to crafting natural and organic products. Founded in 1995, the company emphasizes the use of high-quality ingredients that are free from synthetic chemicals. The Body Deli specializes in artisanal perfumes and skincare that not only enhance beauty but also nourish the skin. Their story began with a focus on raw, fresh ingredients, and over the years, they've developed a reputation for creating unique and innovative products that resonate with eco-conscious consumers.",https://www.thebodydeli.com/cdn/shop/files/TBD-logo.1.png?height=106&v=1715638342,https://thebodydeli.com,United States,1995,indie,,,,2025-07-18T12:32:10.942225,2025-08-29T14:27:22.319729
cmdcf62229a05b46431f8c0,The Bon Marché,"The Bon Marché is a historic department store located in Paris, France, known for its wide range of products including fragrances, cosmetics, fashion, and luxury goods. Established in the mid-19th century, it has built a reputation for offering high-quality items and exceptional customer service. The store specializes in both established luxury brands and niche perfumery, offering a curated selection of scents that cater to diverse preferences, and often highlighting artisanal and unique fragrance houses.",https://images.unsplash.com/photo-1587017539504-67cfbddac569?w=400&h=300&fit=crop,https://www.bonmarche.com,France,1852,designer,,,"2 Rue de la Chaussée d'Antin, 75009 Paris, France",2025-07-18T12:32:10.942225,2025-08-29T14:27:28.503792
cmdeeb0d916dc955d6d438c,The Boring Company,"The Boring Company is an infrastructure and tunnel construction services company founded by Elon Musk. Although primarily focused on tunneling projects, they have gained notoriety for their unique approach to branding, including the development of novelty products like novelty flamethrowers and a proposed line of fragrances. Their specialty lies in innovative technology and unique consumer products that align with the company’s futuristic vision and branding.",https://images.squarespace-cdn.com/content/v1/6063b0835f68896079d7d643/367844c9-6818-4963-985d-9cfeb9d077b0/white+logo.png,https://www.boringcompany.com,United States,2016,indie,,,,2025-07-18T12:32:10.942225,2025-08-29T14:27:34.377576
cmd26bedcccbf15308fb256,The Bottle Company,"The Bottle Company is a unique player in the perfume industry, known for its artistic approach to fragrance design. Founded by a team of passionate perfumers and designers, the company focuses on creating high-quality, artisanal fragrances that encapsulate emotion and storytelling. The Bottle Company emphasizes sustainability and innovation in its product development process, utilizing eco-friendly materials for both their scents and packaging. They aspire to connect with consumers on a personal level, encouraging a deep exploration of scent as a medium of expression.",https://static.HugeDomains.com/images/hdv3-img/hd-header-logo-v3.svg,www.thebottlecompany.com,United States,2015,indie,contact@thebottlecompany.com,,,2025-07-18T12:32:10.942225,2025-08-29T14:27:40.989893
cmd10bcbf04d9bf125a8953,The C. Collection,"The C. Collection is a luxury perfume brand known for its artisanal, handcrafted fragrances. The company specializes in creating unique and personalized scents, often drawing inspiration from various cultural themes and natural ingredients. Founded with the vision of redefining how fragrances can evoke emotions and memories, The C. Collection places a strong emphasis on quality and originality, ensuring each bottle represents a story waiting to be told.",https://images.unsplash.com/photo-1587017539504-67cfbddac569?w=400&h=300&fit=crop,https://www.theccollection.com,United States,2016,niche,info@theccollection.com,,,2025-07-18T12:32:10.942225,2025-08-29T14:27:46.675205
cmded0171ff7825e6281bf5,The Candy Perfume Boy,"The Candy Perfume Boy is an independent fragrance brand known for its unique and artistic approach to perfumery. Founded by the renowned fragrance blogger, they focus on creating distinctive scents that often draw inspiration from pop culture and contemporary themes. The brand emphasizes creativity and quality, often collaborating with artists to produce limited edition fragrances and engaging storytelling around their products.",https://images.unsplash.com/photo-15907369626-6c63ac16f3df?w=400&h=300&fit=crop,https://www.candyperfumeboy.com,United Kingdom,2016,indie,,,,2025-07-18T12:32:10.942225,2025-08-29T14:27:52.489689
cmd8d9083503d3b37e40f72,The Caplin Family,"The Caplin Family is a niche perfume company known for its artisanal approach to fragrance creation. Founded by members of the Caplin family, the company focuses on crafting unique, high-quality scents that reflect personal stories and emotions. They source rare and exotic ingredients, often emphasizing sustainability and ethical sourcing practices. The brand aims to create a sense of nostalgia and connection through its fragrances, offering limited-edition releases that highlight their heritage and craftsmanship.",https://images.unsplash.com/photo-15907369626-6c63ac16f3df?w=400&h=300&fit=crop,www.thecaplinfamily.com,United States,2015,niche,contact@thecaplinfamily.com,,,2025-07-18T12:32:10.942225,2025-08-29T14:27:58.375014
cmdd0c71abac64673f31aeb,The Center,"The Center is an innovative perfume company that specializes in creating unique, artisanal fragrances inspired by nature and the urban experience. Founded by a team of fragrance enthusiasts, The Center emphasizes sustainability and ethical sourcing in its ingredients, aiming to create scents that resonate with the emotional and sensory experiences of its customers. The company is known for its meticulous craftsmanship and commitment to quality, blending traditional perfumery techniques with modern aesthetics.",https://images.unsplash.com/photo-1541643600914-78b084683601?w=400&h=300&fit=crop,www.thecenterfragrances.com,United States,2018,niche,info@thecenterfragrances.com,,"123 Fragrance Ave, New York, NY 10001, United States",2025-07-18T12:32:10.942225,2025-08-29T14:28:05.033522
