id,name,description,image,website,country,founded,type,email,phone,address,createdAt,updatedAt
cmd47beadd9251d70effb85,S4P - Science for Peace,"S4P - Science for Peace is a unique perfume company that focuses on creating fragrances that embody the ideals of peace and harmony. Founded on the principles of sustainability and ethical sourcing, S4P specializes in using scientifically researched ingredients that not only provide pleasant scents but also promote well-being and environmental consciousness. Their products often highlight the intersection of science and art, showcasing how thoughtful formulation can result in both beautiful fragrances and positive social impact.",https://images.unsplash.com/photo-15907369626-6c63ac16f3df?w=400&h=300&fit=crop,www.s4pfragrances.com,Italy,2020,niche,contact@s4pfragrances.com,,"Via della Pace, 10, 00100 Rome, Italy",2025-07-18T12:32:10.942225,2025-08-29T12:21:53.349357
cmd2a60d6ac9a563f4d88a7,SA Fragrances,"SA Fragrances is a dedicated fragrance company that specializes in creating high-quality, luxurious perfumes. Founded with a passion for craftsmanship and artistry in scent creation, the company prides itself on sourcing the best raw materials from around the globe. Each fragrance is a unique blend, reflecting a commitment to originality and sophistication, which caters to both individual tastes and trends in the fragrance market. Their story revolves around a blend of tradition and innovation, allowing them to stand out in the competitive perfume industry.",https://images.unsplash.com/photo-1582735689369-4fe89db7114c?w=400&h=300&fit=crop,,,,indie,,,,2025-07-18T12:32:10.942225,2025-08-29T12:21:59.162334
cmd5ef62393d1c2bed77df1,SAB,"SAB (Scent Aromatic Bliss) is a perfume house specializing in the creation of niche fragrances. Founded with the mission to blend traditional perfumery techniques with contemporary inspirations, SAB has carved a niche for itself by focusing on high-quality, artisanal scents that appeal to connoisseurs of niche perfumes. The company draws inspiration from various cultures and landscapes, often incorporating unique and exotic ingredients to create distinct olfactory experiences.",https://images.unsplash.com/photo-1587017539504-67cfbddac569?w=400&h=300&fit=crop,www.scentaromaticbliss.com,United States,2010,niche,contact@scentaromaticbliss.com,,,2025-07-18T12:32:10.942225,2025-08-29T12:22:05.150446
cmd75344166e9b330ccce6f,SABCO Group,,https://images.unsplash.com/photo-1582735689369-4fe89db7114c?w=400&h=300&fit=crop,https://www.sabco.com,United Arab Emirates,1980,designer,,,,2025-07-18T12:32:10.942225,2025-08-29T12:22:11.362164
cmdf80386675ed737c8b0ad,Sabine Poncet,"Sabine Poncet is a French niche perfume brand that focuses on creating unique, artisanal fragrances that reflect the richness of nature and history. Founded by perfumer Sabine Poncet, the company emphasizes individuality and quality, using carefully selected ingredients to craft scents that tell stories and evoke emotions. Sabine Poncet’s creations are characterized by their complex compositions and are aimed at a sophisticated clientele that appreciates the artistry of perfumery.",https://images.unsplash.com/photo-1582735689369-4fe89db7114c?w=400&h=300&fit=crop,https://www.sabineponcet.com,France,2015,niche,,,,2025-07-18T12:32:10.942225,2025-08-29T12:22:18.834690
cmd384b54b5bf987acafabf,Sabon,"Sabon is a beauty and personal care brand that specializes in a range of luxurious body and skincare products, including soaps, bath salts, body scrubs, and fragrances. Founded in Tel Aviv, Israel, in 1997, Sabon began as a small shop selling handmade soaps and quickly gained popularity for its artisanal approach and high-quality ingredients. The company's philosophy focuses on providing a pampering experience while promoting self-care and wellness. Over the years, Sabon has expanded its product lines and retail presence, establishing locations in various countries and becoming known for its unique blends of fragrances and effective formulas.",https://us.sabon.com/cdn/shop/files/Sabon_Gold_SVG.svg?v=1708726156&width=320,https://www.sabon.com,Israel,1997,indie,,,,2025-07-18T12:32:10.942225,2025-08-29T12:22:27.521689
cmd288218e8470ed2967377,Sabrina Carpenter,"Sabrina Carpenter has ventured into the fragrance industry with her own line of perfumes, showcasing her personal style and creative vision. As a well-known actress and singer, Carpenter’s fragrances often reflect her youthful energy and artistic expression, appealing primarily to her fan base. The brand focuses on creating accessible and appealing scents that resonate with the themes of self-expression and individuality.",https://www.sabrinacarpenter.com/wp-content/uploads/sites/1508/2025/06/logo1.png,https://sabrinacarpenter.com,United States,2020,Celebrity,,,,2025-07-18T12:32:10.942225,2025-08-29T12:22:34.901582
cmd5ff684987535dad0ee6c,Sachajuan,"Sachajuan is a Swedish hair care and fragrance company founded in 2004 by hairstylists Sacha Mitic and Juan Rosenlind. Originally known for their professional hair care products, they expanded into the fragrance sector with a line that emphasizes simplicity and quality ingredients. Their perfumes are crafted with a focus on Scandinavian essences and are designed to reflect the ethos of minimalism and elegance inherent in Swedish culture.",https://sachajuan.com/cdn/shop/files/updated-logo-SACHAJUAN-Algae-Bioscience-7_500x.png?v=1718094100,https://www.sachajuan.com,Sweden,2004,niche,,,,2025-07-18T12:32:10.942225,2025-08-29T12:22:41.746371
cmd2ad1a6028d3f80ad61db,Saffron James Parfums,"Saffron James Parfums is an artisanal perfume company specializing in creating exquisite fragrances inspired by the diverse landscapes and cultures of the world. Founded by perfumer and creative director, James Daniel, the brand is known for its attention to detail and use of traditional methods melded with modern sensibilities. Each scent reflects a journey, often emphasizing unique ingredients and storytelling to evoke particular emotions and memories. The brand's commitment to sustainability and eco-friendly practices further enhances its appeal in the niche perfume market.",https://images.unsplash.com/photo-1556909114-f6e7ad7d3136?w=400&h=300&fit=crop,https://saffronjames.com,United States,2016,niche,,,,2025-07-18T12:32:10.942225,2025-08-29T12:22:47.666049
cmd37ea63bb794441e704ea,Saffron,"Saffron is a luxury fragrance house known for its exquisite and unique scents that often incorporate traditional and exotic ingredients, with an emphasis on artisanal craftsmanship. The brand's story begins with a passion for the art of perfumery, focusing on creating high-quality, rare fragrances that evoke an emotional response. Saffron specializes in blending signature notes that capture the essence of nature and culture, often utilizing saffron as a prominent ingredient, which symbolizes luxury and richness in its perfumes.",https://images.unsplash.com/photo-1556909114-f6e7ad7d3136?w=400&h=300&fit=crop,https://www.saffronperfumes.com,United Arab Emirates,2020,niche,,,,2025-07-18T12:32:10.942225,2025-08-29T12:22:54.085682
cmdb11ac9d4d13d2c82a02c,Sage Machado,"Sage Machado is a niche perfume company founded by Sage Machado in 2000, known for its artistic approach to fragrance crafting. The brand focuses on small-batch production and employs natural ingredients to create perfumes that evoke emotions and stories. Each scent is designed to be unique, reflecting the aesthetic sensibilities and experiences of the founder. Sage Machado also emphasizes the use of eco-friendly and sustainable practices in its production processes, appealing to a growing audience of environmentally conscious consumers.",https://images.unsplash.com/photo-1541643600914-78b084683601?w=400&h=300&fit=crop,https://www.sagemachado.com,United States,2000,niche,,,,2025-07-18T12:32:10.942225,2025-08-29T12:23:00.004033
cmdb8802620c0187acc9ad8,Sage,"Sage is a specialty perfume company known for its natural and eco-friendly fragrance products. Founded on the principles of sustainability and wellness, Sage creates artisanal scents using carefully chosen ingredients that evoke a sense of place and promote emotional well-being. The company offers a range of fragrances, body care products, and wellness-focused items, while also prioritizing ethical sourcing and environmentally conscious practices. Over the years, Sage has built a loyal customer base by combining creativity in scent formulation with a commitment to health and the environment.",https://sagescotland.com/wp-content/uploads/2022/11/sage-founder-new-1.jpg,https://www.sagescotland.com,United States,2020,indie,,,,2025-07-18T12:32:10.942225,2025-08-29T12:23:10.266607
cmd36364ad683acb0d5b4b7,Saguara Perfumes,"Saguara Perfumes is a niche fragrance house that specializes in creating artisanal perfumes inspired by nature and cultural heritage. The company prides itself on handcrafting its fragrances with a focus on high-quality, sustainable ingredients sourced from various regions around the world. Saguara’s story begins with a passion for storytelling through scent, aiming to evoke emotions and memories associated with the natural and cultural elements of the landscapes they draw inspiration from.",https://images.squarespace-cdn.com/content/v1/58648268be659480ddff4d57/1483263262614-D8FDCFUU3BEFALJV6APT/SAGUARA+logo.jpg?format=300w,www.saguaraperfumes.com,United States,2018,niche,contact@saguaraperfumes.com,,,2025-07-18T12:32:10.942225,2025-08-29T12:23:16.910551
cmd2cecce4384b6c6217af6,Sahlini,"Sahlini is a perfume company known for its focus on creating unique and high-quality fragrances inspired by Middle Eastern heritage. The brand emphasizes artisanal craftsmanship, combining traditional scent-making techniques with modern sensibilities. Sahlini's offerings often feature exotic ingredients and are characterized by their rich, complex scents that cater to a discerning clientele seeking distinctive olfactory experiences.",https://images.unsplash.com/photo-1556909114-f6e7ad7d3136?w=400&h=300&fit=crop,www.sahlini.com,United Arab Emirates,2020,niche,,,,2025-07-18T12:32:10.942225,2025-08-29T12:23:23.821289
cmdfc584d6287b2ac081ccc,SAI New York,"SAI New York is a niche perfume company that specializes in crafting unique and innovative fragrances inspired by diverse cultures and environments. Established by a team of fragrance enthusiasts, the company aims to blend art and science in perfume-making, focusing on high-quality ingredients and artisanal craftsmanship. Their story emphasizes a commitment to sustainability and a multifaceted approach to scent creation, catering to individuals seeking distinctive olfactory experiences that tell a story.",https://images.unsplash.com/photo-1587017539504-67cfbddac569?w=400&h=300&fit=crop,https://sainy.com,United States,2018,niche,,,,2025-07-18T12:32:10.942225,2025-08-29T12:23:30.005584
cmdbf50cd560bb28485277a,Saint Charles,"Saint Charles is a niche perfume company that focuses on crafting artisanal fragrances, offering unique and high-quality scents created with fine ingredients. Founded by a passionate perfumer, Saint Charles has carved a niche in the fragrance industry by emphasizing sustainability and craftsmanship in their production process. The brand is known for its distinct approach to scent creation, melding traditional techniques with modern aesthetics, appealing to fragrance connoisseurs who appreciate individuality and sophistication in their perfume choices.",https://images.unsplash.com/photo-15907369626-6c63ac16f3df?w=400&h=300&fit=crop,https://saintcharles.com,United States,2016,niche,info@saintcharles.com,,,2025-07-18T12:32:10.942225,2025-08-29T12:23:35.867595
cmd2ccf4963f44a66309a8a,Saint Cyr,"Saint Cyr is a luxury perfume company known for its high-quality fragrances that draw inspiration from historical and cultural elements. The brand emphasizes artisanal craftsmanship and employs traditional techniques to create unique scents. Their story revolves around a commitment to quality and the art of perfumery, appealing to those who appreciate exclusive and sophisticated fragrances.",https://images.unsplash.com/photo-15907369626-6c63ac16f3df?w=400&h=300&fit=crop,http://www.saintcyrparfums.com,France,2005,niche,,,,2025-07-18T12:32:10.942225,2025-08-29T12:23:41.295227
cmdb156e19e96608e26a704,Saint-Gobain Desjonquères,"Saint-Gobain Desjonquères is a renowned company specializing in the manufacture and distribution of glass containers specifically for the perfume, cosmetics, and pharmaceutical industries. Established in the 18th century, it has become a prominent player in the glass manufacturing sector, known for its innovative designs and high-quality products. The company has a legacy of craftsmanship in glass making and has adapted modern technologies to enhance efficiency and sustainability in its operations. Its expertise caters to luxury brands, providing bespoke solutions to meet the unique needs of the fragrance industry.",https://images.unsplash.com/photo-1587017539504-67cfbddac569?w=400&h=300&fit=crop,https://www.desjonqueres.saint-gobain.com,France,1775,niche,,,,2025-07-18T12:32:10.942225,2025-08-29T12:23:47.848955
cmdf896a379c52f7cff2c00,Saint Hilaire,"Saint Hilaire is a French perfume company that creates a diverse range of fragrances inspired by nature and artisanal craftsmanship. Founded with a mission to make luxury accessible, the brand focuses on high-quality ingredients and sustainable practices. They offer an array of scents for both men and women, emphasizing innovation and creativity in their fragrance compositions.",https://images.unsplash.com/photo-1556909114-f6e7ad7d3136?w=400&h=300&fit=crop,https://www.sainthilaire.com,France,2016,indie,,,,2025-07-18T12:32:10.942225,2025-08-29T12:24:03.554193
cmd54a79d5f62913d00a87a,Saint James,"Saint James is a French perfume company that specializes in crafting high-quality, artisanal fragrances inspired by the rich maritime history and cultural heritage of the Saint James region in France. The company emphasizes the use of natural ingredients and sustainable practices in its perfume-making process, ensuring that each scent tells a story of the coastal environment and local craftsmanship.",https://images.unsplash.com/photo-15907369626-6c63ac16f3df?w=400&h=300&fit=crop,www.saintjamesparfum.com,France,2018,niche,,,,2025-07-18T12:32:10.942225,2025-08-29T12:24:10.090030
cmd18c96cfe358a25827ea3,Sainte Cellier,"Sainte Cellier is a luxury fragrance brand that emphasizes the art of perfumery through the creation of exquisite, small-batch perfumes. The company has a rich heritage in traditional perfuming techniques, focusing on the use of natural ingredients sourced from around the world. Sainte Cellier prides itself on crafting unique scents that embody elegance and sophistication, making them highly sought after by fragrance connoisseurs.",https://saintecellier.com/cdn/shop/files/Sainte_Cellier__long_red_fixed_TRANSPARENT.png?v=1654501968&width=200,www.saintecellier.com,France,2017,niche,contact@saintecellier.com,,,2025-07-18T12:32:10.942225,2025-08-29T12:24:16.741689
cmd6907fe12e76e9c15d7df,Sakamichi,"Sakamichi is an innovative perfume house that specializes in creating unique, artisanal fragrances inspired by Japanese culture and nature. Founded by a team of fragrance enthusiasts and artisans, the brand focuses on blending traditional techniques with modern olfactory creativity. Their perfumes often reflect the beauty and essence of Japan’s diverse landscapes and cultural heritage, appealing to consumers seeking distinct and high-quality scents.",https://images.unsplash.com/photo-15907369626-6c63ac16f3df?w=400&h=300&fit=crop,www.sakamichiparfum.com,Japan,2019,niche,contact@sakamichiparfum.com,,,2025-07-18T12:32:10.942225,2025-08-29T12:24:23.557182
cmdb78e61f0bdc05c67ebdb,Saks Fifth Avenue,"Saks Fifth Avenue is a premier American luxury department store that offers a curated selection of fine fragrances, among other luxury goods including designer clothing, accessories, and home products. The company was founded in 1924 and is known for its high-end shopping experience, featuring top perfume brands and exclusive scents. Saks Fifth Avenue is recognized for its unparalleled customer service and promotional events, which often include fragrance launches and personal consultations to enhance the shopping experience.",https://images.unsplash.com/photo-1556909114-f6e7ad7d3136?w=400&h=300&fit=crop,https://www.saksfifthavenue.com,United States,1924,designer,,,"611 5th Ave, New York, NY 10022, United States",2025-07-18T12:32:10.942225,2025-08-29T12:24:33.327982
cmd02983a9a3353c0cd8204,Sali Oguri,"Sali Oguri is an innovative perfume brand that focuses on creating unique and expressive scents. Founded by the renowned perfumer Sali Oguri, the company prides itself on its artisanal approach to fragrance; combining traditional techniques with modern sensibilities. The brand is known for its dedication to sustainable practices, sourcing raw materials ethically while crafting fragrances that evoke the emotions and memories of those who wear them. Their specialty lies in creating personal, niche fragrances that celebrate individuality.",https://images.unsplash.com/photo-1582735689369-4fe89db7114c?w=400&h=300&fit=crop,https://salioguri.com,Japan,2018,niche,contact@salioguri.com,,,2025-07-18T12:32:10.942225,2025-08-29T12:24:39.522304
cmd66300fdd6409080f8044,Salle Privée,"Salle Privée is a luxury perfume house that specializes in creating exclusive and high-quality fragrances. Founded by Frédéric Malle in 2018, the brand focuses on artistic expression through scent, blending traditional craftsmanship with innovative approaches to fragrance creation. Their perfumes often draw inspiration from various artistic influences and perspectives, establishing a strong connection to art and culture in each composition. With an emphasis on quality ingredients and distinctive olfactory experiences, Salle Privée aims to redefine luxury fragrance.",https://images.unsplash.com/photo-15907369626-6c63ac16f3df?w=400&h=300&fit=crop,https://www.salleprivee.com,Netherlands,2018,niche,,,,2025-07-18T12:32:10.942225,2025-08-29T12:24:45.573917
cmd7c18b68b53fc10a4f2f5,Salle,"Salle is an innovative perfume company known for its artistic approach to fragrance creation. Founded by a team of passionate scent enthusiasts, Salle focuses on high-quality, unique scent compositions that often draw inspiration from various artistic disciplines. The company places a strong emphasis on sustainable sourcing of ingredients and aims to create fragrances that evoke emotional experiences and memories. Their specialty lies in crafting unisex fragrances that cater to a diverse audience, making each scent a personal statement for the wearer.",https://images.unsplash.com/photo-1541643600914-78b084683601?w=400&h=300&fit=crop,https://www.salle.fragrance,United States,2021,niche,,,,2025-07-18T12:32:10.942225,2025-08-29T12:24:51.339667
cmd121efcf4ef3353b15251,Sally Hansen,"Sally Hansen is a well-known brand primarily recognized for its nail care products, including nail polish, treatments, and removers. While the company has a strong presence in the beauty sector, it does not specialize distinctly in perfumes. Founded in 1946, Sally Hansen has a mission to empower beauty enthusiasts with innovative nail care solutions that enhance their creativity and individual style.",https://www.sallyhansen.com/ccx-files/assets/logo.svg,https://www.sallyhansen.com,United States,1946,drugstore,,,,2025-07-18T12:32:10.942225,2025-08-29T12:24:57.067747
cmdfa0013df1f651a386c38,Salming,"Salming is a Swedish sports brand that specializes in manufacturing athletic equipment, including running shoes and apparel. Although primarily known for its sports gear, it also offers a line of perfumes designed to capture the essence of an active lifestyle. The brand focuses on performance, functionality, and style, catering to athletes and fitness enthusiasts.",https://salming.com/cdn/shop/files/salming_logo.webp?v=1731319531&width=320,https://www.salming.com,Sweden,2001,indie,,,,2025-07-18T12:32:10.942225,2025-08-29T12:25:03.693331
cmdc22b47cb733f2aec1b64,Salt & Stone,"Salt & Stone is a California-based brand that specializes in creating natural and eco-friendly fragrances as well as skincare products. Founded by a former pro surfer, the company is dedicated to using high-quality, sustainably sourced ingredients and environmentally conscious practices. Their fragrances are designed to evoke the natural beauty and essence of the coastal lifestyle, making them unique in both scent composition and branding. Salt & Stone emphasizes minimalism and purity in its formulations, aiming to provide customers with products that are not only effective but also kind to the planet.",https://www.saltandstone.com/cdn/shop/files/Nav_Highlight_-_Body_Wash_1000x.jpg?v=1750443429,https://www.saltandstone.com,United States,2017,indie,,,,2025-07-18T12:32:10.942225,2025-08-29T12:25:11.337574
cmd4040ba9a9ff4d67d39be,Salt & Straw,"Salt & Straw is an artisan ice cream company founded in Portland, Oregon, known for its innovative and seasonal flavors that showcase local ingredients. Originally starting as an ice cream shop, they have collaborated with various artisans and local producers to create unique flavor profiles. Although primarily recognized for ice cream, Salt & Straw launched a line of fragrances inspired by their signature flavors, reflecting their creative approach to food and scent. Their specialty lies in blending culinary inspiration with perfumery, offering a unique experience for customers.",https://saltandstraw.com/cdn/shop/files/Logo.svg?v=1718743182&width=800,https://saltandstraw.com,United States,2011,indie,,,,2025-07-18T12:32:10.942225,2025-08-29T12:25:18.291711
cmdc1af2b040f1d5360588e,Salt Trade,"Salt Trade is a niche perfume company that creates artisanal fragrances inspired by nature and travel. Their unique approach involves sourcing rare and sustainable materials from around the world, reflecting a deep commitment to environmental responsibility. The company emphasizes storytelling in its products, capturing the essence of locations and experiences through scent. They strive to provide consumers with a sensory journey, highlighting their connection to the world.",https://static.HugeDomains.com/images/hdv3-img/hd-header-logo-v3.svg,https://www.salttrade.com,United States,2017,niche,contact@salttrade.com,,,2025-07-18T12:32:10.942225,2025-08-29T12:25:24.789273
cmdf68dda9d656eb4d0194a,Salum,"Salum is a niche perfume house known for its artisanal approach to fragrance creation. With a focus on high-quality ingredients and unique scent profiles, Salum aims to craft distinct, emotionally evocative perfumes. The brand's story is rooted in a passion for personal expression through aroma, drawing inspiration from diverse cultures and natural environments. Salum specializes in creating limited edition fragrances that cater to a discerning clientele who appreciate the artistry of perfumery.",https://images.unsplash.com/photo-1582735689369-4fe89db7114c?w=400&h=300&fit=crop,www.salumfragrance.com,France,2021,niche,info@salumfragrance.com,,"15 Rue de la Parfumerie, Paris, France",2025-07-18T12:32:10.942225,2025-08-29T12:25:30.633320
cmddbd5c3e0d4ec70ac02f1,Salvador Dali,"Salvador Dali Parfums is a perfume brand inspired by the work and personality of the iconic surrealist artist Salvador Dalí. The brand, which started developing fragrances in the 1980s, aims to create unique olfactory experiences that reflect Dalí's avant-garde spirit and artistic vision. The fragrances often feature imaginative packaging, invoking Dalí's distinctive style and characteristics. The company specializes in offering a range of fragrances that blend artistic innovation with olfactory creativity, appealing to both art lovers and fragrance enthusiasts.",https://images.unsplash.com/photo-1587017539504-67cfbddac569?w=400&h=300&fit=crop,https://www.dali.fr,France,1983,designer,,,,2025-07-18T12:32:10.942225,2025-08-29T12:26:17.648737
cmd33b6bf4a83cf2fa673da,Salvatore Ferragamo,"Salvatore Ferragamo is an Italian luxury brand known for its exquisite footwear, leather goods, and fashion accessories. Established in the early 20th century, the company began as a bespoke shoemaker in Florence, founded by Salvatore Ferragamo himself, who became famous for his innovative designs and craftsmanship. As the brand expanded, it started producing fragrances, entering the perfume industry with the same emphasis on quality and sophistication that defines its other products. Salvatore Ferragamo fragrances are characterized by a blend of elegance, audacity, and sensuality, often inspired by the iconic designs of the brand's fashion collections. The company today continues to uphold its legacy by creating perfumes that encapsulate the essence of Italian luxury.",https://images.unsplash.com/photo-15907369626-6c63ac16f3df?w=400&h=300&fit=crop,https://www.ferragamo.com,Italy,1927,designer,,,"Via de' Tornabuoni, 2, 50123 Florence, Italy",2025-07-18T12:32:10.942225,2025-08-29T12:26:25.230808
