id,name,description,image,website,country,founded,type,email,phone,address,createdAt,updatedAt
cmde5bf1ca9bcc305974283,VIP Room,"VIP Room is a fragrance company that specializes in creating high-end perfumes, drawing inspiration from both contemporary trends and classic scents. Established by renowned figures in the fashion and entertainment industry, VIP Room aims to offer exclusive and luxurious fragrances that appeal to a discerning clientele. The brand often collaborates with various celebrities and influences to create unique scent experiences that resonate with their lifestyle and persona.",https://images.unsplash.com/photo-1541643600914-78b084683601?w=400&h=300&fit=crop,https://www.viproom.com,France,2012,niche,,,,2025-07-18T12:32:10.942225,2025-08-29T15:15:45.928078
cmd167299049708222eaae2,Vireo Perfumes,"Vireo Perfumes is an artisanal fragrance house that specializes in creating unique and environmentally conscious perfumes. Founded by a passionate perfumer, the company focuses on using sustainable ingredients and ethically sourced raw materials. Vireo is notable for its dedication to crafting scents that are inspired by nature and personal experiences, catering to a clientele that values individuality and authenticity in fragrance.",https://images.unsplash.com/photo-1556909114-f6e7ad7d3136?w=400&h=300&fit=crop,https://www.vireoperfumes.com,United States,2017,niche,,,,2025-07-18T12:32:10.942225,2025-08-29T15:15:55.349583
cmdf876b362fb51ec835f14,Virgin Vie,"Virgin Vie was a cosmetics brand associated with Virgin Group, founded to provide a range of beauty products, including fragrances. The brand aimed to offer innovative, stylish, and high-quality products that resonate with a youthful and adventurous spirit. Virgin Vie specialized in creating unique perfumes that captured a sense of individuality and self-expression, often reflecting the core values of the Virgin brand. Though the brand has since ceased trading, it contributed to the beauty market in the early 2000s.",https://images.unsplash.com/photo-1541643600914-78b084683601?w=400&h=300&fit=crop,,United Kingdom,1998,indie,,,,2025-07-18T12:32:10.942225,2025-08-29T15:16:01.304669
cmdbf342d7bc3c807048f73,Visari,"Visari is a perfume company that specializes in creating unique, high-quality fragrances that cater to a discerning audience. The company was established with the vision of blending art and science in fragrance creation, emphasizing natural ingredients and sophisticated scent profiles. They focus on artisan approaches to perfumery, often drawing inspiration from cultural and artistic themes, which allows them to stand out in the crowded fragrance market.",https://images.unsplash.com/photo-1556909114-f6e7ad7d3136?w=400&h=300&fit=crop,,,,niche,,,,2025-07-18T12:32:10.942225,2025-08-29T15:16:07.236379
cmd9242b898ab59d9ca3194,Visconti di Modrone,"Visconti di Modrone is an Italian perfume house known for its luxurious fragrances that embody the elegance and richness of Italian heritage. Founded in Milan, the company draws inspiration from the beauty of Italian history, art, and culture. The brand focuses on high-quality, artisanal perfumes that reflect sophisticated craftsmanship. Visconti di Modrone prides itself on using the finest raw materials and traditional techniques, creating a niche for itself in the crowded fragrance market with unique scent compositions.",https://images.unsplash.com/photo-1587017539504-67cfbddac569?w=400&h=300&fit=crop,https://www.viscontidimodrone.com,Italy,2014,niche,,,,2025-07-18T12:32:10.942225,2025-08-29T15:16:23.897390
cmded23fa22b45fe361dce5,Visim,"Visim is a forward-thinking perfume company specializing in creating unique and captivating fragrances that merge traditional perfumery techniques with contemporary trends. Founded by a passionate team of fragrance enthusiasts, Visim aims to deliver scents that inspire and evoke emotions. The company focuses on quality ingredients and sustainability, ensuring that their products not only smell exquisite but also respect the environment. Their story began with a vision to harness the power of scent for personal expression and luxury at an accessible price.",https://images.unsplash.com/photo-15907369626-6c63ac16f3df?w=400&h=300&fit=crop,,,,indie,,,,2025-07-18T12:32:10.942225,2025-08-29T15:16:30.482641
cmd485395f33be969191016,Visiteur,"Visiteur is a niche perfume company founded by the renowned perfumer, Thomas Dunckley, who aims to capture the essence of travel and the diverse array of experiences that accompany it. Their fragrances are inspired by memories of different places and cultures, emphasizing storytelling through scent. Each creation is meticulously crafted with a blend of high-quality ingredients, making them unique and evocative works of art in the perfume industry.",https://images.unsplash.com/photo-1556909114-f6e7ad7d3136?w=400&h=300&fit=crop,https://www.visiteurparfums.com,United States,2019,niche,,,,2025-07-18T12:32:10.942225,2025-08-29T15:16:36.608726
cmdfe2da24e2035e1866dea,Vitabath,"Vitabath is a personal care brand that specializes in producing a variety of bath and body products, including fragrances, body washes, lotions, and shower gels. Founded with the idea of providing a luxurious and spa-like experience at home, Vitabath combines unique and sophisticated scents with skin-nourishing ingredients. The brand is known for its premium quality and refreshing fragrances inspired by various regions and elements of nature, catering to a wide audience looking for both effective skincare and delightful aromas.",https://res.cloudinary.com/american-bath-group/image/upload/v1635359331/websites-product-info-and-content/vitaspa/content/common/language_black_144x144.png,https://www.vitabath.com,USA,1950,drugstore,,,,2025-07-18T12:32:10.942225,2025-08-29T15:16:46.700563
cmdbed7d43c39a0807696b0,VitaMan,"VitaMan is a wellness brand specializing in personal grooming and skincare products, including a range of premium fragrances. The company blends high-quality ingredients with wellness principles to create scents that reflect an active lifestyle and promote overall wellbeing. Founded with a mission to provide products tailored specifically for men, VitaMan emphasizes natural formulation and eco-friendliness in its manufacturing processes.",https://www.vitaman.com/cdn/shop/files/VITAMAN_7ad87cd8-2acf-4cda-a061-0a45adf8127a.png?v=1702323878&width=600,https://www.vitaman.com,Australia,2001,indie,,,,2025-07-18T12:32:10.942225,2025-08-29T15:16:52.274466
cmd90b39443200b8c2a21f4,Vito Ballare,"Vito Ballare is a niche perfume house known for its luxurious and artisanal fragrances. The company focuses on creating unique scent profiles by using high-quality, natural ingredients. Founded by passionate perfumer Vito Ballare, the brand aims to evoke emotions and memories through bespoke fragrances that offer a distinctive character and quality. Vito Ballare has gained recognition in the perfume industry for its commitment to craftsmanship and innovation.",https://images.unsplash.com/photo-1582735689369-4fe89db7114c?w=400&h=300&fit=crop,www.vitoballare.com,Italy,2015,niche,contact@vitoballare.com,,"Via Roma 123, Milan, Italy",2025-07-18T12:32:10.942225,2025-08-29T15:16:58.010085
cmd020a132234890c0d2bef,Viva Eros,"Viva Eros is a contemporary perfume company that focuses on creating unique and alluring fragrances inspired by passion, emotion, and sensuality. The company prides itself on blending traditional perfumery techniques with modern aesthetics, offering a range of scents that cater to a diverse audience. Their story centers around the idea of celebrating love and desire through scent, drawing inspiration from art and culture. Viva Eros’s specialty lies in crafting high-quality, long-lasting fragrances that evoke deep emotional connections.",https://images.unsplash.com/photo-15907369626-6c63ac16f3df?w=400&h=300&fit=crop,,,,niche,,,,2025-07-18T12:32:10.942225,2025-08-29T15:17:03.683668
cmd72632468130df21a3e8a,Vivamor,"Vivamor is a niche perfume company that specializes in creating artisanal fragrances inspired by the essence of life's beauty and emotions. The brand was founded by a group of fragrance enthusiasts who wanted to offer unique scents that evoke personal experiences and connections. Vivamor's products are crafted using high-quality ingredients sourced from around the world, aiming to provide a luxurious and sensory experience to its customers. Their story is rooted in a passion for scent and a desire to redefine traditional perfume boundaries.",https://images.unsplash.com/photo-1587017539504-67cfbddac569?w=400&h=300&fit=crop,,,,niche,,,,2025-07-18T12:32:10.942225,2025-08-29T15:17:09.315626
cmd09368a702cdf7a13140c,Vivaudou,"Vivaudou is a French perfume company known for its unique and captivating fragrances. Founded on a rich heritage of perfumery, the company focuses on creating high-quality scents that embody elegance and sophistication. They specialize in both classic and contemporary perfume compositions, often drawing inspiration from French culture and the art of fragrance making. Vivaudou aims to provide an aromatic experience that resonates with individual personalities and preferences.",https://images.unsplash.com/photo-1587017539504-67cfbddac569?w=400&h=300&fit=crop,www.vivaudou.com,France,2015,niche,,,,2025-07-18T12:32:10.942225,2025-08-29T15:17:25.298328
cmd145bb5aaa8431ce6cf5c,Vive Maria Forbidden Fragrance,,https://images.unsplash.com/photo-1582735689369-4fe89db7114c?w=400&h=300&fit=crop,https://www.vivemaria.com,Germany,2003,niche,,,,2025-07-18T12:32:10.942225,2025-08-29T15:17:32.096868
cmdf08c70af3ef0720775b6,Vive Perfume,"Vive Perfume is an innovative fragrance company focused on creating high-quality, unique scents that cater to a diverse clientele. Established by a group of perfume enthusiasts, the brand aims to blend artistry with aromatic elements, offering a wide selection of perfumes that reflect individuality and personal expression. Their specialty lies in crafting artisanal fragrances using premium ingredients, with a strong emphasis on sustainability and ethical sourcing. Vive Perfume embodies the essence of contemporary perfumery, appealing to a modern audience that values authenticity and creativity in scent.",https://images.unsplash.com/photo-1556909114-f6e7ad7d3136?w=400&h=300&fit=crop,www.viveperfume.com,United States,2018,indie,info@viveperfume.com,,,2025-07-18T12:32:10.942225,2025-08-29T15:17:40.213716
cmd2f88069be8f59e178df4,Vivi K Perfumes,"Vivi K Perfumes is a boutique perfume company that focuses on crafting unique and high-quality fragrances. Known for their artistic approach and commitment to using natural ingredients, Vivi K Perfumes creates scents that evoke emotions and sensations. The brand emphasizes storytelling through their fragrances, drawing inspiration from nature, art, and culture, which resonates with their clientele seeking individuality and artistry in their scent choices.",https://images.unsplash.com/photo-1541643600914-78b084683601?w=400&h=300&fit=crop,www.vivikperfumes.com,United States,2018,niche,contact@vivikperfumes.com,,,2025-07-18T12:32:10.942225,2025-08-29T15:17:45.121556
cmda946712a16ec3a775742,Vivian Gray,"Vivian Gray is a luxury fragrance brand known for its artisanal approach to perfume-making. Established with the vision of creating high-quality, evocative scents, the company focuses on unique olfactory experiences that blend traditional craftsmanship with contemporary design. The brand often draws inspiration from various cultures and historical elements, infusing each fragrance with a story. Vivian Gray emphasizes the use of premium ingredients and offers a curated selection of perfumes that embody elegance and sophistication.",https://images.unsplash.com/photo-1587017539504-67cfbddac569?w=400&h=300&fit=crop,https://www.viviangray.com,United Kingdom,2015,niche,,,,2025-07-18T12:32:10.942225,2025-08-29T15:17:50.883760
cmdccd3d816dd5b78176ce3,Viviane Vendelle,"Viviane Vendelle is a luxury perfume brand that focuses on creating high-quality, artisanal fragrances. Founded by Viviane Vendelle, the company aims to capture the essence of elegance and sophistication through unique scent compositions. Their perfumes are known for their attention to detail and are crafted with carefully selected ingredients to evoke specific moods and sensations. The brand emphasizes a personalized and immersive experience for its customers, often drawing inspiration from nature and art to develop its fragrances.",https://images.unsplash.com/photo-15907369626-6c63ac16f3df?w=400&h=300&fit=crop,https://www.vivianevendelle.com,France,2018,niche,,,,2025-07-18T12:32:10.942225,2025-08-29T15:17:57.050097
cmd6b4b93d7068a0ab2aebb,Vivienne Westwood,"Vivienne Westwood is a British fashion designer renowned for her contributions to the punk and new wave fashion movements. Founded by Vivienne Westwood herself, the brand began its journey in the 1970s and has since expanded into the fragrance industry, known for its unique and often unconventional scent offerings that mirror the brand's rebellious and avant-garde philosophy. The perfumes encapsulate a blend of fashion, culture, and sustainability, reflecting Westwood's long-standing commitment to ethical fashion and social issues.",https://www.viviennewestwood.com/dw/image/v2/BJGV_PRD/on/demandware.static/-/Library-Sites-viviennewestwood-global-content/default/dw50261acd/images/hp/2025/Wk%2030/VW_HERO_August25.jpg?sw=1920&sh=1200&q=80,https://www.viviennewestwood.com,United Kingdom,1971,designer,,,"44-46 Conduit Street, London, W1S 2YH, United Kingdom",2025-07-18T12:32:10.942225,2025-08-29T15:18:05.135087
cmd478fc491c3e943ef9b18,Viyella,"Viyella is a perfume company known for its artisanal approach to fragrance creation. Founded with a vision to blend traditional perfumery techniques with modern inspirations, Viyella offers a unique selection of high-quality perfumes that are made with carefully sourced raw materials. The brand's story is rooted in a commitment to craftsmanship and creativity, aiming to evoke emotions and memories through scent. Viyella specializes in creating distinctive fragrances that stand out in a crowded market, appealing to fragrance aficionados seeking exclusivity and depth in their scent profiles.",https://images.unsplash.com/photo-15907369626-6c63ac16f3df?w=400&h=300&fit=crop,,,,niche,,,,2025-07-18T12:32:10.942225,2025-08-29T15:18:11.253037
cmdf78ea95bd45c640a2e01,VK Nagrani,"VK Nagrani is a luxury lifestyle brand, primarily known for its high-end men’s wear, but has also ventured into the fragrance market, offering distinctive perfumes that reflect sophistication and elegance. Founded by designer Vicky Nagrani, the brand emphasizes quality craftsmanship and exclusivity. They often create fragrances that embody the essence of refined masculinity, catering to an upscale clientele. VK Nagrani is recognized for its commitment to providing unique and artisanal products, where each scent is crafted to evoke specific emotions and experiences.",https://vknagrani.com/cdn/shop/files/Logo_18_Black.png?v=1613793754&width=1764,https://www.vknagrani.com,United States,2011,niche,,,,2025-07-18T12:32:10.942225,2025-08-29T15:18:18.361944
cmd431a9f45a00a31dfd274,Vogue,"Vogue is a perfume company known for producing a range of fragrances inspired by modern fashion and lifestyle trends. The brand places a strong emphasis on the intersection of style and scent, offering products that appeal to a chic and fashion-forward audience. Their specialty lies in creating captivating and luxurious fragrances that evoke the essence of contemporary elegance. The company aims to redefine traditional notions of perfumery by blending innovative scent compositions with a unique artistic vision.",https://images.unsplash.com/photo-1587017539504-67cfbddac569?w=400&h=300&fit=crop,,,,indie,,,,2025-07-18T12:32:10.942225,2025-08-29T15:18:23.788667
cmd06a923f3246acfa64faa,Voi Jeans,"Voi Jeans is a UK-based fashion brand that originally gained fame for its denim business. The company has expanded its offerings to include a variety of apparel and accessories, including a line of fragrances. Known for its youthful, urban style, Voi Jeans targets a demographic that values trendy, affordable fashion. The fragrance line complements their clothing, appealing to consumers who appreciate a cohesive lifestyle brand.",https://www.voilondon.com/cdn/shop/files/VOI-Website-Logo-Blk_29b8fc6c-7ad8-4685-a3fa-000956de7f1a.png?v=1738334298&width=200,https://www.voijeans.com,United Kingdom,1998,designer,,,,2025-07-18T12:32:10.942225,2025-08-29T15:18:31.566342
cmd8fed2dad8cd3dbab251d,Volnay,"Volnay is a historic French perfume house known for its artisanal and handcrafted fragrances. Established in the 20th century, the company specializes in creating high-quality, unique scents that blend traditional craftsmanship with modern olfactory artistry. With a focus on rare and refined ingredients, Volnay's perfumes aim to evoke emotions and memories, offering an intimate connection to the world of scent. Its legacy underscores a commitment to quality and creativity, reflective of the rich heritage of French perfumery.",https://images.unsplash.com/photo-1541643600914-78b084683601?w=400&h=300&fit=crop,http://www.volnayparfums.com,France,1920,niche,,,,2025-07-18T12:32:10.942225,2025-08-29T15:18:37.360437
cmd05664e7ffcc8f094e502,Voluspa,"Voluspa is a luxury home fragrance company known for its meticulously crafted candles, diffusers, and home fragrance products. Founded by the duo of Tracy and daddy of their children, they sourced high-quality materials, including natural coconut wax and premium essential oils, creating unique scents that are inspired by their travels and cultural experiences. Voluspa emphasizes eco-friendliness and aesthetic design, making their products not only fragrant but also visually appealing. Over the years, the brand has gained a reputation for its exceptional quality and distinctive packaging, making it a leader in the home fragrance market.",https://voluspa.com/cdn/shop/files/Logo_Header_800x400_1.png?v=1698184702&width=410,https://www.voluspa.com,United States,1999,indie,,,,2025-07-18T12:32:10.942225,2025-08-29T15:18:44.516452
cmd3aa4c74287b8e477aa3e,von Eusersdorff,"von Eusersdorff is a luxury perfume house founded in 2012 that specializes in creating artisanal fragrances. The brand is known for its commitment to high-quality ingredients and craftsmanship, drawing inspiration from historical perfume traditions while blending modern sensibilities. With a rich narrative tied to the art of perfumery, von Eusersdorff emphasizes uniqueness and sophistication in its scent offerings, catering to a discerning clientele looking for exclusive and refined fragrances.",https://www.voneusersdorff.com/cdn/shop/files/logo_v2_330x.png?v=1613528439,https://www.voneusersdorff.com,Netherlands,2012,niche,,,,2025-07-18T12:32:10.942225,2025-08-29T15:18:51.592730
cmdc20c493a1da8a038836d,von Sierstorpff,"Von Sierstorpff is a niche fragrance house that specializes in creating unique, artisanal perfumes. Founded by the German perfumer A. von Sierstorpff, the company aims to blend traditional craftsmanship with contemporary scent design. Each perfume is meticulously crafted to evoke emotions and memories, ensuring a personal connection to the art of fragrance. Their offerings are characterized by high-quality ingredients and an emphasis on sustainable sourcing, appealing to discerning customers who appreciate exclusive and complex scents.",https://images.unsplash.com/photo-15907369626-6c63ac16f3df?w=400&h=300&fit=crop,https://www.vonsierstorpff.com,Germany,2014,niche,,,,2025-07-18T12:32:10.942225,2025-08-29T15:18:57.243441
cmdf4776a95f8293661a6f2,Von Sono,"Von Sono is a niche perfume house known for its unique and artisanal approach to fragrance creation. Established in response to a growing demand for bespoke scents, the company focuses on crafting high-quality perfumes that evoke emotional connections through storytelling and sensory experiences. Each fragrance is thoughtfully developed using carefully sourced ingredients, drawing inspiration from various cultures and artistic influences. Von Sono prides itself on its commitment to sustainability and ethical sourcing, positioning itself as a pioneer in the world of niche perfumery.",https://images.unsplash.com/photo-1556909114-f6e7ad7d3136?w=400&h=300&fit=crop,https://www.vonsono.com,United States,2018,niche,,,,2025-07-18T12:32:10.942225,2025-08-29T15:19:02.869151
cmd0ad9f662f996dc87bf35,Vonna,"Vonna is a niche perfume company known for its unique and artisanal approach to fragrance creation. The brand emphasizes the use of high-quality ingredients and sustainable practices in its perfume-making process. Founded by a passionate perfumer, Vonna aims to provide sustainable, innovative scents that evoke emotions and capture the essence of nature, making each fragrance a personal experience for the wearer.",https://images.unsplash.com/photo-1541643600914-78b084683601?w=400&h=300&fit=crop,,,,niche,,,,2025-07-18T12:32:10.942225,2025-08-29T15:19:08.179012
cmd5d03ff4d4967c41f50cd,Voronoi,"Voronoi is a niche perfume brand that focuses on creating unique, artisanal fragrances inspired by scientific concepts and natural elements. The company seeks to blend the art of perfumery with a modern and innovative approach, emphasizing creativity and individuality in their scent collections. Their story is rooted in the belief that fragrances can evoke emotions and memories, and they often curate their products to reflect a personalized and intimate experience. Voronoi specializes in handcrafting a limited range of exotic scents that utilize high-quality, sustainable ingredients.",https://images.unsplash.com/photo-1587017539504-67cfbddac569?w=400&h=300&fit=crop,https://voronoiscent.com,United States,2017,niche,info@voronoiscent.com,,,2025-07-18T12:32:10.942225,2025-08-29T15:19:14.059171
cmd0de61ae6af1d3d38b8a3,Voskanian Parfums,"Voskanian Parfums is a luxury perfume house known for its unique fragrance creations that blend art and science. The company focuses on crafting exclusive, high-quality scents using rare and exquisite raw materials sourced from around the world. Voskanian Parfums aims to provide customers with a luxurious olfactory experience that reflects individual personality and style. Founded by a passionate perfumer, the brand is committed to innovation and sustainability, ensuring each fragrance tells a story and delivers an immersive experience.",https://images.unsplash.com/photo-1582735689369-4fe89db7114c?w=400&h=300&fit=crop,https://voskanianparfums.com,United States,2018,niche,info@voskanianparfums.com,,,2025-07-18T12:32:10.942225,2025-08-29T15:19:20.702706
cmd216576dfa4bcf4ab2ecc,Voyager,"Voyager is a unique perfume company specializing in crafting artisanal fragrances inspired by travel and global cultures. Founded by a team of passionate perfumers, Voyager aims to capture the essence of different destinations through scent, creating a memorable olfactory experience for consumers. The company's philosophy is rooted in exploration and discovery, encouraging customers to embark on a journey through their perfumes.",https://images.unsplash.com/photo-1587017539504-67cfbddac569?w=400&h=300&fit=crop,www.voyagerfragrances.com,United States,2017,niche,contact@voyagerfragrances.com,,"123 Aroma Street, Fragrance City, CA 90210, United States",2025-07-18T12:32:10.942225,2025-08-29T15:19:26.416228
cmdb370470a415a0f51fbf7,Voyages Imaginaires,"Voyages Imaginaires is a French perfume company that focuses on crafting niche fragrances designed to evoke the essence of travel and exploration. The brand seeks to transport wearers to different places through its unique scent compositions, often inspired by exotic locations and experiences. Their story revolves around the founder's passion for travel and perfumery, curating a collection that tells olfactory stories through beautifully blended ingredients. Voyages Imaginaires prides itself on using high-quality materials and artisanal methods to create signature scents with artistic flair.","https://static.wixstatic.com/media/92bf5c_8eb9cce8792e4800932af89b430a0850~mv2.png/v1/fill/w_155,h_106,al_c,q_85,usm_0.66_1.00_0.01,enc_avif,quality_auto/92bf5c_8eb9cce8792e4800932af89b430a0850~mv2.png",https://www.voyagesimaginaires.com,France,2004,niche,,,,2025-07-18T12:32:10.942225,2025-08-29T15:19:33.832372
cmd35b5532a413de1e950ac,Vuarnet,"Vuarnet is primarily recognized as a high-end eyewear brand that has gained fame for its premium sunglasses. However, they have expanded their brand to include a collection of fragrances aimed at embodying the spirit of outdoor adventure and luxury living, reflecting the same quality and craftsmanship found in their eyewear. The brand has carved a niche for itself by blending luxury and performance, aiming to connect with a clientele that appreciates the blend of style and functionality.",https://eu.vuarnet.com/cdn/shop/files/logo-color.png?crop=center&height=123&v=1729511894&width=140,https://www.vuarnet.com,France,1957,niche,,,,2025-07-18T12:32:10.942225,2025-08-29T15:19:40.712157
