id,name,description,image,website,country,founded,type,email,phone,address,createdAt,updatedAt
cmd3d8b990809f058f47c76,Vespa,"Vespa is primarily known as a manufacturer of scooters but has diversified its brand to include a selection of fragrances. The Vespa perfume line reflects the spirit of adventure and freedom associated with riding a Vespa scooter. The brand's story is deeply rooted in Italian design and culture, emphasizing elegance and a carefree lifestyle. Each fragrance is designed to evoke the essence of the iconic Vespa experience, focusing on freshness and youthful exuberance.",https://images.unsplash.com/photo-1541643600914-78b084683601?w=400&h=300&fit=crop,,Italy,1946,niche,,,,2025-07-18T12:32:10.942225,2025-08-29T15:11:40.721384
cmdd971bad8f3868dbd0fc6,Vessel Parfums,"Vessel Parfums is a fragrance company known for creating a range of niche perfumes that emphasize artistry and personal expression. Founded by a team of artisans and fragrance enthusiasts, the brand focuses on unique ingredients and innovative scent profiles. Their story began with a mission to redefine luxury in the perfume market by making high-quality fragrances accessible to everyone, without the heavy marketing overhead. They specialize in crafting scents that are both modern and timeless, often exploring uncommon ingredients to offer an avant-garde olfactory experience.",https://images.unsplash.com/photo-1582735689369-4fe89db7114c?w=400&h=300&fit=crop,https://www.vesselparfums.com,United States,2014,niche,,,,2025-07-18T12:32:10.942225,2025-08-29T15:11:46.818644
cmdc28e913ada00415cf15e,VFiles,"VFiles is a cultural platform and retailer that operates at the intersection of fashion and lifestyle, known for its contemporary approach to fragrance. Established as a creative community where creativity intersects with commerce, VFiles often collaborates with emerging artists and influencers to create unique scents that reflect their avant-garde style. The brand gained attention for its bold and distinct fragrances, promoting a fresh, modern take on traditional perfumery.",https://vfiles.com/assets/chrome_logo.png,https://vfiles.com,United States,2014,indie,,,,2025-07-18T12:32:10.942225,2025-08-29T15:11:52.873450
cmd9a8daa133074a9c1469d,Via Dei Mille,"Via Dei Mille is an innovative perfume company that specializes in creating unique and luxurious scents inspired by various cultural and historical influences. Their story began with a passion for artistry and the expressive nature of fragrances, aiming to offer high-quality perfumes that evoke emotions and memories. They focus on niche markets, often producing limited-edition releases that appeal to true fragrance connoisseurs.",https://images.unsplash.com/photo-1556909114-f6e7ad7d3136?w=400&h=300&fit=crop,www.viadeimille.com,Italy,2018,niche,,,,2025-07-18T12:32:10.942225,2025-08-29T15:11:58.889495
cmd6f3986f3506856f9f2b6,Via Paris Prestige,"Via Paris Prestige is a fragrance company that specializes in creating high-quality perfumes inspired by classic and contemporary scents. The company aims to offer a diverse range of exclusive fragrances that cater to a variety of preferences and occasions. They emphasize the artistry and craftsmanship involved in perfume creation, often utilizing premium ingredients and unique formulations to deliver distinctive olfactory experiences. Their story involves a passion for scent, leading to the development of their own line of perfumes that resonate with both luxury and accessibility.",https://images.unsplash.com/photo-1556909114-f6e7ad7d3136?w=400&h=300&fit=crop,,France,,indie,,,,2025-07-18T12:32:10.942225,2025-08-29T15:12:05.120436
cmd2568c02b1da947237731,Viale!,"Viale! is a modern perfume house that specializes in creating unique and innovative fragrance experiences. Founded on the principles of artistry and craftsmanship, Viale! focuses on blending high-quality ingredients to produce luxurious scents that evoke emotion and memory. The brand emphasizes sustainability and transparency in its production processes, aiming to cater to the contemporary consumer's values while providing engaging scent stories.",https://images.unsplash.com/photo-1541643600914-78b084683601?w=400&h=300&fit=crop,www.vialeperfumes.com,Italy,2020,niche,contact@vialeperfumes.com,,"Via della Fratellanza, 15, 20123 Milano MI, Italy",2025-07-18T12:32:10.942225,2025-08-29T15:12:11.528897
cmd527bdfa7e12c915037ba,Viali,"Viali is a perfume company that focuses on creating luxury fragrances that embody elegance and sophistication. Founded by a team of experienced perfumers, Viali aims to provide high-quality scents that appeal to discerning customers. Their specialty lies in crafting unique blends using carefully selected ingredients, drawing inspiration from various cultures and experiences. Viali's philosophy centers on the idea that fragrance is a powerful form of personal expression, which is reflected in their meticulously designed products and branding.",https://images.unsplash.com/photo-15907369626-6c63ac16f3df?w=400&h=300&fit=crop,,,,niche,,,,2025-07-18T12:32:10.942225,2025-08-29T15:12:17.798375
cmd7c36b8e79b069cf8987b,Vicini,"Vicini is an Italian perfume house that has crafted a reputation for creating high-quality fragrances. The company combines traditional craftsmanship with innovative approaches to scent creation. With a dedication to artistry and an emphasis on luxurious, unique compositions, Vicini stands out in the crowded market by focusing on the individual character of each fragrance. Their range encompasses various scent profiles, catering to diverse customer preferences.",https://images.unsplash.com/photo-15907369626-6c63ac16f3df?w=400&h=300&fit=crop,,Italy,1998,niche,,,,2025-07-18T12:32:10.942225,2025-08-29T15:12:23.561917
cmdbf8cd2345d0e43f15837,Vick Chemical,"Vick Chemical is a prominent manufacturer and supplier of specialty ingredients for the perfume and cosmetic industries. Established in 1963, the company has a long-standing reputation for producing high-quality fragrance compounds as well as excipients and raw materials that support formulations in personal care products. Vick Chemical's expertise lies in creating innovative fragrance solutions, catering to a variety of customer needs, from small indie brands to larger manufacturers. Their dedication to quality and the development of unique scent profiles positions them as a reliable partner in the fragrance industry.",https://images.unsplash.com/photo-1541643600914-78b084683601?w=400&h=300&fit=crop,https://www.vickchemical.com,United States,1963,indie,,,,2025-07-18T12:32:10.942225,2025-08-29T15:12:30.003902
cmd1dd4ba6eee64511fd0eb,Vicki Gunvalson,"Vicki Gunvalson is a perfume brand associated with the reality television personality and entrepreneur Vicki Gunvalson, known for her role on ""The Real Housewives of Orange County."" The brand is characterized by its approach to bringing the essence of confidence and elegance to its fragrances, designed to appeal to fans and fragrance enthusiasts alike. It is part of a broader portfolio that encompasses beauty products.",https://images.unsplash.com/photo-15907369626-6c63ac16f3df?w=400&h=300&fit=crop,https://www.vickigunvalson.com/,United States,2015,celebrity,,,,2025-07-18T12:32:10.942225,2025-08-29T15:12:35.895574
cmdc10ca103619a019ffe80,Vicky Tiel,"Vicky Tiel is a well-known French perfume and fashion designer who gained prominence for her high-quality fragrances and couture fashion designs. Founded in the 1980s, Tiel created a distinct identity within the fragrance industry, specializing in luxurious scents that cater primarily to a sophisticated audience. Her signature style blends creativity with a classic elegance, making her perfumes memorable in both scent and presentation. Over the years, she has garnered a dedicated following, contributing to her reputation in the niche perfume market, particularly among those who appreciate artisanal and unique fragrances.",https://vickytiel.com/wp-content/uploads/2016/05/fb.jpg,https://www.vickytiel.com,France,1980,niche,,,,2025-07-18T12:32:10.942225,2025-08-29T15:12:43.061452
cmd99cca6322c1fb948a25a,Victor Hills,"Victor Hills is a fragrance company known for its commitment to crafting unique and high-quality perfumes. The brand focuses on using fine ingredients and innovative blending techniques to create distinct scents that appeal to a variety of consumers. The company's story is rooted in a passion for perfumery, aiming to provide luxurious experiences through their fragrance offerings. Specializing in both traditional and modern scent profiles, Victor Hills has gained recognition in the niche fragrance market.",https://images.unsplash.com/photo-1587017539504-67cfbddac569?w=400&h=300&fit=crop,,,,niche,,,,2025-07-18T12:32:10.942225,2025-08-29T15:12:48.790009
cmdce9960d3ab3266b37b82,Victor Manuelle,"Victor Manuelle is a prominent Latin music artist who has made a significant impact on the fragrance industry through his eponymous perfume line. The company leverages Manuelle's musical success to create fragrances that resonate with his fans, offering a blend of his personal style and artistic expression. Their specialty lies in crafting scents that evoke emotions and memories, often infused with tropical and romantic undertones. The fragrance line reflects Victor Manuelle's heritage and celebrates Latin culture, aiming to bring joy and passion through scent.",https://images.unsplash.com/photo-1541643600914-78b084683601?w=400&h=300&fit=crop,,United States,2018,celebrity,,,,2025-07-18T12:32:10.942225,2025-08-29T15:12:54.679074
cmdc3efcc1ba2f3d196581c,Victor,"Victor is a perfume company known for its innovative fragrances that blend art with olfactory science. The brand's story began with a passionate desire to create unique scents that cater to diverse tastes, reflecting individuality and personal expression. Victor specializes in crafting high-quality, niche fragrances that often incorporate rare ingredients, appealing to discerning customers who seek something beyond mainstream offerings.",https://images.unsplash.com/photo-1556909114-f6e7ad7d3136?w=400&h=300&fit=crop,www.victorfragrances.com,United States,2015,niche,contact@victorfragrances.com,,,2025-07-18T12:32:10.942225,2025-08-29T15:13:00.158319
cmd646adf24e0c4d90648c7,Victoria Beckham Beauty,"Victoria Beckham Beauty is a luxury beauty brand launched by fashion designer Victoria Beckham. The brand reflects her vision of modern beauty, prioritizing clean and high-quality ingredients. In 2020, the company expanded its offerings to include a range of beauty products, including fragrances, which emphasize an elegant and minimalist aesthetic. Victoria Beckham Beauty is dedicated to sustainable practices and aims to redefine beauty standards with a focus on inclusivity and individual expression.",https://victoriabeckhambeauty.com/cdn/shop/files/VB_LOGO_BLACK_OFFICIAL_USEME.svg?crop=center&height=50&v=1705943993&width=150,https://www.victoriabeckhambeauty.com,United States,2020,celebrity,,,,2025-07-18T12:32:10.942225,2025-08-29T15:13:07.767559
cmd2eeccedf0e65ca43b06e,VB,"VB (Victoria Beckham) is a luxury fashion and lifestyle brand that extended its offerings to include fragrances. Founded by the former Spice Girl and prominent fashion designer Victoria Beckham, the brand's perfume line reflects her sophisticated, modern aesthetic and is known for its unique blend of bold and classic notes. The fragrances often draw inspiration from Victoria's travels and experiences, embodying a blend of elegance and contemporary style.",https://www.victoriabeckham.com/cdn/shop/files/VB_CRAFTMAHSHIP_CAROUSEL_LANDSCAPE_3_c63b8617-3e8a-427a-8753-90d45c783416.jpg?v=1755696626&width=880,https://www.victoriabeckham.com,United Kingdom,2014,niche,,,,2025-07-18T12:32:10.942225,2025-08-29T15:13:15.485317
cmd984b7b8b421666ecce73,Victoria Bitter,"Victoria Bitter, commonly known as VB, is primarily a beer brand owned by Carlton & United Breweries, a subsidiary of Asahi Beverages. As of the latest research, Victoria Bitter does not operate as a perfume company but is instead known for its product line in the beverage industry, particularly for its lager beer. The brand has a storied history tied to Australian culture, often linked to outdoor activities and social events. Specialty in this context aligns with their marketing of manufacturing high-quality beer that resonates well among Australians.",https://www.victoriabitter.com.au/logos/logo_vb.svg,https://www.victoriabitter.com.au,Australia,1854,indie,,,,2025-07-18T12:32:10.942225,2025-08-29T15:13:24.189214
cmd1b65fb5767d4a6fbc84e,Victoria's Secret,"Victoria's Secret is a well-known American lingerie, clothing, and personal care brand that was founded in 1977 by Roy Raymond. It specializes in women's fragrances, beauty products, and fashion, particularly focusing on creating a sensual and empowering image for women. Over the years, Victoria's Secret has expanded its offerings to include various fragrance lines that encapsulate their brand's essence of allure and femininity. The brand gained enormous popularity with its annual fashion shows and marketing campaigns, establishing itself as a cultural icon in the fashion and beauty industry.",https://www.victoriassecret.com/assets/m4295-BvGfAULvRsqys9CIVBXBkA/flags/50bb277d74b47f138592.png,https://www.victoriassecret.com,United States,1977,designer,,,"4 Limited Parkway East, Reynoldsburg, OH 43068, United States",2025-07-18T12:32:10.942225,2025-08-29T15:13:31.773534
cmd1918edc56323ac986548,Victorine,"Victorine is a luxury perfume company that specializes in creating artisanal fragrances with a unique blend of natural ingredients. The brand prides itself on its craftsmanship, often drawing inspiration from traditional perfumery techniques while incorporating modern sensibilities. Victorine was founded by a group of passionate perfumers dedicated to innovating the way fragrances are experienced, with a focus on individuality and personal expression.",https://images.unsplash.com/photo-1556909114-f6e7ad7d3136?w=400&h=300&fit=crop,,,,niche,,,,2025-07-18T12:32:10.942225,2025-08-29T15:13:37.305192
cmdfa83dfc2547188de61cd,Victorinox,"Victorinox is best known for its Swiss Army knives, but it also operates in the perfume industry, producing a range of fragrances. The company emphasizes quality, functionality, and durability, drawing on its Swiss heritage. Victorinox began developing its scent line to embody the spirit of adventure and to reflect the brand's commitment to Swiss craftsmanship. Their fragrances often blend traditional and contemporary notes, appealing to customers seeking both versatility and uniqueness.",https://images.unsplash.com/photo-1556909114-f6e7ad7d3136?w=400&h=300&fit=crop,https://www.victorinox.com,Switzerland,1884,designer,,+41 44 387 77 00,"Victoria, 1, 8404 Zürich, Switzerland",2025-07-18T12:32:10.942225,2025-08-29T15:13:45.323622
cmdc014b33131ebd44a7916,Victorio & Lucchino,"Victorio & Lucchino is a Spanish fashion and fragrance brand established by designers Victorio Pérez and José Luis Medina. Known for their vibrant, eclectic designs, the brand not only focuses on haute couture and ready-to-wear fashion but has also successfully ventured into the world of perfumes. Their fragrance line embodies the spirit of their artistic vision, often drawing inspiration from traditional Andalusian culture, with an emphasis on boldness and unique character. Victorio & Lucchino aims to create scents that reflect their distinctive aesthetic, appealing to a sophisticated clientele that seeks originality and elegance.",https://images.unsplash.com/photo-1587017539504-67cfbddac569?w=400&h=300&fit=crop,https://www.victorioylucchino.es,Spain,1984,designer,,,,2025-07-18T12:32:10.942225,2025-08-29T15:13:52.390349
cmdc3c1648c1d663636dd43,Victory International,"Victory International is a prominent fragrance manufacturer known for its diverse range of perfumes and colognes. The company specializes in creating high-quality, accessible fragrances that appeal to a broad audience. With a commitment to innovation and style, Victory International has built a reputation for delivering unique scent profiles that resonate with consumers. Their portfolio includes products that cater to various tastes and preferences, further establishing their presence in the competitive fragrance market.",http://victoryinternational.com/wp-content/uploads/2014/05/victory-logo-small.png,https://www.victoryinternational.com,United States,1996,designer,,,,2025-07-18T12:32:10.942225,2025-08-29T15:14:00.685511
cmdac18d74b28cc9e95185a,Vigny,"Vigny is a French perfume house known for its commitment to quality and craftsmanship in the fragrance industry. Established in the early 20th century, Vigny successfully blends traditional perfumery techniques with modern innovations to create sophisticated and elegant fragrances. The company's specialty lies in producing artisanal perfumes that appeal to connoisseurs and collectors, focusing on unique scent compositions that tell a story through their aromatic notes.",https://images.unsplash.com/photo-15907369626-6c63ac16f3df?w=400&h=300&fit=crop,https://www.vignyparfums.com,France,1925,niche,,,,2025-07-18T12:32:10.942225,2025-08-29T15:14:07.438750
cmdeadc2bbf46af39caca71,Viktor & Rolf,"Viktor & Rolf is a high-fashion luxury brand founded by Dutch designers Viktor Horsting and Rolf Snoeren. The company is renowned for its innovative creations in both haute couture and fragrance. Their perfumes often reflect a blend of artistic expression and commercial viability, with signature scents that have garnered global attention. Notable fragrances include ""Flowerbomb,"" ""Spicebomb,"" and ""Bonbon,"" which emphasize bold and unique scent profiles, often encapsulated in striking, artistic packaging that mirrors the designers' avant-garde style. The brand has a strong commitment to creativity, frequently intertwining fashion and perfume in an effort to redefine olfactory experiences.",https://www.viktor-rolf.com/cdn/shop/files/viktor-rolf-seal.png?v=1707911848&width=128,https://www.viktor-rolf.com,Netherlands,1993,designer,,,,2025-07-18T12:32:10.942225,2025-08-29T15:14:15.393649
cmd6827a22befa046884deb,Viktoria Minya,"Viktoria Minya is a niche perfume house founded by Viktoria Minya, a perfumer with a distinct vision of blending storytelling with fragrance creation. The brand focuses on producing high-quality, unique perfumes that evoke deep emotions and memories, drawing inspiration from Viktor's travels and experiences. With a commitment to artisanal craftsmanship, Viktoria Minya creates fragrances that stand out for their complexity and luxurious quality, catering to fragrance connoisseurs looking for something rare and special.",https://viktoriaminya.com/cdn/shop/files/logo_VM_picto_noir_410x.png?v=1614324258,https://viktoriaminya.com/,Hungary,2015,niche,,,,2025-07-18T12:32:10.942225,2025-08-29T15:14:22.770809
cmdafba5bd561c80ddb311c,Vila Hermanos,"Vila Hermanos is a fragrance company known for its artisanal and unique perfumes. The company specializes in creating high-quality, handcrafted fragrances that blend traditional perfumery techniques with innovative scents. Founded by a family with a deep passion for perfumery, Vila Hermanos focuses on sourcing the finest ingredients to ensure a distinctive olfactory experience. Their story is rooted in the commitment to quality and authenticity, catering to fragrance enthusiasts who appreciate niche and sophisticated scents.",https://www.vilahermanos.com/images/logo.svg,https://www.vilahermanos.com,Spain,2011,niche,,,,2025-07-18T12:32:10.942225,2025-08-29T15:14:30.262041
cmde021c2b6c39e0893be1c,Vilebrequin,"Vilebrequin is a luxury swimwear and lifestyle brand known for its vibrant prints and high-quality fabrics. Founded in 1971, the company created its first collection of swim trunks in Saint-Tropez, capturing the spirit of the Mediterranean lifestyle. Over the decades, Vilebrequin has expanded its offerings to include a line of fragrances that reflect the same attention to design and craftsmanship, embodying the carefree and sunny essence of vacation. Their perfumes often feature fresh and aquatic notes, appealing to those who enjoy a soothing and summer-inspired scent experience.",https://www.vilebrequin.com/on/demandware.static/Sites-VBQ-US-Site/-/default/dw35a05d22/images_active/header/logo-mobile.png,https://www.vilebrequin.com,France,1971,designer,,,,2025-07-18T12:32:10.942225,2025-08-29T15:14:38.267610
cmdaa9db08cdcdbfbcf5ceb,Vilhelm Parfumerie,"Vilhelm Parfumerie is a niche perfume house founded by Swedish perfumer Vilhelm Larsson, aiming to create unique fragrances that evoke memories and experiences. The company was established with a vision to combine art, craftsmanship, and olfactory storytelling. It features a range of exceptional scents inspired by art, history, and personal narratives, and positions itself within the market as a purveyor of luxury niche perfumes. The brand focuses on high-quality ingredients and artistic packaging, often highlighting the artistic process of fragrance creation.",https://images.unsplash.com/photo-1582735689369-4fe89db7114c?w=400&h=300&fit=crop,https://www.vilhelmpafumeri.com,United States,2015,niche,,,,2025-07-18T12:32:10.942225,2025-08-29T15:14:45.243168
cmde98e072042154139486e,Villa Erbatium,"Villa Erbatium is a luxury perfume house known for its artisanal approach to fragrance creation. Established by a team of passionate perfumers, the company focuses on using high-quality, natural ingredients to craft unique and evocative scents. With a commitment to sustainability and local sourcing, Villa Erbatium aims to create fragrances that tell stories and resonate with true olfactory connoisseurs. Their product line typically includes both unisex fragrances and signature scents that embody the essence of heritage and craftsmanship.",https://images.unsplash.com/photo-1587017539504-67cfbddac569?w=400&h=300&fit=crop,,,,niche,,,,2025-07-18T12:32:10.942225,2025-08-29T15:14:51.507338
cmd451271364a0a77a53a8f,Village Candle,"Village Candle is an American fragrance company known for its high-quality scented candles and home fragrance products. Founded in 1993 by co-founders, it began in a small shop in Maine and has grown into a well-respected brand in the home fragrance industry. The company's specialty lies in its ability to produce rich, true-to-life scents using premium wax and fragrance oils. Village Candle focuses on creating a warm atmosphere and memorable experiences through its extensive catalog of products, which not only includes candles but also fragrance oils and wax melts.",https://www.villagecandle.com/on/demandware.static/Sites-StonewallUS-Site/-/default/dwd8b4dd3f/images/logo.svg,https://www.villagecandle.com,United States,1993,indie,,,,2025-07-18T12:32:10.942225,2025-08-29T15:14:59.084654
cmdb5e7d6fde4bbe4894360,Vince Camuto,"Vince Camuto is a renowned American fashion designer and entrepreneur who established his eponymous brand. The company is known for its stylish and luxurious women's fashion, footwear, and accessories. In addition to its fashion line, Vince Camuto expanded into the fragrance industry, creating a variety of perfumes that capture the spirit of modern femininity. Their fragrances reflect a blend of sophistication and trendiness, appealing to a diverse audience. Founded in the 2000s, the brand rapidly grew in popularity and is celebrated for its commitment to quality and innovative designs.",https://www.vincecamuto.com/cdn/shop/files/vc-logo-main_1.svg?v=1721226261&width=240,https://www.vincecamuto.com,United States,2005,designer,,,,2025-07-18T12:32:10.942225,2025-08-29T15:15:07.169636
cmd941618e4c7f0c995cd57,Vincent Longo,"Vincent Longo is primarily known for its luxury beauty products, emphasizing high-quality formulations and artistic packaging. The brand was founded by Vincent Longo, a makeup artist, who aimed to create products that blend fashion and originality. While Vincent Longo is predominantly recognized for cosmetics, it has also featured a range of fragrances that embody the same principles of luxury and artistry. Their fragrances often reflect the aesthetic and creative vision of the brand, appealing to a discerning clientele that values unique and sophisticated scent profiles.",https://images.unsplash.com/photo-15907369626-6c63ac16f3df?w=400&h=300&fit=crop,https://www.vincentlongo.com,United States,1995,indie,,,,2025-07-18T12:32:10.942225,2025-08-29T15:15:23.714115
cmdd2c8fcbbacaadf9fcc43,Violette Hay,"Violette Hay is a niche perfume company founded by French perfumer and beauty entrepreneur Violette Leduc. The brand focuses on creating unique, high-quality fragrances inspired by the beauty of nature and the art of perfumery. With a commitment to sustainability, Violette Hay positions itself in the luxury fragrance market, offering handmade products that celebrate authenticity and craftsmanship.",https://images.unsplash.com/photo-1541643600914-78b084683601?w=400&h=300&fit=crop,https://www.violettehay.com,France,2020,niche,contact@violettehay.com,,,2025-07-18T12:32:10.942225,2025-08-29T15:15:30.843132
cmd74035c6579163099f095,Violette Market,"Violette Market is a curated online fragrance platform that specializes in niche, artisanal perfumes. Founded by Violette, a passionate fragrance enthusiast and makeup artist, the brand aims to connect consumers with high-quality, unique scents that express individuality. Violette Market emphasizes an authentic and personal approach to fragrance, often collaborating with independent perfume makers and offering a selection that promotes smaller brands and sustainable practices.",https://images.unsplash.com/photo-1587017539504-67cfbddac569?w=400&h=300&fit=crop,https://www.violettemarket.com,United States,2020,niche,,,,2025-07-18T12:32:10.942225,2025-08-29T15:15:39.545084
