id,name,description,image,website,country,founded,type,email,phone,address,createdAt,updatedAt
cmdf4cd76d6a8775eae90a5,The Communications Store,"The Communications Store is a strategic consulting agency that specializes in brand communications for the beauty and lifestyle sectors, including fragrance. They offer a wide range of services including public relations, social media management, and event planning aimed at elevating brand presence and driving consumer engagement. The company prides itself on its deep understanding of luxury markets and leverages this expertise to create impactful campaigns that resonate with target audiences.",https://images.unsplash.com/photo-1541643600914-78b084683601?w=400&h=300&fit=crop,https://www.thecommunicationstore.com,United Kingdom,1999,niche,,,,2025-07-18T12:32:10.942225,2025-08-29T14:28:10.836427
cmdd2bef23bdeeca60c4f1e,The Cross,"The Cross is a boutique perfume company that specializes in crafting artisanal fragrances. Their story begins with a passion for unique scent profiles and a commitment to using high-quality, natural ingredients. The brand focuses on creating distinctive, hand-blended perfumes that evoke emotions and memories, aiming to provide customers with an exceptional olfactory experience. They take pride in their small-batch production process and often draw inspiration from nature and culture in their compositions.",https://images.unsplash.com/photo-1582735689369-4fe89db7114c?w=400&h=300&fit=crop,www.thecrossfragrances.com,United States,2015,indie,info@thecrossfragrances.com,,"123 Fragrance St, Scent City, CA 90210",2025-07-18T12:32:10.942225,2025-08-29T14:28:16.495975
cmdb3867fa27bb64499fb47,The Cure Shop,"The Cure Shop is a niche perfume company that focuses on creating artisanal fragrances using high-quality, natural ingredients. Founded by a team of fragrance enthusiasts, The Cure Shop aims to provide unique scents that evoke emotions and memories. Their story is rooted in the belief that scents can heal and enhance wellbeing, leading them to develop a collection that combines modern perfumery techniques with traditional crafting methods. They specialize in bespoke fragrances that are often handcrafted, ensuring exclusivity and personal touch in each bottle.",https://images.unsplash.com/photo-1587017539504-67cfbddac569?w=400&h=300&fit=crop,https://www.thecureshop.com,United States,2019,niche,contact@thecureshop.com,,,2025-07-18T12:32:10.942225,2025-08-29T14:28:22.807462
cmd50be066f767bf7ed4e9a,The Dandy Gent,"The Dandy Gent is a niche perfume company that specializes in creating unique, handcrafted fragrances inspired by traditional men's grooming and vintage style. Founded by a passionate perfumer, the company focuses on quality ingredients and artisanal methods to produce sophisticated scents that appeal to discerning customers. The brand’s story revolves around celebrating masculinity and elegance, offering a curated selection of perfumes that embody a classic yet modern aesthetic.",https://static.HugeDomains.com/images/hdv3-img/hd-header-logo-v3.svg,https://www.thedandygent.com,United Kingdom,2013,niche,info@thedandygent.com,,,2025-07-18T12:32:10.942225,2025-08-29T14:28:28.984776
cmda4838f6bd96ca8692823,The Diamond Collection,"The Diamond Collection is a luxury fragrance brand known for its unique and exquisite perfume offerings. The brand emphasizes the use of high-quality ingredients and artisanal craftsmanship, creating scents that resonate with elegance and sophistication. Founded with the idea to embody luxury and glamour, The Diamond Collection aims to transform the everyday experience of wearing perfume into a cherished ritual. Their specialty lies in crafting fragrances that reflect opulence, often inspired by gemstones and precious materials.",http://www.thediamondcollection.com/img/logo2.svg,http://www.thediamondcollection.com,United States,2015,niche,,,,2025-07-18T12:32:10.942225,2025-08-29T14:28:35.038174
cmd96e67ac792aa7c1fcc9d,The Different Company,"The Different Company is a niche perfume house known for its innovative and artistic approach to fragrance creation. Established by perfumer Jean-Claude Ellena in 2000, the brand emphasizes quality ingredients, unique scent compositions, and minimalistic yet luxurious packaging. The company focuses on offering a distinct olfactory experience that sets it apart from mainstream fragrance brands, often drawing inspiration from nature, art, and personal experiences. Their collection features a variety of unisex fragrances that cater to a clientele looking for individuality and sophistication in perfumery.",https://www.thedifferentcompany.com/cdn/shop/files/TDC_Logo_cartouche_white_site_200x.png?v=1644840211,https://www.thedifferentcompany.com,France,2000,niche,,,,2025-07-18T12:32:10.942225,2025-08-29T14:28:42.207850
cmd27a644f2dc13691c7532,The Equitium Group,"The Equitium Group is a specialized company in the perfume industry that focuses on creating high-quality, artisanal fragrances. Founded with a vision to innovate within the fragrance market, the company emphasizes unique scent formulations and sustainable sourcing of ingredients. They are known for their commitment to craftsmanship and their ability to blend traditional perfumery techniques with modern trends, aiming to provide sensory experiences that resonate with consumers. The Equitium Group also engages in strategic partnerships and collaborations to expand their fragrance offerings and reach wider audiences.",https://images.unsplash.com/photo-1587017539504-67cfbddac569?w=400&h=300&fit=crop,www.equitiumgroup.com,United States,2018,niche,,,,2025-07-18T12:32:10.942225,2025-08-29T14:28:48.059648
cmda17a3a4f323a889ca4d5,The Exotic Island Perfumer,"The Exotic Island Perfumer is a fragrance house known for creating unique and high-quality perfumes inspired by various exotic locations around the world. The company focuses on using natural ingredients and traditional perfumery techniques to craft fragrances that evoke the essence of their thematic inspirations. Their story began with a passion for travel and exploration, which motivated the founder to capture the scents of different cultures and landscapes in their products, making each perfume a sensory journey.",https://images.unsplash.com/photo-1541643600914-78b084683601?w=400&h=300&fit=crop,www.theexoticislandperfumer.com,United States,2015,niche,contact@theexoticislandperfumer.com,,,2025-07-18T12:32:10.942225,2025-08-29T14:28:53.614779
cmd449593528278d9390c0c,The Face Shop,"The Face Shop is a South Korean beauty and skincare brand that specializes in natural ingredients to formulate its products. Established in 2003, the company focuses on providing a wide range of skincare, cosmetics, and fragrance products inspired by traditional Asian remedies and modern beauty trends. With its commitment to eco-friendly practices and natural ingredients, The Face Shop has become a popular destination for consumers looking for effective and innovative beauty solutions.",https://images.unsplash.com/photo-1582735689369-4fe89db7114c?w=400&h=300&fit=crop,https://www.thefaceshop.com,South Korea,2003,drugstore,,,,2025-07-18T12:32:10.942225,2025-08-29T14:29:01.108931
cmdc5cb382350910552af54,The First,"The First is a luxury perfume house dedicated to creating sophisticated and unique fragrances. Established by a passionate team of fragrance artisans, they focus on crafting scents that tell a story and evoke emotions, utilizing high-quality ingredients and innovative techniques. Their approach blends traditional perfumery with a modern touch, allowing them to stand out in the competitive fragrance market. The company emphasizes personal experience and storytelling in their fragrance lines, with each scent representing an element of art and culture.",https://images.unsplash.com/photo-1541643600914-78b084683601?w=400&h=300&fit=crop,www.thefirstfragrance.com,United States,2019,niche,,,,2025-07-18T12:32:10.942225,2025-08-29T14:29:06.726608
cmda5683694b989fd3aa305,The Fragrance Box,"The Fragrance Box is a niche perfume company specializing in luxury and artisanal fragrances. Founded with the vision to provide a curated selection of high-quality perfumes, the company focuses on unique scent profiles that cater to diverse preferences. The Fragrance Box is dedicated to supporting indie and emerging perfumers by offering their creations alongside exclusive branded perfumes. Their story revolves around the love of scent and the art of perfumery, emphasizing craftsmanship and the emotion that fragrances invoke.",https://images.unsplash.com/photo-15907369626-6c63ac16f3df?w=400&h=300&fit=crop,www.thefragrancebox.com,United States,2015,niche,info@thefragrancebox.com,,,2025-07-18T12:32:10.942225,2025-08-29T14:29:12.817410
cmd2afa4eda274e5cc4f300,The Fragrance Engineers,"The Fragrance Engineers is a niche perfume company that specializes in creating unique and artisanal scents using high-quality ingredients. Founded by a team of skilled perfumers and fragrance enthusiasts, the company aims to push the boundaries of traditional fragrance-making by incorporating innovative techniques and sustainable practices. With a focus on individuality and self-expression, their perfumes are designed to evoke emotions and memories, allowing customers to find a scent that truly resonates with them.",https://www.thefragranceengineers.com/cdn/shop/files/CLEAR_VIEW_300x.png?v=1613527397,www.thefragranceengineers.com,United States,2017,niche,info@thefragranceengineers.com,,,2025-07-18T12:32:10.942225,2025-08-29T14:29:18.944997
cmd46cb32212f7fb5111a19,The Fragrance Foundation,"The Fragrance Foundation is a non-profit organization dedicated to promoting the fragrance industry and its appreciation among consumers and professionals. Established in 1949, the foundation aims to foster an understanding and admiration for fragrance as a form of art and self-expression. It actively supports fragrance education, innovation, and celebrates excellence in the industry through various events and awards, such as the annual Fragrance Foundation Awards, acknowledging outstanding achievements in fragrance creation and marketing.",http://fragrance19prd.wpengine.com/wp-content/uploads/2019/09/accords-logo-1024x175.png,https://www.fragrance.org,United States,1949,indie,,,"200 West 41st Street, Suite 1003, New York, NY 10036, USA",2025-07-18T12:32:10.942225,2025-08-29T14:29:26.228527
cmdaac700d1beb03c041ebb,The Fragrance Group,"The Fragrance Group is a prominent player in the fragrance industry, known for its wide range of scent offerings including fine fragrances, personal care products, and home fragrances. The company was established with a vision to create unique and sophisticated scents that appeal to diverse markets. Focusing on innovation and quality, The Fragrance Group collaborates with international brands and has developed a solid reputation for producing captivating and memorable scent experiences.","https://static.wixstatic.com/media/035244_3511e868a21748338c395d7843494e00~mv2.png/v1/fill/w_26,h_26,al_c,q_85,usm_0.66_1.00_0.01,enc_avif,quality_auto/035244_3511e868a21748338c395d7843494e00~mv2.png",https://www.thefragrancegroup.com,United States,2011,niche,,,,2025-07-18T12:32:10.942225,2025-08-29T14:29:33.920469
cmd25debb34207d18d91bdf,The Fragrance Kitchen,"The Fragrance Kitchen is a luxury perfume house based in Kuwait, renowned for creating artisanal scents that reflect the rich cultural heritage of the Middle East. Founded by the prominent perfumer Mohammed Ghosn in 2012, the company specializes in blending traditional Arabic notes with contemporary fragrance trends, offering a unique collection of perfumes that cater to both local and international markets. Their story emphasizes a deep connection to the artistry of perfumery, celebrating the craftsmanship behind each signature scent. The brand is particularly noted for its use of high-quality, natural ingredients and its commitment to authenticity in fragrance creation.",https://thefragrancekitchen.com/cdn/shop/files/Add_a_heading.png?v=1736776049&width=500,https://www.thefragrancekitchen.com,Kuwait,2012,niche,,,,2025-07-18T12:32:10.942225,2025-08-29T14:29:41.019825
cmd404c7f1ddc4fc6d62b6b,The Fragrance Shop (UK),"The Fragrance Shop is a leading perfume retailer in the UK, specializing in offering a wide range of fragrances for men, women, and children. Established to provide customers with a memorable scent experience, the company prides itself on its extensive collection of designer and niche perfumes at competitive prices. With a focus on customer service and an expert knowledge of fragrances, The Fragrance Shop aims to make every fragrance purchase a special moment. They operate both physical stores and an online shop, catering to diverse customer preferences.",https://images.unsplash.com/photo-1556909114-f6e7ad7d3136?w=400&h=300&fit=crop,https://www.thefragranceshop.co.uk,United Kingdom,1994,drugstore,,0121 559 0660,"1st Floor, 4-6 Lower Marsh, London, SE1 7RJ, United Kingdom",2025-07-18T12:32:10.942225,2025-08-29T14:29:47.930517
cmdb1cce3e9fe613e177b8f,The Fragrance,"The Fragrance is a luxury perfume brand known for its unique and exquisite scent compositions that blend traditional artisanal techniques with modern trends. Founded by a group of fragrance enthusiasts and industry veterans, the company strives to create high-quality, evocative perfumes that resonate with individual experiences and emotions. The Fragrance specializes in niche scents that are crafted from rare ingredients sourced globally, offering a bespoke experience to its clientele. Their story is rooted in a desire to provide personalized fragrances that tell a story through scent, often incorporating elements of art and culture into their creations.",https://images.unsplash.com/photo-1587017539504-67cfbddac569?w=400&h=300&fit=crop,www.thefragrance.com,USA,2015,niche,contact@thefragrance.com,,,2025-07-18T12:32:10.942225,2025-08-29T14:30:06.919408
cmd5440d5e12d8ba61440a2,The Gate Paris,"The Gate Paris is a niche perfume house that specializes in creating unique and artistic fragrances that echo the essence of Parisian culture and lifestyle. Their story begins with a vision to blend modern influences with classic craftsmanship, aiming to evoke emotions through scent. Each fragrance is designed to tell a story, celebrating the artistry of perfumery with limited-edition releases and high-quality ingredients, making their offerings distinct in the competitive landscape of the fragrance industry.",https://thegateparis.com/cdn/shop/files/Asset_14x_ee4622c7-76dc-415b-b786-91d9fe77cd2e.png?v=1735784970&width=50,https://thegateparis.com,France,2019,niche,,,,2025-07-18T12:32:10.942225,2025-08-29T14:30:14.258236
cmdf3106e0d3e1d636e554c,The Gentleman's Shop,"The Gentleman's Shop is a retailer specializing in men's grooming products, including a finely curated selection of perfumes and fragrances tailored for the modern gentleman. Founded to cater to the needs of discerning customers, the shop places an emphasis on quality, craftsmanship, and elegance in its offerings. They pride themselves on providing products that enhance personal style and self-care, offering a unique shopping experience that combines classic sophistication with contemporary trends.",https://images.unsplash.com/photo-1556909114-f6e7ad7d3136?w=400&h=300&fit=crop,https://www.gentlemansshop.com,United Kingdom,2006,indie,,,,2025-07-18T12:32:10.942225,2025-08-29T14:30:22.146030
cmd37b7c93ce8a548af85c3,The Golden Pineapple Fragrance Awards,"The Golden Pineapple Fragrance Awards is an annual awards event dedicated to recognizing and celebrating excellence in the fragrance industry. Established to honor outstanding perfume brands, perfumers, and innovative scents, the awards aim to elevate the craft of perfumery and promote creativity. The event gathers industry experts, influencers, and enthusiasts to celebrate achievements and push the boundaries of fragrance artistry.",https://images.unsplash.com/photo-1582735689369-4fe89db7114c?w=400&h=300&fit=crop,https://www.goldenpineapplefragranceawards.com,United States,2020,niche,contact@goldenpineapplefragranceawards.com,,,2025-07-18T12:32:10.942225,2025-08-29T14:30:27.974466
cmd2ab5c887f5ca17c6b4a6,The Golden Shower Beauty,"The Golden Shower Beauty is a niche perfume company that focuses on creating unique and luxurious fragrances inspired by nature and individual experiences. Founded with the vision of offering exclusive and artistic scents, the brand aims to redefine beauty and self-expression through olfactory art. The company's story is rooted in the belief that fragrance can evoke powerful memories and emotions, allowing individuals to connect deeply with their own personal narrative. Their specialty lies in handcrafting high-quality perfumes made from ethically sourced ingredients, catering to a discerning clientele that values authenticity and creativity.",https://www.thegoldenshowerbeauty.com/cdn/shop/files/TGS_logos-11.png?v=1750866218&width=2724,www.thegoldenshowerbeauty.com,United States,2018,niche,contact@thegoldenshowerbeauty.com,,,2025-07-18T12:32:10.942225,2025-08-29T14:30:35.370660
cmdc37141433a2bfcc5fba9,The Goth Rosary,"The Goth Rosary is an indie perfume company known for its unique and imaginative fragrance offerings inspired by gothic themes and aesthetics. Founded by a dedicated fragrance artist, the company specializes in hand-crafted perfumes that often incorporate dark and mystical elements, appealing to those who resonate with alternative and subculture styles. The brand has cultivated a strong niche following through its commitment to quality and creativity, often reflecting themes of romance, darkness, and individuality in its offerings.",https://images.unsplash.com/photo-1582735689369-4fe89db7114c?w=400&h=300&fit=crop,https://thegothrosary.com,United States,2015,indie,info@thegothrosary.com,,,2025-07-18T12:32:10.942225,2025-08-29T14:30:42.143043
cmdca2688aad58a513ff4e4,The Harmonist,"The Harmonist is a luxury perfume company that specializes in the creation of fragrances inspired by the principles of harmony, balance, and the philosophy of Yin and Yang. Founded by a former fashion executive, the brand seeks to blend art and science through olfactory experiences that reflect the energy and character of the wearer. Each fragrance is crafted with a thoughtful approach to create an emotional connection, making them unique and distinctive. The Harmonist is known for its commitment to high-quality ingredients and its elaborate, aesthetically pleasing bottle designs that reflect the harmony philosophy.",https://www.theharmonist.com/cdn/shop/files/harmonist-logo-black.png?crop=center&height=47&v=1702414955&width=390,https://theharmonist.com,France,2016,niche,,,,2025-07-18T12:32:10.942225,2025-08-29T14:30:50.174608
cmd8c320b64a82452912020,The Healing Garden,"The Healing Garden is a wellness-oriented company specializing in holistic skincare and fragranced products that focus on the therapeutic benefits of essential oils. Founded with the philosophy of combining nature’s healing properties with the power of aromatherapy, The Healing Garden crafts products that promote physical and emotional well-being. The company has a rich history in the personal care market and emphasizes the use of natural ingredients to enhance the health of both body and mind.",https://images.unsplash.com/photo-1582735689369-4fe89db7114c?w=400&h=300&fit=crop,https://www.thehealinggarden.com,United States,1990,indie,,,,2025-07-18T12:32:10.942225,2025-08-29T14:30:56.178405
cmd6c9d190204628f09b2b9,The Heart Company,"The Heart Company is a niche perfume manufacturer that focuses on creating unique, artisanal fragrances. Established with the vision to evoke emotional connections through scent, their products are crafted with high-quality ingredients sourced from around the world. The company prides itself on a storytelling approach to perfumery, where each fragrance is designed to reflect a specific narrative or experience. They emphasize creativity and individual expression in fragrance, often collaborating with artisan perfumers to create one-of-a-kind scents that appeal to a discerning clientele.",https://images.unsplash.com/photo-1582735689369-4fe89db7114c?w=400&h=300&fit=crop,www.theheartcompany.com,United States,2015,niche,contact@theheartcompany.com,,,2025-07-18T12:32:10.942225,2025-08-29T14:31:41.733208
cmda0264debac4e819ed361,The Holy Black,"The Holy Black is a niche fragrance and grooming company that specializes in creating unique and artisan perfumes, shaving products, and grooming essentials. Established in 2013 and based in Michigan, the company combines traditional craftsmanship with modern aesthetics to offer a distinct line of products that appeal to those seeking high-quality, handmade items. Their formulations often draw inspiration from historical fragrances and vintage styles, highlighting their commitment to individuality in a crowded market.",https://theholyblack.com/cdn/shop/files/toplogo_2000x.png?v=1614401913,https://theholyblack.com,United States,2013,niche,,,,2025-07-18T12:32:10.942225,2025-08-29T14:31:50.128015
cmd9cc704aa375be3127e4a,The Institute for Art and Olfaction,"The Institute for Art and Olfaction (IAO) is a non-profit organization dedicated to promoting the exploration and education of scent and perfume. Founded in 2012 by Saskia Wilson-Brown, the IAO serves as a hub for artists, perfumers, and the general public, offering workshops, courses, and events that focus on the creative and artistic aspects of scent-making. The organization also hosts the annual Art and Olfaction Awards, which recognizes and celebrates excellence in independent and artisan perfumery. The IAO's mission is to foster a greater appreciation for the complexities of scent and its role in art and culture, encouraging experimentation and discovery within the olfactory arts.",https://i0.wp.com/artandolfaction.com/wp-content/uploads/2019/12/IAO_Logo_2020_Website_Tiny.png?fit=150%2C150&ssl=1,https://www.artandolfaction.com,United States,2012,indie,,,,2025-07-18T12:32:10.942225,2025-08-29T14:31:58.353052
cmd537ea3e680ae06554793,The Lab Fragrances,"The Lab Fragrances is a unique fragrance company that offers a range of high-quality perfumes inspired by elements of nature, art, and culture. The company is known for its commitment to craftsmanship and creativity, producing fragrances that are distinctive and appealing. They emphasize the use of fine ingredients and have gained a reputation for their innovative scents, designed for individuals who appreciate artisan perfumery. The Lab Fragrances aims to provide a sensory experience that resonates with its customers, and they often experiment with unconventional notes to create signature scents.",https://images.squarespace-cdn.com/content/v1/59aa95f0f14aa1fbc5815057/1505034537609-0HPKQRDNY641WCSAFORS/Header+Logo.JPG,https://www.thelabfragrances.com,United Kingdom,2016,indie,,,,2025-07-18T12:32:10.942225,2025-08-29T14:32:08.297237
cmd62f20fddb331598b3f37,The Limited,"The Limited is a retail company primarily known for its women’s clothing and accessories. While it started as a fashion retailer, The Limited has diversified its offerings, including introducing a line of fragrances that reflect their stylish and contemporary brand identity. The company aims to provide modern women with clothing that is versatile and chic, often integrating seasonal trends into their perfume offerings, focusing on fragrances that complement their apparel.",https://images.unsplash.com/photo-1556909114-f6e7ad7d3136?w=400&h=300&fit=crop,,United States,1963,Designer,,,,2025-07-18T12:32:10.942225,2025-08-29T14:32:18.921443
cmdd2736b879b76259dad29,The Little Alchemist,"The Little Alchemist is an artisan perfume company specializing in handcrafted, natural fragrances. Founded with the philosophy of using high-quality ingredients, they focus on sustainability and the botanical origins of their products. The brand emphasizes transparency in sourcing, allowing consumers to understand the journey of their perfumes from nature to bottle. The company’s story is rooted in a passion for chemistry and nature, aiming to create functional fragrances that not only smell good but also promote well-being.",https://images.unsplash.com/photo-1556909114-f6e7ad7d3136?w=400&h=300&fit=crop,https://www.thelittlealchemist.com.au,Australia,2015,indie,,,,2025-07-18T12:32:10.942225,2025-08-29T14:32:28.048997
cmd862db07f1a509343dd90,The Lyfestyle Co,"The Lyfestyle Co is a forward-thinking perfume company that specializes in creating high-quality, eco-friendly fragrances. They focus on combining sustainable practices with unique scent profiles that cater to modern lifestyles. Established to promote a lifestyle of wellness and sustainability, their scents are crafted with attention to detail and an emphasis on using natural ingredients. The company prides itself on being part of a movement towards responsible consumption and aims to provide an inclusive range of fragrances that appeal to a diverse audience.",https://thelyfestyleco.com/cdn/shop/files/1200px-VOGUE_revista_-_logo.png?v=1737327966&width=3200,www.thelyfestyleco.com,Australia,2017,indie,info@thelyfestyleco.com,,,2025-07-18T12:32:10.942225,2025-08-29T14:32:37.820932
