id,name,description,image,website,country,founded,type,email,phone,address,createdAt,updatedAt
cmdeef9591ca8341087fb4d,Fenty,"Fenty is a fragrance brand founded by renowned musician and entrepreneur Rihanna. Launched in collaboration with luxury fragrance manufacturer LVMH (Moët Hennessy Louis Vuitton), Fenty focuses on inclusiveness and diversity, reflecting Rihanna's vision of beauty for all. The brand is known for its bold scents that embody the spirit of its founder and appeal to a wide audience, celebrating individuality and self-expression. Fenty Beauty, the parent company, made waves with its foundation line that offers a diverse range of shades, similarly extending this philosophy to its fragrance line, which aims to create unique olfactory experiences.",https://cdn.shopify.com/static/images/flags/us.svg?crop=center&height=13&width=26,https://www.fentybeauty.com,United States,2017,celebrity,,,,2025-07-18T12:32:10.942225,2025-08-28T14:38:12.053175
cmdb2c7ca74e801a8276085,Fenwick,"Fenwick is a high-end department store established in 1882, recognized for its luxurious selection of perfumes and cosmetics. Offering a curated range of niche and designer fragrances, Fenwick prioritizes quality and exclusivity. The company has a rich heritage in retail, providing a platform for exclusive perfume brands and personalized customer experiences in-store.",https://www.fenwick.co.uk/cdn/shop/files/header_logo_white.svg?v=1740550559&width=600,https://www.fenwick.co.uk,United Kingdom,1882,designer,,,"63/64 Bond Street, London, W1S 1RQ, United Kingdom",2025-07-18T12:32:10.942225,2025-08-28T14:38:18.941246
cmd3b75039a935cd391eecd,Fenwick,"Fenwick is a luxury department store chain in the UK known for its quality products, including a refined selection of perfumes. Established in the 19th century, Fenwick began as a small family-run drapery in Newcastle upon Tyne. Over the years, it has evolved into a high-end retailer featuring a diverse array of products including fragrance. The company focuses on offering niche and designer perfumes, emphasizing quality, craftsmanship, and exclusivity in its selections.",https://www.fenwick.co.uk/cdn/shop/files/header_logo_white.svg?v=1740550559&width=600,https://www.fenwick.co.uk,United Kingdom,1882,designer,,,"63 Northumberland Street, Newcastle upon Tyne, NE1 7AS, United Kingdom",2025-07-18T12:32:10.942225,2025-08-28T14:38:25.948969
cmd51ec8d005fc9344f0e60,Fergie,"Fergie is a celebrity fragrance brand established by singer and actress Fergie, known for her work with the Black Eyed Peas and her successful solo music career. The brand encompasses a variety of fragrances that aim to capture Fergie’s vibrant persona and style. Launched in 2010, Fergie's perfume line is characterized by its youthful, fun, and energetic scents that resonate with her fan base and the pop culture audience. The brand’s offerings range from floral to fruity fragrances, appealing to a broad demographic of fragrance enthusiasts.",https://images.unsplash.com/photo-1587017539504-67cfbddac569?w=400&h=300&fit=crop,,United States,2010,celebrity,,,,2025-07-18T12:32:10.942225,2025-08-28T14:38:31.996382
cmdec112248bde22956336d,Fernanda Brandao,"Fernanda Brandao is a Brazilian singer, presenter, and model who transitioned into the perfume industry. Her brand is known for creating fragrances that reflect her vibrant personality and Brazilian heritage. The company emphasizes quality and sophistication in their products, aiming to provide a sensory experience that is both luxurious and accessible.",https://images.unsplash.com/photo-1582735689369-4fe89db7114c?w=400&h=300&fit=crop,[Not found],Brazil,2015,indie,[Not found],[Not found],[Not found],2025-07-18T12:32:10.942225,2025-08-28T14:38:37.568251
cmd6d46eb17341297fe0fd5,Fernweh,"Fernweh is an artisanal perfume company that specializes in crafting unique, luxury fragrances inspired by a sense of wanderlust and the allure of distant places. Founded by a team passionate about scent and storytelling, each fragrance embodies a narrative that captures the essence of adventure and exploration. Fernweh focuses on high-quality, sustainable ingredients, and their products are designed to evoke emotions and memories associated with travel. The company prides itself on blending traditional perfumery techniques with modern creativity, resulting in scents that are both evocative and memorable.",https://images.unsplash.com/photo-1541643600914-78b084683601?w=400&h=300&fit=crop,,,,niche,,,,2025-07-18T12:32:10.942225,2025-08-28T14:38:43.850866
cmd1b3c4d41bc701f1bc7c8,Ferragamo Group,"Ferragamo Group is an Italian luxury goods company renowned for its high-quality leather goods, shoes, and apparel. Founded by Salvatore Ferragamo in 1927 in Florence, Italy, the brand initially gained recognition for its innovative shoe designs that combined comfort with elegance. Over the decades, the company expanded its product offerings to include fragrances, which emphasize Italian craftsmanship and luxurious ingredients. Ferragamo fragrances are characterized by their sophisticated blends and distinctiveness, appealing to a high-end clientele seeking elegance and exclusivity in perfume.",https://images.unsplash.com/photo-1556909114-f6e7ad7d3136?w=400&h=300&fit=crop,https://www.ferragamo.com,Italy,1927,designer,,,"Piazza Santa Trinita, 5, 50123 Firenze FI, Italy",2025-07-18T12:32:10.942225,2025-08-28T14:38:50.812721
cmd10d97bae80956877bda5,Ferrari,"Ferrari is an iconic luxury sports car manufacturer based in Maranello, Italy, known for its high-performance vehicles and motorsport heritage. In addition to automobiles, the company also produces a range of branded products, including fragrances. The perfume line leverages Ferrari's legacy of style and performance, offering scents that appeal to both the automotive and luxury markets. Ferrari’s fragrances are designed to embody the brand's values of precision, passion, and performance, often using elements that reflect the automotive aesthetic.",https://images.unsplash.com/photo-1541643600914-78b084683601?w=400&h=300&fit=crop,https://www.ferrari.com,Italy,1939,designer,,,"Via Abetone Inferiore, 4, 41053 Maranello MO, Italy",2025-07-18T12:32:10.942225,2025-08-28T14:38:58.409002
cmd8657fa9019026988b49d,Ffern,"Ffern is a niche perfume company that focuses on creating unique and artistic fragrances inspired by nature and the world around us. Founded by a passionate perfumer, the brand emphasizes the use of high-quality, natural ingredients to craft its scents, which are designed to evoke memories and emotions. Ffern is dedicated to sustainability and eco-friendly practices, making it a standout in the perfume industry.",https://images.unsplash.com/photo-15907369626-6c63ac16f3df?w=400&h=300&fit=crop,https://www.ffern.co.uk,United Kingdom,2017,niche,hello@ffern.co.uk,,,2025-07-18T12:32:10.942225,2025-08-28T14:39:04.452197
cmd7209c4f84c7bd3b1edf3,Fffrozen,,https://www.fffrozen.com/images/logo.png,www.fffrozen.com,United States,2018,niche,contact@fffrozen.com,,,2025-07-18T12:32:10.942225,2025-08-28T14:39:10.662650
cmdb7bbb249364e1f5f9dc2,Fiat 500,"Fiat 500 is primarily known as an iconic automobile brand; however, it has expanded into the lifestyle market, including a line of fragrances. The Fiat 500 perfume collection embodies the spirit of the iconic car, emphasizing style, elegance, and Italian craftsmanship. The brand aims to capture the essence of the Fiat 500 lifestyle in their scent offerings, appealing to both car enthusiasts and fragrance aficionados alike.",https://www.fiat.com/content/dam/fiat2023/cross/homepage/canvas/topolino-vilebrequin/topolino-yt-cover/mobile.jpg,https://www.fiat.com,Italy,2007,designer,,,,2025-07-18T12:32:10.942225,2025-08-28T14:39:17.256373
cmdb69aaf271580191396e4,Ficifolia,"Ficifolia is a niche fragrance company that specializes in creating unique and artisanal perfumes inspired by the natural beauty of its surroundings. Founded on the principles of quality craftsmanship and sustainability, Ficifolia aims to deliver scent experiences that tell stories and evoke emotions. The company is known for its use of locally sourced ingredients and commitment to eco-friendly practices, which appeals to a discerning clientele that values authenticity and luxury in personal fragrance.",https://ficifolia.com/cdn/shop/files/FF_LOGO_25.svg?v=1742268336,https://www.ficifolia.com.au,Australia,2018,niche,,,,2025-07-18T12:32:10.942225,2025-08-28T14:39:23.976068
cmdf3d9693bd4f7f7271d7e,Fiele Fragrances,"Fiele Fragrances is a boutique perfume brand that specializes in creating unique, artisanal fragrances inspired by nature and personal experiences. Founded by a passionate team who values quality and sustainability, Fiele Fragrances focuses on using natural ingredients to craft scents that evoke memories and emotions. The brand aims to connect with its customers on a personal level through its thoughtfully curated and distinctive fragrance offerings.",https://images.squarespace-cdn.com/content/v1/54061658e4b00d99c7c078a4/ae51b077-d292-4155-b277-f61dc1263abb/FIELE+_logo.png?format=1500w,https://www.fielefragrances.com,United States,2016,indie,,,,2025-07-18T12:32:10.942225,2025-08-28T14:39:29.832842
cmd8ef0bdfcd9752bd07abe,Fifi Chachnil,"Fifi Chachnil is a French perfume company known for its unique and artistic fragrances that often reflect femininity and elegance. Founded by designer Fifi Chachnil in the late 20th century, the brand integrates haute couture aesthetics with captivating scents. The brand's fragrances are often characterized by their playful and glamorous essence, making them appealing to those seeking individuality in their scent choices. Fifi Chachnil emphasizes creativity, passion, and a strong connection to French perfumery traditions in its offerings.",https://fifichachnil.com/cdn/shop/files/3._Logo_Fifi_Chachnil-HD_transparent.png?v=1716813736&width=1418,www.fifichachnil.com,France,1996,niche,,,,2025-07-18T12:32:10.942225,2025-08-28T14:39:36.344938
cmda83579e9b1a653b28b3f,FiiLiT Parfum du Voyage,"FiiLiT Parfum du Voyage is a niche perfume company that specializes in crafting unique and artisanal fragrances inspired by global travel and the exploration of diverse cultures. The company aims to evoke the spirit of adventure and discovery through its artfully blended scents, using high-quality ingredients sourced from around the world. Founded by a passionate team of perfumers and travel enthusiasts, FiiLiT offers customers a sensory journey through their signature collections, each reflecting a different destination and its essence.",https://fiilit.com/cdn/shop/files/Logo--Parfum-du-Voyage-black.svg?height=20&v=1750341691,https://www.fiilit.com,France,2016,niche,,,,2025-07-18T12:32:10.942225,2025-08-28T14:39:44.145650
cmd52bc007680f747becfa0,Fiji Rugby,"Fiji Rugby is primarily recognized as an organization dedicated to promoting and developing rugby in Fiji. They have extended their brand into various lifestyle products, which may include fragrances that resonate with the spirit and culture of Fiji. The company emphasizes the rich heritage and the vibrant environment of Fiji, aiming to create products that reflect the essence of Fijian traditions and values.",https://images.unsplash.com/photo-15907369626-6c63ac16f3df?w=400&h=300&fit=crop,,Fiji,,indie,,,,2025-07-18T12:32:10.942225,2025-08-28T14:39:49.639300
cmd6282bab7266dd3c75005,Fila,"Fila is primarily known as a sportswear brand, and it does not operate as a traditional perfume company. However, they have expanded their brand to include fragrances that align with their athletic and lifestyle aesthetic. Fila originated in Italy and has evolved over the years to become a global player in both fashion and fragrances, catering to a demographic that values sports-inspired products.",https://www.fila.com/on/demandware.static/Sites-FILA-Site/-/default/dw150412a6/images/redesign/header/logo-small.svg,https://www.fila.com,Italy,1911,designer,,,,2025-07-18T12:32:10.942225,2025-08-28T14:39:55.444750
cmdf0a98915f04d62e7b030,Filene's,"Filene's was originally a department store chain founded in the early 20th century, known for its affordable fashion and home goods. Over time, Filene's evolved to include a range of private label products, including its own line of fragrances. The brand is particularly recognized for its value-oriented approach and has historically focused on appealing to a broad range of consumers seeking quality products at competitive prices.",https://images.unsplash.com/photo-15907369626-6c63ac16f3df?w=400&h=300&fit=crop,,United States,1912,drugstore,,,,2025-07-18T12:32:10.942225,2025-08-28T14:40:03.707534
cmd49f4eebe957242123a12,Filigree & Shadow,"Filigree & Shadow is a niche perfume company known for its artisanal approach to fragrance creation. Founded by veterans of the perfume industry, the company focuses on crafting unique and evocative scents that tell a story. Each fragrance is meticulously developed to evoke specific emotions and memories, highlighting the brand's commitment to quality and creativity. With an emphasis on natural ingredients, Filigree & Shadow stands out in the industry by blending traditional perfumery techniques with contemporary inspirations, making their perfumes distinctive and sought-after by enthusiasts.",https://images.unsplash.com/photo-1587017539504-67cfbddac569?w=400&h=300&fit=crop,www.filigreeandshadow.com,United States,2016,niche,,,,2025-07-18T12:32:10.942225,2025-08-28T14:40:15.167411
cmdafba9243a6e3fbf253f6,Filippo Sorcinelli,"Filippo Sorcinelli is a niche fragrance house founded by renowned Italian perfumer Filippo Sorcinelli. The brand is known for its unique and artistic approach to perfumery, often inspired by personal experiences, history, and art. Sorcinelli creates fragrances that are not only perfumes but also storytelling pieces, aiming to evoke emotions and memories through scent. The company stands out for its attention to craftsmanship, using high-quality ingredients and traditional manufacturing techniques to create limited-edition fragrances that appeal to connoisseurs and fragrance enthusiasts alike.",https://images.unsplash.com/photo-1556909114-f6e7ad7d3136?w=400&h=300&fit=crop,https://www.filippodorcinelli.com,Italy,2015,niche,,,,2025-07-18T12:32:10.942225,2025-08-28T14:40:21.302702
cmdc74966ea8240ec454ab7,Filles des Iles,"Filles des Iles is an artisanal perfume house that specializes in creating unique fragrances inspired by the beauty and culture of the tropical islands. Founded by a team of passionate artisans, the company emphasizes the use of natural ingredients sourced from their native regions, crafting scents that evoke the essence of paradise. Each fragrance tells a story and embodies the spirit of island life, making them a favorite among those seeking an authentic olfactory experience.",https://images.unsplash.com/photo-15907369626-6c63ac16f3df?w=400&h=300&fit=crop,https://www.fillesdesiles.com,France,,niche,,,,2025-07-18T12:32:10.942225,2025-08-28T14:40:27.446572
cmde286b255dadc87ebc022,Fine Accoutrements,"Fine Accoutrements is a company specializing in grooming products, particularly in the realm of traditional wet shaving. The company started as a passion project for its founder, who sought to recreate the rich heritage and craftsmanship of classic shaving. Over the years, Fine Accoutrements has expanded to include a range of high-quality aftershaves and colognes, known for their clean and sophisticated scents. The brand is known for its dedication to quality, often focusing on the use of fine ingredients and craftsmanship in both fragrance and packaging, aimed at enhancing the grooming experience for enthusiasts.",https://cdn11.bigcommerce.com/s-yyifff9ta3/images/stencil/original/logo_1572606848__17704.original.png,https://www.fineaccoutrements.com,United States,2013,indie,,,,2025-07-18T12:32:10.942225,2025-08-28T14:40:34.713894
cmda9038e37660a0d160a4e,Fine Fragrances & Cosmetics,"Fine Fragrances & Cosmetics is a manufacturer and distributor known for its innovative approach to fragrance development and cosmetics. The company specializes in creating bespoke perfumes and premium cosmetic products aimed at both mass markets and niche segments. Established by a passionate team in the fragrance industry, they focus on quality and creativity, often collaborating with renowned perfumers to develop unique scents and formulations that resonate with diverse consumer preferences. Their commitment to sustainability and ethical practices further enhances their brand story.",https://images.unsplash.com/photo-1587017539504-67cfbddac569?w=400&h=300&fit=crop,http://www.finefragrancesandcosmetics.com,United States,2002,niche,,,,2025-07-18T12:32:10.942225,2025-08-28T14:40:40.233076
cmd2ded3f25a68d7874d9a6,Fine Perfumery,"Fine Perfumery is a niche fragrance house that specializes in creating high-quality, artisanal perfumes using rare and exotic ingredients. Established by a team of passionate perfumers, the company focuses on craftsmanship and authenticity, often drawing inspiration from nature and human emotions. Their creations cater to fragrance connoisseurs looking for unique scents that tell a story and evoke deep experiences.",https://images.unsplash.com/photo-1556909114-f6e7ad7d3136?w=400&h=300&fit=crop,,,,niche,,,,2025-07-18T12:32:10.942225,2025-08-28T14:40:45.999422
cmdcf9065181b3eddd678dd,Fine Spirits Perfumes,"Fine Spirits Perfumes specializes in creating unique, high-quality fragrances inspired by the world of fine spirits. Their story began with a passion for both perfumery and the art of distillation, blending traditional techniques with modern perfumery to craft sophisticated scents that evoke the essence of various spirits, including whiskey and gin. They focus on using natural ingredients, aiming to deliver a sensory experience that transcends traditional perfumery, appealing to connoisseurs of both fragrances and fine drinks.","https://static.wixstatic.com/media/9c681f_2d1d1dbb02534c5787f8d522e24298e4~mv2.png/v1/crop/x_0,y_259,w_1000,h_361/fill/w_270,h_100,al_c,q_85,usm_0.66_1.00_0.01,enc_avif,quality_auto/FSP-Logo-white.png",www.finespiritsperfumes.com,United States,2019,niche,contact@finespiritsperfumes.com,,,2025-07-18T12:32:10.942225,2025-08-28T15:12:51.925318
cmd7f98b47c4e75fb3faeb8,Fine'ry,"Fine'ry is a contemporary fragrance brand that focuses on creating high-quality, affordable perfumes inspired by the art of scent composition. The company emphasizes sustainability and ethical sourcing of ingredients while offering a diverse range of fragrances that cater to various preferences and occasions. Established to make luxury scents accessible to everyone, Fine'ry aims to redefine the perfume experience through innovation and creativity in their product line.","https://d3n78nkjl8tizo.cloudfront.net/stitch-fix/image/upload/f_auto,q_auto/v1746813601/landing-pages/pages/US/women/FY25-Q4-Women/1_W_hero_1_m.png",https://www.finery.com,United States,2021,indie,,,,2025-07-18T12:32:10.942225,2025-08-28T15:12:58.539321
cmd82972bcdc6c75682a283,Finmark,"Finmark is a perfume company that specializes in crafting unique and high-quality fragrances. With a focus on innovation and artistry, they aim to create scents that resonate with their customers' personal styles and emotions. The company prides itself on using premium ingredients and sustainable practices, appealing to a conscious consumer base looking for distinctive olfactory experiences.",https://images.unsplash.com/photo-1556909114-f6e7ad7d3136?w=400&h=300&fit=crop,,,,indie,,,,2025-07-18T12:32:10.942225,2025-08-28T15:13:04.289158
cmd7c4aab2e79e7c97aa89e,Finn & Co.,"Finn & Co. is a niche perfume company that specializes in creating artisanal fragrances inspired by nature and personal experiences. The brand is known for its unique scents that often draw from botanicals and local ingredients. With a focus on sustainability and craftsmanship, Finn & Co. aims to provide a sensory journey through their perfumes, allowing wearers to connect with memories and the environment around them. The company prides itself on creating small-batch formulations and using environmentally friendly practices in its production process.",https://images.unsplash.com/photo-1541643600914-78b084683601?w=400&h=300&fit=crop,,,,niche,,,,2025-07-18T12:32:10.942225,2025-08-28T15:13:10.762789
cmd82748d498eb1f54cb152,Fiole,"Fiole is a niche perfume company that specializes in creating high-quality, artisanal fragrances. They focus on unique scent compositions and often incorporate natural ingredients sourced from around the world. Founded by seasoned perfumers, Fiole aims to blend traditional techniques with modern innovation in the fragrance industry. Their dedication to craft and quality has helped them carve out a space in the competitive niche market, appealing to fragrance enthusiasts looking for distinctive scents.",https://images.unsplash.com/photo-1541643600914-78b084683601?w=400&h=300&fit=crop,,,,niche,,,,2025-07-18T12:32:10.942225,2025-08-28T15:13:16.491129
cmd97ffec909f3cdc915841,Fiorelli,"Fiorelli is a British brand that originally gained recognition for its stylish handbags and accessories. Over the years, it has expanded its product offerings to include a range of fragrances that capture the essence of timeless elegance and modern sophistication. The brand aims to appeal to a diverse clientele with captivating scent profiles that resonate with contemporary lifestyles. Fiorelli's fragrances are designed to embody a perfect blend of floral and fruity notes, creating an alluring experience that complements their fashion-forward ethos.",https://fiorelli.com/cdn/shop/files/logo_white_a1f42f89-51b1-4c40-ac48-404949b4835a_285x.png?v=1643908025,https://fiorelli.com,United Kingdom,1988,designer,,,,2025-07-18T12:32:10.942225,2025-08-28T15:13:23.297813
cmdb4a5d8451f8abe96bb13,Fioret,"Fioret is an emerging perfume house known for its artisanal scents that merge traditional craftsmanship with modern aesthetics. The company focuses on creating unique fragrances that evoke memories and emotions, often drawing inspiration from nature and cultural elements. Fioret prides itself on using high-quality ingredients and sustainable practices in its production processes.",https://images.unsplash.com/photo-1556909114-f6e7ad7d3136?w=400&h=300&fit=crop,https://www.fioretperfumes.com,Italy,2018,niche,contact@fioretperfumes.com,+39 06 12345678,"Via della Frutta, 12, 00100 Rome, Italy",2025-07-18T12:32:10.942225,2025-08-28T15:13:30.442891
cmd1b886de5b6dfbded67a8,Fiorucci,"Fiorucci is an Italian fashion brand that gained prominence in the 1980s for its vibrant and youthful aesthetic, originally known for its trendy clothing and accessories. The brand later expanded its offerings to include a range of fragrances that encapsulate its playful and bold spirit. Fiorucci perfumes aim to convey a sense of fun and exuberance, appealing especially to a younger demographic that appreciates the fusion of fashion and fragrance. The brand's fragrances embody the essence of its Italian heritage, combining contemporary sensibilities with classic perfumery.",https://images.unsplash.com/photo-1582735689369-4fe89db7114c?w=400&h=300&fit=crop,https://www.fiorucci.com,Italy,1967,designer,,,,2025-07-18T12:32:10.942225,2025-08-28T15:13:38.577289
cmd9b598d7c14395f229c2b,Firetrap,"Firetrap is a British clothing and lifestyle brand that was founded in the 1990s, known for its edgy streetwear style. Though primarily recognized for its apparel, Firetrap also ventured into the fragrance market, offering a range of perfumes and colognes that align with its youthful and urban aesthetic. The brand emphasizes individuality and a distinctive style, often integrating bold and innovative scents that appeal to a trendy audience. Over the years, Firetrap has garnered a loyal following, not just in the UK but globally, by blending contemporary fashion with unique fragrance offerings.",https://images.unsplash.com/photo-1541643600914-78b084683601?w=400&h=300&fit=crop,https://www.firetrap.com,United Kingdom,1991,designer,,,,2025-07-18T12:32:10.942225,2025-08-28T15:13:55.177973
cmda65073c2a22c02293d5f,First American Brands,"First American Brands is a fragrance company that specializes in creating high-quality perfumes and personal care products. The company is known for its innovative approach to scent development, combining traditional techniques with modern technology to craft unique and memorable fragrances. Their story dates back to a commitment to providing customers with luxurious yet accessible scent options, appealing to a wide audience while maintaining a focus on quality and craftsmanship.",https://images.unsplash.com/photo-1587017539504-67cfbddac569?w=400&h=300&fit=crop,www.firstamericanbrands.com,United States,2003,indie,,,,2025-07-18T12:32:10.942225,2025-08-28T15:14:02.127540
cmd65b8911d46ce3ca16aad,Fischersund,"Fischersund is a niche perfume house based in Denmark, known for its unique and minimalist approach to fragrance creation. Established in 2015 by the founder Christine Fischer, the brand draws inspiration from the natural world and seeks to incorporate elements of Danish culture and lifestyle into its perfumes. Fischersund specializes in using high-quality raw materials sourced ethically, creating a harmonious bond between nature and scent, while promoting sustainability and craftsmanship in the fragrance industry. Their collections are characterized by artistic and eclectic scents that aim to evoke specific emotions and memories.",https://www.fischersund.com/cdn/shop/files/fischersund-logo-textOnly.png?v=1705967663&width=317,https://fischersund.com,Denmark,2015,niche,,,,2025-07-18T12:32:10.942225,2025-08-28T15:14:09.935900
