id,name,description,image,website,country,founded,type,email,phone,address,createdAt,updatedAt
cmd46142a869c8de9f4ccb1,Rodial,"Rodial is a skincare and cosmetics brand that focuses on high-performance beauty products, including fragrances. Founded by Maria Hatzistefanis in 1999, the brand gained notoriety for its innovative formulations and luxury aesthetic. Rodial specializes in creating effective skincare and beauty solutions inspired by the latest advancements in cosmeceuticals while also expanding into the fragrance market, presenting a collection that embodies the essence of the brand's luxury ethos.",https://www.rodial.com/cdn/shop/files/Nav_bar.jpg?v=1749634363&width=2000,https://www.rodial.com,United Kingdom,1999,indie,,,,2025-07-18T12:32:10.942225,2025-08-29T12:09:12.817269
cmd6f24195110985dd53227,Rodier,"Rodier is a French perfume company known for its unique scents and a blend of traditional and contemporary fragrance craftsmanship. The company specializes in creating luxurious perfumes that embody elegance and refinement, often steeped in the rich history of French perfumery. With a passion for quality ingredients and artistry, Rodier continues to capture the essence of sophistication in its collections, appealing to a clientele that values exclusivity and heritage in their fragrance choices.",https://images.unsplash.com/photo-1582735689369-4fe89db7114c?w=400&h=300&fit=crop,https://www.rodier.com,France,1927,designer,,,,2025-07-18T12:32:10.942225,2025-08-29T12:09:18.829180
cmd481fddf59a6dc40a19f3,Rodin Olio Lusso,"Rodin Olio Lusso is a luxury skincare and fragrance brand founded by Linda Rodin in 2007. The company specializes in high-quality oil-based products, particularly known for its signature fragrance, which is infused with natural ingredients. Rodin's philosophy centers around the belief that beauty should be simple and elegant, focusing on a luxurious approach to skincare and fragrance. The brand has garnered a dedicated following and is celebrated for its artisanal crafting and aesthetic appeal, making it a standout in its market category.",https://images.unsplash.com/photo-1556909114-f6e7ad7d3136?w=400&h=300&fit=crop,https://rodinolio.com,United States,2007,niche,,,,2025-07-18T12:32:10.942225,2025-08-29T12:09:25.009651
cmdd0f52ea3edb9e47d5bb4,Roen,"Roen is a luxury perfume brand that emphasizes a blend of art and science in fragrance creation. It aims to push the boundaries of traditional perfumery with unique compositions that reflect individual narratives and lifestyles. Their story is rooted in a passion for craftsmanship, sourcing high-quality ingredients to create scents that evoke emotions and memories. Roen’s specialty lies in their distinct olfactory profiles that cater to a sophisticated clientele looking for exclusive and personalized fragrance experiences.",https://images.unsplash.com/photo-1582735689369-4fe89db7114c?w=400&h=300&fit=crop,https://roen.com,United States,2018,niche,,,,2025-07-18T12:32:10.942225,2025-08-29T12:09:41.040982
cmdc5f35cdb92d193897816,Roger Allan,"Roger Allan is a luxury perfume brand known for its handcrafted fragrances that embody elegance and sophistication. Established with a passion for the art of perfumery, the company focuses on sourcing high-quality ingredients to create unique and memorable scents. Their offerings cater to discerning customers seeking exclusive fragrances that tell a story and evoke emotions. Roger Allan emphasizes craftsmanship and the blending of traditional techniques with contemporary trends, making their perfumes stand out in the competitive market.",https://images.unsplash.com/photo-15907369626-6c63ac16f3df?w=400&h=300&fit=crop,www.rogerallan.com,United States,2010,niche,,,,2025-07-18T12:32:10.942225,2025-08-29T12:09:47.192485
cmd1d2e25ecfb22ba377d7d,Roger & Gallet,"Roger & Gallet is a renowned French luxury fragrance and cosmetics company, established in 1862. Specializing in the creation of fine perfumes, shower gels, soaps, and skincare products, the brand is celebrated for its rich heritage and commitment to crafting sophisticated scents inspired by natural elements. The company is known for its use of high-quality ingredients and traditional perfume-making techniques, which resonate with a sense of elegance and wellness. Roger & Gallet has a tradition of blending contemporary creativity with historical influences, catering to customers who appreciate both modern and classic fragrances.",https://www.roger-gallet.com/_nuxt/logo.BuOH3vtx.svg,https://www.roger-gallet.com,France,1862,niche,,,,2025-07-18T12:32:10.942225,2025-08-29T12:09:53.974207
cmd9118c56b574dd71e46b5,Roger Federer,"Roger Federer is a globally recognized Swiss professional tennis player who has expanded his brand into the fragrance industry. The Roger Federer perfume line offers a blend of luxury and sophistication, reflecting Federer’s public persona of elegance and finesse. The fragrances aim to encapsulate the spirit of Roger Federer, emphasizing freshness and appeal suitable for diverse occasions. The launch of his perfume line aligns with his ventures in fashion and lifestyle, creating a coherent personal brand that extends beyond sports.",https://images.unsplash.com/photo-1587017539504-67cfbddac569?w=400&h=300&fit=crop,www.rogerfederer.com,Switzerland,2020,celebrity,,,,2025-07-18T12:32:10.942225,2025-08-29T12:10:00.823630
cmd5f6495d6a99798b1a4d4,Roger Vivier,"Roger Vivier is a luxury fashion house known primarily for its exquisite footwear and leather goods. Founded in 1937 by the French designer Roger Vivier, the brand is celebrated for its innovative designs and craftsmanship that blend functionality with elegance. While known mainly for shoes, Roger Vivier also ventured into the world of perfume, with fragrances that mirror the brand's aesthetic of refined luxury and creativity. The company's story is one of elegance and heritage, positioning itself as a symbol of sophistication in the luxury fashion sector.",https://images.unsplash.com/photo-1582735689369-4fe89db7114c?w=400&h=300&fit=crop,[https://www.rogervivier.com](https://www.rogervivier.com),France,1937,designer,,,,2025-07-18T12:32:10.942225,2025-08-29T12:10:06.878646
cmdf68e2f818148975d24ea,Rogue Perfumery,"Rogue Perfumery is an independent niche fragrance house that specializes in creating artisanal perfumes inspired by vintage scent traditions. The company is known for its commitment to using high-quality ingredients and for crafting fragrances that evoke emotion and memory. Founded by brand creator and perfumer, Rogue Perfumery aims to explore the olfactory landscape with a unique perspective, producing scents that are both complex and accessible to fragrance enthusiasts.",https://rogueperfumery.com/cdn/shop/files/RP_97a0ebdf-f157-4ea8-ac71-6ae165aead14_170x.png?v=1744076348,https://rogueperfumery.com,United States,2017,niche,,,,2025-07-18T12:32:10.942225,2025-08-29T12:10:13.214032
cmdd5d462c3736699edd491,Roja Parfums,,https://images.unsplash.com/photo-1582735689369-4fe89db7114c?w=400&h=300&fit=crop,https://www.roja.com,United Kingdom,2011,niche,,,,2025-07-18T12:32:10.942225,2025-08-29T12:10:20.444249
cmd4b907f9f5299780eafd9,Roland Garros,"Roland Garros is primarily known for being associated with the French Open, one of the prestigious Grand Slam tennis tournaments. While the brand is famous for its events and sports culture, its perfume line embodies sophistication and elegance inspired by the spirit of tennis and the vibrant atmosphere of Paris. Their fragrances are often designed to capture the excitement and energy of the tournament while maintaining a luxurious appeal, aimed at both tennis enthusiasts and fragrance connoisseurs alike.",https://images.unsplash.com/photo-1582735689369-4fe89db7114c?w=400&h=300&fit=crop,,France,,designer,,,,2025-07-18T12:32:10.942225,2025-08-29T12:10:26.152174
cmd5abf21ced5900bd055c3,Roma International PLC,"Roma International PLC is a prominent player in the fragrance industry, specializing in the development, manufacturing, and distribution of a diverse range of perfumes and scented products. Established with a vision to create high-quality fragrances, the company has a rich history of blending traditional craftsmanship with modern techniques. Their portfolio includes both classic and contemporary scents, catering to various markets and consumer preferences. In addition to their own branded products, Roma International also provides private label services for other brands, showcasing their expertise in fragrance formulation and product development.",https://static.HugeDomains.com/images/hdv3-img/hd-header-logo-v3.svg,http://www.romainternational.com,United Kingdom,1986,niche,,,,2025-07-18T12:32:10.942225,2025-08-29T12:10:33.632078
cmd0c60e68dad0031797bd3,Romane,"Romane is a luxury perfume company known for its artisanal approach to fragrance creation, blending traditional perfumery techniques with modern innovation. The brand emphasizes quality, sourcing high-grade ingredients from sustainable sources. Romane's story begins with a passion for unique and evocative scents, aiming to create olfactory experiences that resonate with personal memories and emotions. The company specializes in a limited collection of vibrant fragrances designed to appeal to discerning customers looking for exclusivity and sophistication.",https://images.unsplash.com/photo-1541643600914-78b084683601?w=400&h=300&fit=crop,www.romaneparfums.com,France,2015,niche,contact@romaneparfums.com,,"12 Rue de la Parfumerie, 75001 Paris, France",2025-07-18T12:32:10.942225,2025-08-29T12:10:39.886062
cmd3f63a1a3b2ea5a2b8970,Romano,"Romano is a perfume company known for its range of fragrances that cater to a wide audience with a blend of traditional and contemporary scent profiles. Established with a vision to enhance personal expression through scent, Romano has built a reputation for quality and affordability. The brand is often associated with vibrant and youthful fragrances, appealing to both men and women. Their specialties include creating signature fragrances that represent modern lifestyles, and they often focus on innovative packaging and marketing strategies that resonate with younger consumers.",https://images.unsplash.com/photo-1556909114-f6e7ad7d3136?w=400&h=300&fit=crop,www.romano.com,Italy,1985,drugstore,,,,2025-07-18T12:32:10.942225,2025-08-29T12:10:47.049762
cmd021ea4cdf8e1313ac5fb,Romea d'Ameor,"Romea d'Ameor is a niche perfume company that specializes in creating unique, artisanal fragrances inspired by the beauty and richness of nature. The brand emphasizes craftsmanship and quality, often using rare and luxurious ingredients sourced from around the globe. Their story is rooted in a passion for perfumery that seeks to evoke emotions and memories through scent, catering to a discerning clientele who values individuality and sophistication in their fragrance choices.",https://images.unsplash.com/photo-1556909114-f6e7ad7d3136?w=400&h=300&fit=crop,www.romeadameor.com,France,2015,niche,contact@romeadameor.com,,"45 Rue de Rivoli, Paris, 75001, France",2025-07-18T12:32:10.942225,2025-08-29T12:10:53.176467
cmda3133524e821e8ed4ed8,Romella,"Romella is a niche perfume company known for creating high-quality, artisanal fragrances that blend traditional craftsmanship with modern sensibilities. Founded by a passionate perfumer who sought to capture the essence of natural ingredients, Romella focuses on unique scent profiles that evoke emotions and tell a story. The brand prides itself on sustainable sourcing and small-batch production, ensuring each perfume is both distinctive and luxurious.",https://images.unsplash.com/photo-1587017539504-67cfbddac569?w=400&h=300&fit=crop,www.romellaperfumes.com,United States,2015,niche,contact@romellaperfumes.com,,"123 Fragrance Lane, Perfume City, CA 90210, USA",2025-07-18T12:32:10.942225,2025-08-29T12:10:59.677405
cmde8dcb034b530d4d16e7e,Romeo Gigli,"Romeo Gigli is an Italian fashion designer known for his influential contributions to the fashion industry since the 1980s. The brand has expanded its offerings to include perfumes that embody the elegance and sensuality of its fashion lines. Renowned for their artistic and sophisticated scents, Romeo Gigli fragrances often reflect his distinct vision and commitment to high-quality craftsmanship, seeking to evoke emotions and a deep connection with wearers.",https://images.unsplash.com/photo-1556909114-f6e7ad7d3136?w=400&h=300&fit=crop,http://www.romeogigli.com,Italy,1989,designer,,,,2025-07-18T12:32:10.942225,2025-08-29T12:11:05.640854
cmdae955b2545ea023f5ffb,Romero Britto,"Romero Britto is a renowned Brazilian artist known for his colorful and vibrant artwork, which combines elements of pop art and cubism. The company specializes in creating a range of lifestyle products, including fragrance, apparel, and home decor, all featuring Britto’s distinctive artistic style. Founded with the belief that art can bring joy and positivity to people's lives, the brand's fragrances often embody these ideals, appealing to individuals looking for unique and whimsical scent experiences.",https://britto.com/wp-content/uploads/2021/05/logo-britto.png,https://www.britto.com,United States,1988,designer,,,,2025-07-18T12:32:10.942225,2025-08-29T12:11:12.893469
cmd6011f45c005c9cb52b0c,Romilly Wilde,"Romilly Wilde is a luxury perfume and skincare brand founded in 2017 by former journalist and beauty entrepreneur Sarah Rotheram. The company specializes in creating high-quality, sustainable fragrances using natural ingredients, often inspired by traditional perfumery alongside modern sensibilities. Romilly Wilde prides itself on its commitment to environmentally friendly practices, with a focus on transparency in sourcing and production. Their product line is designed to cater to individuals seeking distinctive scents that are both personal and reflective of their values.",https://romillywilde.com/cdn/shop/t/230/assets/logo.svg?v=105174932534091184341670248352,https://www.romillywilde.com,United Kingdom,2017,niche,,,,2025-07-18T12:32:10.942225,2025-08-29T12:11:20.346932
cmd431344681033c66aac8d,Ron Dorff,"Ron Dorff is a luxury fragrance and lifestyle brand that combines French elegance with Swedish functionality. Founded by designers and entrepreneurs, the company aims to offer a range of high-quality perfumes and grooming products that resonate with both modern sensibilities and classic aesthetics. The brand emphasizes a minimalistic design philosophy and focuses on creating unique, distinct scents that appeal to a sophisticated clientele, celebrating both personal identity and style.",https://rondorff.com/cdn/shop/files/logo-rondorff-white_330x.png?v=1656147039,https://rondorff.com,Sweden,2014,niche,,,,2025-07-18T12:32:10.942225,2025-08-29T12:11:31.722787
cmd1aebf8e25a09954948a1,Ronald Esper,"Ronald Esper is a perfume company known for its artisanal approach to fragrance creation, blending unique ingredients to develop distinctive scents tailored for individual expression. The company prides itself on storytelling through its fragrances, encapsulating emotions and inspirations from various cultures and experiences. While still relatively new in the industry, it has gained recognition for its innovative and high-quality products that appeal to fragrance enthusiasts.",https://images.unsplash.com/photo-1556909114-f6e7ad7d3136?w=400&h=300&fit=crop,www.ronalesper.com,United States,2020,niche,contact@ronalesper.com,,,2025-07-18T12:32:10.942225,2025-08-29T12:11:37.635983
cmd65091e82d74515806472,Ronan Keating,"Ronan Keating is a fragrance brand launched by the singer and entertainer Ronan Keating. The brand primarily focuses on creating perfumes that reflect Keating's personal style and charisma, aiming to connect with fans and lovers of his music through unique scent experiences. The company's story intertwines with Keating’s career, which includes his success in the music industry as a member of Boyzone and a solo artist. The fragrances are crafted with an emphasis on quality and elegance, aiming to appeal to a wide demographic.",https://www.ronankeating.com/wp-content/themes/ronankeating/assetsv2/gfx/ronan-keating.png,https://ronankeating.com,United Kingdom,2017,celebrity,,,,2025-07-18T12:32:10.942225,2025-08-29T12:11:44.818481
cmda98d09449e1ce999b926,Rook Perfumes,"Rook Perfumes is a niche fragrance house based in Portland, Oregon. Established in 2012, Rook Perfumes is known for its artisanal approach to fragrance creation, emphasizing unique scent profiles that highlight high-quality ingredients. The company focuses on crafting sophisticated and evocative fragrances that reflect the essence of the natural world. Rook Perfumes builds its collections around personal narratives and emotional experiences, creating scents that resonate deeply with individuals.",https://rookperfumes.co.uk/cdn/shop/files/c194e575-710d-47b3-a7ca-31f00389d951_removalai_preview.png?v=1746993226&width=680,https://rookperfumes.com,United States,2012,niche,,,,2025-07-18T12:32:10.942225,2025-08-29T12:11:53.218511
cmdf2e1201f94f8f3f0aa78,Room 1015,"Room 1015 is a niche perfume company founded by the French artist and designer, Thomas M. It draws inspiration from music and culture from the 1970s and 1980s, particularly the punk rock and new wave scenes. Room 1015 specializes in high-quality fragrance compositions that reflect an artistic and rebellious spirit, creating perfumes with unique stories and concepts behind them. The brand is known for its attention to detail and artistic presentation, aiming to make perfumery an experiential journey.",https://room1015.com/themes/classicchild/assets/img/homepage/jun-desktop-1-720w.jpg,https://www.room1015.com,France,2015,niche,,,,2025-07-18T12:32:10.942225,2025-08-29T12:12:00.993221
cmdfd87e023457e2f11df20,Roos & Roos,"Roos & Roos is a niche perfume house that specializes in creating unique and artisanal fragrances. Founded by a passionate duo, the company emphasizes intricate artistry and craftsmanship in their scent creation process, often drawing inspiration from nature and art. The brand is known for its limited edition releases and personalized fragrance experiences, making it a sought-after label among perfume enthusiasts and collectors.",https://images.unsplash.com/photo-1541643600914-78b084683601?w=400&h=300&fit=crop,https://www.roosandroos.com,Netherlands,2018,niche,,,,2025-07-18T12:32:10.942225,2025-08-29T12:12:06.960960
cmdaa0cbfe0794fac2753bd,Roots Rose Radish,"Roots Rose Radish is a thoughtful perfumery known for creating natural, high-quality fragrances that celebrate the beauty of nature and the art of scent. Founded with a passion for sustainability and botanical ingredients, the company emphasizes a holistic approach to fragrance, using eco-friendly practices and a combination of artisanal methodologies. They curate unique scents inspired by diverse landscapes, gardens, and the essence of natural elements, catering to an audience that appreciates handmade artisanal products. Their specialty lies in focusing on plant-based ingredients and minimalistic formulations that resonate deeply with consumers seeking authenticity and eco-conscious luxury.",https://images.squarespace-cdn.com/content/v1/53a4bb4ce4b074c786320f04/1732556199417-4Z5FCENO85REJAK61P3V/image-asset.jpeg,https://rootsroseradish.com,United States,2014,indie,,,,2025-07-18T12:32:10.942225,2025-08-29T12:12:17.154069
cmd1f22a4abb12391a666f0,Roots,"Roots is a Canadian lifestyle brand that originated in 1973, known for its high-quality apparel, leather goods, and handcrafted accessories. While primarily recognized for its clothing line, the company has also ventured into creating a range of fragrances that embody the essence of the Canadian wilderness, evoking natural elements and a sense of adventure. The specialty of Roots in the perfume industry lies in their ability to blend traditional craftsmanship with modern fragrance trends, often using natural and ethically sourced ingredients.",https://www.roots.com/on/demandware.static/Sites-RootsUS-Site/-/default/dwe017f59d/images/roots_logo.svg,https://www.roots.com,Canada,1973,indie,,,,2025-07-18T12:32:10.942225,2025-08-29T12:12:25.734499
cmda087129030fd94d85951,Rosario Flores,"Rosario Flores is a Spanish artist and entrepreneur known for her work in both music and perfume. The brand reflects her vibrant personality and cultural heritage, offering fragrance options that are inspired by her artistic journey and the diverse elements of her life. Rosario designs perfumes that evoke emotions and memories, targeting consumers who appreciate artistry and personal expression in fragrance.",https://images.unsplash.com/photo-15907369626-6c63ac16f3df?w=400&h=300&fit=crop,,Spain,,indie,,,,2025-07-18T12:32:10.942225,2025-08-29T12:12:31.033784
cmda2eef769794a2f912cf1,Rosarium Blends,"Rosarium Blends is a niche perfume company that specializes in creating artisanal fragrances inspired by the essence of nature and the beauty of flowers. Founded by fragrance enthusiasts, the brand emphasizes the use of high-quality ingredients and intricate blending techniques to craft unique scent profiles. Their story is rooted in a passion for perfumery, aiming to provide customers with distinctive and evocative aromas that reflect the diverse allure of the botanical world. Additionally, Rosarium Blends is dedicated to sustainable practices, ensuring that their products are environmentally friendly and cruelty-free.",http://rosariumblends.com/wp-content/uploads/2020/03/rb-logo-web_white_stroke.png,https://www.rosariumblends.com,United States,2019,niche,info@rosariumblends.com,,,2025-07-18T12:32:10.942225,2025-08-29T12:12:41.868820
cmdb2d843e5c95186ed776a,Rose & Co Manchester,"Rose & Co Manchester is a boutique fragrance company known for creating luxurious and artisanal perfumes. Founded in Manchester, the company emphasizes the use of high-quality natural ingredients and unique scent combinations, reflecting the rich heritage and craftsmanship of the region. Their story began with a passion for perfumery and a desire to offer distinctive fragrances that evoke emotion and connection. Rose & Co places a strong emphasis on sustainability and ethical sourcing, making them a beloved choice for fragrance connoisseurs seeking quality and originality.",https://images.unsplash.com/photo-1587017539504-67cfbddac569?w=400&h=300&fit=crop,https://www.roseandcomanchester.com,United Kingdom,2008,indie,,,,2025-07-18T12:32:10.942225,2025-08-29T12:12:47.481084
cmdd0bc575bda79404b827f,Rose Applebaum,,https://images.unsplash.com/photo-1556909114-f6e7ad7d3136?w=400&h=300&fit=crop,www.roseapplebaum.com,United States,2018,niche,contact@roseapplebaum.com,,,2025-07-18T12:32:10.942225,2025-08-29T12:12:53.167162
cmd5635ac68d6e8bb3d727a,Rose Arabia,"Rose Arabia is a renowned perfume company that specializes in creating high-quality, traditional Arabic perfumes. The company prides itself on blending the rich heritage of Arabian fragrance with contemporary elements, offering a wide range of scents that appeal to both local and international markets. Established with a passion for perfumery, Rose Arabia utilizes premium ingredients, often incorporating hints of rose, oud, and other exotic materials, resulting in unique and luxurious fragrances. Their story is rooted in the cultural significance of perfume in the Arab world, where it has been an essential part of social and personal expression for centuries.",https://images.unsplash.com/photo-1582735689369-4fe89db7114c?w=400&h=300&fit=crop,www.rosearabia.com,United Arab Emirates,2018,niche,,,,2025-07-18T12:32:10.942225,2025-08-29T12:12:59.036903
cmd514f48304c5f7e8eaee4,Rose Desgranges,"Rose Desgranges is a niche perfume house that specializes in crafting artisanal fragrances inspired by the natural beauty of flowers, particularly roses. The company focuses on using high-quality ingredients and traditional techniques to create unique scent experiences that capture the essence of elegance and femininity. Founded by renowned perfumer Rose Desgranges, the brand has a commitment to sustainability and often collaborates with local artisans to produce limited edition collections.",https://rosedesgranges.com/cdn/shop/files/Sans-titre-7.png?v=1675202092&width=600,www.rosedesgranges.com,France,2015,niche,contact@rosedesgranges.com,,"12 Rue du Faubourg Saint-Antoine, 75011 Paris, France",2025-07-18T12:32:10.942225,2025-08-29T12:13:06.950952
cmde1241153505e9ddd1c69,Rose et Marius,"Rose et Marius is a luxury French perfume brand founded by the couple, Rose and Marius, inspired by the Provence region's beauty and rich heritage. The company specializes in high-quality fragrances and perfumed home products that evoke the essence of French elegance with a focus on craftsmanship and tradition. Each fragrance is designed to tell a story, capturing the spirit of the Mediterranean landscape and its fragrant flora.",https://www.roseetmarius.com/img/cms/logo-main.png,https://www.roseetmarius.com,France,2012,niche,,,,2025-07-18T12:32:10.942225,2025-08-29T12:13:14.492450
cmd70a634cf9d9ac7b62387,Rose Valois,"Rose Valois is a luxury perfume house known for its exquisite craftsmanship and the use of high-quality ingredients sourced from around the world. Established with a vision to create fragrances that embody elegance and sophistication, Rose Valois draws inspiration from the rich history of perfumery, particularly the opulence of French culture. They specialize in designing bespoke and artisanal fragrances that cater to a discerning clientele seeking unique olfactory experiences.",https://images.unsplash.com/photo-1587017539504-67cfbddac569?w=400&h=300&fit=crop,https://www.rosevalois.com,France,2015,niche,contact@rosevalois.com,,"12 Rue de la Paix, 75002 Paris, France",2025-07-18T12:32:10.942225,2025-08-29T12:13:20.925872
