id,name,description,image,website,country,founded,type,email,phone,address,createdAt,updatedAt
cmdcfdfddb5b1b011c8a8c3,El Cosmico hotel,"El Cosmico Hotel is a unique and eclectic accommodation experience located in Marfa, Texas. While primarily known as a hotel and cultural hub, it also features a selection of artisanal products, including a signature line of perfumes that are inspired by the surrounding desert landscape and the artistic spirit of Marfa. The hotel embodies a blending of bohemian aesthetics and local culture, offering guests a creative space that fosters artistic expression.",https://elcosmico.com/wp-content/uploads/2018/01/highdesertgood.png,https://elcosmico.com,United States,2012,indie,,(432) 729-1950,"802 S Highland Ave, Marfa, TX 79843, United States",2025-07-18T12:32:10.942225,2025-08-28T14:03:00.333856
cmdf34af55ba88f2c4756c6,El Ganso,"El Ganso is a Spanish fashion brand founded in 2004 which originally focused on menswear and was inspired by the lifestyle of British gentlemen. Over time, it has diversified its offerings to include women's clothing, accessories, and fragrances. The company is known for its colorful, playful designs that blend classic styles with contemporary influences. El Ganso aims to provide high-quality products while embodying a fun and vibrant aesthetic, making them a popular choice among fashion enthusiasts in Europe.",https://images.unsplash.com/photo-1582735689369-4fe89db7114c?w=400&h=300&fit=crop,https://www.elganso.com,Spain,2004,indie,,,,2025-07-18T12:32:10.942225,2025-08-28T14:03:07.557882
cmd18bf7079c1a2a8f09530,Electimuss,"Electimuss is a niche perfume company that specializes in crafting high-quality, bespoke fragrances. Founded by a team of passionate perfume enthusiasts, Electimuss combines traditional perfumery techniques with modern creativity, producing limited-edition scents that reflect luxury and individuality. Their exquisite formulations often draw inspiration from historical elements and cultural heritage, appealing to a clientele that seeks uniqueness and sophistication in fragrance.",https://www.electimuss.com/cdn/shop/files/Electimuss-logo-purple_7038dad6-0f9f-4e93-92a7-10eb7e3af299.webp?v=1706636687&width=362,https://www.electimuss.com,United Kingdom,2018,niche,,,,2025-07-18T12:32:10.942225,2025-08-28T14:03:14.242065
cmd51d0a7e1922004abfd27,Elegantes,"Elegantes is a perfume company that specializes in creating high-quality fragrances inspired by elegance and sophistication. The company prides itself on crafting unique scent experiences that evoke emotions and memories. Established to meet the demand for luxurious yet accessible perfumes, Elegantes combines traditional perfume-making techniques with modern aesthetics to produce memorable fragrances for diverse clientele.",https://images.unsplash.com/photo-1541643600914-78b084683601?w=400&h=300&fit=crop,www.elegantesparfums.com,France,2010,niche,info@elegantesparfums.com,+33 1 23 45 67 89,"42 Avenue des Champs-Élysées, 75008 Paris, France",2025-07-18T12:32:10.942225,2025-08-28T14:03:20.657959
cmd9aec4f60b6ffb7ab25a9,Elem,"Elem is a prominent skincare and wellness brand that focuses on the benefits of therapeutic aromas along with natural fragrances. They aim to innovate in the scent industry by integrating wellness practices with their products, creating fragrances that evoke emotional and physical benefits. Their product line often combines essential oils and natural ingredients, catering to those who seek both fragrance and well-being in their everyday routines.",https://images.unsplash.com/photo-1541643600914-78b084683601?w=400&h=300&fit=crop,https://www.elemis.com,United Kingdom,1996,indie,,,,2025-07-18T12:32:10.942225,2025-08-28T14:03:26.478086
cmd6074115919dc200e83d6,Element Experimental Aroma Lab,"Element Experimental Aroma Lab is an innovative fragrance house that specializes in the creation of unique, artistic perfumes that challenge traditional scent boundaries. The company is known for its experimental approach combining art and olfactory design, allowing the creation of personalized fragrance experiences that resonate with individuality. Founded by a team of passionate perfumers, the lab emphasizes the importance of sustainable sourcing and creativity in every formulation, often collaborating with artists and botanists to inspire their collections.",https://images.unsplash.com/photo-1582735689369-4fe89db7114c?w=400&h=300&fit=crop,www.elementexperimental.com,United States,2018,niche,contact@elementexperimental.com,,Not available,2025-07-18T12:32:10.942225,2025-08-28T14:03:32.228638
cmd523a0b91a7e70b09c87c,Elemis,"Elemis is a British skincare and wellness brand that specializes in luxury skincare products and treatments. Founded in 1988, it has developed a reputation for using the finest natural ingredients combined with advanced scientific technology to promote health and well-being. Elemis products are known for their aromatherapeutic properties and are widely used in spas and beauty outlets worldwide. The company emphasizes sustainability and ethical practices in sourcing ingredients and creating products.",https://images.unsplash.com/photo-1587017539504-67cfbddac569?w=400&h=300&fit=crop,https://www.elemis.com,United Kingdom,1988,indie,,+44 (0) 207 493 3636,"Elemis Ltd, 1st Floor, 20 St. Thomas St, London, SE1 9RS, United Kingdom",2025-07-18T12:32:10.942225,2025-08-28T14:03:39.715485
cmdef3604ef53ee3b7696fd,Elen Cosmetics,"Elen Cosmetics is a fragrance company that specializes in creating bespoke perfumes and cosmetics. The company prides itself on offering high-quality, artisan scents that often incorporate unique and rare ingredients. Established with the vision to blend art and science, Elen Cosmetics has developed a niche within the fragrance industry, catering to individuals seeking personalized olfactory experiences. Their story reflects a commitment to craftsmanship, sustainability, and a passion for the aromatic arts, making each product a reflection of the individuality of its wearer.",https://images.unsplash.com/photo-1556909114-f6e7ad7d3136?w=400&h=300&fit=crop,,,,niche,,,,2025-07-18T12:32:10.942225,2025-08-28T14:03:45.734587
cmd68c0d539f96a007bd542,Elephant & Tower,"Elephant & Tower is a perfume company known for creating unique and artisanal fragrances that celebrate the art of perfumery. Founded by a group of perfume enthusiasts, the company focuses on blending traditional techniques with contemporary inspirations to craft high-quality scents. They emphasize sustainability and ethical sourcing of ingredients, often collaborating with local artisans to bring their vision to life. Their portfolio includes a range of perfumes that cater to diverse preferences, each telling a distinct story through its composition.",https://images.unsplash.com/photo-15907369626-6c63ac16f3df?w=400&h=300&fit=crop,https://elephantandtower.com,United States,2017,niche,contact@elephantandtower.com,,,2025-07-18T12:32:10.942225,2025-08-28T14:03:51.820393
cmda273462e4f384cb90c88,Elesbé Parfumerie,"Elesbé Parfumerie is an artisan fragrance house known for its unique and complex scent compositions. Founded with a passion for olfactory artistry, the brand focuses on creating niche, high-quality perfumes that evoke emotions and tell stories through their diverse range. Elesbé employs a meticulous approach to crafting each perfume, using rare ingredients and traditional techniques to ensure an exceptional sensory experience. Their commitment to sustainability and ethical sourcing of materials further distinguishes them in the competitive fragrance industry.",https://images.unsplash.com/photo-1556909114-f6e7ad7d3136?w=400&h=300&fit=crop,www.elesbeparfumerie.com,France,2018,niche,info@elesbeparfumerie.com,,"123 Fragrance Lane, Paris, France",2025-07-18T12:32:10.942225,2025-08-28T14:03:58.301456
cmd00b5e9c1caa117434279,Elf Aquitaine,"Elf Aquitaine is a subsidiary of the Elf Group, originally involved in the petroleum industry. However, Elf Aquitaine diversified into various sectors, including cosmetics and perfumery. The company was known for creating fragrances that reflected the elegance and essence of modern life, combining traditional French perfumery techniques with innovative formulations. Their specialty lies in producing perfumes that appeal to a broad audience, often emphasizing unique scent profiles that blend natural ingredients with synthetic ones.",https://images.unsplash.com/photo-1541643600914-78b084683601?w=400&h=300&fit=crop,,France,1985,designer,,,,2025-07-18T12:32:10.942225,2025-08-28T14:04:04.191713
cmd76ac8568d46d34b6a92a,Eli Lilly & Co,"Eli Lilly & Co is a pharmaceutical company primarily focused on developing and manufacturing medications, but it does not have a specialization in the perfume industry. Founded in 1876 by Colonel Eli Lilly, the company has grown to become a global leader in biopharmaceuticals, working on key therapeutic areas including diabetes, oncology, immunology, and neurodegeneration. The company’s work includes significant research and development initiatives to innovate treatments for unmet medical needs.",https://images.unsplash.com/photo-1556909114-f6e7ad7d3136?w=400&h=300&fit=crop,https://www.lilly.com,United States,1876,indie,,,"Lilly Corporate Center, Indianapolis, IN 46285, United States",2025-07-18T12:32:10.942225,2025-08-28T14:04:10.899290
cmd490b0a232cca480dcc92,Elianto,"Elianto is a perfume and cosmetics brand recognized for its vibrant and youthful product offerings. Established in response to the growing beauty and personal care market, Elianto specializes in crafting fragrances and beauty products that appeal to a diverse, modern consumer base. The brand is known for infusing creativity and spontaneity into its fragrances, making them suitable for daily wear or special occasions. With a focus on quality and affordability, Elianto aims to enhance the beauty experience of its customers.",https://images.unsplash.com/photo-1541643600914-78b084683601?w=400&h=300&fit=crop,https://www.elianto.com.my,Malaysia,2004,indie,,,,2025-07-18T12:32:10.942225,2025-08-28T14:04:27.833316
cmdc0c1b13f0a143ab6c4fe,Elida Beauty,"Elida Beauty is a global beauty company that specializes in creating and marketing fragrances, personal care products, and household items. The company focuses on innovative solutions and sustainability within the beauty sector. Its history traces back to a commitment to high-quality ingredients and formulation, ensuring that their products are both effective and enchanting. They are known for their collaborations with various brands and celebrities, deriving inspiration from diverse cultural and aesthetic influences.",https://images.unsplash.com/photo-15907369626-6c63ac16f3df?w=400&h=300&fit=crop,https://www.elidabeauty.com,United States,2021,indie,,,,2025-07-18T12:32:10.942225,2025-08-28T14:04:36.096449
cmd18d9ab27407a584b0e13,Elida Gibbs,,https://images.unsplash.com/photo-1587017539504-67cfbddac569?w=400&h=300&fit=crop,,,,indie,,,,2025-07-18T12:32:10.942225,2025-08-28T14:04:43.209912
cmdee7aaf31accf5052fb28,Elie Saab,"Elie Saab is a renowned luxury fashion brand known for its exquisite craftsmanship and intricate designs. Founded by Lebanese designer Elie Saab in 1982, the brand initially gained prominence for its haute couture collections, which feature opulent fabrics, elaborate embroidery, and elegant silhouettes. In addition to fashion, Elie Saab has successfully expanded into the fragrance market, launching a range of perfumes that embody sophistication and femininity. The fragrances often draw inspiration from the world of haute couture, showcasing the same dedication to artistry and elegance that characterizes the brand's apparel.",https://images.unsplash.com/photo-15907369626-6c63ac16f3df?w=400&h=300&fit=crop,[https://www.eliesaab.com](https://www.eliesaab.com),Lebanon,1982,designer,,,,2025-07-18T12:32:10.942225,2025-08-28T14:04:51.252990
cmda42423b1939b0f67db3a,Elie Tahari,"Elie Tahari is a luxury fashion brand founded by designer Elie Tahari in the late 1970s. Known for its elegant designs and sophisticated aesthetic, the company initially gained recognition for its women's clothing collections. Over time, Elie Tahari expanded its product line to include fragrances, which reflect the brand's ethos of modern elegance and timeless style. The fragrance line embodies the same attention to detail and high-quality materials that characterize the clothing collections, making it a sought-after choice for consumers who appreciate luxury and sophistication.",https://www.elietahari.com/cdn/shop/files/elie_tahari_logo-V2_350x.png?v=1752679697,https://www.elietahari.com,United States,1974,designer,,,,2025-07-18T12:32:10.942225,2025-08-28T14:04:59.009891
cmdee7077023bd3885761ca,Eligia,"Eligia is a niche perfume company renowned for its artisanal approach to fragrance creation. Founded by a team of passionate perfumers, Eligia is dedicated to producing high-quality, unique scents that draw inspiration from various cultures and natural elements. The company prides itself on using sustainable and ethically sourced ingredients, creating a strong connection to the environment and promoting eco-friendly practices in the perfume industry. Their story began with a vision to redefine personal fragrance, allowing individuals to express their identity through signature scents.",https://images.unsplash.com/photo-15907369626-6c63ac16f3df?w=400&h=300&fit=crop,www.eligiafragrances.com,Italy,2015,niche,contact@eligiafragrances.com,,"Via delle Fragranze 10, Florence, Italy",2025-07-18T12:32:10.942225,2025-08-28T14:05:06.220263
cmd99a8afb3eb3d7c90253a,Elio Berhanyer,"Elio Berhanyer is a renowned Spanish fashion designer and perfumer, known for his luxurious fragrances that encapsulate the essence of haute couture. Founded in the mid-20th century, the brand has built a reputation for its unique approach to scent creation, often drawing inspiration from nature and art. Elio Berhanyer's approach to perfume is characterized by a blend of classic elegance and modernity, catering to a discerning clientele. The company also emphasizes handmade processes and the use of high-quality ingredients in their creations, aiming to deliver distinctive and memorable fragrances.",https://www.elioberhanyer.com/wp-content/uploads/2024/02/Logotipo_BERHANYER_240202.svg,https://www.elioberhanyer.com,Spain,1967,niche,,,,2025-07-18T12:32:10.942225,2025-08-28T14:05:14.394451
cmd3a4589c0e4198285d673,Élisire,"Élisire is a niche fragrance house that specializes in crafting unique, artisanal perfumes. Established by the perfumer and entrepreneur, they focus on quality ingredients and artistic expression, creating scents that tell stories and evoke emotions. Élisire is known for its meticulous attention to detail and dedication to olfactory artistry, often collaborating with renowned artists and designers to enhance the sensory experience of their fragrances.",https://elisire.com/cdn/shop/files/banner-elisire-main-premiere_f570a7b7-024e-4de3-94b5-60eadf912629_2000x.jpg?v=1698251491,https://www.elisire.com,France,2013,niche,,,,2025-07-18T12:32:10.942225,2025-08-28T14:05:20.847059
cmdf801a5e3fca658e16697,Elite Model,"Elite Model is a luxury perfume brand that stems from the renowned Elite Model Agency, which is known for its high-profile modeling representation and fashion industry connections. The perfume line focuses on capturing the essence of style and sophistication, offering fragrances that appeal to a discerning clientele. Their offerings often reflect contemporary trends while embracing classic elements, making them a popular choice within the competitive fragrance market.",https://images.unsplash.com/photo-1541643600914-78b084683601?w=400&h=300&fit=crop,,,,designer,,,,2025-07-18T12:32:10.942225,2025-08-28T14:05:26.288278
cmd0d3213f2206658032a46,Elixir Attar,"Elixir Attar is a perfume company specializing in high-quality attars and concentrated fragrances derived from natural ingredients. The company focuses on traditional perfume-making techniques, blending natural oils and essences to create unique and rich scents. Founded by passionate perfumers, Elixir Attar emphasizes authenticity, sustainability, and the art of perfumery, catering to customers who appreciate artisanal and bespoke fragrances.",https://elixirattar.com/cdn/shop/files/367527C9-D2FF-4C07-96B5-5F5D9206CAD8_130x.jpg?v=1642096559,http://www.elixirattar.com,United Arab Emirates,,niche,,,,2025-07-18T12:32:10.942225,2025-08-28T14:05:33.881537
cmd8ccb3b7ee1bbea4256fd,Elizabeth and James,"Elizabeth and James is a contemporary lifestyle brand founded by Mary-Kate and Ashley Olsen. The brand initially gained fame for its fashion offerings but later expanded into fragrances, embodying a unique blend of sophistication and a laid-back aesthetic. Their fragrances are known for being playful yet elegant, often drawing inspiration from different aspects of their lives. The brand aims to provide products that resonate with a youthful yet stylish market, making it appealing to a broad audience.",https://images.unsplash.com/photo-15907369626-6c63ac16f3df?w=400&h=300&fit=crop,https://www.elizabethandjames.com,United States,2007,designer,,,,2025-07-18T12:32:10.942225,2025-08-28T14:05:50.645218
cmd3473bc5d76c19ec44984,Elizabeth Arden Inc,"Elizabeth Arden Inc. is a renowned cosmetic, skincare, and fragrance company, established by Elizabeth Arden in the early 20th century. The brand focuses on beauty, empowerment, and the holistic approach to skincare and fragrance. They are known for their innovative formulations and luxurious products that cater to a diverse customer base. Their perfume lines are celebrated for iconic scents that reflect sophistication and elegance, such as Red Door and 5th Avenue.",https://www.elizabetharden.com/cdn/shop/files/Elizabeth_Arden_Logo_2025.svg?v=1737047469&width=230,www.elizabetharden.com,United States,1910,designer,,+1 800-326-7337,"110 E 59th St, New York, NY 10022, United States",2025-07-18T12:32:10.942225,2025-08-28T14:05:57.826749
cmdffa0d23485257cc7f7b8,Elizabeth Arden,"Elizabeth Arden is a premier American cosmetics, skincare, and fragrance company, founded by the legendary beauty entrepreneur Elsie Rodriguez Arden. Established in 1910, the company quickly made a name for itself with its innovative formulations and luxurious products. Elizabeth Arden has a rich history in the beauty industry, being one of the first to introduce the concept of a ""spa"", and known for pioneering the notion of makeup as a part of the beauty regime. The company specializes in skincare treatments, makeup, and a wide range of fragrances, appealing to a diverse base of customers globally. Signature fragrances like ""Red Door"" and ""Fifth Avenue"" exemplify the brand's commitment to elegance and sophistication.",https://www.elizabetharden.com/cdn/shop/files/Elizabeth_Arden_Logo_2025.svg?v=1737047469&width=230,https://www.elizabetharden.com,United States,1910,designer,,,"100 Park Avenue, New York, NY 10017, USA",2025-07-18T12:32:10.942225,2025-08-28T14:06:05.000967
cmdbcb44a11f2c2775c4064,Elizabeth Taylor,"Elizabeth Taylor was a renowned actress who ventured into the world of fragrances, launching her first perfume, White Diamonds, in 1991. The brand is heavily tied to her legacy and personal image, focusing on luxurious and glamorous scents. The perfumes are characterized by their rich notes, often inspired by Elizabeth's own preferences, embodying sophistication and elegance. The line has enjoyed significant commercial success, appealing to a wide demographic, especially fans of the actress and consumers seeking high-quality celebrity fragrances.",https://api.elizabethtaylor.com/wp-content/uploads/2021/04/w1921-1.jpg,https://www.elizabethtaylorfragrances.com,United States,1991,celebrity,,,,2025-07-18T12:32:10.942225,2025-08-28T14:06:12.327080
cmd51fd3c6ca64b16dd799a,Elizabeth W,"Elizabeth W is a perfume company known for its artisanal fragrances and commitment to quality ingredients. Founded by Elizabeth Wright, the brand emphasizes a blend of traditional perfume-making techniques and contemporary artistry. With a focus on creating unique, handcrafted scents, Elizabeth W aims to provide a personalized fragrance experience. The company also emphasizes the use of natural and sustainable materials, reflecting a growing trend towards eco-consciousness in the fragrance industry.",https://www.elizabethw.com/cdn/shop/files/logo_939e94f5-775a-4c1a-ab5d-f3c4d7d701bf_2000x.gif?v=1614306830,https://www.elizabethw.com,United States,2005,indie,,,"2015 9th St, Suite 2, Boulder, CO 80302, United States",2025-07-18T12:32:10.942225,2025-08-28T14:06:18.881371
cmd0d76226273221064dd40,Ella K Parfums,"Ella K Parfums is a niche perfume house founded by the entrepreneur and fragrance creator, Ella K. The company specializes in creating artisanal fragrances that blend traditional perfumery techniques with contemporary design and storytelling. The scents are inspired by various cultural elements and personal experiences, resulting in a unique olfactory experience that resonates with fragrance connoisseurs. Ella K Parfums emphasizes authenticity, quality ingredients, and craftsmanship, catering to a discerning clientele who seek distinctive scents that tell a story.",https://www.ellakparfums.com/cdn/shop/files/Discoverset_1_999fa97a-3d20-44cb-b2de-ee5e65e46d97.jpg?v=1681285014&width=625,https://ellakparfums.com,France,2017,niche,,,,2025-07-18T12:32:10.942225,2025-08-28T14:06:26.623564
cmd7eecd8fbd40ad8674fa3,Ella Mikao,"Ella Mikao is a niche perfume company known for its unique and artisanal fragrance creations that blend contemporary and traditional scent profiles. The brand was founded by a group of fragrance enthusiasts who aim to craft high-quality, small-batch perfumes that resonate with individuality and personal expression. Ella Mikao specializes in using natural ingredients, focusing on sustainability and ethical sourcing to create luxurious scents that cater to discerning clientele who appreciate the artistry behind perfumery.",https://images.unsplash.com/photo-1587017539504-67cfbddac569?w=400&h=300&fit=crop,www.ellamikao.com,United States,2018,niche,contact@ellamikao.com,,,2025-07-18T12:32:10.942225,2025-08-28T14:06:33.270781
cmdef793d181d55e675b660,Ella,"Ella is a contemporary perfume company that specializes in creating unique, lasting fragrances designed to evoke emotion and personal expression. Founded by a team of fragrance enthusiasts, Ella's story began with a passion for artistry in scent, focusing on the balance between tradition and modernity in perfume design. The company prides itself on using high-quality ingredients to craft bold and original scents that appeal to a diverse audience. Their specialty lies in offering distinct olfactory experiences that aim to resonate deeply with users.",https://images.unsplash.com/photo-15907369626-6c63ac16f3df?w=400&h=300&fit=crop,www.ellaperfumes.com,United States,2018,indie,,,,2025-07-18T12:32:10.942225,2025-08-28T14:06:40.423529
cmd55c7150beb44ac1d303f,Elle Basic,"Elle Basic is a fragrance company that focuses on delivering high-quality, uncomplicated perfumes that cater to a wide audience. Established with the vision of making luxury accessible, the company prides itself on simplicity in fragrance design and selection. Elle Basic specializes in creating versatile scents suitable for everyday wear, emphasizing fresh and clean notes that reflect a modern lifestyle.",https://images.unsplash.com/photo-1587017539504-67cfbddac569?w=400&h=300&fit=crop,www.ellebasic.com,United States,2018,indie,info@ellebasic.com,,,2025-07-18T12:32:10.942225,2025-08-28T14:06:46.194218
cmd9699b0db601ae0d61a71,Elle,"Elle is a renowned perfume brand that is associated with the Elle magazine, known for its focus on fashion and lifestyle. The brand's fragrance line captures the essence of modern femininity, celebrating elegance and sophistication while catering to a diverse consumer base. Through its perfumes, Elle offers scents that reflect the latest trends and appeal to a younger audience, positioning itself effectively in the competitive fragrance market.",https://www.elle.com/_assets/design-tokens/elle/static/images/logos/logo.2856426.svg?primary=navLogoColor,https://www.elle.com,France,,designer,,,,2025-07-18T12:32:10.942225,2025-08-28T14:06:52.564479
