id,name,description,image,website,country,founded,type,email,phone,address,createdAt,updatedAt
cmd8ca94d99144a50b2f4bc,Eau de Space,"Eau de Space is a unique perfume company that specializes in creating fragrances inspired by the scent of outer space. Launched as a creative endeavor by a team of scientists and perfumers, the brand aimed to bring the unique olfactory experience of space exploration to the terrestrial realm. The concept emerged as part of a NASA initiative to capture the essence of what astronauts have described as the scent of space. Eau de Space's product line focuses on offering an innovative and out-of-this-world fragrance experience that appeals to both perfume aficionados and science enthusiasts alike.",https://eaudespace.com/cdn/shop/files/Eau_de_Space_Logo_Small_x60.png?v=1614313806,www.eaudespace.com,United States,2020,indie,,,,2025-07-18T12:32:10.942225,2025-08-28T13:58:57.984624
cmd3baf48ef3d2874d48c34,Eau d'Italie,"Eau d'Italie is a niche perfume house that captures the essence of the Italian landscape and culture through its fragrances. The company was founded in 2004 and draws inspiration from the natural beauty and rich history of Italy, crafting scents that evoke memories and experiences. Their specialty lies in creating unique, artisanal perfumes that reflect the charm of Italian life, often using high-quality ingredients and traditional techniques. Eau d'Italie has built a reputation for its dedication to craftsmanship and storytelling through scent, offering a range of perfumes that appeal to discerning customers looking for something beyond mainstream offerings.",https://eauditalie.com/cdn/shop/files/logo_black_110x.png?v=1656272607,https://www.eauditalie.com,Italy,2004,niche,,,,2025-07-18T12:32:10.942225,2025-08-28T13:59:06.058912
cmd5b8e90220d982ec863f2,Eau Jeune,"Eau Jeune is a French perfume company that specializes in creating youthful and vibrant fragrances. Established in the late 1980s, the brand aims to provide affordable, trendy perfumes targeting a younger audience. Their offerings are known for being energetic and playful, often packaged in bright, eye-catching designs that reflect the spirit of youth. Eau Jeune emphasizes creativity in its scent compositions, often drawing inspiration from pop culture and contemporary themes.",https://images.unsplash.com/photo-1541643600914-78b084683601?w=400&h=300&fit=crop,https://eaujeune.com,France,1989,drugstore,,,,2025-07-18T12:32:10.942225,2025-08-28T13:59:12.613187
cmd4d4694ea6396455b41cb,EAU.MG,"EAU.MG is a contemporary perfume company that specializes in creating high-quality, unique fragrances, often with a focus on sustainable and eco-friendly practices. The brand emphasizes a minimalist aesthetic and aims to offer a personalized scent experience. EAU.MG believes in the art of perfumery and often collaborates with artisans to craft their scents, ensuring attention to detail and originality.",https://images.unsplash.com/photo-1587017539504-67cfbddac569?w=400&h=300&fit=crop,https://eau.mg,United States,2020,indie,,,,2025-07-18T12:32:10.942225,2025-08-28T13:59:18.713508
cmd7e61b53ae5056d9f97fb,Eauk,"Eauk is a luxury fragrance brand that emphasizes a unique, artistic approach to perfumery. Founded on the philosophy of celebrating the beauty in individuality, Eauk's creations often feature bold and unconventional scent profiles, drawing inspiration from nature and personal experiences. Their story began with a deep passion for scent and a commitment to sustainability, with a focus on using high-quality, ethically-sourced ingredients. The company aims to craft fragrances that not only smell exquisite but also evoke emotions and memories.",https://images.unsplash.com/photo-1582735689369-4fe89db7114c?w=400&h=300&fit=crop,https://www.eauk.com,United Kingdom,2016,niche,contact@eauk.com,,,2025-07-18T12:32:10.942225,2025-08-28T13:59:25.745633
cmd84d2a146cc05b20a9249,Ebba,"Ebba is a modern perfume company that specializes in creating unique and artistic fragrances inspired by personal stories and emotions. Founded by a team of passionate perfumers and fragrance enthusiasts, Ebba aims to bridge the gap between traditional perfumery and contemporary scent experiences. The company emphasizes individuality and self-expression through their carefully crafted scents, often utilizing sustainable and ethically sourced ingredients. Their approach combines innovation with artisanal techniques, catering to a growing audience seeking niche and distinctive fragrances.",https://images.unsplash.com/photo-1582735689369-4fe89db7114c?w=400&h=300&fit=crop,[www.ebba.com](http://www.ebba.com),United States,2015,niche,,,,2025-07-18T12:32:10.942225,2025-08-28T13:59:33.747842
cmdb70eb21c02da165f910b,Eclectic Collections,"Eclectic Collections is a niche perfume company known for creating artisanal fragrances that blend unique ingredients and storytelling. Founded by a passionate group of fragrance artisans, the brand aims to celebrate individuality and diversity through scent, producing limited-edition and elevated perfumes that reflect a broad spectrum of influences and cultures. Their offerings are characterized by creative compositions and a focus on high-quality ingredients, often inspired by various artistic and cultural themes.",https://static.hugedomains.com/images/hdv3-img/hd-header-logo-v3.svg,https://www.eclecticcollections.com,United States,2018,niche,contact@eclecticcollections.com,,"1234 Fragrance Lane, Scent City, CA 90210, USA",2025-07-18T12:32:10.942225,2025-08-28T13:59:41.156992
cmd35b28cdd5f4beba031fc,Ed Hardy,"Ed Hardy is a fragrance brand that emerged from the iconic designs of tattoo artist Don Ed Hardy. The brand epitomizes a fusion of art and fashion, specializing in perfumes that reflect edgy and vibrant aesthetics inspired by Hardy's tattoo artwork. Originally gaining popularity in the early 2000s, Ed Hardy perfumes complement a lifestyle brand that encompasses clothing, accessories, and other merchandise. The brand appeals primarily to a youthful demographic and is known for its bold scents and innovative packaging that mirror its artistic roots.",https://images.unsplash.com/photo-15907369626-6c63ac16f3df?w=400&h=300&fit=crop,https://www.edhardyfragrance.com,United States,2004,designer,,,,2025-07-18T12:32:10.942225,2025-08-28T13:59:47.552976
cmdb5ef492608b448738d2e,Eddie Bauer,"Eddie Bauer is an American outdoor apparel and equipment company known for its high-quality clothing and gear, especially designed for outdoor enthusiasts. Founded by Eddie Bauer in 1920, the company originally focused on sportswear with an emphasis on outdoor activities like hiking, camping, and skiing. Over the years, it has expanded its offerings to include home products and fragrances. Eddie Bauer's specialty includes blending classic American style with functionality, catering to those who appreciate both style and durability in their outdoor apparel and lifestyle products, including a range of perfumes.",https://images.unsplash.com/photo-1587017539504-67cfbddac569?w=400&h=300&fit=crop,https://www.eddiebauer.com,United States,1920,designer,,,,2025-07-18T12:32:10.942225,2025-08-28T13:59:55.237672
cmd7b73c18c2b1b79b68262,Eddy Ford Beverly Hills,"Eddy Ford Beverly Hills is a luxury fragrance brand known for its unique and high-quality perfumes that capture the essence of sophistication and elegance. The company emphasizes craftsmanship, selecting the finest ingredients to create distinct and memorable scents. Founded in the upscale neighborhood of Beverly Hills, the brand's story revolves around blending modern luxury with classic inspirations to craft a fragrance experience that appeals to both men and women. Their specialty lies in offering a diverse range of perfumes that cater to various preferences and occasions, distinguished by their distinctive branding and upscale packaging.",https://images.unsplash.com/photo-1582735689369-4fe89db7114c?w=400&h=300&fit=crop,http://eddyford.com,United States,2017,niche,,,,2025-07-18T12:32:10.942225,2025-08-28T14:00:01.694693
cmd3aa90dd316623b1b9f1b,Eden Classics,"Eden Classics is a fragrance company that specializes in creating a wide range of affordable perfumes for both men and women. The brand focuses on delivering high-quality scents inspired by luxury designer perfumes, offering consumers an accessible alternative. Established with the commitment to making captivating fragrances widely available, Eden Classics has gained popularity for its diverse offerings which cater to various preferences and occasions.",https://images.unsplash.com/photo-1556909114-f6e7ad7d3136?w=400&h=300&fit=crop,,,,drugstore,,,,2025-07-18T12:32:10.942225,2025-08-28T14:00:07.715781
cmdb006cb0acf2c0b11501d,Eden Parfums,,https://eden.carlfeilner.com/wp-content/uploads/sites/10/2022/05/Eden-Parfums-Logo.svg,https://edenparfums.com,United Kingdom,2016,indie,support@edenparfums.com,,,2025-07-18T12:32:10.942225,2025-08-28T14:00:17.682435
cmde679b39cdc1e989f4cec,Eden Park,"Eden Park is a French brand that combines elegance and casual style, primarily known for its men's fashion line, including fragrances. The brand was inspired by the rugby culture, particularly from the famous rugby stadium in New Zealand. Founded in 1987 by Olivier and Franck Mesnel, Eden Park aims to capture a spirit of sophistication influenced by the sports and lifestyle of rugby enthusiasts. Their fragrance line reflects the same principles of style and modernity, appealing to individuals who appreciate refined yet contemporary scents.",https://www.eden-park.com/cdn/shop/files/logo.svg?v=1742891292&width=600,https://www.eden-park.fr/,France,1987,designer,,,,2025-07-18T12:32:10.942225,2025-08-28T14:00:27.875165
cmded170947f8790cdc71d6,Eden Project,"Eden Project is a renowned ecological park located in Cornwall, England, dedicated to educating the public about plants and sustainability. While primarily known for its stunning biodomes housing a variety of global ecosystems, the Eden Project has also ventured into the perfume industry. They create fragrances inspired by the natural environment, emphasizing botanical ingredients and sustainable practices. Their story is rooted in environmental consciousness, and their specialty lies in creating unique aromas that reflect the biodiversity of the plants showcased in the project.",https://www.edenproject.com/sites/default/files/files/domain-logos/EdenProjectNaturalWhite_0_3.svg,https://www.edenproject.com,United Kingdom,2001,indie,,,"Bodelva, Par, Cornwall PL24 2SG, United Kingdom",2025-07-18T12:32:10.942225,2025-08-28T14:00:35.220750
cmd8c8959cacfd85ba0b06b,Edenbridge,"Edenbridge is a niche perfume company known for its artisanal approach to fragrance creation. The brand focuses on crafting unique, high-quality scents that evoke emotional experiences and connections with their users. With a dedication to using natural ingredients and bespoke formulations, Edenbridge has cultivated a reputation for its luxurious and sophisticated offerings in a competitive market. The company prides itself on its refined aesthetics and storytelling in each fragrance, celebrating the art of perfumery through innovative designs and concepts.",https://images.unsplash.com/photo-15907369626-6c63ac16f3df?w=400&h=300&fit=crop,www.edenbridgefragrances.com,United Kingdom,2015,niche,,,,2025-07-18T12:32:10.942225,2025-08-28T14:00:42.180710
cmdd59d9d9ec4fd99e93b91,EDENISTE PARFUMS,"EDENISTE PARFUMS is a niche fragrance house dedicated to creating unique and luxurious perfumes inspired by the natural world. Founded by a team of artisans, the company focuses on craftsmanship and sustainability, using ethically sourced ingredients to create sophisticated scents that evoke a sense of nature and elegance. Their offerings cater to an audience that values quality and artistry in perfumery.",https://images.unsplash.com/photo-15907369626-6c63ac16f3df?w=400&h=300&fit=crop,https://edenisteparfums.com,France,2020,niche,contact@edenisteparfums.com,,,2025-07-18T12:32:10.942225,2025-08-28T14:00:47.624831
cmd8f3bd26047a04e8e914e,Edeniste,"Edeniste is a luxury French fragrance brand that specializes in creating artisanal perfumes using natural ingredients. The company focuses on blending contemporary scent design with the philosophy of wellness and skin benefits, creating fragrances that are not only aromatic but also boost the mood and promote well-being. Founded by the passionate perfumer Rami Mekdachi, Edeniste places an emphasis on the art of perfumery while maintaining a commitment to sustainability and eco-friendly practices. Their philosophy revolves around enhancing personal identity through unique scents that evoke emotions and memories.",https://www.edeniste.com/cdn/shop/files/Untitled_design_4_copy_200x.png?v=1648750420,https://edeniste.com,France,2018,niche,,,,2025-07-18T12:32:10.942225,2025-08-28T14:00:54.511772
cmd6d2cec39bb8e4ee26b23,Edge Beauty,"Edge Beauty is a fragrance company that specializes in creating, developing, and distributing affordable, high-quality perfumes for both consumers and retailers. Established to meet the growing demand for innovative scents in the beauty industry, Edge Beauty has built a reputation for its trendy and accessible fragrances, often collaborating with renowned designers and celebrities to create unique and appealing products. The company’s ethos focuses on delivering value through creativity and market responsiveness, providing a broad range of fragrances that cater to diverse consumer preferences.",https://scentbeauty.com/cdn/shop/files/SB-logo-withouttag-black_4295bf48-dc0e-4226-817a-1ff868576a37.png?v=1674579818&width=500,http://www.edgebeauty.com,United States,2010,drugstore,,,,2025-07-18T12:32:10.942225,2025-08-28T14:01:02.307050
cmd0d0e02727b3f7bf7deaf,Edition Perfumes,"Edition Perfumes is a luxury fragrance house that specializes in creating niche perfumes characterized by their high-quality ingredients and artisanal craftsmanship. The company tells a story of passion for perfumery, often drawing inspiration from unique concepts and artistic expressions. They focus on limited edition releases, allowing for a distinctive, exclusive appeal in the competitive perfume market.",https://images.unsplash.com/photo-1541643600914-78b084683601?w=400&h=300&fit=crop,https://www.editionperfumes.com,United States,2015,niche,,,,2025-07-18T12:32:10.942225,2025-08-28T14:01:09.343047
cmd5893d21ac4cb6b69cdf9,Editions de Parfums Frederic Malle,,https://images.unsplash.com/photo-1541643600914-78b084683601?w=400&h=300&fit=crop,https://www.fredericmalle.com,France,2000,niche,,,,2025-07-18T12:32:10.942225,2025-08-28T14:01:16.440606
cmd1d98f6a0868369362c7c,Éditions M.R,"Éditions M.R is a niche perfume house that specializes in creating unique and artisanal fragrances that reflect a blend of traditional craftsmanship and innovative scent compositions. Founded by a duo with backgrounds in fashion and art, the brand emphasizes the storytelling aspect of its scents, often inspired by literature, travel, and personal experiences. Their offerings range from audacious to subtle notes, and they focus on high-quality ingredients and limited-edition releases, making their perfumes desirable collectors’ items.",https://editionsmr.com/wp-content/plugins/revslider/sr6/assets/assets/dummy.png,https://editionsmr.com/,France,2016,niche,,,,2025-07-18T12:32:10.942225,2025-08-28T14:01:23.488679
cmd37c775ba69978b7dff6d,EDO PYPSH,"EDO PYPSH is a niche perfume company that specializes in creating unique and innovative fragrances. It is known for its artistic approach to scent creation, blending various natural and synthetic ingredients to produce distinctive olfactory experiences. The company emphasizes the story behind each fragrance, often drawing inspiration from cultural themes, art, and personal journeys, thereby offering customers a more personal connection to their products.",https://images.unsplash.com/photo-1556909114-f6e7ad7d3136?w=400&h=300&fit=crop,,,,niche,,,,2025-07-18T12:32:10.942225,2025-08-28T14:01:29.437063
cmd448e74482f9389eda12e,Edward Bess,"Edward Bess is an American luxury perfume and cosmetics brand founded by Edward Bess himself. Known for its sophisticated and elegant fragrances, the brand emphasizes quality ingredients and artisanal craftsmanship. It aims to embody timeless beauty and is recognized for its minimalist aesthetic. Edward Bess first gained attention in the beauty industry with its makeup line and later expanded into fragrance, gaining a reputation for its unique and alluring scents that appeal to a discerning clientele.",https://www.edwardbess.com/cdn/shop/t/99/assets/ico-bag.svg?v=2633928659138565971599870048,http://edwardbess.com,United States,2006,niche,,,,2025-07-18T12:32:10.942225,2025-08-28T14:01:36.296803
cmd941367abf8a195dab6ff,Edwige Fenech,"Edwige Fenech is a French perfume brand renowned for its unique and artistic fragrances that blend traditional and contemporary olfactory elements. The company draws inspiration from the historical and cultural heritage of France, crafting scents that evoke emotions and memories. Edwige Fenech is dedicated to quality and artistry, producing limited edition perfumes that cater to a niche market of fragrance enthusiasts. The brand's story is steeped in elegance and a passion for perfumery, establishing itself as a respected name in the niche segment of the perfume industry.",https://images.unsplash.com/photo-15907369626-6c63ac16f3df?w=400&h=300&fit=crop,,France,2020,niche,,,,2025-07-18T12:32:10.942225,2025-08-28T14:01:43.069918
cmdc4b21d8be556617bb286,Edwin Jagger,"Edwin Jagger is a British company dedicated to producing high-quality grooming products, including shaving supplies, skincare, and fragrances. Established in 1988, Edwin Jagger specializes in traditional wet shaving items and is renowned for its craftsmanship, particularly in creating elegant safety razors and a range of fine grooming accessories. The brand emphasizes sustainability and the use of natural ingredients in its products, appealing to both classic and modern consumers.",https://www.edwinjagger.com/wp-content/uploads/2022/09/Edwin-Jagger-Sheffield-England-logo.webp,https://www.edwinjagger.com,United Kingdom,1988,indie,,,,2025-07-18T12:32:10.942225,2025-08-28T14:01:51.852674
cmd58eb589b5e8ab0528cab,Effrontè et Evocateur,"Effrontè et Evocateur is a niche perfume house that specializes in crafting unique and artistic fragrances. Founded by a group of passionate perfumers, the brand emphasizes the evocative power of scent, drawing inspiration from art, literature, and personal experiences. Their collections often feature intricate compositions, with an aim to challenge conventional olfactory norms and engage the wearer in a sensory narrative. The company is known for its commitment to high-quality ingredients and artisan methods, producing limited edition perfumes that appeal to fragrance enthusiasts and collectors.",https://images.unsplash.com/photo-1582735689369-4fe89db7114c?w=400&h=300&fit=crop,https://www.effronteevocateur.com,France,2018,niche,contact@effronteevocateur.com,,"45 Rue des Petits Champs, 75001 Paris, France",2025-07-18T12:32:10.942225,2025-08-28T14:01:58.997951
cmdcf4ab2fa90025ad600e8,Eglė Jonaitytė Botanical Perfumes,"Eglė Jonaitytė Botanical Perfumes specializes in creating handcrafted, natural perfumes using botanical ingredients. The founder, Eglė Jonaitytė, is passionate about developing unique scent profiles that evoke emotions and memories while being environmentally friendly and sustainable. The brand emphasizes the use of organic and locally sourced materials, aiming to promote both individuality and a connection to nature in their fragrance offerings.",https://images.unsplash.com/photo-15907369626-6c63ac16f3df?w=400&h=300&fit=crop,https://www.eglėjonaitytė.com/,Lithuania,2018,indie,,,,2025-07-18T12:32:10.942225,2025-08-28T14:02:05.529666
cmda897627d437e95441f2d,Ego Facto,"Ego Facto is a niche perfume house known for its unique approach to fragrance creation, blending art and olfactory experience. Founded by a team of passionate perfumers and creatives, Ego Facto seeks to push the boundaries of traditional perfumery by focusing on storytelling and the emotions that scents can evoke. Their collections are often inspired by personal narratives and experiences, leading to compositions that are both artistic and evocative. The brand emphasizes quality, craftsmanship, and a bespoke sensibility, establishing a distinctive identity in the competitive perfume market.","https://static.wixstatic.com/media/1be55c_5f5cf8a69eb84d2cb246fed3d6ec089e~mv2.jpg/v1/fill/w_488,h_488,al_c,q_80,usm_0.66_1.00_0.01,enc_avif,quality_auto/Egofacto%20pyramide.jpg",https://www.egofacto.com,France,2015,niche,contact@egofacto.com,,,2025-07-18T12:32:10.942225,2025-08-28T14:02:13.124256
cmd4d8501515f033d317b2a,Egon von Furstenberg,"Egon von Furstenberg is a niche perfume company known for its unique and artistic fragrance creations. Founded by the designer and perfumer Egon von Furstenberg, the brand combines elements of art, culture, and personal expression in its scent offerings. The company emphasizes high-quality ingredients and craftsmanship, often drawing inspiration from nature and historical references in the development of its fragrances.",http://www.egonvonfurstenberg.com/wp-content/uploads/2019/03/logo_sito.png,http://www.egonvonfurstenberg.com,France,1980,niche,,,,2025-07-18T12:32:10.942225,2025-08-28T14:02:19.658782
cmd66d2737854b710f78d3a,EHP,"EHP, short for Essence House Productions, is a niche fragrance company specializing in crafting high-quality, artisanal perfumes. The company was founded on the principle of creating unique scent experiences that capture the essence of nature and various cultural inspirations. Their commitment to using sustainable ingredients and traditional production methods sets them apart in the perfume industry. EHP has built a loyal customer base by offering limited-edition fragrances that are thoughtfully designed and meticulously crafted, embodying both artistry and innovation.",https://images.unsplash.com/photo-1587017539504-67cfbddac569?w=400&h=300&fit=crop,https://www.ehpfragrances.com,United States,2018,niche,info@ehpfragrances.com,,,2025-07-18T12:32:10.942225,2025-08-28T14:02:26.153199
cmd7a58d80c90b2bcd3d92e,EI Solutions,"EI Solutions is a perfume company specializing in the development of customized fragrances for individuals and businesses. With a focus on providing unique and high-quality scents, the company aims to blend traditional perfumery techniques with modern technology. They cater to a diverse range of clients, offering personalized scent creation, branding solutions for beauty and lifestyle products, and a commitment to sustainability in their ingredient sourcing and packaging.",https://images.unsplash.com/photo-1556909114-f6e7ad7d3136?w=400&h=300&fit=crop,,,,indie,,,,2025-07-18T12:32:10.942225,2025-08-28T14:02:31.912099
cmdde0cc86ca56a9251f4eb,Eight & Bob,"Eight & Bob is a luxury perfume company known for its exclusive fragrances, which have historical ties to the 1930s. The brand was founded by a young French aristocrat, Albert Fouquet, who created distinct and refined scents that gained popularity among elite social circles. The story goes that the company was inspired by a chance meeting with John F. Kennedy, who requested a sample of the fragrance during a trip to Paris. Eight & Bob specializes in niche perfumes, offering limited production batches and unique scents that evoke a sense of sophistication and elegance.",https://eightandbob.com/cdn/shop/files/logo_EB_horizontal.png?v=1747752062&width=1000,https://www.eightandbob.com,France,1937,niche,,,,2025-07-18T12:32:10.942225,2025-08-28T14:02:39.729379
cmda04aa88e85efb1647355,Ein Gedi,"Ein Gedi is a fragrance and skincare company that draws inspiration from the biblical region of Ein Gedi in Israel. The company focuses on creating high-quality perfumes and skincare products that incorporate natural ingredients, with a unique emphasis on the beauty and biodiversity of the region. Their story is deeply rooted in the tradition of aromatic plants found in the Holy Land, and they aim to combine ancient knowledge with modern perfumery techniques to produce distinctive scents that evoke the essence of the landscape.",https://www.eingedi.com/logo/logonew.png,https://www.eingedi.com,Israel,1980,niche,,,,2025-07-18T12:32:10.942225,2025-08-28T14:02:46.731050
cmd6c273aa012e3e4055cda,Eisenberg & Sons,"Eisenberg & Sons is a luxury perfume house known for its high-quality fragrances, which blend artistic creativity with sophisticated craftsmanship. Founded by Joseph Eisenberg, the company emphasizes the use of premium ingredients and unique scent compositions, reflecting the brand's commitment to elegance and exclusivity. The company not only produces fragrances but also emphasizes a holistic approach to beauty, which includes skincare and cosmetics, establishing itself as a multifaceted entity in the luxury cosmetic market.",https://eisenberg.com/cdn/shop/files/1200px-VOGUE_revista_-_logo_300x.png?v=1669062507,https://www.eisenberg.com,France,2000,niche,,,,2025-07-18T12:32:10.942225,2025-08-28T14:02:53.458810
