id,name,description,image,website,country,founded,type,email,phone,address,createdAt,updatedAt
cmd8825c15c874516837ef2,Duran Duran,"Duran Duran is a renowned British band known for their new wave and synth-pop music, which gained immense popularity during the 1980s. As part of their brand expansion, they ventured into the perfume industry, creating signature fragrances that encapsulate the essence of their music and style. The perfumes are aimed at fans and appeal to a luxury market while reflecting the band's artistic identity and innovative spirit.",https://images.unsplash.com/photo-1587017539504-67cfbddac569?w=400&h=300&fit=crop,,United Kingdom,1978,celebrity,,,,2025-07-18T12:32:10.942225,2025-08-28T13:54:28.422204
cmd1d1da64829185d4bdffa,Durance de Provence,"Durance de Provence is a French company specializing in the creation of high-quality home fragrance and personal care products. Established in 1997, they are known for using natural ingredients and traditional craftsmanship. Their offerings include scented candles, diffusers, and body care products, often inspired by the scents of Provence, which reflect the essence of the region's rich heritage and culture. Durance de Provence takes pride in its commitment to creating eco-friendly products with an emphasis on authenticity and tradition.",https://www.durance.com/images/logo.png,https://www.durance.com,France,1997,indie,,,,2025-07-18T12:32:10.942225,2025-08-28T13:54:35.187115
cmd4337dc4a3fdd38a739d2,Durer,"Durer is an innovative perfume company specializing in artisanal, high-quality fragrances. Founded by a team of passionate perfumers, the company aims to create unique scents that evoke emotions and tell stories through fragrant artistry. Durer focuses on using natural and sustainable ingredients, often drawing inspiration from nature and traditional perfumery techniques. Their portfolio includes a range of fragrances that cater to both men and women, with an emphasis on exclusivity and craftsmanship.",https://images.unsplash.com/photo-1556909114-f6e7ad7d3136?w=400&h=300&fit=crop,www.durerparfums.com,France,2015,niche,contact@durerparfums.com,,,2025-07-18T12:32:10.942225,2025-08-28T13:54:41.965750
cmd539d0510f351855d634c,Dutal,"Dutal is a boutique perfume company known for its artisanal approach to fragrance creation. Established with a passion for olfactory art, Dutal specializes in crafting unique, high-quality scents that blend traditional perfumery techniques with modern sensibilities. The company prides itself on using a select range of natural ingredients, aiming to evoke emotions and memories through the power of scent. Their story is rooted in a commitment to quality and creativity, focusing on limited edition releases that appeal to niche fragrance enthusiasts.",https://images.unsplash.com/photo-15907369626-6c63ac16f3df?w=400&h=300&fit=crop,www.dutalperfumes.com,United States,2015,niche,contact@dutalperfumes.com,,"123 Fragrance Lane, Scent City, CA 90001",2025-07-18T12:32:10.942225,2025-08-28T13:54:49.084188
cmd100eab3c75993051378f,Duty Free Cosmetics,"Duty Free Cosmetics is a retailer specializing in the sale of cosmetic and fragrance products within the duty-free sector. The company aims to provide travelers with access to high-quality beauty products at competitive prices, taking advantage of the duty-free shopping experience primarily located in airports and other border locations. They focus on a wide range of renowned perfume brands, catering to both luxury and everyday consumers while delivering an exceptional shopping experience characterized by service and accessibility.",https://images.unsplash.com/photo-1587017539504-67cfbddac569?w=400&h=300&fit=crop,,,,indie,,,,2025-07-18T12:32:10.942225,2025-08-28T13:54:55.253444
cmd34e7617fbd08643c4a79,DuWop,"DuWop is a cosmetics company that specializes in innovative makeup and fragrance solutions. Founded in 1999, the brand gained popularity for its unique approach to beauty products which often blend unconventional concepts with effective results. DuWop is best known for its lip treatments and signature perfumes that cater to a diverse audience looking for distinguishable and high-quality beauty solutions. The company focuses on creating products that enhance individual beauty rather than conforming to trends.",https://images.unsplash.com/photo-15907369626-6c63ac16f3df?w=400&h=300&fit=crop,www.duwop.com,United States,1999,indie,,,,2025-07-18T12:32:10.942225,2025-08-28T13:55:03.542710
cmd495738439744c7e7bb73,DW Home,"DW Home is a lifestyle brand that specializes in creating a variety of home fragrance products, including scented candles, diffusers, and room sprays. Founded in 1996, the company has built a reputation for crafting high-quality, artisanal fragrances that enhance the atmosphere of any space. Their products are often characterized by unique scent combinations and elegant packaging, making them popular choices for both personal use and gifting. DW Home emphasizes the use of natural ingredients and eco-friendly practices in their manufacturing processes, contributing to their appeal in the home fragrance market.",https://www.dwhome.com/cdn/shop/files/DW_FalLCeramics_Desktop_Aug25.gif?crop=center&v=1755899822&width=2560,https://www.dwhome.com,United States,1996,indie,,,,2025-07-18T12:32:10.942225,2025-08-28T13:55:13.002873
cmd6b6d14f92f1df9158485,Dwell212,"Dwell212 is a perfume company known for its innovative and artistically crafted fragrances that reflect the essence of modern living. The brand emphasizes creating scents that evoke emotions and memories, often utilizing high-quality ingredients sourced from around the world. Dwell212 aims to cater to individuals seeking unique and personal olfactory experiences, setting itself apart with a commitment to sustainability and eco-friendly practices. Their story is rooted in a passion for perfumery that combines both tradition and contemporary sensibilities, appealing to a diverse clientele.",https://dwell212.com/cdn/shop/files/Dwell_Logo_White_98b3a275-6c99-4f70-8990-eeb29cbd1917.png?v=1721335113&width=600,http://dwell212.com,United States,,indie,,,,2025-07-18T12:32:10.942225,2025-08-28T13:55:21.796750
cmd8316571fc3cad8e0ddcf,Dzintars,,https://dzintars.lv/wp-content/uploads/2024/02/Vector.svg,https://www.dzintars.lv,Latvia,1849,indie,,,,2025-07-18T12:32:10.942225,2025-08-28T13:55:31.630929
cmdd65d305ff21191ad1012,dsm-Firmenich,"dsm-Firmenich is a leading global company specializing in the creation of fragrance and flavor solutions. The company is the result of a merger between DSM (Dutch State Mines) and Firmenich, a Swiss company known for its expertise in fragrance and flavor development. dsm-Firmenich focuses on combining innovation with sustainability to create high-quality sensory experiences in various consumer products, including perfumes, cosmetics, and food & beverage. With a rich heritage and a commitment to sustainability, the company is dedicated to enhancing people's lives through sensory experiences while minimizing environmental impact.",https://www.dsm-firmenich.com/content/dam/dsm-firmenich/logos/logo-white.svg,https://www.dsm-firmenich.com,Switzerland,2022 (merger of DSM and Firmenich),niche,,,,2025-07-18T12:32:10.942225,2025-08-28T13:55:38.861362
cmd7ad32359cc826a650319,Dusita,"Dusita is a niche perfume house founded by Pissara Umavijani, known for its exquisite craftsmanship and dedication to blending traditional perfume-making techniques with Thai cultural elements. The brand aims to evoke emotions and memories through its fragrances, often inspired by literature and poetry. Each scent is carefully crafted using high-quality ingredients, showcasing both artistic vision and a deep connection to nature. Dusita has gained recognition within the luxury fragrance community for its unique olfactory stories and artistic presentation.",https://images.unsplash.com/photo-1582735689369-4fe89db7114c?w=400&h=300&fit=crop,https://www.dusitaperfumes.com,Thailand,2016,niche,,,,2025-07-18T12:32:10.942225,2025-08-28T13:55:47.765108
cmd5e0086a594c3d05865c6,Designer Shaik,"Designer Shaik is a luxury perfume house that specializes in creating high-quality fragrances inspired by the opulence of Middle Eastern culture. Founded in the United Arab Emirates, the brand aims to blend traditional Arabian scents with modern perfumery techniques. Their perfumes are often characterized by rich, deep notes, showcasing a lavish interpretation of fragrance artistry. Designer Shaik has gained recognition for its unique and bold compositions, catering primarily to customers seeking distinctive and extravagant olfactory experiences.",https://designershaik.com/cdn/shop/files/3_320x.png?v=1678978692,http://www.designershaik.com,United Arab Emirates,2000,niche,,,,2025-07-18T12:32:10.942225,2025-08-28T13:55:55.317408
cmdd61e0e12a602685a37fd,Ōdeaur,"Ōdeaur is a niche perfume company that specializes in crafting unique, high-quality fragrances that often draw inspiration from diverse cultural elements and modern artistry. Established with a vision to redefine personal expression through scent, Ōdeaur emphasizes the artisanal approach to creating perfumes that are both sophisticated and accessible. The brand aims to appeal to a discerning clientele that seeks personalized and evocative olfactory experiences, standing out in a competitive market with its signature blends and innovative scent formulations.",https://images.unsplash.com/photo-1556909114-f6e7ad7d3136?w=400&h=300&fit=crop,https://odeaur.com,United States,2019,niche,contact@odeaur.com,,,2025-07-18T12:32:10.942225,2025-08-28T13:56:02.695377
cmd011a96e797b2cb16a30d,EDITh,"EDITh is a niche perfume company known for its artisanal and handcrafted fragrances, emphasizing individuality and personal expression through scent. The brand focuses on creating unique olfactory experiences by using high-quality natural ingredients and innovative scent compositions that reflect modern lifestyles. Founded by a team of dedicated perfumers, EDITh aims to redefine the way consumers interact with perfumes, encouraging them to explore and discover their personal scent journeys.",https://images.unsplash.com/photo-1587017539504-67cfbddac569?w=400&h=300&fit=crop,www.edithparfums.com,France,2021,niche,contact@edithparfums.com,,,2025-07-18T12:32:10.942225,2025-08-28T13:56:08.782502
cmd29bfe1ff7fc40dd7008b,ÉDIT(h),"ÉDIT(h) is a niche perfume house that specializes in creating distinctive and artisanal fragrances. The company focuses on crafting unique, high-quality scents that evoke emotions and tell stories through their compositions. ÉDIT(h) emphasizes the use of rare ingredients and innovative olfactory structures, positioning itself as a brand that celebrates individuality and sophisticated perfumery.",https://images.unsplash.com/photo-1582735689369-4fe89db7114c?w=400&h=300&fit=crop,https://www.edit-h.com,France,2017,niche,contact@edit-h.com,,,2025-07-18T12:32:10.942225,2025-08-28T13:56:34.565187
cmd6e13416c80af86a72fcb,Édouard Matisse,"Édouard Matisse is a niche perfume house known for its artistic approach to fragrance creation. Established by a group of fragrance enthusiasts who share a passion for art and olfactory experiences, the company draws inspiration from various art movements and cultural narratives, translating them into unique scents. Their specialty lies in crafting high-quality, avant-garde perfumes that resonate with artistic themes and provide a distinctive fragrance experience.",https://images.unsplash.com/photo-15907369626-6c63ac16f3df?w=400&h=300&fit=crop,http://www.edouardmatisse.com,France,2020,niche,,,,2025-07-18T12:32:10.942225,2025-08-28T13:56:41.592986
cmd5ff1fe896a253e45e8ce,Elida Fabergé,"Elida Fabergé is a fragrance company known for its heritage and connection to the iconic Fabergé brand. The company specializes in creating luxury perfumes that reflect a rich sense of artistry and craftsmanship, drawing on the history of the famous egg designs and the opulence associated with the Fabergé name. Elida Fabergé has a unique approach to fragrance development, often incorporating elements of nature and high-quality ingredients to create captivating olfactory experiences. Their story is intertwined with the legacy of Peter Carl Fabergé, who established his reputation in the late 19th century for exquisite craftsmanship, which is emulated in their perfume offerings.",https://www.faberge.com/cdn/shop/files/Ruby_Swatch_Icon_3822295b-b28f-4284-aa65-8518e0295802.jpg?v=1718103281&width=50,https://www.faberge.com,United Kingdom,2000,niche,,,,2025-07-18T12:32:10.942225,2025-08-28T13:56:48.953115
cmd9d25c767cb2eef2db468,Élixir Privé,"Élixir Privé is a niche perfume house that specializes in creating bespoke, artisanal fragrances. Founded on the principle of individuality, the company focuses on crafting unique scents that tell a story through their ingredients and blends. The brand prides itself on using high-quality materials and traditional perfumery techniques to deliver exclusive olfactory experiences to consumers.",https://images.unsplash.com/photo-15907369626-6c63ac16f3df?w=400&h=300&fit=crop,,,,niche,,,,2025-07-18T12:32:10.942225,2025-08-28T13:56:54.251120
cmdb27d0fe4b1c7310554ea,Ego,"Ego is a perfume company that specializes in creating unique, high-quality fragrances that evoke emotions and memories. The company prides itself on using premium ingredients sourced from around the world to ensure a luxurious scent experience. Ego was founded with a vision to challenge the mainstream fragrance market by offering artisanal and distinctive scents that cater to individual preferences. The brand has carved a niche for itself through innovative marketing strategies and collaborations with well-known artists, leading to a passionate customer base that appreciates the artistry of perfumery.",https://images.unsplash.com/photo-1541643600914-78b084683601?w=400&h=300&fit=crop,www.egoparfums.com,Italy,2018,niche,contact@egoparfums.com,,"Via dei Martiri 12, 10124 Torino, Italy",2025-07-18T12:32:10.942225,2025-08-28T13:57:03.557435
cmddaf771c82aefe0da11e4,Eilish,"Eilish is a fragrance line created by American singer-songwriter Billie Eilish that reflects her personal style and emotional expression. Launched in November 2021, the brand showcases a unique scent that blends notes of warm vanilla, soft spices, and rich fruits, embodying Eilish's distinctive aesthetic. The company emphasizes sustainability and inclusivity, aiming to resonate with a broad audience while offering a personal and intimate fragrance experience. Eilish aims to redefine celebrity fragrances by focusing on authentic connections with fans through their scents.",https://images.unsplash.com/photo-1582735689369-4fe89db7114c?w=400&h=300&fit=crop,https://www.billeilish.com/fragrance,United States,2021,celebrity,,,,2025-07-18T12:32:10.942225,2025-08-28T13:57:14.442526
cmde641981134567632b5dc,Eau de Boujee,"Eau de Boujee is a contemporary perfume company known for its luxurious and eclectic fragrance offerings. The brand focuses on creating unique scent profiles that resonate with modern, urban consumers who appreciate artistry in perfumery. Established as a response to the traditional fragrance market, Eau de Boujee prides itself on using high-quality ingredients and promoting an inclusive, diverse approach to scent. Their story is rooted in the desire to empower individuals through personal expression, offering a range of perfumes that cater to various tastes and preferences.",https://eaudeboujee.com/cdn/shop/files/EauDeBoujee-Logo-white_300x300.png?v=1728468867,www.eaudeboujee.com,United States,2021,indie,contact@eaudeboujee.com,,,2025-07-18T12:32:10.942225,2025-08-28T13:57:21.455217
cmdcf253d025920ca13ec63,Eau de Juice,"Eau de Juice is a fragrance brand known for its playful and youthful approach to scents. Launched in 2019, it was created with a strong focus on celebrating individuality and self-expression. The company offers a range of fruity and floral fragrances, aimed primarily at a younger audience. Eau de Juice is characterized by its vibrant packaging, which often features bold colors and cheeky names, resonating with a fun and modern aesthetic. The brand positions itself as an accessible and light-hearted choice within the fragrance market.",https://images.unsplash.com/photo-15907369626-6c63ac16f3df?w=400&h=300&fit=crop,https://www.eaudejuice.com,United States,2019,indie,,,,2025-07-18T12:32:10.942225,2025-08-28T13:57:28.464726
cmd5e5f5c64c575f6ddf402,Eau de Couvent,"Eau de Couvent is a luxury perfume brand that specializes in creating high-quality, artisanal fragrances inspired by the rich history and heritage of the art of perfumery. Founded by a group of perfumers and enthusiasts passionate about the intricate craft of fragrance-making, Eau de Couvent captures the essence of elegance and sophistication through its unique scent compositions. The brand is known for its luxurious packaging and commitment to natural ingredients, making every scent a masterpiece that evokes emotion and memory.",https://images.unsplash.com/photo-1582735689369-4fe89db7114c?w=400&h=300&fit=crop,https://www.eaude-couvent.com,France,2013,niche,,,,2025-07-18T12:32:10.942225,2025-08-28T13:57:34.661771
cmda937f066abe4d3aeee57,E. Coudray,"E. Coudray is a historic fragrance house that originated in France in the 19th century. Founded by Édouard Coudray, the company specializes in creating luxurious perfumes and scented products. Coudray is known for blending traditional French craftsmanship with an artisanal approach to fragrance development, resulting in elegant and sophisticated scents. The brand focuses on high-quality materials and time-honored techniques to deliver unique aromatic experiences. Over the years, E. Coudray has expanded its product line to include scented body care items and home fragrances, while maintaining its classic heritage.",https://images.unsplash.com/photo-15907369626-6c63ac16f3df?w=400&h=300&fit=crop,https://www.ecoudray.com,France,1825,niche,,,,2025-07-18T12:32:10.942225,2025-08-28T13:57:40.871737
cmdac93bfcb92ab45aea778,E. Marinella,"E. Marinella is an esteemed Italian company known for its luxurious ties and elegant accessories. Founded in Naples in 1914, the company has a rich heritage that embodies sophistication and Italian craftsmanship. While primarily recognized for textile products, E. Marinella has expanded into the realm of fragrances, creating signature perfumes that reflect the essence of Italian style and luxury. Their scent creations often draw inspiration from the vibrant culture and landscapes of Italy, making them unique in the fragrance market.",https://www.emarinella.eu/cdn/shop/files/marinella-logo-light.svg?v=1699972330&width=150,https://www.emarinella.com,Italy,1914,niche,,,,2025-07-18T12:32:10.942225,2025-08-28T13:57:49.536995
cmd893376f054e1a0106148,e-suitcase,"e-suitcase is a contemporary perfume company that specializes in the development and distribution of travel-friendly fragrance solutions. The company is known for its innovative approach to packaging and scents, offering refillable and portable options for fragrance lovers who are often on the move. Founded with a vision to merge practicality with luxury, e-suitcase curates a selection of unique scents for various occasions, making perfume accessible and convenient for everyone.",https://images.unsplash.com/photo-1582735689369-4fe89db7114c?w=400&h=300&fit=crop,,,,indie,,,,2025-07-18T12:32:10.942225,2025-08-28T13:57:55.178688
cmd1af85e97ffe15d83ae09,E. T. Browne Drug Co,"E. T. Browne Drug Co is a personal care company known for its high-quality, natural products. Established in 1858, the company initially focused on pharmacy products but gained recognition for its herbal formulations. Over the years, E. T. Browne transitioned to specializing in body care essentials and fragrances, with the notable introduction of its famous ""Palmers"" line, which includes a range of cocoa butter products. The brand emphasizes its commitment to sustainability, ethical practices, and the use of high-quality, naturally sourced ingredients in its formulations.",https://images.unsplash.com/photo-1582735689369-4fe89db7114c?w=400&h=300&fit=crop,https://www.etbrowne.com,United States,1858,drugstore,,,,2025-07-18T12:32:10.942225,2025-08-28T13:58:01.603219
cmd67a500e649e55fcde457,E99-EsAns,"E99-EsAns is a pioneering perfume company specializing in the creation of avant-garde fragrances that blend technology with traditional perfumery. Established by a group of passionate perfumers and technologists, E99-EsAns aims to innovate the olfactory experience by utilizing data science to analyze scent preferences and customize fragrances for individual consumers. Their story involves a commitment to sustainability and ethical sourcing of ingredients, focusing on eco-friendly practices to minimize environmental impact while delivering high-quality perfumes.",https://images.unsplash.com/photo-1541643600914-78b084683601?w=400&h=300&fit=crop,https://www.e99-esans.com,United States,2021,indie,contact@e99-esans.com,,,2025-07-18T12:32:10.942225,2025-08-28T13:58:07.771173
cmd3344fc2c1607e1b5c541,Eadward,"Eadward is a luxury perfume company that specializes in creating bespoke and handcrafted fragrances. The brand is known for its artisanal approach that combines traditional techniques with modern creativity, resulting in unique scent profiles tailored to individual preferences. Founded by master perfumers, Eadward emphasizes high-quality ingredients and sustainability, appealing to a discerning clientele that values craftsmanship and exclusivity.",https://images.unsplash.com/photo-1541643600914-78b084683601?w=400&h=300&fit=crop,www.eadwardfragrances.com,United Kingdom,2019,niche,contact@eadwardfragrances.com,,,2025-07-18T12:32:10.942225,2025-08-28T13:58:14.305688
cmdbf0ca28c6d9f9801d524,Eagle Nest Group,"Eagle Nest Group is a global player in the perfume industry, known for its innovative fragrance creations and diverse portfolio. Established with a mission to provide unique scents that evoke emotions and memories, the company focuses on enhancing personal expression through fragrance. Over the years, Eagle Nest Group has developed a reputation for quality and originality, catering to a wide audience with both refined tastes and casual preferences. Their specialty lies in crafting both mainstream and niche fragrances, making them a versatile brand in the competitive market.",https://images.unsplash.com/photo-1582735689369-4fe89db7114c?w=400&h=300&fit=crop,www.eaglenestgroup.com,United States,2002,indie,contact@eaglenestgroup.com,+1-800-555-0199,"123 Fragrance Ave, Suite 200, New York, NY 10001",2025-07-18T12:32:10.942225,2025-08-28T13:58:21.830654
cmd879a21df5ec3a66a4556,Early Modern,"Early Modern is a niche perfume company specializing in the creation of artisanal fragrances inspired by historical periods and themes. Established by a team of perfumers and historians, the brand aims to evoke emotions and stories through scent, offering unique, carefully crafted perfumes that are reminiscent of specific times in history. Their approach combines traditional perfume-making techniques with modern aesthetics, resulting in a collection that appeals to fragrance connoisseurs and those seeking distinctive olfactory experiences.",https://images.unsplash.com/photo-1582735689369-4fe89db7114c?w=400&h=300&fit=crop,www.earlymodernperfumes.com,United States,2017,niche,contact@earlymodernperfumes.com,,,2025-07-18T12:32:10.942225,2025-08-28T13:58:30.934651
cmd6d48c0088c11d303d8b0,Earth Source,"Earth Source is a perfume company dedicated to creating sustainable and eco-friendly fragrance products. Their story began with a mission to combine high-quality ingredients sourced from nature with modern perfumery techniques. Specializing in artisanal scents, Earth Source emphasizes transparency in its ingredient sourcing and production practices, appealing to environmentally conscious consumers.",https://images.unsplash.com/photo-1541643600914-78b084683601?w=400&h=300&fit=crop,www.earthsourcefragrances.com,United States,2015,indie,contact@earthsourcefragrances.com,,,2025-07-18T12:32:10.942225,2025-08-28T13:58:36.572515
cmd1f6ae0527f6b54938de2,Esas,"Esas is a forward-thinking perfume company specializing in high-quality fragrances that blend traditional perfumery techniques with modern sensibilities. Established with a vision to create unique scent experiences, Esas focuses on using natural ingredients and sustainable practices. The company's story began with a passionate founder who sought to honor the artistry of fragrance while making it accessible to a broader audience. Their specialty lies in crafting unisex perfumes that appeal to diverse preferences, often inspired by nature and various cultures.",https://images.unsplash.com/photo-1587017539504-67cfbddac569?w=400&h=300&fit=crop,https://www.esasfragrances.com,United States,2018,indie,contact@esasfragrances.com,,"123 Scent Lane, Perfume City, CA 90210",2025-07-18T12:32:10.942225,2025-08-28T13:58:43.695771
cmdfdbd9f8ef5282d0ef303,EastWest Bottlers,"EastWest Bottlers is a leading fragrance company specializing in the creation and distribution of high-quality perfumes and cosmetic products. The company is known for its innovative approach to fragrance formulation and its commitment to sourcing premium ingredients from around the world. EastWest Bottlers has established a strong presence in the global perfume market, focusing on both niche and mainstream fragrances while catering to a diverse clientele.",https://cdn11.bigcommerce.com/s-a3c0i19vl3/images/stencil/268x269/screen_shot_2019-11-12_at_8.27.02_pm_1573608442__09139.original.png,https://www.eastwestbottlers.com,United States,2005,niche,,,,2025-07-18T12:32:10.942225,2025-08-28T13:58:50.747050
