id,name,description,image,website,country,founded,type,email,phone,address,createdAt,updatedAt
cmd45679673e1a7f8cc647d,Irene Mulle,"Irene Mulle is a niche perfume company known for its unique, artisanal fragrances. Established with a vision to blend art with olfactory experiences, they focus on creating limited-edition scents that reflect the heritage and culture of various inspirations. Each fragrance is crafted with high-quality ingredients, often sourced sustainably, and tells a story that resonates with the wearer. The brand emphasizes individuality and self-expression through expertly formulated blends, catering to a discerning clientele seeking distinct scent experiences.",https://images.unsplash.com/photo-15907369626-6c63ac16f3df?w=400&h=300&fit=crop,https://www.irenemulle.com,United States,2015,niche,info@irenemulle.com,,,2025-07-18T12:32:10.942225,2025-08-28T16:59:20.253155
cmd6ec6595ed563a607ed05,Irié Wash,"Irié Wash is a boutique perfume brand that specializes in creating unique scents derived from natural ingredients. The company emphasizes sustainability and artisanal craftsmanship, offering a range of fragrances that are inspired by various cultures and nature. Their story began with a passion for high-quality, environmentally-friendly perfumes, aiming to provide consumers with an alternative to synthetic fragrances.",https://images.unsplash.com/photo-1556909114-f6e7ad7d3136?w=400&h=300&fit=crop,www.iriewash.com,United States,2020,indie,contact@iriewash.com,,,2025-07-18T12:32:10.942225,2025-08-28T16:59:27.073989
cmdfa93d009ec81e4acaf4a,Irma Armanet,"Irma Armanet is a fragrance house known for its unique and artistic approach to perfume creation. The company was founded by Irma Armanet, who has a deep passion for scent and a background in art and design. The brand focuses on small-batch, artisanal perfumes that blend traditional techniques with contemporary inspirations. Each fragrance tells a story, often drawing from cultural and personal narratives. Irma Armanet has gained acclaim for its commitment to quality ingredients and innovative scent compositions, appealing to fragrance connoisseurs who seek individuality and authenticity in their scent choices.",https://images.unsplash.com/photo-1541643600914-78b084683601?w=400&h=300&fit=crop,http://www.irmaarmanet.com,France,2017,niche,,,"12 Rue des Archives, Paris, France",2025-07-18T12:32:10.942225,2025-08-28T16:59:33.874033
cmd893ff949fa41fb014930,Irma Shorell,"Irma Shorell is a boutique perfume company known for its unique and artistic fragrance creations. Founded by Irma Shorell in the 1980s, the brand is characterized by a dedication to high-quality ingredients and an artisanal approach to perfume making. As a pioneer in the niche fragrance market, Irma Shorell creates exceptional scents that often incorporate elements inspired by nature and the arts, aiming to evoke emotion and memories through olfactory experiences.",https://irmashorell.com/cdn/shop/files/Irma_Shorell_signature_iso.png?v=1712721103&width=556,http://www.irmashorell.com,United States,1980,niche,,,,2025-07-18T12:32:10.942225,2025-08-28T16:59:41.817998
cmdf96f6b1179cca4ffc059,Iruela,,https://images.unsplash.com/photo-1556909114-f6e7ad7d3136?w=400&h=300&fit=crop,www.iruela.com,Spain,2015,niche,,,,2025-07-18T12:32:10.942225,2025-08-28T16:59:47.755989
cmd94c15950f87f3cd39899,Irving Rice Cosmetics,"Irving Rice Cosmetics is a fragrance and beauty company specializing in the development of high-quality perfumes. The company was founded by fragrance expert Irving Rice, who envisioned creating unique scents that cater to diverse consumer preferences. Known for blending traditional and contemporary fragrance techniques, Irving Rice Cosmetics offers a range of luxury products that appeal to both casual wearers and fragrance connoisseurs.",https://images.unsplash.com/photo-1582735689369-4fe89db7114c?w=400&h=300&fit=crop,,United States,1981,indie,,,,2025-07-18T12:32:10.942225,2025-08-28T16:59:53.255041
cmd22a1bccdadd36ca670d9,Irving Rice,"Irving Rice is a perfume company known for its expertise in fragrance creation, focusing on unique scent compositions that cater to a discerning clientele. The company has a rich history in the perfume industry, emphasizing craftsmanship and quality. Irving Rice specializes in niche fragrances, often drawing inspiration from art, culture, and nature to create their signature scents.",https://images.unsplash.com/photo-1556909114-f6e7ad7d3136?w=400&h=300&fit=crop,www.irvingrice.com,United States,2005,niche,,,,2025-07-18T12:32:10.942225,2025-08-28T17:00:00.888153
cmdb412fd140b3ba7efcd07,Isaac Mizrahi,"Isaac Mizrahi is a well-known American fashion designer who has expanded his brand into the perfume industry. Founded in the 1980s, Mizrahi's fragrances reflect his eclectic and stylish vision, incorporating unique and vibrant notes that appeal to a diverse clientele. His perfume lines often embody a sense of luxury and creativity akin to his fashion collections. Over the years, Isaac Mizrahi has gained recognition for blending classic and contemporary elements in both his apparel and fragrance offerings, establishing himself as a key player in the world of haute couture and lifestyle branding.",https://images.unsplash.com/photo-1556909114-f6e7ad7d3136?w=400&h=300&fit=crop,[https://www.isaacmizrahi.com](https://www.isaacmizrahi.com),United States,1987,designer,,,,2025-07-18T12:32:10.942225,2025-08-28T17:00:08.126830
cmd652d05e62807e12507c3,Isabel Derroisné,"Isabel Derroisné is a French niche perfume house known for its artisanal approach to fragrance creation. The brand focuses on crafting unique, high-quality scents that blend traditional techniques with contemporary aesthetics. Established by perfume creator Isabel Derroisné, the company has carved a niche in the luxury perfume market, emphasizing exceptional ingredients and storytelling through scent. Their offerings often reflect a deep connection to nature and art, aiming to evoke emotions and memories through olfactory experiences.",https://images.unsplash.com/photo-1582735689369-4fe89db7114c?w=400&h=300&fit=crop,https://www.isabelderroisne.com,France,2016,niche,,,,2025-07-18T12:32:10.942225,2025-08-28T17:00:14.622371
cmdd1b8f337b7bb1b9fae30,Isabel Queiroz do Vale,,https://images.unsplash.com/photo-1541643600914-78b084683601?w=400&h=300&fit=crop,http://www.isabelqueirozdovale.com,Portugal,2015,niche,,,,2025-07-18T12:32:10.942225,2025-08-28T17:00:21.154701
cmd5a48942ac12cc831931d,Isabel Toledo,"Isabel Toledo was a prominent fashion designer known for her unique blend of handcrafted artistry and modern design. While primarily recognized for her contributions to fashion, she briefly ventured into the perfume market, integrating her aesthetic and passion for color and texture into her fragrance line. Toledo's work is characterized by its vibrant, bold elements, and she emphasized the importance of storytelling through her creations. Her fragrances are an extension of her fashion philosophy, capturing the essence of her vibrant designs and Hispanic heritage.",https://images.unsplash.com/photo-1582735689369-4fe89db7114c?w=400&h=300&fit=crop,,USA,,niche,,,,2025-07-18T12:32:10.942225,2025-08-28T17:00:27.041564
cmdc7168b4d2345fbe99917,Isabel,"Isabel is a contemporary perfume company that specializes in creating unique and artfully crafted fragrances. The brand was founded with a vision to blend the elegance of traditional perfumery with modern aesthetics, appealing to a diverse audience. Their collections often evoke memories and emotions, drawing inspiration from nature and personal experiences. Isabel positions itself within the niche of artisanal perfume makers, focusing on quality ingredients and sustainable practices to create bespoke scents that resonate with individual identities.",https://images.unsplash.com/photo-15907369626-6c63ac16f3df?w=400&h=300&fit=crop,www.isabelperfume.com,United States,2016,niche,info@isabelperfume.com,,,2025-07-18T12:32:10.942225,2025-08-28T17:00:33.920768
cmd1a2400606518503430cd,Isabela Capeto,"Isabela Capeto is a Brazilian fashion designer and entrepreneur known for her unique approach to perfumery. The company emphasizes a connection between fashion and fragrance, creating scents that embody the spirit of Brazilian culture and nature. With a focus on high-quality ingredients and artisanal craftsmanship, Isabela Capeto offers a limited range of exclusive perfumes that reflect her artistic vision and personal experiences. The brand is recognized for its vibrant aesthetic and storytelling capabilities through fragrance.",https://images.tcdn.com.br/files/1345112/themes/49/img/settings/Prancheta_logo.png?9ce3a054befd0bbdd9478a484405892f,http://www.isabelacapeto.com.br/,Brazil,2014,niche,,,,2025-07-18T12:32:10.942225,2025-08-28T17:00:41.624632
cmd43b49df160288afde6c8,Isabell,"Isabell is a luxury perfume company known for crafting exquisite fragrances that evoke elegance and sophistication. The company focuses on using high-quality ingredients sourced from around the world to create unique scent profiles. Established with a mission to blend art and science in perfumery, Isabell has garnered a dedicated following for its artisanal approach and carefully curated collections. The brand emphasizes personalization, offering bespoke scent consultations and custom fragrance creations for discerning customers seeking a signature aroma.",https://images.unsplash.com/photo-1587017539504-67cfbddac569?w=400&h=300&fit=crop,www.isabellperfumes.com,United States,2015,niche,info@isabellperfumes.com,,,2025-07-18T12:32:10.942225,2025-08-28T17:00:48.410916
cmd35d150e00181dab4a708,Isabella Kristensen,"Isabella Kristensen is a luxury perfume house that specializes in creating artisanal fragrances. Founded by Danish perfumer Isabella Kristensen, the brand is known for its commitment to using high-quality ingredients and traditional craftsmanship. The company aims to capture the essence of luxurious and natural scents, often drawing inspiration from the Scandinavian landscape and culture. Isabella Kristensen’s perfumes are characterized by their complexity and uniqueness, appealing to a niche market of fragrance connoisseurs seeking exclusivity and depth in their olfactory experiences.",https://images.unsplash.com/photo-1541643600914-78b084683601?w=400&h=300&fit=crop,https://isabellakristensen.com,Denmark,2014,niche,,,,2025-07-18T12:32:10.942225,2025-08-28T17:00:55.579214
cmd05b126cbc06ccd1c9906,Isabella Rossellini,"Isabella Rossellini's fragrance line is an extension of her artistic persona, combining elements of nature with sophisticated scents. Inspired by her personal philosophy regarding beauty and femininity, the brand has garnered attention for its unique approaches to perfumery that engage with themes of sustainability and organic ingredients. The fragrances are characterized by their blend of classic and modern perfumery techniques, aimed at both evoking emotions and celebrating individuality. Rossellini's involvement in the development of her perfumes reflects her dedication to quality and creative expression, leading to a niche offering in the fragrance market.",https://images.unsplash.com/photo-15907369626-6c63ac16f3df?w=400&h=300&fit=crop,https://www.isabellarossellini.com,United States,1999,niche,,,,2025-07-18T12:32:10.942225,2025-08-28T17:01:02.964090
cmd658e653c81a2a0c719ac,Isabelle Larignon,"Isabelle Larignon is a niche perfume house known for its artisanal approach to fragrance creation. Founded by perfumer Isabelle Larignon, the company emphasizes high-quality ingredients and unique scent compositions, reflecting a personal storytelling aspect in each fragrance. The brand embraces both traditional and modern techniques in perfumery, aiming to create scents that resonate on an emotional level with users.",https://isabellelarignon.com/cdn/shop/files/IL_LOGO_TYPOGRAMME_3_lignes_NOIR.png?v=1753199575&width=600,http://www.isabellelarignon.com,France,2013,niche,,,,2025-07-18T12:32:10.942225,2025-08-28T17:01:10.954611
cmd8dd973bc913a09a46ed6,Isabey,"Isabey is a French perfume house founded in 1924, known for its elegant and sophisticated fragrances that draw inspiration from nature and historical motifs. The brand integrates traditional techniques with innovative approaches to create luxurious scent experiences. Their specialty lies in crafting unique perfumes that often feature rare and high-quality ingredients, making them treasured collectibles among perfume enthusiasts.",https://images.unsplash.com/photo-1582735689369-4fe89db7114c?w=400&h=300&fit=crop,https://www.isabey.com,France,1924,niche,,,,2025-07-18T12:32:10.942225,2025-08-28T17:01:17.490414
cmdf8c6bcbc793ed45b450b,Isadora,"Isadora is a fragrance company that specializes in creating captivating and unique scents. The brand is known for its innovative approach to perfumery, using high-quality ingredients to craft distinct fragrances that cater to a diverse clientele. Isadora's story began with a passion for artistry in scent creation, focusing on both traditional and modern perfumery techniques. They aim to inspire emotions and memories through their various fragrance offerings, targeting consumers who appreciate individuality in scent.",https://images.unsplash.com/photo-1556909114-f6e7ad7d3136?w=400&h=300&fit=crop,https://www.isadoraparfums.com,Sweden,2020,niche,info@isadoraparfums.com,,,2025-07-18T12:32:10.942225,2025-08-28T17:01:24.562392
cmda57f5f6bafbd48cd5e93,Isotta Fraschini,"Isotta Fraschini is a luxury perfume house known for its high-quality, artisanal fragrances. The company originated from the historic Italian automotive brand Isotta Fraschini, which was established in the early 20th century. Leveraging its legacy of craftsmanship and attention to detail, Isotta Fraschini transitioned into the perfume industry, focusing on creating unique scents that embody elegance and sophistication. The brand is dedicated to blending traditional techniques with modern innovation, offering a range of perfumes that appeal to discerning customers.",https://isottafraschini.com/wp-content/uploads/2025/02/logo-website-header.png,https://www.isottafraschini.com,Italy,2020,niche,,,,2025-07-18T12:32:10.942225,2025-08-28T17:01:35.102867
cmdb26e32a5ebba473f44d2,Issey Miyake,"Issey Miyake is a renowned Japanese fashion designer known for his innovative and artistic approach to design. Established in 1970, the Issey Miyake brand has extended its philosophy of ‘living beauty’ into the fragrance industry, offering scents that emphasize simplicity, individuality, and a connection to nature. The brand's first fragrance, L'Eau d'Issey, launched in 1992, became a global icon due to its unique blend of fresh floral and aquatic notes. Issey Miyake is dedicated to using cutting-edge technology in fragrance creation, often focusing on natural materials and sustainable practices.",https://www.isseymiyake.com/cdn/shop/t/3/assets/exp-logo.svg?v=152887727321034772761655530564,https://www.isseymiyake.com,Japan,1970,designer,,,,2025-07-18T12:32:10.942225,2025-08-28T17:01:42.308603
cmdfaf5f28442d0c72d1fe4,Italart,"Italart is a specialized perfume company known for its expertise in crafting high-quality, luxury fragrances. It focuses on creating unique scent compositions that cater to discerning customers who appreciate artisanal perfumery. Established with a vision to blend artistic expression with olfactory innovation, Italart has gained recognition for its quality ingredients and commitment to sustainability.",https://images.unsplash.com/photo-1587017539504-67cfbddac569?w=400&h=300&fit=crop,,,,indie,,,,2025-07-18T12:32:10.942225,2025-08-28T17:01:47.990612
cmda9b7149b8b93051444d7,ITF Cosmetics,"ITF Cosmetics is a globally recognized fragrance manufacturer and distributor that focuses on producing a diverse range of perfumes and cosmetics. Established in 1981, the company develops both original and licensed fragrance lines, catering to various market segments. ITF Cosmetics has built a reputation for its innovative approach to scent creation, utilizing cutting-edge technology and extensive market research to create captivating fragrances that resonate with consumers worldwide. The brand works with various partners, including celebrities and fashion houses, to bring exclusive perfume collections to the market.",https://images.unsplash.com/photo-1556909114-f6e7ad7d3136?w=400&h=300&fit=crop,https://www.itfcosmetics.com,United States,1981,designer,,,,2025-07-18T12:32:10.942225,2025-08-28T17:01:55.536813
cmde726acfc8c3913305a6d,Iunx,"Iunx is a luxury perfume brand founded by renowned perfumer Olivia Giacobetti in 2003. The company is known for its artisanal approach to fragrance creation, emphasizing quality and creativity. Iunx captures the essence of fragrant materials from natural sources and offers a collection of unique perfumes that often evoke memories and emotions. The brand creates a sensory experience through its poetic approach to scent, exploring the bond between perfumes and life's fleeting moments.",https://assets.superlander.com/newimages/mu-logo.png,https://iunx.com,France,2003,niche,,,,2025-07-18T12:32:10.942225,2025-08-28T17:02:02.092432
cmdf70d04e480f493bfb666,Ivana Trump,"Ivana Trump is a perfume brand associated with the former model and businesswoman Ivana Trump. The company specializes in creating fragrances that reflect a combination of style, femininity, and elegance, often inspired by Ivana’s personal style and experiences. The brand aims to capture the essence of glamour and sophistication in its product offerings, appealing to a diverse clientele who appreciate celebrity-endorsed scents. The line of perfumes has been marketed heavily, reflecting Ivana's identity and lifestyle.",https://images.unsplash.com/photo-1556909114-f6e7ad7d3136?w=400&h=300&fit=crop,,United States,1995,celebrity,,,,2025-07-18T12:32:10.942225,2025-08-28T17:02:08.147502
cmdacdae1f64ed5db381335,Ivanka Trump,"Ivanka Trump Fragrances is a brand that offers a range of perfumes created by Ivanka Trump, an American businesswoman and former advisor to the President of the United States. The brand is known for its sophisticated and elegant scents designed to embody empowerment and confidence. Ivanka Trump launched her fragrance line as part of her broader lifestyle brand that includes fashion and accessories. The perfumes typically feature a blend of floral and fruity notes, appealing to a diverse customer base that seeks luxury and femininity.",https://www.ivankatrump.com/assets/ivanka_logo.png,https://www.ivankatrump.com/,United States,2016,celebrity,,,,2025-07-18T12:32:10.942225,2025-08-28T17:02:15.410481
cmdc9f3a69d963b04f63614,IWP International,"IWP International is a prominent player in the perfume industry, specializing in the creation and distribution of fine fragrances. Established with a commitment to quality and innovation, the company has developed a diverse portfolio of fragrances that cater to various consumer preferences. Their expertise lies in combining traditional perfumery techniques with modern trends to craft unique scent profiles. IWP International services both the retail and wholesale markets, ultimately aiming to deliver exceptional perfumes that resonate with audiences globally.",https://images.unsplash.com/photo-1587017539504-67cfbddac569?w=400&h=300&fit=crop,http://www.iwp-international.com,United Arab Emirates,1988,niche,,,,2025-07-18T12:32:10.942225,2025-08-28T17:02:21.797361
cmdffb88598b10b9b11d677,IXXI,"IXXI is a fragrance company that specializes in unique and artisanal perfumes. Founded by a team of passionate scent creators, IXXI aims to redefine the personal fragrance experience with a diverse range of olfactory creations that cater to various preferences and styles. Their philosophy revolves around creativity, craftsmanship, and sustainability, often using high-quality ingredients that are ethically sourced. The brand is known for its innovative approach and has garnered attention for its distinctive fragrances and visually appealing packaging.",https://images.unsplash.com/photo-15907369626-6c63ac16f3df?w=400&h=300&fit=crop,www.ixxi-fragrance.com,France,2019,niche,,,,2025-07-18T12:32:10.942225,2025-08-28T17:02:27.935627
cmdfc72fc8c507989231e90,IZOD,"IZOD is an American brand known primarily for its sportswear, but it has expanded its offerings to include a line of fragrances. The brand serves a younger demographic, promoting a casual and sporty lifestyle through its clothing and scent products. Founded in the 1930s, IZOD has evolved into an iconic label, reflecting classic American style with modern flair. The fragrance line complements its apparel by reflecting the same casual yet stylish ethos.",https://izod.com/cdn/shop/files/IZOD_LOGO-01_135x.png?v=1631420563,https://www.izod.com,United States,1938,designer,,,,2025-07-18T12:32:10.942225,2025-08-28T17:02:34.860476
cmd6aca5cb18a89709ccffc,Ilana Jivago,"Ilana Jivago is a luxury perfume company specializing in artisanal fragrances that are inspired by global cultures and memories. Founded by Ilana Jivago, the brand emphasizes craftsmanship, using high-quality ingredients to create unique scent profiles. The company originated from Jivago's passion for art, nature, and the emotional connections that scents evoke. Their perfumes are known for storytelling through fragrance and often incorporate rare ingredients sourced from around the world.",https://images.unsplash.com/photo-1582735689369-4fe89db7114c?w=400&h=300&fit=crop,https://www.jivagoparfums.com,United States,1996,niche,,,,2025-07-18T12:32:10.942225,2025-08-28T17:02:41.221096
cmdf1ee0512733f0a96f555,J & E Atkinsons,"J & E Atkinsons is a historic perfumery known for its exceptional fragrances and grooming products. Established in 1799 by James Atkinson, the brand has roots in the art of crafting fine perfumes and has built a reputation for quality and elegance over more than two centuries. J & E Atkinsons specializes in creating luxurious scents that reflect the heritage and style of British perfumery, focusing on traditional methods and high-quality ingredients. The brand is particularly recognized for its classic formulations and signature scents, appealing to discerning customers looking for sophisticated and timeless fragrances.",https://images.unsplash.com/photo-1541643600914-78b084683601?w=400&h=300&fit=crop,https://www.atkinsons1781.com,United Kingdom,1799,niche,,,,2025-07-18T12:32:10.942225,2025-08-28T17:02:48.268950
cmde40a1bc781eeffe823eb,James Heeley,"James Heeley is a niche perfume brand founded by British designer James Heeley in 2006. The company specializes in creating distinctive and high-quality fragrances that incorporate both traditional perfume-making techniques and innovative approaches. Heeley's philosophy emphasizes the art of subtlety in fragrance, often inspired by nature and personal experiences. The brand stands out for its unique scents and eco-friendly practices, leveraging high-quality raw materials, with a focus on artisanal craftsmanship. Their fragrances appeal to connoisseurs seeking individuality and authenticity in their perfume choices.",https://www.jamesheeley.com/img/logo.jpg?1686822784,https://www.jamesheeley.com,United Kingdom,2006,niche,,,,2025-07-18T12:32:10.942225,2025-08-28T17:03:05.804184
cmdecae7b0799fe2db1576b,J Casanova,"J Casanova is a niche perfume company known for its artisanal approach to fragrance creation. Founded by perfumer José Casanova, the company specializes in developing unique and evocative scents that draw from a rich heritage of olfactory craftsmanship. The brand aims to create fragrances that tell a story and evoke emotions, often using high-quality, sustainably sourced ingredients. J Casanova's commitment to artistry and individual expression has distinguished it within the competitive perfume industry.",https://images.unsplash.com/photo-1582735689369-4fe89db7114c?w=400&h=300&fit=crop,https://www.jcasanova.com,United States,2017,niche,contact@jcasanova.com,,,2025-07-18T12:32:10.942225,2025-08-28T17:03:13.711692
cmd5120b6b1e190f7f591f3,J. Crew,"J. Crew is a popular American retailer known primarily for its stylish clothing and accessories, including a limited range of fragrances. Founded in 1983, J. Crew offers modern, classic styles that appeal to a diverse clientele. The company emphasizes quality materials and craftsmanship in its offerings, blending preppy aesthetics with contemporary style. Over the years, J. Crew has expanded its product line to include a curated selection of perfumes, often collaborating with established fragrance houses to create exclusive scents that align with their brand identity and lifestyle.",https://images.unsplash.com/photo-1556909114-f6e7ad7d3136?w=400&h=300&fit=crop,https://www.jcrew.com,United States,1983,designer,,,,2025-07-18T12:32:10.942225,2025-08-28T17:03:30.144478
