id,name,description,image,website,country,founded,type,email,phone,address,createdAt,updatedAt
cmdceaa628af7df06c538f6,Fakoshima,"Fakoshima is an avant-garde perfume company that focuses on creating unique, artistic fragrances inspired by nature and the fusion of cultures. They emphasize handcrafted production methods and use high-quality, sustainable ingredients to craft scents that are not only luxurious but also reflect a story and a lifestyle. The company has garnered attention for its innovative approach to fragrance design, often collaborating with artists and designers to create limited edition pieces that resonate with perfume connoisseurs.",https://images.unsplash.com/photo-1582735689369-4fe89db7114c?w=400&h=300&fit=crop,www.fakoshima.com,United States,2013,niche,info@fakoshima.com,,"123 Perfume Ave, Fragrance City, CA 90210, USA",2025-07-18T12:32:10.942225,2025-08-28T14:33:44.485227
cmd09bb3b9a803ee7762406,Falic Group,"Falic Group is a leading global distributor of prestige fragrances and cosmetics. Founded in 1991, the company specializes in the marketing and distribution of both popular and niche fragrance brands in various markets worldwide. They are known for their innovative approach to retailing and their ability to adapt to changing consumer trends. The company manages a diverse portfolio of brands, helping to amplify their presence in both physical and online marketplaces.",http://www.falicgroup.com/logo_white.svg,http://www.falicgroup.com,United States,1991,designer,,,,2025-07-18T12:32:10.942225,2025-08-28T14:33:50.392930
cmd1d4ec1d1658b01720377,Fanette,"Fanette is a niche perfume company known for its artisanal approach to fragrance creation. Founded by a team of passionate perfumers, the brand focuses on crafting unique, high-quality scents that embody a sense of individuality and artistry. Fanette seeks to elevate the experience of fragrance by offering limited edition and bespoke options, drawing inspiration from nature, art, and various cultures to create distinctive olfactory experiences.",https://images.unsplash.com/photo-15907369626-6c63ac16f3df?w=400&h=300&fit=crop,https://www.fanetteparfumerie.com,France,2018,niche,contact@fanetteparfumerie.com,,,2025-07-18T12:32:10.942225,2025-08-28T14:33:56.238882
cmdd4d198397fef907d7daf,Fanfare Beauty,"Fanfare Beauty is a contemporary fragrance company known for its innovative and artistic approach to scent creation. The company focuses on using high-quality ingredients to craft unique and memorable fragrances that appeal to a diverse audience. Fanfare Beauty embraces a philosophy that combines beauty with individuality, emphasizing self-expression through scent. It was founded by a team of passionate fragrance enthusiasts who aim to elevate the perfume experience by offering evocative and sophisticated blends.",https://images.unsplash.com/photo-1587017539504-67cfbddac569?w=400&h=300&fit=crop,www.fanfarebeauty.com,United States,2021,indie,contact@fanfarebeauty.com,,,2025-07-18T12:32:10.942225,2025-08-28T14:34:03.482043
cmd18b95035229ea3e5f6b1,FAnn,"FAnn is a well-known perfume retailer based in the Czech Republic, specializing in offering a wide array of fragrances, cosmetics, and beauty products from both mainstream and niche brands. The company has built a reputation for providing quality products and a comprehensive selection that caters to various consumer preferences. Founded in the early 1990s, FAnn initially began as a small retail shop and has since expanded its presence, embracing both online and physical retail formats. Their focus on customer experience and expert advice has positioned FAnn as a go-to destination for fragrance lovers in the region.",https://static.fann.cz/images/fann_logo.svg,https://www.fann.cz,Czech Republic,1993,indie,,,,2025-07-18T12:32:10.942225,2025-08-28T14:34:11.137979
cmdbb8dae15dc67ef5b742b,Fantôme,"Fantôme is a niche perfume company that specializes in creating unique and artistic fragrances. Established by a team of perfumers passionate about fusing traditional and contemporary scent-making techniques, the company focuses on crafting limited-edition perfumes that tell a story and evoke memories and emotions. Fantôme draws inspiration from nature, art, and history, ensuring that each fragrance is a reflection of their explorative ethos and dedication to craftsmanship.",https://images.unsplash.com/photo-1541643600914-78b084683601?w=400&h=300&fit=crop,www.fantomeparfums.com,France,2015,niche,contact@fantomeparfums.com,,"14 Rue de la Paix, 75002 Paris, France",2025-07-18T12:32:10.942225,2025-08-28T14:34:18.679649
cmd7760b37a389783c0c50a,Farfalla,"Farfalla is a Swiss company known for its commitment to natural perfumes and essential oils. Founded in the early 1980s, the company focuses on creating high-quality, environmentally friendly fragrances using organic and sustainably sourced ingredients. Farfalla emphasizes the importance of aromatherapy, blending scents to enhance well-being, and it offers a wide range of personal perfumes as well as home fragrances. The brand is dedicated to holistic health and ecological responsibility, making it a preferred choice for consumers looking for natural and luxurious perfume options.",https://www.farfalla.ch/static/img/logo.0d5f8194e00c.svg,https://www.farfalla.ch,Switzerland,1985,niche,,,,2025-07-18T12:32:10.942225,2025-08-28T14:34:26.617487
cmdeb5df5f62738633fb74e,Fargginay,"Fargginay is a French perfume house known for crafting exquisite fragrances that draw inspiration from the rich heritage of perfume creation. Established in the early 20th century, they specialize in high-quality, artisanal perfumes that reflect both traditional and contemporary olfactory art. Fargginay has gained recognition for its unique scent blends that capture the essence of nature and emotions, catering to a discerning clientele who appreciate niche fragrance compositions.",https://images.unsplash.com/photo-1587017539504-67cfbddac569?w=400&h=300&fit=crop,http://www.fargginay.com,France,1925,niche,,,,2025-07-18T12:32:10.942225,2025-08-28T14:34:44.168509
cmd9255cfe8d03f183dbaca,Fariboles,"Fariboles is a French perfume company that specializes in creating artisanal fragrances. Founded by a group of passionate perfumers, the company aims to bridge the gap between nature and olfactory art, using high-quality, sustainable ingredients to craft unique scents. Their story is rooted in the tradition of perfume-making, emphasizing creativity and individuality. Fariboles is known for its intimate and personal approach to fragrance, allowing customers to explore their emotional connection to scents and providing bespoke options.",https://www.fariboles.com/img/logo-17212888301.svg,https://www.fariboles.com,France,2014,niche,,,,2025-07-18T12:32:10.942225,2025-08-28T14:34:53.479503
cmd51ffccd8a1a6a4eae2fb,Farina Gegenüber,"Farina Gegenüber is a luxury perfume house renowned for its rich heritage and artisanal craftsmanship in fragrance creation. Established in 1709, it boasts a legacy as one of the oldest perfumeries in the world, offering unique, high-quality scents that are often inspired by historical references and the founder's original formulas. The company specializes in exclusive, handcrafted perfumes, delivering a personal touch through its bespoke fragrance services.",https://images.unsplash.com/photo-15907369626-6c63ac16f3df?w=400&h=300&fit=crop,https://www.farina-gegenueber.de,Germany,1709,niche,,,,2025-07-18T12:32:10.942225,2025-08-28T14:34:59.959987
cmd67daeb0f58ce0fdd7075,Farlabo,"Farlabo is a perfume company known for its unique approach to fragrance creation, focusing on artisanal and high-quality ingredients. The brand emphasizes craftsmanship and the art of perfumery, aiming to create distinctive scents that tell a story. Their offerings often reflect the culture and essence of the regions they draw inspiration from, making each fragrance a narrative experience for the wearer.",https://images.unsplash.com/photo-1541643600914-78b084683601?w=400&h=300&fit=crop,,,,indie,,,,2025-07-18T12:32:10.942225,2025-08-28T14:35:05.811262
cmd4c81f387a916d2e19813,Farmacia SS. Annunziata,"Farmacia SS. Annunziata is an iconic Italian perfumery known for its artisanal fragrances and apothecary products. Established in Florence, it has a rich history dating back to 1561, blending tradition and modernity in its perfume creations. The company specializes in high-quality, handcrafted fragrances inspired by Italian heritage and natural ingredients. They offer a unique selection of scents and personal care products, emphasizing the artisanal nature of their craft, and maintaining a strong connection to the Florentine roots in their offerings.",https://images.unsplash.com/photo-1582735689369-4fe89db7114c?w=400&h=300&fit=crop,https://www.farmaciassanannunziata.com,Italy,1561,niche,,,,2025-07-18T12:32:10.942225,2025-08-28T14:35:12.221114
cmd0ae9a60a22bd6596b0b1,Farmasi,"Farmasi is a cosmetics and personal care company that specializes in manufacturing high-quality beauty products, including a range of fragrances. Founded with a vision to create beauty solutions accessible to all, Farmasi has emphasized the use of natural ingredients and dermatologically tested formulations. The company operates through a multi-level marketing (MLM) structure, empowering individuals to become independent representatives and promote their products. Over the years, Farmasi has expanded its international presence and product lines while maintaining a commitment to affordability and inclusiveness in the beauty industry.",https://www.farmasi.com/images/landing/logoc619.png?v=1.0,https://www.farmasi.com,Turkey,2010,drugstore,,,,2025-07-18T12:32:10.942225,2025-08-28T14:35:18.927518
cmdce5882f0a07ead7c7951,Fashion Fair,,https://fashionfair.com/cdn/shop/files/Group_2092_1_150x150.png?v=1692097395,https://www.fashionfair.com,United States,1973,designer,,,,2025-07-18T12:32:10.942225,2025-08-28T14:35:25.315270
cmdb699381f8d77bdb64838,Fashion Fragrances & Cosmetics Ltd,,https://img.atom.com/story_images/visual_images/logo-image-52979-fashionfragrances.jpg?class=show,www.fashionfragrances.com,United Kingdom,2005,designer,,,,2025-07-18T12:32:10.942225,2025-08-28T14:35:34.490608
cmde6b6b86b0194047dfe18,Fashion Fragrances,"Fashion Fragrances is a perfume company known for its innovative and trendy scent collections. The company has specialized in creating a range of fragrances that emphasize style, elegance, and the latest fashion trends. Fashion Fragrances has built a reputation for blending classic notes with modern elements to appeal to a diverse clientele. The brand focuses on maintaining high-quality standards while catering to the contemporary consumer's desires.",https://images.unsplash.com/photo-1541643600914-78b084683601?w=400&h=300&fit=crop,,,,indie,,,,2025-07-18T12:32:10.942225,2025-08-28T14:35:39.987604
cmd56056369df5d4e985835,Fastrack,"Fastrack is a lifestyle brand based in India, primarily known for its trendy accessories including watches, eyewear, and fragrances. It was launched as a sub-brand of the Indian company Titan Company Limited in 1998, targeting the youth market with bold and modern designs. The brand focuses on offering unique scents that resonate with the adventurous and outgoing nature of its consumers, making it a popular choice among young individuals.",https://images.unsplash.com/photo-1587017539504-67cfbddac569?w=400&h=300&fit=crop,https://www.fastrack.in,India,1998,designer,,,,2025-07-18T12:32:10.942225,2025-08-28T14:35:45.847495
cmd90adaa0511aa3f4aefe6,Fátima Lopes,"Fátima Lopes is a renowned Portuguese fashion designer who has expanded her brand to include a line of perfumes. The company is distinguished by its unique blend of elegance and modernity, often reflecting the sophisticated aesthetics of Fátima Lopes’ fashion designs. With a focus on luxury, each fragrance is crafted to evoke emotions and memorable experiences, embodying the essence of contemporary femininity. The brand is celebrated for its commitment to high-quality ingredients and artistic expression, appealing to a discerning clientele that values both style and substance.",https://images.unsplash.com/photo-1582735689369-4fe89db7114c?w=400&h=300&fit=crop,[www.fatimalopes.com](http://www.fatimalopes.com),Portugal,1994,designer,,,,2025-07-18T12:32:10.942225,2025-08-28T14:35:52.313682
cmdce48048d28a18659675b,Faviol Seferi,"Faviol Seferi is a luxury perfume brand known for its artisanal and handcrafted fragrances. The company was founded by renowned perfumer Faviol Seferi, who draws inspiration from a rich heritage of scent-making, blending traditional techniques with contemporary aesthetics. The brand emphasizes unique fragrance compositions that allow individuals to express their personal stories and emotions through scent. With a focus on high-quality ingredients and sustainability, Faviol Seferi has carved out a niche in the competitive perfume industry, appealing to connoisseurs seeking exclusive and sophisticated aromas.",https://faviolseferi.es/cdn/shop/files/organization-logo.webp?v=1745612435&width=600,www.faviolseferi.com,France,2018,niche,contact@faviolseferi.com,+33 1 23 45 67 89,"42 Rue de la Parfumerie, Paris, France",2025-07-18T12:32:10.942225,2025-08-28T14:36:00.541076
cmd04ecab646d3fdfb50228,Favorit & Co,"Favorit & Co is a perfume company that specializes in the creation of high-quality fragrances characterized by unique compositions and creative artistry. Known for its commitment to using fine ingredients and innovative scent profiles, the company has developed a strong reputation in the niche perfume market. Favorit & Co aims to deliver an olfactory experience that reflects individuality and artistry, drawing inspiration from various cultural and natural elements to craft its perfumes.",https://images.unsplash.com/photo-1582735689369-4fe89db7114c?w=400&h=300&fit=crop,www.favoritandco.com,France,2010,niche,contact@favoritandco.com,+33 1 23 45 67 89,"12 Rue de la Parfumerie, 75001 Paris, France",2025-07-18T12:32:10.942225,2025-08-28T14:36:12.313462
cmdb85aabbf70c8bddfb937,Faynt,"Faynt is a niche perfume brand that focuses on creating unique, artisanal fragrances inspired by the emotions and memories they evoke. Established with a vision to blend luxury with personal storytelling, Faynt intertwines elements of modern artistry with traditional perfumery techniques. The brand often sources high-quality natural ingredients and emphasizes sustainability and craftsmanship in their production processes, appealing to fragrance enthusiasts seeking distinctive olfactory experiences.",https://images.unsplash.com/photo-1582735689369-4fe89db7114c?w=400&h=300&fit=crop,https://www.faynt.com,United States,,niche,,,,2025-07-18T12:32:10.942225,2025-08-28T14:36:18.912161
cmd835f1e99ae5843d596be,Fazzolari + Gardoni,"Fazzolari + Gardoni is a unique perfume company known for their artisanal approach to fragrance creation. They specialize in crafting bespoke perfumes that reflect personal stories, emotions, and experiences, with a focus on using high-quality, natural ingredients. Founded by two passionate perfumers, their mission is to challenge conventional norms in the fragrance industry by offering exclusive scents that evoke a sense of individuality and luxury. Their products cater to niche markets and emphasize quality over quantity, attracting discerning clientele who appreciate the artistry behind perfumery.",https://images.unsplash.com/photo-1556909114-f6e7ad7d3136?w=400&h=300&fit=crop,www.fazzolarigardoni.com,Italy,2016,niche,,,,2025-07-18T12:32:10.942225,2025-08-28T14:36:24.991355
cmd0a8ed9b5a0464598f057,FB Beauty Ltd,"FB Beauty Ltd is a prominent player in the perfume industry, focusing on the creation and distribution of high-quality fragrance products. Established with a vision to merge artistry with modern fragrance formulation, the company prides itself on innovative scent creations that cater to diverse consumer tastes. Their specialization encompasses a range of offerings from personal fragrances to beauty-related products, ensuring a luxurious experience for their clientele. The brand is known for its commitment to sustainability and ethical sourcing, appealing both to environmentally conscious consumers and fragrance enthusiasts.",https://images.unsplash.com/photo-15907369626-6c63ac16f3df?w=400&h=300&fit=crop,www.fbbeauty.com,United Kingdom,2015,indie,contact@fbbeauty.com,+44 20 1234 5678,"123 Fragrance Lane, London, UK, EC1A 1BB",2025-07-18T12:32:10.942225,2025-08-28T14:36:31.667662
cmd4f15f02f49a356835b5e,FC Barcelona,"FC Barcelona is a professional football (soccer) club based in Barcelona, Spain, known for its rich history and cultural significance in the world of sports. Beyond its football operations, FC Barcelona has ventured into lifestyle and merchandise, including the creation of its own line of fragrances. The FC Barcelona perfumes embody the spirit and values of the club, aimed at fans and aficionados, blending sport with luxury in an innovative way.",https://www.fcbarcelona.com/resources/v3.1.5-7231/i/elements/badge-app-store.svg,https://www.fcbarcelona.com,Spain,1899,celebrity,,,,2025-07-18T12:32:10.942225,2025-08-28T14:36:37.705239
cmdc193a20903fd2741b881,FC Bayern München,"FC Bayern München is primarily known as a professional football club. However, they have ventured into branded fragrances, offering a line of perfumes that embody the essence and identity of the football club. Their perfumes often reflect the passion and loyalty of their fanbase and celebrate achievements in sports. The fragrance line aims to connect with fans both on and off the field, showcasing the club's image and values.",https://images.unsplash.com/photo-1582735689369-4fe89db7114c?w=400&h=300&fit=crop,https://www.fcbayern.com,Germany,1900,celebrity,,,"Säbener Str. 51-57, 81547 München, Germany",2025-07-18T12:32:10.942225,2025-08-28T14:36:53.727013
cmd760c6b4bc706c04fa389,fcuk,"FCUK, which stands for French Connection United Kingdom, is a British fashion brand founded in 1972. It is known for its edgy and provocative branding and has expanded its offerings to include a range of products, including clothing, accessories, and fragrances. The FCUK fragrance line was launched as an extension of its bold fashion identity, featuring a range of scents that appeal to a youthful, modern audience. The brand's fragrances are characterized by their contemporary designs and catchy marketing campaigns, often targeting consumers looking for unique and assertive scents.",https://www.frenchconnection.com/cdn/shop/files/AW25_Workwear_MM_077b8f10-8639-4a89-b45a-cff213db5df0.jpg?v=1754565198&width=300,https://www.frenchconnection.com,United Kingdom,1972,designer,,,,2025-07-18T12:32:10.942225,2025-08-28T14:37:00.760958
cmd6b380ac8cd94facf88d1,Federico Cantelli,"Federico Cantelli is a luxury perfume house known for its commitment to craftsmanship and artisanal approaches to fragrance creation. Founded by Italian perfumer Federico Cantelli, the brand emphasizes the use of high-quality natural ingredients and unique scent compositions. The company prides itself on creating exclusive and sophisticated fragrances that appeal to connoisseurs of niche perfumes, marketing its creations as a reflection of personal identity and artistic expression.",https://ss-pics.s3.eu-west-1.amazonaws.com/ci/1410492/large-MANGO.jpg?1756314167,www.federicocantelli.com,Italy,2015,niche,,,,2025-07-18T12:32:10.942225,2025-08-28T14:37:07.243793
cmd878b0686fd0fdf905f45,Federico Griffi,,https://images.unsplash.com/photo-1556909114-f6e7ad7d3136?w=400&h=300&fit=crop,https://www.federicogriffi.com,Italy,2016,niche,,,,2025-07-18T12:32:10.942225,2025-08-28T14:37:13.382319
cmdb5bf3d65e8d235873bdd,Federico Mahora,"Federico Mahora is a fragrance company that specializes in producing quality perfumes inspired by high-end brands, offering an affordable alternative to luxury scents. Founded with the aim of making fine fragrances accessible to a wider audience, they blend creativity and elegance in their perfume offerings. The brand is known for its wide range of options catering to both men and women, focusing on delivering strong scent profiles that appeal to various consumer tastes.",https://images.unsplash.com/photo-1582735689369-4fe89db7114c?w=400&h=300&fit=crop,https://federicamahora.com,Poland,2006,drugstore,,,,2025-07-18T12:32:10.942225,2025-08-28T14:37:19.311870
cmd698c7017d64b475c2aa8,Feel Oud,"Feel Oud is a perfume company that specializes in crafting high-quality oud-based fragrances. They focus on blending traditional Middle Eastern perfume-making techniques with modern aesthetics, creating unique scents that appeal to both regional and global markets. Their story is rooted in a deep appreciation for the cultural significance of oud in the fragrance world, and they aim to elevate this renowned ingredient by producing elegantly bottled perfumes that resonate with contemporary consumers.",https://images.unsplash.com/photo-15907369626-6c63ac16f3df?w=400&h=300&fit=crop,https://feeloud.com,United Arab Emirates,2019,niche,contact@feeloud.com,,,2025-07-18T12:32:10.942225,2025-08-28T14:37:25.552176
cmd8ea1382004026743c57a,Feel Unique,"Feel Unique is a UK-based online beauty retailer that specializes in a wide range of beauty products including perfumes, skincare, makeup, and hair products. Founded in 2005, the company has established itself as a leading destination for beauty enthusiasts, offering access to over 30,000 products from a variety of brands, both mainstream and niche. Feel Unique is known for its commitment to providing quality products and excellent customer service, making it a go-to source for beauty needs. The company prides itself on its extensive selection, competitive prices, and innovative approaches to the beauty shopping experience.",https://www.feelunique.com/assets/img/icons/sephora-logo.svg,https://www.feelunique.com,United Kingdom,2005,drugstore,,,,2025-07-18T12:32:10.942225,2025-08-28T14:37:33.748171
cmd0adbca493b0225eaf7c6,Felton Worldwide,"Felton Worldwide is a prominent player in the fragrance industry, specializing in the formulation and distribution of high-quality perfumes and scents. The company has built a strong reputation for its innovative fragrance creations that cater to both mainstream and exclusive markets. With a rich history steeped in tradition, Felton Worldwide prides itself on using the finest raw materials sourced globally, ensuring unique and captivating olfactory experiences. Their dedication to artistry and craftsmanship distinguishes their brand, enhancing customer loyalty and satisfaction.",https://images.unsplash.com/photo-1556909114-f6e7ad7d3136?w=400&h=300&fit=crop,www.feltonworldwide.com,United States,1998,niche,info@feltonworldwide.com,,,2025-07-18T12:32:10.942225,2025-08-28T14:37:41.323842
cmd0c235f745186a866849d,Feminista,"Feminista is a niche perfume company that specializes in creating unique and empowering fragrances designed for modern women. The brand focuses on celebrating femininity through scent, offering a range of perfumes that evoke strength, independence, and confidence. Each fragrance is meticulously crafted using high-quality ingredients, often inspired by diverse cultural elements and modern femininity. Feminista captures the essence of contemporary womanhood and aims to connect with consumers on a personal level through their stories and emotional appeal.",https://images.unsplash.com/photo-15907369626-6c63ac16f3df?w=400&h=300&fit=crop,www.feministaperfumes.com,United States,2020,niche,contact@feministaperfumes.com,,,2025-07-18T12:32:10.942225,2025-08-28T14:37:48.359045
cmd2d5a483680d4ded25e61,Fendi,"Fendi is an Italian luxury fashion house founded in 1925 by Adele and Edoardo Fendi. The brand initially specialized in high-quality leather goods, including handbags and luggage, and has since expanded its offerings to include ready-to-wear clothing, shoes, and accessories. Fendi is famous for its innovative designs, particularly the iconic 'Baguette' bag and the use of fur in their collections. In the fragrance segment, Fendi is recognized for crafting elegant and sophisticated perfumes that embody the brand's luxurious heritage.",https://images.unsplash.com/photo-15907369626-6c63ac16f3df?w=400&h=300&fit=crop,[www.fendi.com](http://www.fendi.com),Italy,1925,designer,,,"8, Via M. Venturi, 00187 Rome, Italy",2025-07-18T12:32:10.942225,2025-08-28T14:37:55.357331
cmdb27a817e278736333e79,Fenjal,"Fenjal is a Swiss brand known for its luxurious body care and fragrance products. Established in 1960, Fenjal combines high-quality ingredients with traditional perfumery techniques to create a distinctive wellness experience. The brand is celebrated for its focus on skin-friendly formulations that enhance the well-being of the user, making it popular among those seeking delicate and effective body care solutions. Fenjal's product range includes body lotions, shower gels, and fragrances that reflect their commitment to elegance and sophistication in personal care.",https://www.fenjal.ch/typo3conf/ext/fenjal/Resources/Public/Images/fenial.png,https://www.fenjal.ch/,Switzerland,1960,drugstore,,,,2025-07-18T12:32:10.942225,2025-08-28T14:38:02.844556
