id,name,description,image,website,country,founded,type,email,phone,address,createdAt,updatedAt
cmd491085433aadc9f10251,Inglot,"Inglot is a cosmetics company best known for its high-quality makeup products, including a range of fragrances. Founded in 1983 by Wojciech Inglot in Poland, the brand focuses on creating innovative formulations, vivid color palettes, and extensive customization options. Over the years, Inglot has expanded its product line to include perfumes that resonate with its commitment to quality and creativity, making it a favorite among beauty enthusiasts.",https://inglotcosmetics.com/img/logo-1715947222.svg,https://inglotcosmetics.com,Poland,1983,indie,,,,2025-07-18T12:32:10.942225,2025-08-28T16:55:25.453929
cmd9d4f157eac7c3cfa2ac0,Ingredients,"Ingredients is a niche perfume brand that emphasizes the use of natural and sustainable ingredients to create high-quality fragrances. They focus on transparency in sourcing and production, aiming to educate consumers about the raw materials used in perfumery. The brand was founded with a philosophy of minimalism and craftsmanship, drawing inspiration from global cultures and nature. Their unique blends often feature a balance of rare essential oils and modern synthetic notes.",https://images.unsplash.com/photo-1556909114-f6e7ad7d3136?w=400&h=300&fit=crop,,,,niche,,,,2025-07-18T12:32:10.942225,2025-08-28T16:55:30.927512
cmdc132caf84441118bf896,Ingrid Starnes,"Ingrid Starnes is a New Zealand-based fragrance house founded by designer Ingrid Starnes. The company specializes in creating unique, artisanal perfumes that reflect the essence of New Zealand's natural landscapes and urban environments. Offering a compelling blend of sophistication and originality, Ingrid Starnes' fragrances are characterized by their complex compositions and artistry, appealing to a niche market of perfume enthusiasts looking for distinctive scents. The brand’s emphasis on quality ingredients and craftsmanship sets it apart in the perfume industry.",https://images.unsplash.com/photo-1582735689369-4fe89db7114c?w=400&h=300&fit=crop,https://ingridstarnes.com,New Zealand,2012,niche,,,,2025-07-18T12:32:10.942225,2025-08-28T16:55:38.515236
cmd2c1b13b457d9260b02f2,Ingrid,"Ingrid is a perfume company that focuses on creating high-quality, sophisticated fragrances inspired by the diverse nature of femininity and beauty. Founded with the intention of providing an olfactory experience that transcends time and trends, Ingrid's offerings often highlight unique ingredients and craftsmanship. The brand emphasizes artisanal processes and seeks to connect with consumers through stories behind each scent.",https://images.unsplash.com/photo-1582735689369-4fe89db7114c?w=400&h=300&fit=crop,,,,indie,,,,2025-07-18T12:32:10.942225,2025-08-28T16:55:43.800836
cmd2201697af1c70ef025d9,Initio,"Initio is a niche perfume brand known for its luxurious and unique fragrances. Established by a passionate team of perfumers, Initio focuses on exploring the art of fragrance creation by blending high-quality ingredients with innovative techniques. The company draws inspiration from the mystical and transformative powers of scents, often emphasizing the emotional and psychological aspects of fragrance. Each perfume in their collection is crafted to evoke deep feelings and memories, making each scent a personal journey for the wearer. Their offerings are often characterized by bold combinations, rich compositions, and a signature depth that sets them apart in the perfume industry.",https://images.unsplash.com/photo-1582735689369-4fe89db7114c?w=400&h=300&fit=crop,https://initio-parfums.com,France,2015,niche,,,,2025-07-18T12:32:10.942225,2025-08-28T16:55:50.425691
cmd0e539ca0b7679423e309,Ink + Ocean Botanicals,"Ink + Ocean Botanicals is a niche perfume company that specializes in creating natural and botanical-based fragrances. Founded with a commitment to sustainability and eco-consciousness, the brand emphasizes the use of organic ingredients sourced from nature. Their unique scents are designed to evoke the tranquil essence of the ocean and its surroundings. The company aims to provide customers with luxurious, yet environmentally friendly fragrance options, focusing on holistic wellness and self-expression through scent.",https://images.unsplash.com/photo-1556909114-f6e7ad7d3136?w=400&h=300&fit=crop,https://www.inkoceanbotanicals.com,United States,2018,niche,hello@inkoceanbotanicals.com,,,2025-07-18T12:32:10.942225,2025-08-28T16:55:56.448412
cmd82e20e7922759a6b6efb,Innisfree,"Innisfree is a South Korean cosmetic brand founded by the parent company Amorepacific in 2000. The brand is renowned for its commitment to natural ingredients sourced from Jeju Island, South Korea, and it specializes in skincare and beauty products, including a wide range of perfumes. Innisfree focuses on environmental sustainability and eco-consciousness, incorporating green practices in both product development and packaging, thus catering to consumers who value natural and clean beauty products.",https://inm-cdn.innisfree.com/origin-image/display/banner/c366c025-2fcb-4954-b682-e1f42c1a0b1a.jpg,https://www.innisfree.com,South Korea,2000,indie,,,,2025-07-18T12:32:10.942225,2025-08-28T16:56:03.597236
cmd1f88dfd5c024f095515e,InnoFairs Messe,"InnoFairs Messe is a prominent organization that specializes in hosting trade fairs and exhibitions specifically focused on the perfume and fragrance industry. They play a vital role in connecting manufacturers, suppliers, and retailers, providing a platform for networking, showcasing new products, and facilitating business opportunities within the fragrance sector. Their fairs often feature a diverse range of companies, including niche brands, designer labels, and indie creators, making them a critical hub for industry innovation and collaboration.",https://images.unsplash.com/photo-1556909114-f6e7ad7d3136?w=400&h=300&fit=crop,www.innofairsmesse.com,Germany,,niche,,,,2025-07-18T12:32:10.942225,2025-08-28T16:56:09.534476
cmdae3b75754920aba9d436,Innovia Technology,"Innovia Technology is a company focused on advanced scent technologies. They specialize in developing innovative scent delivery systems and fragrances, often working with brands across various industries to enhance sensory experiences. The company leverages cutting-edge research and development in the field of olfaction and scent innovations, aiming to create unique atmospheric and personal fragrance solutions.",https://images.unsplash.com/photo-1587017539504-67cfbddac569?w=400&h=300&fit=crop,,,,indie,,,,2025-07-18T12:32:10.942225,2025-08-28T16:56:15.478385
cmde2375625b2387532704c,Innoxa,"Innoxa is an Australian-based fragrance and cosmetics company known for its dedication to creating quality products that enhance beauty and well-being. Established with a focus on purity and natural ingredients, Innoxa has a rich heritage in the formulation of perfumes as well as skincare and makeup products. Over the years, the brand has become synonymous with accessible luxury, aiming to cater primarily to those who seek elegant and timeless scents without the high price tag. Innoxa emphasizes botanical extracts and has developed a unique identity within the competitive fragrance market.",https://innoxa.com.au/cdn/shop/files/logo_400x_af598685-1774-410b-a831-c0cfedb878f9_small.png?v=1670803812,https://www.innoxa.com.au,Australia,1930,indie,,,,2025-07-18T12:32:10.942225,2025-08-28T16:56:22.122098
cmddcd96547b78707329e5f,Insider Parfums,"Insider Parfums is a niche perfume house known for its exclusive and artisanal fragrances. The company focuses on high-quality ingredients and craftsmanship, creating unique scents that cater to customers looking for one-of-a-kind olfactory experiences. Founded by a passionate team with deep roots in the fragrance industry, Insider Parfums aims to inspire and elevate personal expression through the art of perfumery.",https://insiderparfums.com/cdn/shop/files/Insider_Parfums_logo_final-02.png?v=1721119302&width=1828,www.insiderparfums.com,United States,2018,niche,contact@insiderparfums.com,,,2025-07-18T12:32:10.942225,2025-08-28T16:56:29.108260
cmdcc3653371cbd3ceda778,Insignia,"Insignia is a luxury perfume company that specializes in crafting high-quality, sophisticated fragrances. The brand emphasizes the importance of fine ingredients and expert craftsmanship, drawing inspiration from art and culture to create scents that are both unique and evocative. Established with a vision to redefine the luxury perfume market, they focus on storytelling through scent, allowing customers to connect emotionally with their products.",https://images.unsplash.com/photo-1587017539504-67cfbddac569?w=400&h=300&fit=crop,www.insigniaparfums.com,United States,2015,niche,info@insigniaparfums.com,,,2025-07-18T12:32:10.942225,2025-08-28T16:56:35.138013
cmd94c987dc3c04a3148326,Inspirations by Payard,"Inspirations by Payard is a fragrance company known for crafting unique and evocative scents that draw inspiration from the rich heritage and artistic vision of its founder. The brand emphasizes the artistry of perfume-making, often combining elements from various cultures to create luxurious and memorable experiences. Their product line typically includes a diverse range of fragrances catering to both men and women, celebrating the essence of creativity and refinement.",https://images.unsplash.com/photo-1587017539504-67cfbddac569?w=400&h=300&fit=crop,www.payardfragrances.com,United States,,niche,,,,2025-07-18T12:32:10.942225,2025-08-28T16:56:41.104302
cmd4ff0248de1ce9e692cbd,Inspiritu,"Inspiritu is a contemporary perfume company that focuses on creating unique and evocative scents inspired by various emotions and experiences. With a commitment to sustainability and the use of high-quality, natural ingredients, Inspiritu aims to provide its customers with a sensory journey that connects them to their inner selves and the world around them. The company's story began with a vision to craft fragrances that are not only delightful but also tell a story, allowing wearers to express their individuality through scent.",https://www.inspiritu.com/tun2u-hosting.jpg,www.inspiritu.com,United States,2015,indie,contact@inspiritu.com,,,2025-07-18T12:32:10.942225,2025-08-28T16:56:47.858397
cmdc1fdfb66a99eaa97bb13,Institut Tres Bien,"Institut Tres Bien is a niche perfume company that specializes in creating high-quality, artisanal fragrances. Founded in the spirit of individuality and storytelling, the brand emphasizes unique scent experiences that reflect creativity and innovation in perfumery. Their products often highlight the artistry of fragrance composition and are crafted using fine raw materials sourced from around the world, catering to discerning customers looking for exclusive and distinctive scents.",https://images.unsplash.com/photo-1556909114-f6e7ad7d3136?w=400&h=300&fit=crop,https://institut-tres-bien.com,France,2020,niche,contact@institut-tres-bien.com,,,2025-07-18T12:32:10.942225,2025-08-28T16:56:53.751897
cmd239bf046269f7bac12fd,Instituto Español,"Instituto Español is a Spanish company founded in 1903, known for producing a wide range of personal care products, including perfumes. Over its long history, the company has specialized in creating fragrances that cater to various demographics, nurturing a legacy of quality and affordability. They are recognized for their dedication to tradition while embracing modern trends in scent formulation. Additionally, they have established a strong presence in both domestic and international markets, focusing on accessibility of their products.",https://institutoespanol.com/wp-content/uploads/2021/03/logo-60.png,https://www.institutoespanol.com,Spain,1903,drugstore,,,,2025-07-18T12:32:10.942225,2025-08-28T16:57:03.236573
cmdd73cb0c3e17fdc127899,Instyle ActivEssence,"Instyle ActivEssence is a modern perfume company that focuses on creating unique and bold fragrances. Their story began with a vision to develop scents that not only evoke emotions but also reflect personal identity. The brand specializes in using high-quality ingredients while embracing sustainability in their production processes. Their philosophy intertwines tradition with contemporary design, aiming to bring a sense of luxury and accessibility to the fragrance industry.",https://images.unsplash.com/photo-1541643600914-78b084683601?w=400&h=300&fit=crop,www.instyleactivessence.com,United States,2015,indie,contact@instyleactivessence.com,,,2025-07-18T12:32:10.942225,2025-08-28T16:57:10.431105
cmd53a57b54f78d2a199f15,Intelligent Nutrients,"Intelligent Nutrients is a company founded by entrepreneur and Whole Foods Market co-founder Horst Rechelbacher in 2008, focusing on creating organic and naturally derived personal care products, including perfumes. The brand is committed to providing sustainable, eco-friendly products that are free from harmful chemicals and toxins, promoting overall health and wellness while enhancing beauty and vitality. Intelligent Nutrients positions itself as a pioneer in the field of clean and green beauty, advocating for environmental sustainability and consumer safety.",https://intelligentnutrients.com/cdn/shop/files/I-N_Logo_April_2025_White_300px.png?v=1744839152&width=301,https://www.intelligentnutrients.com,United States,2008,indie,,,,2025-07-18T12:32:10.942225,2025-08-28T16:57:17.058775
cmdd6f9f85fd311bcb8454b,Intelligent Skincare,"Intelligent Skincare is a perfume and skincare company that focuses on creating high-quality, eco-friendly products aimed at enhancing natural beauty through innovative formulations. The brand is known for its commitment to using sustainable ingredients and environmentally conscious practices in production. Their story revolves around the idea of merging sophisticated fragrance with advanced skincare solutions, allowing consumers to enjoy both benefits in one product line.",https://images.squarespace-cdn.com/content/v1/556f0ae7e4b00d4b3011ec92/1433341012782-HOTFG4Y02QXAN4NNIHW5/Intelligent+Skincare+Logo+PDF.png?format=1500w,https://www.intelligentskincare.com,United Kingdom,,indie,,,,2025-07-18T12:32:10.942225,2025-08-28T16:57:22.605497
cmd0b60fd1f8459de5bcbd4,Intelligent,"Intelligent is a perfume company that specializes in creating innovative and high-quality fragrances designed to enhance personal expression and individuality. The company prides itself on its ability to blend cutting-edge technology with traditional perfumery methods to craft unique scent profiles. Intelligent's story began with a vision to revolutionize the fragrance industry by focusing on sustainability and ethical sourcing of ingredients, ensuring that each product tells a story while remaining environmentally conscious.",https://images.unsplash.com/photo-1582735689369-4fe89db7114c?w=400&h=300&fit=crop,,,,indie,,,,2025-07-18T12:32:10.942225,2025-08-28T16:57:28.265714
cmd91be28f76a3b16b5c7b3,Inter Parfums,"Inter Parfums, Inc. is a prominent global player in the fragrance industry, involved in the development, production, and marketing of a diverse portfolio of fragrance products. Established in 1984, the company specializes in creating and distributing fragrances for both luxury and lifestyle brands. Inter Parfums collaborates with renowned fashion houses and celebrities to produce signature scents that resonate with their brand identities. With a focus on innovation and quality, Inter Parfums has built a reputation for its ability to capture the essence of its partners' brands in captivating fragrance form.",https://images.unsplash.com/photo-1556909114-f6e7ad7d3136?w=400&h=300&fit=crop,https://www.interparfumsinc.com,United States,1984,designer,,+1 (212) 983-0102,"551 Fifth Avenue, 15th Floor, New York, NY 10176, USA",2025-07-18T12:32:10.942225,2025-08-28T16:57:35.233862
cmd0d392416035d3717acc6,Intercosma West,"Intercosma West is a leading provider in the fragrance industry, specializing in the development and manufacture of private label and branded fragrances. The company has carved a niche for itself by focusing on innovative perfume solutions, catering to a diverse clientele that includes cosmetic companies, retailers, and luxury brands. Established in the early 2000s, Intercosma West combines creativity with cutting-edge technology to produce high-quality fragrances that resonate with consumers globally. Their expertise spans product development, scent creation, and marketing strategies, making them a key player in both the industrial and retail fragrance markets.",https://images.unsplash.com/photo-15907369626-6c63ac16f3df?w=400&h=300&fit=crop,https://www.intercosmawest.com,United States,2003,indie,,,,2025-07-18T12:32:10.942225,2025-08-28T16:57:42.490978
cmd1749a6540caa6a38d95f,International Classic Brands,"International Classic Brands is a well-established player in the fragrance industry, specializing in the creation and distribution of a diverse range of scent products. The company focuses on both classic and contemporary perfume lines, catering to various consumer preferences. With a rich history in the fragrance business, they emphasize quality and unique packaging, often drawing inspiration from timeless designs and cultural influences in their scent compositions.",https://images.unsplash.com/photo-1587017539504-67cfbddac569?w=400&h=300&fit=crop,http://www.internationalclassicbrands.com,United States,1982,designer,,,,2025-07-18T12:32:10.942225,2025-08-28T16:57:48.363499
cmd3f6d2ea3425db2c20d7d,International Cosmetics and Perfumes,"International Cosmetics and Perfumes (ICP) is a prominent player in the global fragrance market, specializing in the manufacture and distribution of high-quality perfumes and cosmetics. Established in 1984 in Dubai, UAE, the company has a rich heritage in the fragrance industry, focusing on the creation of signature scents that appeal to a diverse clientele. ICP collaborates with various renowned fragrance houses and brands, allowing them to offer a wide range of products including fine fragrances, skincare, and personal care items. Their commitment to quality and innovation has made them a trusted name in the industry.",https://images.unsplash.com/photo-1587017539504-67cfbddac569?w=400&h=300&fit=crop,https://www.icp-uae.com,United Arab Emirates,1984,niche,,,,2025-07-18T12:32:10.942225,2025-08-28T16:57:55.484012
cmddfe50184e78c27cd40bd,International Perfume Bottle Association,"The International Perfume Bottle Association (IPBA) is dedicated to the preservation and promotion of perfume and scent-related collectibles. Established by a group of passionate collectors and enthusiasts, the organization focuses on the appreciation and history of perfume bottles, including their artistic and technical design elements. They facilitate events, exhibitions, and networking among collectors, as well as providing resources for education related to the art of perfumery and the history of fragrance packaging.",https://www.ipba.org/sites/main/www/images/logo.png,https://www.ipba.org,United States,1994,niche,,,,2025-07-18T12:32:10.942225,2025-08-28T16:58:04.271620
cmd4fc41bf8fc5e1c31f196,Interneeds,"Interneeds is a dynamic perfume company specializing in creating innovative, high-quality fragrances for a diverse customer base. Established with a passion for scent, Interneeds focuses on understanding the emotional connection people have with fragrances and aims to enhance the everyday lives of its consumers. The company prides itself on using premium ingredients and modern scent technology to develop unique olfactory experiences. With a strong emphasis on sustainability and ethical sourcing, Interneeds also strives to minimize its environmental impact while producing exciting new fragrances that cater to market trends.",https://images.unsplash.com/photo-15907369626-6c63ac16f3df?w=400&h=300&fit=crop,,,,indie,,,,2025-07-18T12:32:10.942225,2025-08-28T16:58:10.499495
cmd093acaa717de1c63b023,Intertrade Europe,"Intertrade Europe specializes in the development and distribution of fine fragrances, as well as personal care products. Founded with a vision to combine creativity with a strong sense of marketing and innovation, they offer a wide array of scents catering to both emerging brands and established names in the perfume industry. Their expertise lies in sourcing high-quality ingredients and the creation of unique formulations, aimed at enhancing the customer experience and providing distinctive fragrances that stand out in the market.",https://images.unsplash.com/photo-1556909114-f6e7ad7d3136?w=400&h=300&fit=crop,https://www.intertrade-europe.com,Italy,1994,niche,,,,2025-07-18T12:32:10.942225,2025-08-28T16:58:16.081389
cmd2e748257866053c059f1,Intimate Brands,,https://images.unsplash.com/photo-1587017539504-67cfbddac569?w=400&h=300&fit=crop,https://www.intimatebrands.com,United States,1992,designer,,,,2025-07-18T12:32:10.942225,2025-08-28T16:58:34.267422
cmd1149208aec8970ec3a6f,Intimate Research,"Intimate Research is an innovative perfume company that focuses on creating fragrances that resonate with intimate emotions and personal connections. Established by a team of fragrance enthusiasts and researchers, the company combines scientific insights into scent perception with artistic fragrance creation, cultivating a niche market for sophisticated and meaningful scents. Their offerings often explore themes of intimacy, connection, and personal exploration, setting them apart in the industry.",https://images.unsplash.com/photo-1556909114-f6e7ad7d3136?w=400&h=300&fit=crop,www.intimateresearch.com,United States,2015,niche,info@intimateresearch.com,,,2025-07-18T12:32:10.942225,2025-08-28T16:58:41.241645
cmd138192b52ba51bc3b395,Intimissimi,"Intimissimi is a well-known lingerie and intimate apparel brand, part of the Calzedonia Group, which also offers a range of fragrances. Established in 1996 in Italy, the brand has successfully positioned itself in the fashion industry by providing products that blend elegance, comfort, and sexuality. Intimissimi is especially recognized for its attention to quality fabrics and craftsmanship, appealing to a broad demographic of women. Their line of perfumes complements the brand’s identity, focusing on sensuality and intimacy, enhancing the overall customer experience with their domestic collection that often reflects the same aesthetic as their apparel.",https://www.intimissimi.com/on/demandware.static/-/Library-Sites-IntimissimiContentLibrary/default/dw69511bf1/images/hp/splash/intimissimi-logo.svg,https://www.intimissimi.com,Italy,1996,designer,,,,2025-07-18T12:32:10.942225,2025-08-28T16:58:48.467514
cmd60372967442a05504089,Investindustrial,"Investindustrial is an Italian investment firm specializing in private equity and special situations. Although not a direct perfume company, Investindustrial has invested in several brands within the beauty and personal care sector, including fragrance companies. Their specialty lies in identifying and nurturing businesses with high growth potential, often through strategic partnerships and operational improvements. The firm has a strong focus on European markets and is known for its successful management of portfolio companies.",https://www.investindustrial.com/docroot/site-investindustrial/img/content/main-logo.svg,https://www.investindustrial.com,Italy,1990,indie,,,,2025-07-18T12:32:10.942225,2025-08-28T16:58:55.369402
cmdeaaa9bed6d20db21bd60,Invisible Places,"Invisible Places is a niche perfume brand dedicated to crafting uniquely personal fragrances that evoke memory and emotion. Founded by a group of renowned perfumers and creative artists, the company focuses on blending elements of olfactory art with personal storytelling, allowing each fragrance to represent an invisible experience or memory. Their specialty lies in creating small-batch, artisanal scents that are exclusive and often limited edition, emphasizing quality and individuality.",https://images.unsplash.com/photo-1587017539504-67cfbddac569?w=400&h=300&fit=crop,https://www.invisibleplaces.com,Portugal,2018,niche,contact@invisibleplaces.com,,,2025-07-18T12:32:10.942225,2025-08-28T16:59:01.448319
cmdd726a715f5081151ccdb,IPD Fragrances,"IPD Fragrances is a company specializing in the development and production of private label fragrances for various retailers and brands. Established in response to the growing demand for personalized scent offerings, IPD Fragrances focuses on creating unique fragrance formulations tailored to individual market needs. Their expertise in scent creation and innovative packaging solutions allows clients to enhance their brand portfolios with quality fragrances that resonate with consumers.",https://images.unsplash.com/photo-15907369626-6c63ac16f3df?w=400&h=300&fit=crop,https://www.ipdfragrances.com,United States,2009,indie,,,,2025-07-18T12:32:10.942225,2025-08-28T16:59:06.764225
cmd6813e4e909ade4b1e3a8,Ipuro,"Ipuro is a fragrance company specializing in home fragrances, including scented candles, room sprays, and diffuser products. Founded in Germany, Ipuro focuses on creating high-quality, innovative scent experiences designed to enhance living environments. The brand is committed to using natural and sustainable materials in their products, ensuring an appealing sensory experience while promoting a sense of well-being. Since its inception, Ipuro has expanded its product lines and gained recognition across various markets for its sophisticated scents and distinctive packaging.",https://www.ipuro.com/cdn/shop/files/ipuro-logo-white.png?v=1694533313&width=140,https://www.ipuro.com,Germany,2004,indie,,,,2025-07-18T12:32:10.942225,2025-08-28T16:59:13.873634
