id,name,description,image,website,country,founded,type,email,phone,address,createdAt,updatedAt
cmdfb7160b9835b0ed96f8e,Vurv,"Vurv is a niche perfume company known for creating artisanal fragrances that blend luxury with innovation. Established with the vision of bringing unique and bold scents to the fragrance world, Vurv focuses on high-quality ingredients and sustainable practices. Their story is rooted in a passion for olfactory art, and they often draw inspiration from various cultures and experiences to craft their distinctive perfume collections. Specializing in limited edition scents, Vurv aims to cater to individuals looking for something beyond mainstream offerings, marketing their products as exclusive and bespoke artworks in fragrance.",https://images.unsplash.com/photo-1587017539504-67cfbddac569?w=400&h=300&fit=crop,https://vurrperfumes.com,United States,2018,niche,info@vurrperfumes.com,,,2025-07-18T12:32:10.942225,2025-08-29T15:19:47.321643
cmde05d3a9e6c24318b7117,Vyrao,"Vyrao is a contemporary perfume brand founded by model and entrepreneur Yasmin Le Bon. The company focuses on creating premium fragrances that blend luxury with wellness, utilizing sustainably sourced botanicals. Each scent is designed to enhance well-being and encapsulate unique emotional experiences. Vyrao places special emphasis on environmental responsibility and carefully curates its ingredients to create fragrances that are both exquisite and mindful of their ecological impact. The brand's ethos is rooted in a holistic approach to beauty, aiming to uplift the spirit through scent.",https://vyrao.com/cdn/shop/files/vyrao_small.png?v=1666693912,https://www.vyrao.com,United Kingdom,2020,niche,,,,2025-07-18T12:32:10.942225,2025-08-29T15:19:54.547074
cmd8a495872ae0edffa532e,86 West,"86 West is a niche perfume company known for its innovative and artistic approach to fragrance creation. The brand emphasizes the importance of storytelling through scent, often inspired by personal narratives and emotions. Established by a team of fragrance enthusiasts, 86 West aims to produce high-quality, unique perfumes that resonate with wearers on a deeper level, focusing on craftsmanship and distinctive scent profiles.",https://images.unsplash.com/photo-1556909114-f6e7ad7d3136?w=400&h=300&fit=crop,https://www.86westfragrance.com,United States,2021,niche,,,,2025-07-18T12:32:10.942225,2025-08-29T15:20:00.613722
cmd85f58d0cae18b62b714f,William Gossage & Sons,"William Gossage & Sons was originally known for its production of soaps and cleaning products in the 19th century. The company has evolved over the years, but their historical roots are tied to quality and craftsmanship. In more recent times, they have ventured into the fragrance industry, focusing on delivering products that embody their legacy of quality. Their specialty lies in creating unique scents that resonate with tradition and nostalgia, often appealing to a market looking for classic yet innovative fragrances.",https://images.unsplash.com/photo-1541643600914-78b084683601?w=400&h=300&fit=crop,,United Kingdom,1800,niche,,,,2025-07-18T12:32:10.942225,2025-08-29T15:20:06.673735
cmd718703207bd1278420db,World of Chris Collins,"World of Chris Collins is a luxury perfume brand known for its niche fragrances that draw inspiration from different cultures and experiences around the globe. Founded by Chris Collins, the brand emphasizes artisanal craftsmanship and unique scent profiles, creating a distinguished selection of perfumes that cater to connoisseurs of fine fragrances. The story behind the brand includes the founder's passion for travel and discovery, which is reflected in the scents that capture various moments and emotions.",https://chriscollins.com/cdn/shop/files/CC_logo_white_385x66.jpg?v=1621867068,https://www.worldofchriscollins.com,United States,2015,niche,,,,2025-07-18T12:32:10.942225,2025-08-29T15:20:14.061725
cmd35153d5c60977dd142e8,Wajid Farah,"Wajid Farah is a perfume company that specializes in luxury fragrances inspired by Middle Eastern culture and heritage. The brand is known for creating unique scents that often incorporate traditional notes such as oud, rose, and spices, blending them into modern compositions that appeal to a global audience. Their goal is to bridge the gap between traditional perfumery and contemporary fashion, offering high-quality products that reflect their rich cultural background.",https://images.unsplash.com/photo-15907369626-6c63ac16f3df?w=400&h=300&fit=crop,,,,niche,,,,2025-07-18T12:32:10.942225,2025-08-29T15:20:19.784828
cmd04a4114a5990206a85d8,Wakeheart,"Wakeheart is an innovative perfume company specializing in creating sustainable and eco-friendly fragrances. Their mission focuses on blending artistry and nature while providing an immersive olfactory experience. Founded by a team passionate about holistic wellbeing, Wakeheart draws inspiration from natural elements, often incorporating vegan ingredients and sustainable practices to promote environmental consciousness. The brand emphasizes mindfulness and self-care, crafting scents that resonate with the spirit and enhance personal well-being.",https://images.unsplash.com/photo-1582735689369-4fe89db7114c?w=400&h=300&fit=crop,www.wakeheart.com,United States,2020,indie,contact@wakeheart.com,,,2025-07-18T12:32:10.942225,2025-08-29T15:20:25.677579
cmdc5efb02205d0facdf114,Walden,"Walden is a niche perfume company that focuses on creating unique fragrances inspired by the great works of literature, particularly the transcendentalist themes of nature and self-discovery. The brand was founded with the mission to evoke emotions and memories through scent, offering a deep connection to the art of perfumery. Each fragrance is crafted with high-quality ingredients, emphasizing a story and concept behind the scent, which appeals to those who appreciate both literature and intricate fragrance experiences.",https://images.unsplash.com/photo-15907369626-6c63ac16f3df?w=400&h=300&fit=crop,https://www.waldenperfumes.com,United States,2013,niche,,,,2025-07-18T12:32:10.942225,2025-08-29T15:20:32.478916
cmd25f454d29d64dace79f0,Wales Perfumery,"Wales Perfumery is a high-end fragrance house specializing in the creation of unique, artisanal perfumes inspired by the natural beauty and heritage of Wales. Their story began with a passion for capturing the essence of the Welsh landscape and culture through fragrance. The company focuses on using locally sourced ingredients and traditional craftsmanship to produce distinctive scents that tell a story, offering a personalized fragrance experience to customers.","https://static.wixstatic.com/media/ab03a6_d3e66edf0e3145a4b01dd3955a1733c9~mv2.jpg/v1/fill/w_170,h_109,al_c,q_80,usm_0.66_1.00_0.01,enc_avif,quality_auto/guardian%20logo.jpg",https://www.walesperfumery.com,United Kingdom,2019,niche,info@walesperfumery.com,,,2025-07-18T12:32:10.942225,2025-08-29T15:20:40.142339
cmd5451bb8442bcbedd9153,Walgreens Boots Alliance,"Walgreens Boots Alliance is a global leader in retail pharmacy, health and wellness products, and pharmacy-led health and beauty services. Formed through the merger of Walgreens and Alliance Boots, the company operates thousands of retail pharmacy locations, providing a range of products including prescription medications, health products, over-the-counter medications, and personal care items, as well as an assortment of perfumes and cosmetics. With a strong focus on customer care and a commitment to improving health outcomes, Walgreens Boots Alliance also integrates technology in their services for better customer experience.",https://images.unsplash.com/photo-1582735689369-4fe89db7114c?w=400&h=300&fit=crop,https://www.walgreensbootsalliance.com,United States,2014,drugstore,,,"108 Wilmot Road, Deerfield, IL 60015, United States",2025-07-18T12:32:10.942225,2025-08-29T15:20:46.199117
cmdb24f0c1bcca2cc522e56,Walgreens,"Walgreens is a pharmacy-led health and wellness company that operates a chain of drugstores across the United States. In addition to providing prescription and over-the-counter medications, Walgreens also offers a variety of beauty products, including a selection of perfumes and fragrances. Founded in 1901, Walgreens has established itself as a key player in the retail pharmacy landscape, focusing on convenience, customer service, and health services. The company has expanded over the years through various acquisitions and collaborations, ensuring a wide range of products catering to various consumer needs.",https://www.walgreens.com/images/adaptive/sp/logo-mywag.png,https://www.walgreens.com,United States,1901,drugstore,,1-800-925-4733,"200 Wilmot Rd, Deerfield, IL 60015, United States",2025-07-18T12:32:10.942225,2025-08-29T15:20:54.006146
cmd1554674f1997d8ba2a4d,Wallpaper* / Steidl,"Wallpaper* / Steidl is a collaboration between Wallpaper*, a prominent design and lifestyle magazine, and Steidl, a celebrated publishing house. This partnership focuses on creating artistic and innovative fragrances that reflect the aesthetics and philosophies of contemporary design and art. The company emphasizes collaborations with renowned creatives and artists to produce unique scents, merging the worlds of olfactory art and visual artistry. Their specialty lies in crafting niche perfumes that tell a story, encapsulating the essence of design and culture.",https://images.unsplash.com/photo-1582735689369-4fe89db7114c?w=400&h=300&fit=crop,https://www.wallpaper.com/perfume,United Kingdom,2009,niche,,,,2025-07-18T12:32:10.942225,2025-08-29T15:21:00.777200
cmdf2720466f7ca24783157,Warm NYC,"Warm NYC is a fragrance company known for creating high-quality, niche perfumes that promote a sense of warmth and comfort. Established by a passionate team, Warm NYC draws inspiration from the emotional connections that scents evoke, often focusing on the cozy and intimate aspects of life. The company specializes in crafting unique, artisanal fragrances that cater to a clientele seeking distinctive olfactory experiences. Their products often emphasize sustainability and ethical sourcing.",https://images.unsplash.com/photo-15907369626-6c63ac16f3df?w=400&h=300&fit=crop,https://www.warm.nyc,United States,2018,niche,,,,2025-07-18T12:32:10.942225,2025-08-29T15:21:07.499121
cmd20c7d0f76637e1d93b62,Warnaco,"Warnaco was an American company known for its apparel, activewear, and intimate apparel. It was founded in 1930 and eventually expanded into the fragrance market, associating itself with several fashion brands. Warnaco specialized in creating licensed fragrances for its subsidiary brands, focusing on enhancing their apparel offerings with complementary scent products. Due to its broad portfolio, Warnaco became synonymous with quality and style within both the apparel and fragrance industries.",https://images.unsplash.com/photo-1582735689369-4fe89db7114c?w=400&h=300&fit=crop,,United States,1930,designer,,,,2025-07-18T12:32:10.942225,2025-08-29T15:21:12.464124
cmd690e4e6f12eb9bdd18af,Warner Communications,"Warner Communications is primarily known as a media and entertainment conglomerate. While they primarily operate in film, television, and music industries, they are not directly a perfume company. Warner Communications has historically been involved in various branding and merchandising opportunities, including collaborations with fragrances, but does not have a dedicated perfume line or identity.",https://images.unsplash.com/photo-1556909114-f6e7ad7d3136?w=400&h=300&fit=crop,,United States,1972,Not applicable (Not a dedicated perfume company),,,,2025-07-18T12:32:10.942225,2025-08-29T15:21:18.523695
cmdf4553fd0333765eb7d77,Warner Cosmetics,"Warner Cosmetics is a fragrance company that specializes in creating high-quality perfumes and personal care products. Founded with a passion for craftsmanship, the company has built its reputation on blending innovative scent compositions with luxurious ingredients. They focus on creating unique fragrances that resonate with individual personalities and styles, catering to a wide range of consumers. Warner Cosmetics also emphasizes sustainability in their production processes, aiming to create eco-friendly products that do not compromise on quality or effectiveness.",https://images.unsplash.com/photo-1582735689369-4fe89db7114c?w=400&h=300&fit=crop,www.warnercosmetics.com,United States,2001,indie,contact@warnercosmetics.com,,"1234 Fragrance Lane, New York, NY 10001, USA",2025-07-18T12:32:10.942225,2025-08-29T15:21:24.698451
cmd7f7f17822f4f4b7e837c,Warner-Hudnut,"Warner-Hudnut is an American perfume company renowned for its classic fragrances and has been a significant player in the fragrance industry for decades. Founded in the early 20th century, the company initially gained popularity for its unique scents and has continued to innovate, adapting to changing consumer preferences while maintaining a commitment to quality. Their specialty lies in creating timeless, elegant fragrances that resonate with consumers looking for sophistication and tradition.",https://images.unsplash.com/photo-15907369626-6c63ac16f3df?w=400&h=300&fit=crop,,United States,1891,designer,,,,2025-07-18T12:32:10.942225,2025-08-29T15:21:30.482686
cmd5744a447d991d9bea2d6,Warner-Lambert Co,"Warner-Lambert Co. was a notable American pharmaceutical and consumer goods company, which was originally founded in the 19th century. While primarily recognized for its pharmaceutical products, the company also ventured into the fragrance sector, producing a variety of personal care items, including perfumes. Warner-Lambert was known for its innovative approach to product development and marketing, and it specialized in creating high-quality consumer goods that met the needs of a diverse clientele. The company eventually merged with Pfizer in 2000, expanding its influence in both the pharmaceutical and consumer health markets.",https://images.unsplash.com/photo-1587017539504-67cfbddac569?w=400&h=300&fit=crop,,United States,1856,drugstore,,,,2025-07-18T12:32:10.942225,2025-08-29T15:21:37.106921
cmd8e5b25adb792e6bf994c,Warot,"Warot is an innovative perfume company known for its unique approach to fragrance creation. The brand emphasizes artisanal craftsmanship and emphasizes sustainable sourcing of materials, blending traditional techniques with modern sensibilities to create captivating scents. Warot aims to tell stories through its fragrances, often inspired by nature and emotional experiences. The company has developed a reputation in the niche perfume market for its limited edition releases and exclusive collaborations with artists and perfumers.",https://images.unsplash.com/photo-1541643600914-78b084683601?w=400&h=300&fit=crop,www.warotperfumes.com,France,2021,niche,contact@warotperfumes.com,,"12 Rue des Fleurs, 75008 Paris, France",2025-07-18T12:32:10.942225,2025-08-29T15:21:42.921894
cmdc7ad37dd87c6e3714924,Wary Meyers,"Wary Meyers is a luxury candle and fragrance company founded by design duo Anne and Patrick Meyers. The brand focuses on creating unique, artisanal fragrances and home scents that combine high-quality ingredients and sophisticated aesthetics. Known for their eclectic and whimsical scent combinations, Wary Meyers emphasizes craftsmanship and a personal touch in their products, reflecting their background in design and art. Their candles and perfumes are often inspired by a diverse range of artistic influences and experiences, making them distinctive in the niche fragrance market.",https://warymeyers.com/cdn/shop/files/WMcolor2_68883e88-3946-42d0-8383-fdbbdf9a3c79.jpg?v=1735832813&width=382,https://www.warymeyers.com,United States,2009,niche,,,,2025-07-18T12:32:10.942225,2025-08-29T15:21:52.606853
cmd03f88dc244c66bbc79b4,Washington Tremlett,"Washington Tremlett is a niche fragrance company that focuses on crafting unique and high-quality perfumes. The company was founded by a visionary perfumer with a passion for creating exquisite scents that tell a story. With a commitment to artisanal techniques and sourcing rare ingredients, Washington Tremlett specializes in limited-edition fragrances that appeal to discerning customers who value exclusivity and craftsmanship. Their collections often draw inspiration from nature and art, making each scent a unique narrative experience.",https://images.unsplash.com/photo-1587017539504-67cfbddac569?w=400&h=300&fit=crop,https://www.washingtontremlett.com,United Kingdom,2020,niche,info@washingtontremlett.com,,,2025-07-18T12:32:10.942225,2025-08-29T15:21:57.980626
cmd484f91d57accb3aad726,Wasserstein Perella,"Wasserstein Perella is a luxury perfume company known for its artisanal approach to fragrance creation. Founded by fragrance enthusiasts, the company specializes in crafting unique, high-quality scents that evoke specific emotions and memories. With a commitment to using only the finest ingredients, Wasserstein Perella has carved a niche in the perfume market, appealing to discerning customers who value exclusivity and artistry in their fragrances.",https://images.unsplash.com/photo-1541643600914-78b084683601?w=400&h=300&fit=crop,,,,niche,,,,2025-07-18T12:32:10.942225,2025-08-29T15:22:06.196486
cmd8341d215f570b781a84f,Waterford,"Waterford is renowned for its luxury crystal glassware, and they have extended their craftsmanship into the fragrance market, offering a collection of perfumes that epitomize elegance and sophistication. The Waterford brand has a rich heritage, which began with the establishment of its glass factory in 1783 in Waterford, Ireland. Their fragrances often draw inspiration from the crystal's design, integrating high-quality ingredients to create unique scents that embody the same level of artistry found in their glass products.",https://www.waterford.com/-/media/waterford/images/waterford-logo-svg.svg?la=en-US&hash=59C08C309B329B2D8DA18A130BBAD781,https://www.waterford.com,Ireland,1783,designer,,,,2025-07-18T12:32:10.942225,2025-08-29T15:22:13.717882
cmd0cc538efc45c9172b06a,Waters + Wild,"Waters + Wild is a perfume company that specializes in creating artisanal fragrances inspired by nature. The brand focuses on the use of ethically sourced ingredients and sustainable practices. Their story began with a passion for the outdoors and a desire to capture the essence of natural landscapes in bottle form, translating the beauty of the wild into unique scent experiences. Waters + Wild is known for its commitment to craftsmanship and natural scents, offering a curated selection of fragrances that evoke memories and emotions tied to nature.",https://images.squarespace-cdn.com/content/v1/5698e6021a5203aa7d45f827/32ea4321-8a9f-43cd-a1ca-9a197d796221/W%2BW-white.png,https://www.watersandwild.com,United States,2019,indie,,,,2025-07-18T12:32:10.942225,2025-08-29T15:22:20.400091
cmd3feb494b92bba310777b,Wax Poetic,"Wax Poetic is a niche perfume company known for its artisanal approach to fragrance creation. Established by a team of passionate perfumers, the company focuses on blending unique scent profiles that tell a story and evoke emotions. They pride themselves on using high-quality ingredients and sustainable practices, often taking inspiration from art, literature, and personal experiences to craft their signature fragrances. Wax Poetic has built a reputation for its limited-edition collections and collaboration with local artists, ensuring each scent is not just a product but a piece of art.",https://images.unsplash.com/photo-1587017539504-67cfbddac569?w=400&h=300&fit=crop,www.waxpoeticperfumes.com,United States,2015,niche,info@waxpoeticperfumes.com,,"123 Fragrance Lane, Scent City, CA 90210, USA",2025-07-18T12:32:10.942225,2025-08-29T15:22:25.878938
cmd32376c34211997442f41,WCW,"WCW (World Class Wrestling) is a unique perfume company that specializes in creating fragrances inspired by the world of professional wrestling. The brand aims to encapsulate the essence of strength, charisma, and entertainment through expertly crafted perfume lines. Established by wrestling enthusiasts, WCW combines the theatricality of wrestling with the artistry of perfumery, resulting in fragrances that appeal to both fans and collectors alike. They emphasize quality ingredients and unique scent profiles that reflect the personalities of legendary wrestling stars.",https://images.unsplash.com/photo-1582735689369-4fe89db7114c?w=400&h=300&fit=crop,www.wcwfragrances.com,United States,2021,indie,contact@wcwfragrances.com,,,2025-07-18T12:32:10.942225,2025-08-29T15:22:31.999104
cmdc476ac42fc5a556c5a59,We are Curators,"We are Curators is a niche perfume company that specializes in offering a curated selection of unique and artisanal fragrances. Founded by a team of fragrance enthusiasts and experts, the company aims to elevate the perfume buying experience by focusing on quality over quantity. They emphasize storytelling in their selections, connecting consumers with the inspiration behind each fragrance and the artisans who create them. Their collections often feature limited editions and exclusive scents, appealing to customers seeking distinctive olfactory experiences.",https://images.unsplash.com/photo-1582735689369-4fe89db7114c?w=400&h=300&fit=crop,https://wearecurators.com,United States,2013,niche,,,,2025-07-18T12:32:10.942225,2025-08-29T15:22:38.476279
cmd367396a48ab2ac61e91a,We Love Candles,"We Love Candles is a company specializing in high-quality scented candles and home fragrance products. Founded by a passionate team of fragrance enthusiasts, the brand aims to create a unique sensory experience that transforms any space into a warm and inviting environment. Their products are crafted using premium ingredients, and each candle is designed to evoke specific emotions and memories, making them a favorite among home decor and fragrance aficionados.",https://images.unsplash.com/photo-1556909114-f6e7ad7d3136?w=400&h=300&fit=crop,https://www.welovecandles.com,United Kingdom,2015,indie,contact@welovecandles.com,,,2025-07-18T12:32:10.942225,2025-08-29T15:22:54.738320
cmdedb83167442ef701d1fb,We Wear Perfume,"We Wear Perfume is a contemporary fragrance company focused on creating unique and personalized scents for a diverse clientele. Founded by a team of fragrance enthusiasts, the company emphasizes individuality and self-expression through their innovative perfume blends. We Wear Perfume aims to redefine the way people experience and interact with fragrance, offering a range of products that can cater to various tastes and styles. Their specialty lies in crafting high-quality, artisanal perfumes that cater to both classic and avant-garde preferences, turning fragrance into a staple of personal identity.",https://www.wewearperfume.com/wp-content/uploads/2024/08/arnaud-02-360x220.jpg,https://www.wewearperfume.com,United States,2018,indie,contact@wewearperfume.com,,,2025-07-18T12:32:10.942225,2025-08-29T15:23:02.295200
cmda9d3d5eb963ab543aa33,Weil,"Weil is a renowned French perfume house established in 1947 by the perfumer and businessman, Jacques Weil. The company is known for its unique and innovative fragrances that blend traditional techniques with contemporary styles. Weil has introduced a variety of classic and modern scents, making a significant impact in the niche perfume market. The brand’s signature approach focuses on quality and the artistic expression of fragrance, often drawing inspiration from nature and art.",https://images.unsplash.com/photo-1556909114-f6e7ad7d3136?w=400&h=300&fit=crop,http://www.weil-parfums.com,France,1947,niche,,,,2025-07-18T12:32:10.942225,2025-08-29T15:23:08.383148
cmd51f2b95ddf03c67478f4,Weleda,"Weleda is a Swiss company renowned for its holistic and natural approach to skincare and aromatherapy. Founded in 1921 by philosopher Rudolf Steiner and Dr. Ita Wegman, Weleda started by creating homeopathic medicines. Over the years, it evolved into a wellness brand focused on organic and biodynamic ingredients for skincare, body care, and fragrances. With a commitment to sustainability and natural ingredients, Weleda is celebrated for its effective products crafted from plant-based elements, promoting a philosophy of beauty that connects deeply with nature.",https://www.weleda.com/cdn-cgi/image/width=112%2Cq=80%2Cf=auto%2Csharpen=0.7%2Cdpr=2/binaries/_cb_1686142942715/contentSquare/content/gallery/global/assets/certifications/logo_natrue.png,https://www.weleda.com,Switzerland,1921,indie,,,,2025-07-18T12:32:10.942225,2025-08-29T15:23:15.444710
cmde32acd187b8883b8fd2c,Well-Sewn,"Well-Sewn is a boutique perfume house dedicated to creating unique fragrances that blend art and storytelling. Founded by a group of passionate perfumers and artists, Well-Sewn focuses on using sustainable and high-quality ingredients, resulting in distinctive scents that evoke emotions and memories. The company prides itself on its artisanal approach, where each fragrance is meticulously crafted to reflect a narrative, appealing to both scent enthusiasts and those seeking personalized olfactory experiences.",https://well-sewn.com/wp-content/uploads/2022/06/Vector-File-01-logo.png,www.well-sewn.com,United States,2021,niche,contact@well-sewn.com,,,2025-07-18T12:32:10.942225,2025-08-29T15:23:22.601197
