id,name,description,image,website,country,founded,type,email,phone,address,createdAt,updatedAt
cmda31fffcf66325c2406e6,Salvatore Regio,"Salvatore Regio is a niche perfume house that specializes in crafting unique fragrances with an Italian flair. The brand is known for its artistic approach to perfumery, often combining traditional methods with modern creative influences. Salvatore Regio focuses on high-quality ingredients and believes in storytelling through scent, making each fragrance a personal experience for the wearer. The company has gained recognition for its limited edition releases and bespoke services, catering to customers who seek individuality in their fragrance choices.",https://images.unsplash.com/photo-15907369626-6c63ac16f3df?w=400&h=300&fit=crop,https://www.salvatoreregio.com,Italy,2015,niche,,,,2025-07-18T12:32:10.942225,2025-08-29T12:26:31.460408
cmd533acf11954606bd9123,Sam Edelman,"Sam Edelman is primarily recognized as a footwear brand, but they have diversified into fragrances as part of their lifestyle offerings. Founded by designer Sam Edelman and his partner, they focus on creating high-quality and stylish products that reflect a modern and chic aesthetic. The fragrance line embodies the same spirit of creativity and fashion-forward thinking that defines their shoes and accessories, aiming to captivate consumers with appealing scents that represent an effortless, carefree lifestyle.",https://images.unsplash.com/photo-1582735689369-4fe89db7114c?w=400&h=300&fit=crop,https://www.samedelman.com,United States,2004,designer,,,,2025-07-18T12:32:10.942225,2025-08-29T12:26:37.805398
cmd0bc009edeaca6b9aea97,Samanda,"Samanda is a burgeoning perfume company known for crafting unique and artisanal fragrances that emphasize natural ingredients and sustainability. The brand emerged from a passion for perfumery and aims to offer exquisite scents that resonate with the individuality of its users. Samanda combines traditional techniques with modern sensibilities, ensuring each fragrance tells a compelling story while appealing to contemporary consumers seeking authenticity.",https://images.unsplash.com/photo-1556909114-f6e7ad7d3136?w=400&h=300&fit=crop,www.samandaperfumes.com,United States,2021,indie,contact@samandaperfumes.com,,,2025-07-18T12:32:10.942225,2025-08-29T12:26:44.187742
cmd4d3d7b11754b0b588926,Samantha Faiers,"Samantha Faiers is a British television personality and entrepreneur who launched her own line of perfumes, appealing primarily to her fan base and the broader fragrance market. Known for its chic and feminine scents, Samantha Faiers’ perfume collection reflects her personal style and lifestyle brand. Faiers gained fame from reality TV and leveraged her popularity by creating products that resonate with her audience, focusing on quality and elegance in fragrance creation.",https://images.unsplash.com/photo-1541643600914-78b084683601?w=400&h=300&fit=crop,https://www.samanthafaiers.com,United Kingdom,2016,celebrity,,,,2025-07-18T12:32:10.942225,2025-08-29T12:26:50.230307
cmda6901ffc93c852b74e37,Samar,"Samar is a fragrance company known for its unique and evocative scents that draw inspiration from diverse cultural heritages. The company specializes in creating artisanal perfumes that resonate with individuality and creativity, crafted from high-quality ingredients sourced globally. Samar's story is rooted in a passion for perfumery and a commitment to sustainability, making each fragrance not just a scent but an experience that reflects personal and cultural narratives.",https://images.unsplash.com/photo-1587017539504-67cfbddac569?w=400&h=300&fit=crop,,,,indie,,,,2025-07-18T12:32:10.942225,2025-08-29T12:26:56.265913
cmd2b9862fea3dbd9d1278a,Sammarco,,https://images.squarespace-cdn.com/content/v1/525dd835e4b0c7141e880260/1419359956662-G82Z0IE6Z1J7QSYIXGBR/volvo-cars-logo-uk-quality-technology-software.jpg?format=500w,https://www.sammarco.com,Italy,2015,niche,,,,2025-07-18T12:32:10.942225,2025-08-29T12:27:03.823461
cmd4b09767e7afed4cdcd74,Samouraï,"Samouraï is a fragrance company established in the 1990s that draws inspiration from the Japanese samurai culture. The brand is known for creating bold, distinctive scents that evoke a sense of adventure and strength, often emphasizing themes of honor and tradition. Their products typically cater to both men and women and include a range of Eau de Toilettes, body sprays, and other personal care items. Positioned at the intersection of elegance and authenticity, Samouraï has developed a loyal following among consumers looking for unique and evocative fragrances.",https://images.unsplash.com/photo-1541643600914-78b084683601?w=400&h=300&fit=crop,https://www.samourai-parfums.com,France,1995,niche,,,,2025-07-18T12:32:10.942225,2025-08-29T12:27:10.037650
cmd357fe7a94303dfd25177,Sampter's,"Sampter's is a unique perfume house known for its artisanal approach to fragrance creation. Established with a vision to blend tradition and innovation, the company specializes in crafting high-quality perfumes that evoke emotion and memories. With a commitment to using natural ingredients and sustainable practices, Sampter's has created a niche in the market for individuals seeking personalized and evocative scents.",https://images.unsplash.com/photo-15907369626-6c63ac16f3df?w=400&h=300&fit=crop,https://www.sampters.com,United States,2020,niche,contact@sampters.com,,"123 Fragrance Ave, Suite 100, Springfield, USA",2025-07-18T12:32:10.942225,2025-08-29T12:27:16.558085
cmdef5ed02823299bc44873,Sana Jardin,"Sana Jardin is a niche perfume company known for creating luxurious fragrances that are inspired by the rich culture of Morocco. Founded by Amy Christiansen Si-Ahmed, the brand is celebrated for its commitment to sustainability and female empowerment in the fragrance industry. Sana Jardin focuses on providing unique olfactory experiences while using ethical practices, including sourcing raw materials from local Moroccan communities and embracing a circular economy model where used perfume bottles are returned for reuse.",https://sanajardin.com/cdn/shop/files/SJ_LOGO_BLACK_2x_b114f9ac-92ff-48e2-8bc9-973e488dd622.svg?v=1721322869&width=400,https://www.sanajardin.com,United Kingdom,2018,niche,,,,2025-07-18T12:32:10.942225,2025-08-29T12:27:24.206847
cmd962b23a53b5d24f5a365,Sanae Intoxicants,"Sanae Intoxicants is a niche perfume company known for its artisanal and evocative fragrances that draw inspiration from natural and cultural elements. The company focuses on creating unique scent experiences that aim to transport users to different worlds. Founded by a passionate perfumer, Sanae Intoxicants takes pride in meticulously crafting each fragrance using high-quality ingredients and innovative techniques, establishing a distinct market presence among fragrance enthusiasts.",https://www.sanaeintoxicants.com/cdn/shop/files/Untitled_design_2.png?v=1724335987&width=600,www.sanaeintoxicants.com,United States,2019,niche,info@sanaeintoxicants.com,,,2025-07-18T12:32:10.942225,2025-08-29T12:27:32.125697
cmd4e24fd2192935ce5a1c0,Sanborns,"Sanborns is a well-known retail chain and department store in Mexico that also operates in the perfume industry. Originally founded as a bookstore in 1903, Sanborns has grown to become a significant hub for lifestyle products, including a variety of fragrances. The company specializes in bringing both international and domestic perfume brands to the Mexican market, offering a diverse assortment of products that cater to different tastes and preferences. Over the years, Sanborns has established itself not only as a retail destination but also as a cultural icon within Mexico, providing a unique shopping experience.",https://images.unsplash.com/photo-1582735689369-4fe89db7114c?w=400&h=300&fit=crop,http://www.sanborns.com.mx,Mexico,1903,designer,,,,2025-07-18T12:32:10.942225,2025-08-29T12:27:40.239990
cmd3eb420c39a632b5b8d57,Sanctuary,"Sanctuary is a wellness and beauty brand known for its luxurious range of products including fragrances, skincare, and body care. The company's ethos revolves around creating a sense of sanctuary and self-care through immersive experiences and high-quality formulations. They emphasize the use of natural ingredients and have a strong commitment to sustainability, aiming to provide products that enhance well-being while being environmentally friendly.",https://images.unsplash.com/photo-1541643600914-78b084683601?w=400&h=300&fit=crop,https://www.sanctuary.com,United Kingdom,1992,indie,,,,2025-07-18T12:32:10.942225,2025-08-29T12:27:46.763758
cmd76ac1665195f0059bd15,Sanctum Soho,"Sanctum Soho is a luxury scent brand that draws inspiration from the vibrant ethos of Soho, London. They specialize in creating unique, artisanal perfumes that evoke the eclectic spirit and energy of the area. The brand is committed to using high-quality, natural ingredients to craft distinctive fragrances that resonate with individuality and creativity. Their story is rooted in a passion for the arts and a tribute to the diverse culture of Soho, making them a standout in the niche perfume market.",https://images.unsplash.com/photo-1556909114-f6e7ad7d3136?w=400&h=300&fit=crop,https://sanctumsoho.com,United Kingdom,2009,niche,,,,2025-07-18T12:32:10.942225,2025-08-29T12:27:53.219918
cmd491cd1726a3d8232fdaa,Sand + Fog,"Sand + Fog is a lifestyle brand known for its artisanal candles and fragrance products. Established with a vision of creating high-quality home scents that evoke positivity and warmth, the company specializes in crafting unique fragrances inspired by nature and personal experiences. Their product line includes candles, diffusers, and room sprays, focusing on using clean ingredients and sustainable practices. Sand + Fog is dedicated to enhancing everyday moments with delightful scents, making it a popular choice among consumers who appreciate both aesthetics and quality.",https://images.unsplash.com/photo-1541643600914-78b084683601?w=400&h=300&fit=crop,https://www.sandandfog.com,United States,2013,indie,,,,2025-07-18T12:32:10.942225,2025-08-29T12:28:00.519540
cmd47a43ce64384b1f60adc,Sandovalis,"Sandovalis is a niche perfume house that specializes in creating unique and artisanal fragrances inspired by the enchanting essence of nature and cultural experiences. Founded by a group of passionate perfumers, the brand focuses on quality ingredients and craftsmanship, ensuring that each fragrance tells a story and evokes emotion. Sandovalis embraces the art of fragrance-making by blending traditional methods with innovative approaches, aiming to bring a sensory journey to its customers through thoughtfully composed scents.","https://static.wixstatic.com/media/12b48a_30f5344dfa674233ba8f797fec7559b7.jpg/v1/fill/w_210,h_128,al_c,q_80,usm_0.66_1.00_0.01,enc_avif,quality_auto/12b48a_30f5344dfa674233ba8f797fec7559b7.jpg",www.sandovalis.com,Italy,2018,niche,,,,2025-07-18T12:32:10.942225,2025-08-29T12:28:09.780308
cmdc9667142f51f973a47ac,Sandro,"Sandro is a French fashion luxury brand that was founded in 1984 by Moroccan-born designer Evelyne Chetrite. The brand is known for its modern, chic, and effortless style, focusing primarily on ready-to-wear collections for men and women. Sandro entered the fragrance market to complement its fashion lines, offering perfumes that embody the elegance and sophistication reflected in its clothing designs. The fragrances typically feature fresh, floral, and sophisticated notes that appeal to the contemporary consumer seeking a sense of luxury.",https://www.sandro-paris.com/on/demandware.static/Sites-Sandro-US-Site/-/default/dw50cf6ce2/images/brand-logo/logo-sandro-white.svg,https://www.sandro-paris.com,France,1984,designer,,,,2025-07-18T12:32:10.942225,2025-08-29T12:28:17.091835
cmd97a1d3c5d09752450551,Sanofi Beauté,"Sanofi Beauté is a prominent fragrance and cosmetics company known for creating innovative and high-quality perfumes. Part of the larger Sanofi group, which initially focused on health and pharmaceuticals, Sanofi Beauté specializes in the development and marketing of fragrances that resonate with modern trends while respecting the tradition of fine perfumery. The company is committed to sustainability and ethical sourcing of ingredients, offering an array of fragrances that appeal to diverse consumer preferences.",https://images.unsplash.com/photo-1587017539504-67cfbddac569?w=400&h=300&fit=crop,[https://www.sanofibeauty.com](https://www.sanofibeauty.com),France,2001,designer,,,"54 Rue La Boétie, 75008 Paris, France",2025-07-18T12:32:10.942225,2025-08-29T12:28:31.123943
cmdb41621e373cb2b18716e,Sanrio [Hello Kitty],"Sanrio Co., Ltd. is a Japanese company best known for its creation of the iconic character Hello Kitty and several other character brands. Founded in 1960, Sanrio specializes in designing, developing, and licensing products featuring its characters, including fragrances, stationery, fashion, and accessories. The company has cultivated a significant cultural impact by promoting various forms of merchandise that resonate with fans worldwide, particularly through collaborations with artists and other brands. Sanrio’s approach combines kawaii (cute) culture with lifestyle products, setting it apart in the global market.",https://www.sanrio.com/cdn/shop/files/04142022_ecomm_bannerwallpapers_005_2000x.gif?v=1650050690,https://www.sanrio.com,Japan,1960,designer,,,"3411 W. 6th Street, Los Angeles, CA 90020, USA (Sanrio's U.S. office)",2025-07-18T12:32:10.942225,2025-08-29T12:28:46.915302
cmd6691a221871df387f049,Sans Soucis,"Sans Soucis is a German perfume and cosmetics brand that specializes in skincare and scent products that promote well-being. Founded on the principles of beauty and nature, the company emphasizes the use of natural ingredients to enhance skin health and fragrance experiences. Their products are infused with minerals from the thermal waters of Baden-Baden, aiming to create a holistic approach to beauty. Over the years, they have developed a loyal customer base in Europe and beyond, celebrating the synergy between beauty and wellness.",https://sanssoucis.de/cdn/shop/files/CSS_Brunnen.png?height=30&v=1668590384,https://www.sanssoucis.com,Germany,1961,niche,,,,2025-07-18T12:32:10.942225,2025-08-29T12:28:55.442277
cmd3040ad6d9e80ffce5ab2,Santa Eulalia,"Santa Eulalia is a luxury boutique established in Barcelona, Spain, known for its exclusive selection of high-end fashion and niche perfumery. Founded in 1843, it has become a reference point for contemporary and avant-garde pieces, emphasizing craftsmanship and unique design. The company carries a curated range of artisanal perfumes, focusing on quality and originality, and often collaborates with emerging and established fragrance houses to offer unique scents.",https://images.unsplash.com/photo-1556909114-f6e7ad7d3136?w=400&h=300&fit=crop,[https://www.santaeulalia.com](https://www.santaeulalia.com),Spain,1843,niche,,,"Carrer de Pau Claris, 167, 08037 Barcelona, Spain",2025-07-18T12:32:10.942225,2025-08-29T12:29:02.014302
cmd2febf9fa9113317a949e,Santa Maria Novella,"Santa Maria Novella is one of the oldest pharmacies in the world, established in Florence, Italy. Founded by monks of the Dominical Order in 1221, it produces luxury perfumes, cosmetics, and wellness products. Known for its natural formulation and artisan craftsmanship, Santa Maria Novella specializes in high-quality fragrances inspired by historical botanical recipes, and offers a unique range of scents derived from various herbs, flowers, and spices. Their products reflect a deep sense of tradition and elegance, making them highly sought after in the niche fragrance market.",https://images.unsplash.com/photo-1587017539504-67cfbddac569?w=400&h=300&fit=crop,https://www.santamarianovella.com,Italy,1221,niche,,+39 055 216276,"Via della Scala, 16, 50123 Firenze FI, Italy",2025-07-18T12:32:10.942225,2025-08-29T12:29:19.046085
cmded49796621886301030c,Sante,"Sante is a perfume company that focuses on creating unique and high-quality fragrances with an emphasis on natural ingredients. Founded in the spirit of sustainability, Sante prides itself on crafting scents that are not only aromatic but also environmentally friendly, appealing to individuals who value eco-conscious products. The brand has gained recognition for its artisanal approach, using traditional techniques combined with innovative practices to develop distinctive scents that resonate with consumers.",https://images.unsplash.com/photo-1582735689369-4fe89db7114c?w=400&h=300&fit=crop,https://www.sante-aromatherapy.com,Germany,2010,indie,info@sante-aromatherapy.com,,,2025-07-18T12:32:10.942225,2025-08-29T12:29:25.912290
cmd2aa799cf86bd2d38658e,Santi Burgas,"Santi Burgas is a niche perfume house renowned for its artisanal approach to fragrance creation. Founded by master perfumer Santi Burgas, the company blends traditional techniques with modern inspiration to craft unique scents that are often influenced by cultural and artistic themes. Their commitment to quality is reflected in the use of premium ingredients and the limited production of their fragrances, making them a sought-after choice for connoisseurs of fine perfumes.",https://santiburgas.com/img/logo.jpg,https://santiburgas.com,Spain,2012,niche,,,,2025-07-18T12:32:10.942225,2025-08-29T12:29:34.238082
cmd1f21d9efb6acdce04403,Santini,"Santini is a renowned fragrance company that specializes in creating high-quality perfumes with a focus on artisanal craftsmanship. Established with a passion for olfactory artistry, Santini combines innovative scent compositions with traditional techniques, drawing inspiration from nature and art. The brand has developed a loyal following for its unique and sophisticated fragrances that cater to discerning customers looking for exclusivity and elegance in their scent choices.",https://images.unsplash.com/photo-15907369626-6c63ac16f3df?w=400&h=300&fit=crop,www.santinifragrances.com,Italy,2010,niche,contact@santinifragrances.com,,,2025-07-18T12:32:10.942225,2025-08-29T12:29:41.174925
cmdabf53916bbfc5ba9e7e5,SAP,"SAP, a specialized perfume company, is renowned for its unique scent compositions that fusion floral, woody, and oriental elements. Established by a team of fragrance developers and perfumers, SAP focuses on creating high-quality fragrances that resonate with diverse customer preferences. The company emphasizes the sustainability aspect of perfume-making, sourcing ingredients ethically and ensuring environmentally-friendly production practices.",https://images.unsplash.com/photo-1582735689369-4fe89db7114c?w=400&h=300&fit=crop,,,,indie,,,,2025-07-18T12:32:10.942225,2025-08-29T12:29:47.489947
cmd7c42a1b9835535c2b97a,Saperpa,"Saperpa is a specialized perfume company that focuses on the creation of high-quality and unique fragrances. Founded by a group of passionate perfumers, Saperpa emphasizes the art of scent crafting, blending traditional techniques with modern innovations. The company is known for sourcing rare ingredients and creating signature scents that evoke emotions and memories, catering primarily to fragrance enthusiasts who appreciate niche offerings.",https://images.unsplash.com/photo-1582735689369-4fe89db7114c?w=400&h=300&fit=crop,www.saperpa.com,France,2005,niche,contact@saperpa.com,+33 1 23 45 67 89,"123 Rue des Fleurs, 75000 Paris, France",2025-07-18T12:32:10.942225,2025-08-29T12:29:53.401536
cmd640c605523ced0cd583c,Sapil,,https://sapil.com/cdn/shop/files/sapil-logo123.png?v=1709725825&width=500,https://sapil.com,United Arab Emirates,1996,Indie,,,,2025-07-18T12:32:10.942225,2025-08-29T12:30:00.831347
cmd13bdf30147ed9fe9f307,Saponifere,"Saponifere is a niche perfume company that specializes in creating artisanal fragrances inspired by nature and traditional art forms. They focus on high-quality ingredients and sustainable practices, producing unique scents that reflect various cultural and artisanal heritages. Established by a team of passionate perfumers, Saponifere aims to combine the art of perfumery with a commitment to environmental responsibility, resulting in luxury perfumes that tell a story and invite exploration through scent.",https://images.unsplash.com/photo-1541643600914-78b084683601?w=400&h=300&fit=crop,www.saponifere.com,France,2018,niche,contact@saponifere.com,,,2025-07-18T12:32:10.942225,2025-08-29T12:30:07.948880
cmdd28597f0e7b0174c898e,Saponificio Varesino,"Saponificio Varesino is a historic Italian company specializing in the production of high-quality artisanal soaps and grooming products. Established in 1945 in Varese, Italy, the brand is renowned for its commitment to craftsmanship and the use of traditional methods. Saponificio Varesino also incorporates the use of rare and unique ingredients, often drawing inspiration from Italian culture and its rich history in perfumery. While primarily known for its soaps, the company has expanded its line to include fragrances and aftershaves, appealing to a niche market of discerning consumers looking for luxury personal care products.",https://images.unsplash.com/photo-1541643600914-78b084683601?w=400&h=300&fit=crop,https://www.saponificiovaresino.com,Italy,1945,niche,,,,2025-07-18T12:32:10.942225,2025-08-29T12:30:19.499248
cmd834f1ac69ca6d6ad3d80,Sapphire Studios,"Sapphire Studios is a niche perfume house that specializes in creating unique and artisanal fragrances. Founded by a group of passionate scent enthusiasts, the company is dedicated to crafting high-quality perfumes that blend traditional methods with innovative elements. Their story began in a small studio where they experimented with various natural ingredients to develop their distinctive scent profiles. The brand is known for its artistic approach and limited production, ensuring each fragrance tells a story through its carefully selected notes.",https://www.sapphire-studios.com/images/logo.gif,https://www.sapphire-studios.com,United States,2017,niche,contact@sapphire-studios.com,,,2025-07-18T12:32:10.942225,2025-08-29T12:30:28.344738
cmd417b087b7fce7f225421,Sara Lee,"Sara Lee is primarily known for its food and beverage products, but it also has a footprint in the beauty and personal care sector, which includes fragrance lines. The company has a long history, emphasizing high-quality products that cater to consumers' desires. Sara Lee has evolved over the years, consolidating its operations and focusing on its core competencies in the consumer goods segment. The fragrance offerings from Sara Lee often emphasize pleasant, approachable scents that appeal to a wide audience.",https://images.unsplash.com/photo-1587017539504-67cfbddac569?w=400&h=300&fit=crop,,United States,1941,drugstore,,,,2025-07-18T12:32:10.942225,2025-08-29T12:30:34.380535
