id,name,description,image,website,country,founded,type,email,phone,address,createdAt,updatedAt
cmdbbd3742eebbcb67aa707,Rozhishka,"Rozhishka is an emerging perfume company known for its unique approach to fragrance creation by blending traditional perfumery techniques with modern aesthetics. Founded by a group of passionate artisans, the company emphasizes high-quality, natural ingredients and aims to capture the essence of varied cultures through its scent portfolio. Their specialty lies in creating bespoke fragrances that resonate personally with customers, offering a personalized experience in every bottle.",https://images.unsplash.com/photo-1541643600914-78b084683601?w=400&h=300&fit=crop,www.rozhishka.com,Russia,2021,indie,info@rozhishka.com,,,2025-07-18T12:32:10.942225,2025-08-29T12:17:42.649803
cmdccf4a378d99c6cb98525,Rua29,"Rua29 is a niche perfume company that focuses on creating unique and artisanal fragrances. Established with a dedication to inspiring emotion through scent, Rua29 emphasizes the use of high-quality ingredients and innovative techniques in their perfume-making process. The brand is known for its evocative storytelling behind each fragrance, drawing inspiration from various cultures and experiences, aiming to engage the customer in a sensory journey.",https://images.unsplash.com/photo-1587017539504-67cfbddac569?w=400&h=300&fit=crop,,,,niche,,,,2025-07-18T12:32:10.942225,2025-08-29T12:17:48.218706
cmdd330dc636c23b5622b00,Rubeus,"Rubeus is a niche perfume company known for its luxurious and artisanal scents. Founded by a team of fragrance enthusiasts, the brand focuses on creating unique and high-quality fragrances that capture the essence of individuality and elegance. The company emphasizes craftsmanship and the use of premium ingredients, aiming to provide not just a scent, but an emotional experience. Each fragrance tells a story and reflects a deep understanding of olfactory art, appealing to connoisseurs and fragrance lovers around the world.",https://www.rubeus.com/img/logo2.svg,https://www.rubeus.com,Italy,2015,niche,,,,2025-07-18T12:32:10.942225,2025-08-29T12:17:54.575369
cmdb994c824fe7a3d9a515f,Rubini,,https://images.unsplash.com/photo-1582735689369-4fe89db7114c?w=400&h=300&fit=crop,,,,niche,,,,2025-07-18T12:32:10.942225,2025-08-29T12:18:00.917404
cmda0c8137c2700cb6280b8,Rubino,"Rubino is a distinguished fragrance house known for blending traditional craftsmanship with modern aesthetics. Established with the intent to create unique, high-quality perfumes, Rubino has garnered attention for its artistic approach to scent creation. Each fragrance is inspired by stories and emotions, making them not just scents but olfactory experiences. The brand emphasizes sustainability and uses ethically sourced ingredients to craft its fragrances, catering to a growing market of conscious consumers seeking authenticity in their perfumes.",https://images.unsplash.com/photo-1582735689369-4fe89db7114c?w=400&h=300&fit=crop,www.rubinoparfums.com,Italy,2015,niche,contact@rubinoparfums.com,,"Via dei Profumi, 12, Milan, Italy",2025-07-18T12:32:10.942225,2025-08-29T12:18:07.042443
cmdd671cb87fa44c47a51a8,Ruby & Millie,"Ruby & Millie is a cosmetics and fragrance brand known for its stylish yet accessible beauty products. Founded by celebrities Ruby and Millie, the brand successfully merges high-quality formulations with innovative designs. It was known for its fun and youthful ethos, specializing in makeup and perfumes that cater to a diverse audience while promoting self-expression and creativity.",https://images.unsplash.com/photo-1582735689369-4fe89db7114c?w=400&h=300&fit=crop,,United Kingdom,2002,indie,,,,2025-07-18T12:32:10.942225,2025-08-29T12:18:13.655856
cmd55798d959c6cb363d300,Ruddy Water,"Ruddy Water is a niche perfume company known for its artisanal approach to scent creation. Founded by a team of fragrance enthusiasts, the brand focuses on handcrafting unique and evocative fragrances that encapsulate personal stories and experiences. Their commitment to quality ingredients and sustainable practices is reflected in their small batch production, ensuring that each release is distinctive and exclusive.",https://static.HugeDomains.com/images/hdv3-img/hd-header-logo-v3.svg,https://www.ruddywater.com,United States,2016,niche,contact@ruddywater.com,,,2025-07-18T12:32:10.942225,2025-08-29T12:18:22.325720
cmdc156c7b348a706877027,Rude,"Rude is a niche fragrance company known for its unique and edgy scents that appeal to a younger audience. Founded with the mission to challenge traditional notions of perfumery, Rude offers a variety of bold and vibrant fragrances that are designed to evoke individual expression and creativity. The brand emphasizes inclusivity and personal style, allowing customers to explore their identity through scent.",https://www.rude.com/JEXO-blue-white.png,https://www.rude.com,Canada,2013,niche,,,,2025-07-18T12:32:10.942225,2025-08-29T12:18:32.945031
cmdc9282ff27a77b4a36105,Rudross,"Rudross is a niche perfume company that specializes in creating handcrafted, artisanal fragrances. Founded by the perfumer H. Rudross, the brand focuses on using high-quality, sustainable ingredients to craft unique and evocative scents. By fusing traditional perfumery techniques with modern art, Rudross aims to tell a story through each fragrance, appealing to connoisseurs of fine perfumes seeking originality and luxury.",https://rudross.com/images/sys/rudrowsnew_1.svg,https://rudross.com,United States,2015,niche,contact@rudross.com,,,2025-07-18T12:32:10.942225,2025-08-29T12:18:39.998257
cmd9cd1783107a36da55efd,Rue 37,"Rue 37 is an artisanal perfume company specializing in creating high-quality, unique fragrance compositions. Founded with a passion for fragrance exploration, Rue 37 prides itself on blending traditional techniques with innovative concepts. Their offerings often center around sustainable sourcing and the celebration of diverse aromatic notes inspired by various cultural elements.",https://images.unsplash.com/photo-1541643600914-78b084683601?w=400&h=300&fit=crop,https://www.rue37.com,United States,2014,niche,contact@rue37.com,,,2025-07-18T12:32:10.942225,2025-08-29T12:18:45.177579
cmd984ad273e661e8b632ef,Rue Broca,"Rue Broca is a niche perfumery brand based in Paris, France, that specializes in creating artisanal, handcrafted fragrances. Founded by a group of passionate perfumers, the company draws inspiration from the artistic essence and cultural history of Paris, delivering unique scent compositions that reflect the city's charm. Rue Broca focuses on the use of high-quality ingredients and traditional perfumery techniques, offering an exclusive and intimate olfactory experience to its clientele.",https://images.unsplash.com/photo-1582735689369-4fe89db7114c?w=400&h=300&fit=crop,https://ruebroca.com,France,2016,niche,contact@ruebroca.com,,"123 Rue Broca, 75005 Paris, France",2025-07-18T12:32:10.942225,2025-08-29T12:18:54.077819
cmd53c3557efd2d86acfa9e,Rue21,"Rue21 is a specialty retailer that focuses on providing fashionable apparel, accessories, and footwear for young men and women. Founded in 2003, the brand has built a strong presence by offering an array of trendy clothing and scented products, including perfumes and body sprays. Rue21 emphasizes affordability and contemporary styles, catering primarily to a younger demographic that values self-expression through fashion. The company's perfume line is designed to complement its fashion offerings, allowing customers to indulge in personal fragrance choices that resonate with current trends.",https://rue21.com/cdn/shop/files/Rue_21_logo_Rue21_210x.webp?v=1726235962,https://www.rue21.com,United States,2003,drugstore,,,,2025-07-18T12:32:10.942225,2025-08-29T12:19:01.631698
cmd003c883bb9a0f4457e2a,Ruehl No. 925,"Ruehl No. 925 was a lifestyle brand that originated from the Abercrombie & Fitch company, focusing primarily on apparel, accessories, and fragrances. Named after the street address of their headquarters in New York City, Ruehl No. 925 was designed to evoke the spirit of New York and aimed at the young adult demographic. The brand's fragrances were characterized by their sophisticated yet approachable scents, capturing both the essence of urban life and individual expression. The company has a reputation for producing fragrances that complement their apparel, adding an olfactory dimension to the overall lifestyle experience. Ruehl No. 925 ceased operations in 2010, but its fragrances are still remembered by fans of the brand.",https://images.unsplash.com/photo-1556909114-f6e7ad7d3136?w=400&h=300&fit=crop,,United States,2004,indie,,,"of their headquarters in New York City, Ruehl No. 925 was designed to evoke the spirit of New York and aimed at the young adult demographic. The brand's fragrances were characterized by their sophisticated yet approachable scents, capturing both the essence of urban life and individual expression. The company has a reputation for producing fragrances that complement their apparel, adding an olfactory dimension to the overall lifestyle experience. Ruehl No. 925 ceased operations in 2010, but its fragrances are still remembered by fans of the brand.",2025-07-18T12:32:10.942225,2025-08-29T12:19:08.496858
cmd89cccd7c9db2bc3398c5,Rufus Hound,"Rufus Hound is a British comedian and actor who ventured into the perfume industry, launching his own fragrance line. The brand is known for its creative and whimsical approach to scent, incorporating Hound's distinct personality and humor into the fragrance experience. While Rufus Hound may not operate as a traditional perfume company, his offerings reflect his artistic influence and aim to connect with fans through unique aromatic experiences.",https://images.unsplash.com/photo-15907369626-6c63ac16f3df?w=400&h=300&fit=crop,,United Kingdom,2021,indie,,,,2025-07-18T12:32:10.942225,2025-08-29T12:19:14.320330
cmdf378b39a65df71baedae,Rugby Club Toulonnais,"Rugby Club Toulonnais is primarily known as a professional rugby union team based in Toulon, France. However, it has expanded its brand to include a range of lifestyle products, including perfumes. The perfume line reflects the strength and spirit of the rugby club, channeling athleticism and the passion of its fan base into the fragrance offerings. The brand emphasizes quality and a connection to rugby culture, appealing to both sports enthusiasts and fragrance aficionados.",https://rctoulon.com/wp-content/uploads/landing/logo_rctoulon.png,https://www.rctoulon.com,France,1908,niche,,,"41 Rue Jacques Ibert, 83100 Toulon, France",2025-07-18T12:32:10.942225,2025-08-29T12:19:22.476238
cmd33fb8f6ee67bdfcd1370,Ruhr-Universität Bochum,"Ruhr-Universität Bochum is a public research university located in Bochum, Germany. While primarily an educational institution, it has a strong focus on various disciplines, including chemistry and materials science. The university is known for its innovative research in the field of perfumery and fragrance chemistry, contributing to the development of new scent formulations and advancements in the perfume industry.",https://www.ruhr-uni-bochum.de/themes/custom/rub/logo.svg,https://www.ruhr-uni-bochum.de/,Germany,1962,indie,,,"Universitätsstr. 150, 44801 Bochum, Germany",2025-07-18T12:32:10.942225,2025-08-29T12:19:29.313807
cmde505b513b711873b5e90,RUIK,"RUIK is an innovative perfume brand that specializes in creating unique and artisanal fragrances. Founded with the mission to blend traditional perfume-making techniques with modern sensibilities, RUIK offers a diverse range of scent profiles that cater to various preferences and lifestyles. The company prides itself on using high-quality ingredients sourced from around the world, and emphasizes sustainability and eco-friendliness in its production processes. RUIK's story is rooted in a passion for olfactory art, and they continuously strive to push the boundaries of fragrance creation by collaborating with renowned perfumers.",https://images.unsplash.com/photo-1587017539504-67cfbddac569?w=400&h=300&fit=crop,www.ruikfragrances.com,United States,2021,niche,contact@ruikfragrances.com,,,2025-07-18T12:32:10.942225,2025-08-29T12:19:35.696400
cmd3a587138fd0b883e8be1,Rundholz Parfums,"Rundholz Parfums is a luxury perfume brand that originates from the German fashion design duo, Carsten and Claudia Rundholz. Known for their avant-garde approach, the brand combines elements of fashion and fragrance, creating unique, high-quality scents that reflect their artistic vision. Rundholz Parfums often offers fragrances that are unisex, and they place a significant emphasis on natural ingredients and sustainable practices. The brand embodies an experimental and artistic ethos, creating a niche for itself in the perfume industry.",https://www.rundholz.com/images/social_media/twitter-logo-blue.png,https://www.rundholz.com,Germany,1993,niche,,,,2025-07-18T12:32:10.942225,2025-08-29T12:19:43.597316
cmdd692a8fd788849942961,RuPaul,"RuPaul is a multifaceted personality known primarily for his work in the entertainment industry as a drag performer, singer, and television personality. The brand ""RuPaul"" includes a range of products, including fragrances that reflect his vibrant persona and style. The company's fragrance line aims to empower individuals by celebrating self-expression and individuality, resonating with fans of the drag culture and the larger LGBTQ+ community. RuPaul's perfumes are often marketed with a focus on love, acceptance, and glamor, embodying the essence of his public persona.",https://images.unsplash.com/photo-1587017539504-67cfbddac569?w=400&h=300&fit=crop,[https://www.rupaul.com](https://www.rupaul.com),United States,2015,celebrity,,,,2025-07-18T12:32:10.942225,2025-08-29T12:19:50.019818
cmd0f0c5f1685a1a15ce71c,Ruth Mastenbroek,"Ruth Mastenbroek is a British perfumer known for creating fine fragrances that reflect her expertise and passion for scent. Founded by Ruth Mastenbroek, the company aims to produce evocative perfumes that tell a story and evoke emotions. Ruth's background in fragrance development and her commitment to artisanal craftsmanship set her apart in the perfume industry. The brand specializes in high-quality, bespoke perfumes, with a focus on using natural ingredients and sustainable practices. Ruth Mastenbroek is known for previously working with luxury brands, and she imbues her own products with the same quality and artistry found in high-end fragrances.",https://ruthmastenbroek.com/wp-content/plugins/revslider/public/assets/assets/dummy.png,https://www.ruthmastenbroek.com,United Kingdom,2011,niche,,,,2025-07-18T12:32:10.942225,2025-08-29T12:20:02.918319
cmd031fac4e003a8b44974f,Ryan Richmond,"Ryan Richmond is a contemporary perfume brand that blends modern aesthetics with classic perfumery techniques. Founded by fragrance innovator Ryan Richmond, the company focuses on creating unique scents that cater to diverse tastes. Their offerings are characterized by high-quality ingredients and creative compositions, aimed at consumers who appreciate the artistry of fragrance. The brand has gained recognition for its dedication to sustainability and ethical practices within the perfume industry, emphasizing a connection to nature in their scent profiles.",https://images.unsplash.com/photo-1587017539504-67cfbddac569?w=400&h=300&fit=crop,https://www.ryanrichmond.com,United States,2017,niche,,,,2025-07-18T12:32:10.942225,2025-08-29T12:20:09.375702
cmdf7c50e37e2a38357e748,Sparkle PR,"Sparkle PR is a public relations company specializing in the beauty and fragrance industry. They work closely with brands to enhance their presence in the market through strategic communication and relationship management. Established to amplify the unique stories of fragrance houses, Sparkle PR emphasizes creativity and innovation in promoting scents, allowing brands to connect effectively with their target audiences.",https://images.unsplash.com/photo-1541643600914-78b084683601?w=400&h=300&fit=crop,,,,indie,,,,2025-07-18T12:32:10.942225,2025-08-29T12:20:14.867229
cmde1b61215c78be129ea95,SheMedia,"SheMedia is a multi-platform media company focused on empowering women through content that informs, inspires, and engages. While not primarily a perfume company, SheMedia operates within the lifestyle domain, connecting various brands, including fragrance brands targeting female consumers. The company emphasizes the importance of women's voices and perspectives in digital media and creates opportunities for partnerships and collaborations across industries, including beauty and fragrance.",https://images.squarespace-cdn.com/content/v1/60d5f8090a1c2602ed32d58c/3029f2e5-affc-4b4d-bc30-a4d27a3be293/TVLine_logo5.png,https://www.shemedia.com,United States,2018,indie,,,,2025-07-18T12:32:10.942225,2025-08-29T12:20:21.930602
cmd1635c419d635a7141f5c,1st Femme,"1st Femme is a contemporary perfume company that specializes in creating unique and luxurious fragrances tailored for women. Founded with a passion for celebrating femininity and elegance, 1st Femme offers a curated selection of scents that evoke emotions and make lasting impressions. Their vision is to empower women to express their individuality through fragrance, focusing on high-quality ingredients and artisanal craftsmanship.",https://images.unsplash.com/photo-1587017539504-67cfbddac569?w=400&h=300&fit=crop,,,,indie,,,,2025-07-18T12:32:10.942225,2025-08-29T12:20:29.470443
cmdd37d51a30d19215f8d8a,5 Sens,"5 Sens is a niche perfume company that specializes in creating unique and artisanal fragrances inspired by various themes and emotions. Established with a passion for olfactory art, the company aims to evoke memories and experiences through carefully blended scents. They focus on high-quality ingredients and sustainable sourcing methods, catering to connoisseurs who appreciate the complexity and depth of hand-crafted perfumes.",https://images.unsplash.com/photo-1587017539504-67cfbddac569?w=400&h=300&fit=crop,www.5sensparfums.com,France,2003,niche,contact@5sensparfums.com,,,2025-07-18T12:32:10.942225,2025-08-29T12:20:36.475029
cmdb325b9a80b182ee3c1db,Scherrer,"Scherrer is a French perfume house established by the designer Jean-Louis Scherrer in the early 1980s. The brand is known for its elegant fragrances that often reflect the same sophisticated style as Scherrer's fashion designs. Over the years, Scherrer has cultivated a niche for creating timeless scents that appeal to discerning customers who appreciate luxury and refinement. The house emphasizes the use of high-quality ingredients and classic formulations.",https://images.unsplash.com/photo-1556909114-f6e7ad7d3136?w=400&h=300&fit=crop,http://www.scherrer-fragrance.com,France,1980,niche,,,,2025-07-18T12:32:10.942225,2025-08-29T12:20:43.497091
cmdb139afbef1247cd7b7c7,Scent Strip Perfume,"Scent Strip Perfume is a fragrance company that specializes in creating high-quality fragrance samples and discovery sets, allowing customers to explore a wide variety of scents without committing to full-sized bottles. Their unique approach combines the convenience of sample sizes with a curated selection of both mainstream and niche perfumes, catering to diverse preferences and helping consumers find their signature scents. Scent Strip Perfume focuses on accessibility and a personalized fragrance journey, presenting both established and emerging fragrance brands.",https://images.unsplash.com/photo-15907369626-6c63ac16f3df?w=400&h=300&fit=crop,https://www.scentstripperfume.com,United States,2018,indie,support@scentstripperfume.com,,,2025-07-18T12:32:10.942225,2025-08-29T12:20:49.482403
cmdc422e5acf96bdb4d77c1,S.A.C.K.Y,"S.A.C.K.Y is a niche perfume company dedicated to crafting unique and innovative fragrances that resonate with individual personalities and emotions. Established by a team of passionate perfumers, the company focuses on limited edition scents that provide personal storytelling through the art of perfume. Their specialty lies in combining rare ingredients with avant-garde formulations to deliver transformative olfactory experiences.",https://images.unsplash.com/photo-1582735689369-4fe89db7114c?w=400&h=300&fit=crop,www.sackyfragrances.com,United States,2020,niche,contact@sackyfragrances.com,,,2025-07-18T12:32:10.942225,2025-08-29T12:20:55.923160
cmd8173882a86e5e0d4955e,S & C Parfums,"S & C Parfums is a boutique fragrance company that specializes in creating high-quality, artisanal perfumes. They focus on blending unique ingredients to craft signature scents that convey individuality and sophistication. Founded by a passionate team of fragrance experts, the company has a rich history in exploring diverse olfactory experiences while maintaining a commitment to sustainability and ethical sourcing of their materials.",https://images.unsplash.com/photo-1587017539504-67cfbddac569?w=400&h=300&fit=crop,www.scparfums.com,France,2010,niche,contact@scparfums.com,,"23 Rue de la Parfumerie, Paris, France",2025-07-18T12:32:10.942225,2025-08-29T12:21:01.974780
cmd9104b9a72b6f5d0d44a9,S+M Fragrances,"S+M Fragrances is a specialized perfume company that focuses on creating high-quality, artisanal fragrances. Established with a passion for scent, the brand emphasizes unique scent combinations and sustainable sourcing for its ingredients. The company's mission is to celebrate the artistry of perfumery while promoting ethical practices in fragrance creation.",https://images.squarespace-cdn.com/content/v1/5442c4a5e4b0b8e2e81f4e53/1413666520693-Y8VYFNJT46KSMTZG8J04/BpPSAFyd7-vn1GvZtrSjpo8F9ifbNgWnlI_rq50gar0%2Cib9q0QWRMIEQB5S6eiCVxEToKEtsThPVDEzwXSAiJVQ.jpg,www.smfragrances.com,United States,2015,niche,contact@smfragrances.com,,,2025-07-18T12:32:10.942225,2025-08-29T12:21:08.160824
cmde76173f9b78983e9ea9e,S. Cute,"S. Cute is a fragrance company specializing in creating unique and affordable perfumes. The brand focuses on producing fresh, playful scents that appeal to a youthful audience. Their mission is to provide quality fragrances at accessible prices, enabling customers to express their personalities through scent. S. Cute has become known for their vibrant branding and innovative marketing strategies, often collaborating with social media influencers to reach their target demographic.",https://images.unsplash.com/photo-1587017539504-67cfbddac569?w=400&h=300&fit=crop,https://www.scute.com,United States,2018,indie,contact@scute.com,,,2025-07-18T12:32:10.942225,2025-08-29T12:21:17.396858
cmd26e45d478f21ff8e7d86,s.Oliver,"s.Oliver is a German fashion brand that also offers a range of fragrances, particularly targeting a youthful audience. Established in 1969, s.Oliver has grown to become one of the leading textile companies in Europe, known for its stylish clothing and accessories. The brand emphasizes a casual and fashionable lifestyle, striving to embody contemporary trends while maintaining high-quality standards. Their fragrance line reflects this ethos, featuring various perfumes for both men and women, which aim to capture the essence of modern living.",https://images.unsplash.com/photo-1587017539504-67cfbddac569?w=400&h=300&fit=crop,https://www.soliver.de,Germany,1969,designer,,,,2025-07-18T12:32:10.942225,2025-08-29T12:21:24.737356
cmd25f0ca07f68c5bcf8ad7,S-Perfume,"S-Perfume is a creative perfumery house known for its innovative and artistic approach to fragrance creation. Established by a team of talented perfumers and industry visionaries, the company specializes in crafting high-quality niche perfumes that embody unique stories and emotions. S-Perfume emphasizes the use of rare ingredients and artistic concepts, allowing them to stand out in a crowded market. Over the years, they have gained recognition for their avant-garde fragrance compositions and have collaborated with various artists and designers to expand their olfactory offerings.",https://images.squarespace-cdn.com/content/v1/576ac487725e254d2ff42cc5/657c2717-3226-473f-b0b8-79490618ef1f/SQ_WWDIS.png?format=1500w,https://www.s-perfume.com,United States,2009,niche,,,,2025-07-18T12:32:10.942225,2025-08-29T12:21:33.320514
cmdc9fd9b23360f05334e4c,S.T. Dupont,,https://www.st-dupont.com/cdn/shop/t/8/assets/dupont-logo-white.png?v=87632058323058416441716297995,https://www.st-dupont.com,France,1872,designer,,,,2025-07-18T12:32:10.942225,2025-08-29T12:21:40.723921
cmd78360d162705ecc09c3b,S3,"S3 is a contemporary fragrance company that focuses on creating unique and innovative perfumes that appeal to a modern audience. Established by a group of fragrance enthusiasts, S3 aims to blend traditional perfumery techniques with modern trends to craft scents that resonate with consumers. Their specialty lies in utilizing high-quality ingredients and sustainable practices to produce a line of fragrances that not only smell exquisite but also reflect a commitment to environmental responsibility.",https://images.unsplash.com/photo-15907369626-6c63ac16f3df?w=400&h=300&fit=crop,www.s3fragrances.com,United States,2018,indie,contact@s3fragrances.com,,"123 Fragrance Lane, New York, NY 10001",2025-07-18T12:32:10.942225,2025-08-29T12:21:47.040057
