id,name,description,image,website,country,founded,type,email,phone,address,createdAt,updatedAt
cmd88edbcd14d71a94de205,Rosebud Perfume Co,"Rosebud Perfume Co is a company dedicated to creating high-quality, unique perfumes and body products, with a rich history that dates back to the late 19th century. Originating from a small apothecary in the United States, they specialize in creating wax-based perfume balms, lip balms, and other scented products. The brand is known for its nostalgic appeal and classic formulations, maintaining a focus on traditional craft while appealing to contemporary customers.",https://images.unsplash.com/photo-1587017539504-67cfbddac569?w=400&h=300&fit=crop,https://www.rosebudperfume.com,United States,1892,indie,,,,2025-07-18T12:32:10.942225,2025-08-29T12:13:27.513110
cmd814501d6e2f84ef598fe,Rosebud Perfume Lab,"Rosebud Perfume Lab is a long-established company known for its handcrafted, natural fragrances and balms. Founded in 1892, it has built a reputation for quality and authenticity, focusing on using natural and organic ingredients. The company specializes in creating unique scents that evoke memories and emotions, offering a nostalgic experience through perfumes and skincare products. Their signature product, the Rosebud Salve, has become iconic in the beauty industry.",https://images.unsplash.com/photo-1582735689369-4fe89db7114c?w=400&h=300&fit=crop,https://www.rosebudperfume.com,United States,1892,indie,,,,2025-07-18T12:32:10.942225,2025-08-29T12:13:33.438009
cmd26aa9b4199946d5488fe,Rosella Fiora,"Rosella Fiora is a niche perfume house specializing in crafting artisanal fragrances inspired by nature. With an emphasis on high-quality ingredients and innovative scent compositions, the brand aims to create unique olfactory experiences. Each perfume tells a story, merging traditional perfumery techniques with modern inspirations. Founded by a passionate perfumer, Rosella Fiora is dedicated to sustainable practices and often highlights the beauty of natural elements in their products.",https://images.unsplash.com/photo-1582735689369-4fe89db7114c?w=400&h=300&fit=crop,https://www.rosellafiora.com,Italy,2015,niche,,,,2025-07-18T12:32:10.942225,2025-08-29T12:13:39.971927
cmd8acf5775cdafab1d44ab,Rosendo Mateu Olfactive Expressions,"Rosendo Mateu Olfactive Expressions is a niche perfume house founded by Rosendo Mateu, who is known for his expertise in creating high-quality fragrances that combine traditional craftsmanship with modern sensibilities. The company specializes in producing artisanal perfumes that emphasize individuality and the art of perfumery, showcasing unique scents derived from a blend of natural and synthetic ingredients. Their fragrances often tell a story and aim to evoke emotions, making them stand out in the competitive fragrance market.",https://rosendomateu.com/wp-content/uploads/2020/01/Logo-rosendo-mateu-bl-transp-bandera-768x138.png,https://www.rosendomateu.com,Spain,2016,niche,,,,2025-07-18T12:32:10.942225,2025-08-29T12:13:49.785923
cmd4c73cff7aa8011b064aa,Roses for Autism,"Roses for Autism is a social enterprise dedicated to employing individuals with autism by creating and selling high-quality, hand-crafted perfumes. The company integrates the art of perfumery with a mission of supporting and empowering individuals on the autism spectrum. Their story began to provide meaningful jobs and skill development in a supportive environment, combining fragrance-making with advocacy for autism awareness. Their specialty lies in unique floral and aromatic blends that reflect a commitment to quality and social impact.",https://images.unsplash.com/photo-15907369626-6c63ac16f3df?w=400&h=300&fit=crop,https://rosesforautism.com,United States,2015,niche,,,,2025-07-18T12:32:10.942225,2025-08-29T12:13:56.411871
cmdbb77c4bee901afa2e15e,Rosie Huntington-Whiteley,"Rosie Huntington-Whiteley is a luxury lifestyle brand founded by the British model and actress Rosie Huntington-Whiteley, known for her work with Victoria's Secret and various fashion campaigns. The brand extends to fragrances, offering sophisticated and elegant scents that reflect Rosie's personal style and aesthetic. They focus on creating high-quality, unique fragrances that appeal to those seeking a touch of luxury in their daily lives.",https://images.unsplash.com/photo-1587017539504-67cfbddac569?w=400&h=300&fit=crop,https://www.rosiehuntingtonwhiteley.com,United Kingdom,2018,celebrity,,,,2025-07-18T12:32:10.942225,2025-08-29T12:14:01.993521
cmd18fe803c606be9838070,Rosie Jane Cosmetics,"Rosie Jane Cosmetics is a niche perfume and cosmetics brand founded by Rosie Jane, who is deeply passionate about creating unique and personal fragrances. The company emphasizes clean beauty by using non-toxic ingredients and environmentally friendly practices. Since its inception, Rosie Jane has embraced a philosophy that blends modern aesthetics with a distinct sense of nostalgia, crafting scents that evoke personal memories and experiences. The brand is known for its minimalist approach and has garnered a loyal following through its distinct and high-quality fragrance offerings.",https://img.atom.com//public/images/logo.svg,https://rosiejane.com,United States,2010,indie,,,,2025-07-18T12:32:10.942225,2025-08-29T12:14:09.546634
cmd3fdc4da5177692d39b84,Rossano Cortini,"Rossano Cortini is a luxury fragrance house that specializes in creating high-quality, artisanal perfumes. The brand is known for its unique approach to scent formulation, combining traditional techniques with modern aesthetics. Rossano Cortini's story began with a passion for perfumery and a dedication to craftsmanship, focusing on using the finest ingredients sourced from around the globe. Their fragrances embody a sense of individuality and artistry, appealing to discerning customers who appreciate exclusivity and sophistication in scent.",https://jjparfums.com/cdn/shop/files/Diseno_sin_titulo_17.png?v=1732659846&width=600,https://www.rossanocortini.com,Italy,,niche,,,,2025-07-18T12:32:10.942225,2025-08-29T12:14:17.071705
cmd8e9faa0e28168e3af7a9,Rossignol 1634,"Rossignol 1634 is a niche perfume house known for blending traditional French perfumery techniques with contemporary artistry. Established by a group of passionate perfumers and fragrance enthusiasts, the brand focuses on crafting high-quality, unique fragrances that tell a story and evoke a deep emotional connection. The name 'Rossignol' refers to the nightingale, a symbol of beauty and song, reflecting the company’s dedication to creating harmonious and memorable scent experiences. Their specialty lies in limited-edition collections that often highlight natural and rare ingredients sourced sustainably from around the world.",https://images.unsplash.com/photo-1541643600914-78b084683601?w=400&h=300&fit=crop,https://www.rossignol1634.com,France,2016,niche,,,,2025-07-18T12:32:10.942225,2025-08-29T12:14:23.581769
cmde3ea92fa14640ac67e04,Rosy & Earnest,"Rosy & Earnest is an artisanal perfume company dedicated to crafting high-quality, unique fragrances that blend traditional perfumery techniques with modern inspirations. Founded by a duo of passionate fragrance enthusiasts, the company focuses on using sustainably sourced ingredients, aiming to create a sensory experience that tells a story. They specialize in creating small-batch perfumes that embody a sense of luxury while emphasizing individuality and self-expression.",https://cdn.shopify.com/s/files/1/0690/2123/7537/files/forbes_logo.png?v=1683228564,www.rosyandearnest.com,United States,2015,indie,contact@rosyandearnest.com,,,2025-07-18T12:32:10.942225,2025-08-29T12:14:31.118197
cmd67fcd71f37e51895a097,Rouge Bunny Rouge,"Rouge Bunny Rouge is a luxury beauty brand founded in 2006, known for its high-quality cosmetics and fragrances. The brand was founded by a creative team dedicated to bringing artistry, imagination, and avant-garde aesthetics to the realm of beauty. Their products are characterized by their whimsical and poetic packaging combined with exceptional performance, aiming to enhance the natural beauty of every individual. Rouge Bunny Rouge specializes in the creative blending of high-quality ingredients to formulate captivating fragrances that evoke memories and emotions.",https://images.unsplash.com/photo-1582735689369-4fe89db7114c?w=400&h=300&fit=crop,https://www.rougebunnyrouge.com,United Kingdom,2006,niche,,,,2025-07-18T12:32:10.942225,2025-08-29T12:14:38.026879
cmd2db58ba5675a73b59e1f,Roullier White,"Roullier White is a luxury fragrance company that specializes in creating artisanal perfumes inspired by nature and the artistic vision of its founders. The brand emphasizes the use of high-quality ingredients and traditional craftsmanship, offering a unique olfactory experience. Roullier White's story is rooted in the desire to blend art and scent, aiming to evoke emotions and memories through their carefully curated fragrances.",https://www.roullierwhite.com/cdn/shop/files/rw-lite-high-res.jpg?v=1719922856&width=600,https://www.roullierwhite.com,United States,2013,niche,,,,2025-07-18T12:32:10.942225,2025-08-29T12:14:44.569366
cmd07c4923b31612e2ad440,Roure Bertrand Dupont,"Roure Bertrand Dupont is a distinguished fragrance house known for its expertise in fragrance creation and olfactory innovation. Established from the merger of historical French perfumery names, the company specializes in providing high-quality fragrances for luxury brands, as well as developing its own perfume lines. With a rich history rooted in the art of perfumery, Roure Bertrand Dupont combines tradition and modernity, leveraging advanced techniques and premium materials to craft unique scent compositions that cater to a diverse clientele.",https://images.unsplash.com/photo-1582735689369-4fe89db7114c?w=400&h=300&fit=crop,http://www.rourebertranddupont.com,France,2001,niche,,,,2025-07-18T12:32:10.942225,2025-08-29T12:14:50.953114
cmda738178870dbe80eed7a,Roure,"Roure is a prestigious fragrance house known for its rich heritage in perfume creation, with a focus on crafting high-quality, artisanal scents. Established by renowned perfumer Henri Roure in the early 20th century, the company specializes in producing fine fragrances and innovative scent compositions utilizing natural ingredients. Roure has been influential in the development of modern perfumery, leading to the creation of iconic and distinctive scents that are renowned in the perfume industry. Their commitment to quality and craftsmanship sets them apart, making them a respected name among fragrance connoisseurs.",https://images.unsplash.com/photo-1541643600914-78b084683601?w=400&h=300&fit=crop,https://www.roure.com,France,1906,niche,,,,2025-07-18T12:32:10.942225,2025-08-29T12:14:57.583038
cmd279737a22852f0865d08,Roussel-Uclaf,"Roussel-Uclaf, founded in the 1960s as a pharmaceutical company, has diversified into various sectors over the years, including the fragrance industry. The company specializes in developing and marketing innovative products, particularly those that combine scientific research with consumer needs. Although primarily recognized for its pharmaceutical advancements, it has also created unique fragrance lines that cater to niche markets, focusing on high-quality ingredients and exclusive formulations.",https://images.unsplash.com/photo-1587017539504-67cfbddac569?w=400&h=300&fit=crop,,France,1964,niche,,,,2025-07-18T12:32:10.942225,2025-08-29T12:15:03.731166
cmdb2ac035b86685652aa29,Route 66,"Route 66 is a fragrance company inspired by the iconic highway that represents the American spirit of freedom and adventure. The brand aims to encapsulate the essence of classic Americana through its unique scents, each crafted to evoke nostalgia and a sense of travel. Route 66 specializes in creating fun and accessible fragrances that cater to a diverse range of customers, reflecting the colorful culture associated with the famous route.",https://images.unsplash.com/photo-1587017539504-67cfbddac569?w=400&h=300&fit=crop,http://www.route66fragrances.com,United States,,indie,,,,2025-07-18T12:32:10.942225,2025-08-29T12:15:09.228144
cmd87be561b8abd84381c6a,Routine Paris,"Routine Paris is a French perfume company that specializes in creating high-quality, niche fragrances inspired by art, travel, and culture. The brand focuses on sustainability by using responsibly sourced ingredients and eco-friendly packaging. Established by a team passionate about the art of perfumery, Routine Paris is dedicated to crafting unique and memorable scents that resonate with individual experiences and emotions.",https://routineparis.com/img/logo-Concept24.svg,https://routineparis.com,France,2011,niche,,,,2025-07-18T12:32:10.942225,2025-08-29T12:15:16.184579
cmd97663d257a2c0ab06f23,Roux Saint James,"Roux Saint James is a niche perfume company that specializes in creating unique, artisanal fragrances inspired by the cultural and natural elements of its namesake, the historic neighborhood of Saint James in Paris. The company seeks to blend traditional perfumery craftsmanship with modern inspirations to produce scents that tell a story and evoke emotions. With a focus on quality ingredients and small-batch production, Roux Saint James aims to offer customers distinctive fragrances that stand out in the market.",https://images.unsplash.com/photo-1541643600914-78b084683601?w=400&h=300&fit=crop,https://rouxsaintjames.com,France,2018,niche,contact@rouxsaintjames.com,,,2025-07-18T12:32:10.942225,2025-08-29T12:15:24.051453
cmdb65da4c5cc8af5322414,Roxana Illuminated Perfumes,"Roxana Illuminated Perfumes is a niche perfume company that specializes in creating handcrafted, natural perfumes. Founded by Roxana Villa, the company emphasizes the use of botanical and sustainable ingredients to create unique fragrances that reflect the beauty of nature. Their approach combines traditional perfumery techniques with a modern sensibility, resulting in fragrances that are not only appealing but also environmentally friendly. The brand is known for its commitment to purity and transparency in sourcing materials and for crafting artisanal products that resonate with scent enthusiasts looking for a more conscious choice in perfume.",https://images.unsplash.com/photo-1587017539504-67cfbddac569?w=400&h=300&fit=crop,https://www.roxanailluminated.com,United States,2009,niche,,,,2025-07-18T12:32:10.942225,2025-08-29T12:15:31.130896
cmd3d92d21b55d360b1bb13,Roxy,"Roxy is a brand primarily recognized for its active lifestyle wear, catering specifically to young women who love the surf and skate culture. Over the years, Roxy has expanded its offerings to include a range of perfumes that embody the spirit of adventure and freedom synonymous with the Roxy lifestyle. The brand aims to encapsulate the essence of youthfulness and the thrill of outdoor activities in its fragrance lines. Roxy's perfumes often feature vibrant, fresh notes that resonate with its active audience.",https://www.roxy.com/cdn/shop/files/Logo_Roxy_HeartWordmark_Anthracite.png?v=1743451254&width=280,https://www.roxy.com,United States,1990,celebrity,,,,2025-07-18T12:32:10.942225,2025-08-29T12:15:37.613688
cmd25c1e0ee83af73df2710,Royal Apothic,"Royal Apothic is a fragrance and body care brand known for its luxurious, vintage-inspired scents and beautifully crafted products. The company was founded by entrepreneur Sean O'Neill and draws inspiration from the rich history of apothecaries, combining quality ingredients with stylish packaging. Their product range includes perfumes, home fragrances, and body care items that evoke nostalgia while offering a modern touch. Royal Apothic emphasizes the art of scent creation, showcasing its commitment to craftsmanship and heritage in the perfume industry.",https://royalapothic.com/cdn/shop/files/royal_hr_crest_logo_2_4x_b9070088-fb32-4d3c-8218-70245a2594e8.png?crop=center&height=340&v=1704737524&width=750,https://www.royalapothic.com,United States,2010,indie,,,,2025-07-18T12:32:10.942225,2025-08-29T12:15:45.267032
cmdb08a7cc45a12787b6b80,Royal Brands,"Royal Brands is a fragrance company specializing in creating high-quality, luxury perfumes. Established with the aim of delivering sophisticated scents that embody elegance and style, the company draws inspiration from royal heritage and the art of perfumery. Their offerings cater to a diverse clientele, reflecting a commitment to craftsmanship and excellence in fragrance development.",https://images.unsplash.com/photo-1556909114-f6e7ad7d3136?w=400&h=300&fit=crop,,,,indie,,,,2025-07-18T12:32:10.942225,2025-08-29T12:15:51.257591
cmd0e2e8a24a83126da8d43,Royal Copenhagen,"Royal Copenhagen is a renowned Danish company that originally started as a porcelain manufacturer in 1775. In addition to their fine porcelain, they expanded into the fragrance industry, offering a range of luxury perfumes that embody elegance and sophistication. Their scents often reflect the heritage of Danish craftsmanship, combining traditional values with contemporary appeal. Signature fragrances are designed to evoke the aesthetic qualities associated with their iconic porcelain items, making Royal Copenhagen a unique player in the perfume market.",https://www.royalcopenhagen.com/-/media/royalcopenhagen/icons/nyt-rc-logo-2024.png?h=446&w=1462&la=en-GB&hash=91F48542DA9A4E30A3758C9B01276773,https://www.royalcopenhagen.com,Denmark,1775,designer,,,,2025-07-18T12:32:10.942225,2025-08-29T12:15:58.844920
cmd0900a237878ff207f81d,Royal Crown,"Royal Crown is a luxury niche perfume company that specializes in creating high-quality fragrances using the finest ingredients sourced from around the world. Founded in 1997, the company is renowned for its artisanal approach to perfumery, where each scent is crafted with meticulous attention to detail and artistry. Royal Crown is known for its unique and opulent fragrances, often presented in exquisite packaging that signifies luxury and sophistication. The brand celebrates the heritage of perfumery while also pushing the boundaries of contemporary scent creation.",https://images.unsplash.com/photo-1587017539504-67cfbddac569?w=400&h=300&fit=crop,https://royalcrownperfumes.com,Italy,1997,niche,,,,2025-07-18T12:32:10.942225,2025-08-29T12:16:05.452748
cmd509ad2ff1053887bdeed,Royal Doulton,"Royal Doulton is a renowned British brand that is best known for its fine china and collectibles, including figurines and tableware. In addition to its core porcelain products, Royal Doulton has ventured into the world of fragrance, offering a selection of elegant perfumes that reflect the brand's heritage of craftsmanship and style. The company was originally established in 1815 and has a rich history steeped in artistry and tradition, with a focus on creating luxurious, high-quality products that enhance the elegance of everyday life.",https://www.royaldoulton.com/-/media/royaldoulton/logos/rd_logo.svg?la=en-GB&hash=62ACF79358589BDA5FD14069B609E60B,https://www.royaldoulton.com,United Kingdom,1815,designer,,,,2025-07-18T12:32:10.942225,2025-08-29T12:16:12.515015
cmda3993a69f3c25d6f2d0d,Royal Hawaiian Perfumes,"Royal Hawaiian Perfumes is a specialty fragrance company that focuses on creating luxurious and distinctive perfumes inspired by the beauty and spirit of Hawaii. Founded by an artisan perfumer, the company aims to capture the essence of the islands through unique blends of natural ingredients, including tropical flowers and exotic botanicals. The brand emphasizes traditional handcrafted methods, ensuring that each fragrance is a true representation of Hawaiian culture and heritage. Their product range includes personal fragrances, home scents, and tropical-themed gift sets.",https://images.unsplash.com/photo-1541643600914-78b084683601?w=400&h=300&fit=crop,https://www.royalhawaiianperfumes.com,United States,2014,niche,,,,2025-07-18T12:32:10.942225,2025-08-29T12:16:29.141698
cmd1cab9371e983f5289362,Royal Mirage,"Royal Mirage is a prominent perfume company based in the UAE, well-known for its luxurious range of fragrances. Established in 1992, the brand aims to blend traditional Arabic perfumery with contemporary influences, offering an exquisite selection of both men’s and women’s scents. Royal Mirage specializes in high-quality formulations that highlight rich Arabian ingredients, creating long-lasting fragrances that reflect cultural heritage and sophistication.",https://images.unsplash.com/photo-1556909114-f6e7ad7d3136?w=400&h=300&fit=crop,https://www.royalmirage.com,United Arab Emirates,1992,niche,,,,2025-07-18T12:32:10.942225,2025-08-29T12:16:37.729357
cmdb1ce36fea9e1c335c463,Royal Opera House Muscat,"Royal Opera House Muscat is an esteemed cultural institution in Oman that combines the world of performing arts with the luxury fragrance industry. They offer an exclusive range of perfumes inspired by the region’s rich heritage, blending traditional Arabian scents with modern olfactory principles. The company aims to provide a unique sensory experience that reflects the artistry of opera and the cultural richness of Muscat. Furthermore, they promote the appreciation of perfume as an art form and a symbol of Omani craftsmanship.",https://www.rohmuscat.org/wp-content/uploads/2023/04/rohmuscat-white-edited.png,https://rohmuscat.org/,Oman,2011,niche,,,,2025-07-18T12:32:10.942225,2025-08-29T12:16:45.877157
cmd822e120ad1caedfe9b33,Royal Sanders,"Royal Sanders is a prominent manufacturer in the fragrance industry, known for producing an array of personal care products, including perfumes. They focus on creating high-quality fragrances that blend tradition with modern influences. Established in the Netherlands, the company prides itself on its craftsmanship and dedication to sustainability, utilizing eco-friendly practices in their production processes. Royal Sanders has built a reputation for innovation and strives to cater to diverse consumer preferences through its wide range of offerings.",http://royalsanders.com/wp-content/uploads/2020/09/heawave_header_1428px_DT_boven_a.png,https://www.royalsanders.com,Netherlands,1970,indie,,,,2025-07-18T12:32:10.942225,2025-08-29T12:16:54.648679
cmdf12ee736fdd21c016a01,Royal Secret,"Royal Secret is a perfume company that specializes in creating a range of fragrances, focusing primarily on producing exotic and luxurious scents. The company is known for its enchanting fragrances, often inspired by royal themes and stories, which attract a diverse customer base. Royal Secret has positioned itself as a brand that embodies elegance and sophistication, often appealing to those looking for something unique in the fragrance market.",https://images.unsplash.com/photo-1587017539504-67cfbddac569?w=400&h=300&fit=crop,www.royalsecret.com,United States,1985,niche,,,,2025-07-18T12:32:10.942225,2025-08-29T12:17:20.503865
cmdffe3ba51b296941ac54c,Royall Lyme of Bermuda,"Royall Lyme of Bermuda is a niche perfume house that specializes in high-quality fragrances inspired by the sea and landscapes of Bermuda. The company emphasizes natural ingredients and artisanal craftsmanship, creating scents that capture the essence of the island's environment. Their flagship product, Royall Lyme, was created in the 1950s and has become a classic representation of Bermuda's spirit. The brand experts engineer fragrances that evoke the luxury of island living, appealing to both men and women.",https://images.unsplash.com/photo-1541643600914-78b084683601?w=400&h=300&fit=crop,http://www.royalllyme.com,Bermuda,1954,niche,,,,2025-07-18T12:32:10.942225,2025-08-29T12:17:26.655377
