id,name,description,image,website,country,founded,type,email,phone,address,createdAt,updatedAt
cmd036aa96ab13a0152ff4d,Aluwwah,"Aluwwah is a niche perfume company specializing in creating unique, high-quality fragrances inspired by exotic locations and rich cultural heritage. With a strong emphasis on artisanal craftsmanship, Aluwwah seeks to blend traditional perfumery techniques with modern sensibilities to offer a luxurious olfactory experience. The brand’s story revolves around the passion for scent-making and the desire to evoke emotions and memories through carefully curated perfume blends.",https://images.unsplash.com/photo-1541643600914-78b084683601?w=400&h=300&fit=crop,www.aluwwah.com,United States,2015,niche,contact@aluwwah.com,,,2025-07-18T12:32:10.942225,2025-08-28T09:03:17.348304
cmd5ebc9ba4507966d1a13f,Alvarez Gomez,"Alvarez Gomez is a distinguished Spanish perfume company, established in 1899 by the Alvarez Gomez family in Madrid. The brand is renowned for its high-quality colognes, body lotions, and scented products that reflect Spanish heritage. Its signature fragrance, ""Agua de Colonia,"" is well-loved and represents a blend of traditional and contemporary perfumery, focusing on natural ingredients and artisanal craftsmanship. Alvarez Gomez has carved a niche in the market for its commitment to quality and authenticity, focusing on creating fragrances that embody the essence of Spain.",https://alvarezgomez.com/wp-content/uploads/2021/03/cropped-logo-alvarez-gomez.png,https://www.alvarezgomez.com,Spain,1899,niche,,,,2025-07-18T12:32:10.942225,2025-08-28T09:03:25.655106
cmd1306b1d9971d6aac5d06,Alviero Martini,"Alviero Martini is an Italian fashion brand known for its luxury leather goods, accessories, and fragrances. Founded by designer Alviero Martini in the late 1980s, the brand gained fame for its signature ""Geo"" print, which features a distinctive world map design. Alviero Martini's fragrance line embodies the same spirit of adventure and sophistication, offering scents that reflect global influences and the brand's commitment to elegance. The company emphasizes high-quality craftsmanship and has positioned itself in the luxury market, appealing to a clientele that values both exclusivity and style.",https://images.unsplash.com/photo-1541643600914-78b084683601?w=400&h=300&fit=crop,https://www.alvieromartini.com,Italy,1988,designer,,,,2025-07-18T12:32:10.942225,2025-08-28T09:03:38.116402
cmd54c5abc6597e856465c2,Alyaka,"Alyaka is a fragrance and beauty e-commerce platform specializing in niche and artisanal perfumes. Founded with a passion for unique scent experiences, Alyaka offers a curated selection of perfumes from around the world, focusing on quality ingredients and unique compositions. The company connects customers with both established and emerging fragrance houses, providing a platform for discovering rare and exclusive fragrances that are not commonly found in mainstream retail.",https://www.alyaka.com/cdn/shop/files/minimalist-black-circular-logo-letters-p-separated-horizontal-line.webp?v=1732130970&width=720,https://www.alyaka.com,United Kingdom,2012,niche,,,,2025-07-18T12:32:10.942225,2025-08-28T09:03:46.274465
cmd3ea4f2ddb1e14fbd941f,Alys,"Alys is a niche perfume brand specializing in artisanal fragrances crafted from high-quality ingredients. The company emphasizes the story behind each scent, often inspired by nature, culture, and personal experiences. With a commitment to sustainability and ethical practices, Alys has cultivated a unique identity in the perfume industry, appealing to fragrance connoisseurs and those seeking distinct olfactory experiences.",https://images.unsplash.com/photo-1582735689369-4fe89db7114c?w=400&h=300&fit=crop,,,,niche,,,,2025-07-18T12:32:10.942225,2025-08-28T09:03:52.888537
cmdaad209205930f8cf7c6c,Alyson Oldoini,"Alyson Oldoini is a niche perfume house renowned for its artistic and olfactory storytelling through fragrance. Founded by Italian-born perfumer Alyson Oldoini, the brand blends essential oils and natural ingredients to craft unique scents that evoke emotions and experiences rather than conforming to mainstream fragrance trends. The company emphasizes on quality, originality, and personal expression, making each perfume a reflection of artistry and individuality.",https://images.unsplash.com/photo-1587017539504-67cfbddac569?w=400&h=300&fit=crop,https://www.alysonoldoini.com,Italy,2015,niche,,,,2025-07-18T12:32:10.942225,2025-08-28T09:03:59.977514
cmdf6722b4189b9944ae68d,Alyssa Ashley,"Alyssa Ashley is a perfume company known for its innovative and unique fragrances, often inspired by the spirit of youth and individuality. The brand was originally launched in 1990, gaining recognition for its signature scents that blend modern and classic olfactory notes. It has developed a strong following among consumers for its approachable pricing, allowing quality perfumes to be accessible to a wider audience. Over the years, Alyssa Ashley has expanded its product line to include body cares and gift sets while maintaining a commitment to creativity and fragrance artistry.",https://www.alyssaashley.com/cdn/shop/files/Logo_AA_nero_simbolo.svg?v=1719834210&width=290,https://www.alyssaashley.com,United States,1990,drugstore,,,,2025-07-18T12:32:10.942225,2025-08-28T09:04:08.466384
cmdcbf95e3a57a00ce8ebeb,AM Associates,"AM Associates is a perfume company that specializes in the crafting of bespoke fragrances. Established by a group of fragrance enthusiasts and experts, the company aims to provide customers with unique scent experiences that resonate with their personal stories and preferences. Their offerings include both pre-made collections and customized scents tailored to individual tastes, emphasizing the art and science of perfumery.",https://images.unsplash.com/photo-1556909114-f6e7ad7d3136?w=400&h=300&fit=crop,,,,indie,,,,2025-07-18T12:32:10.942225,2025-08-28T09:04:15.040333
cmd2044eb9544a6c5026581,Amado,"Amado is a niche perfume company that specializes in creating unique and artistic fragrances. Founded by a group of passionate perfumers and fragrance enthusiasts, Amado's story began with a vision to blend traditional fragrance-making techniques with modern inspirations. Their specialty lies in their commitment to high-quality ingredients and innovative scent compositions, aiming to evoke emotions and memories through their carefully crafted perfumes.",https://images.unsplash.com/photo-1587017539504-67cfbddac569?w=400&h=300&fit=crop,www.amadoperfumes.com,USA,2015,niche,info@amadoperfumes.com,,,2025-07-18T12:32:10.942225,2025-08-28T09:04:22.069936
cmd508b87c5df16ca250f0f,Amaffi,"Amaffi is a unique perfume house that specializes in luxury fragrances inspired by the art of perfumery. Founded by a team of creative individuals passionate about olfactory experiences, Amaffi aims to blend traditional techniques with modern innovations. Their perfumes often tell a story through scent, evoking emotions and memories tied to their ingredients. The company is known for its artisanal approach, using high-quality raw materials sourced from around the world to create distinctive fragrances that cater to an upscale clientele.",https://images.unsplash.com/photo-1541643600914-78b084683601?w=400&h=300&fit=crop,https://www.amafft.com,United Arab Emirates,2018,niche,,,,2025-07-18T12:32:10.942225,2025-08-28T09:04:29.217322
cmd354604f1ab4d17015b35,Aman,"Aman is a luxury perfume brand that specializes in artisanal fragrances inspired by various global cultures and traditions. The company emphasizes sustainability and natural ingredients, producing high-quality scents that evoke a sense of peace and serenity, aligning with its philosophy of mindful living. Aman was founded on the principles of creating a sensory experience that connects individuals to their inner selves and the environment.",https://www.aman.com/themes/custom/aman/logo.svg,https://www.aman.com,United States,2018,niche,,,,2025-07-18T12:32:10.942225,2025-08-28T09:04:36.025916
cmd080c77c88850b9923b46,Amanda Lepore,"Amanda Lepore is a well-known figure in the fashion and beauty industry, celebrated for her contributions to the world of art, music, and performance. Her perfume line encapsulates her unique aesthetic and persona, representing glamour and individuality. The fragrances often reflect her bold style and are targeted towards fans of niche luxury scents. The brand emphasizes creativity and self-expression, aligning with Amanda's identity as an icon in the LGBTQ+ community.",https://amandalepore.com/cdn/shop/files/AL-LIPS-SIG-TRANSPARENTBG.png?v=1710355282,https://www.amandalepore.com,United States,,niche,,,,2025-07-18T12:32:10.942225,2025-08-28T09:04:44.208624
cmd32439799b6f1635d3156,Amaran,"Amaran is a luxury perfume house that specializes in creating high-quality, handcrafted fragrances. The company is known for its commitment to using artisanal techniques and premium ingredients to develop unique scent profiles that appeal to a discerning clientele. Amaran's story begins with a passion for perfumery and a desire to redefine luxury through the art of scent, offering an exclusive range of perfumes infused with rich cultural inspirations and storytelling.",https://images.unsplash.com/photo-1587017539504-67cfbddac569?w=400&h=300&fit=crop,,,,niche,,,,2025-07-18T12:32:10.942225,2025-08-28T09:04:51.873061
cmdd932b865deb31f09a1b6,Amaranthus Herbis,"Amaranthus Herbis is a niche perfume house that specializes in creating artisanal fragrances inspired by nature and botanical elements. Founded by a team of perfumers and botanists, the company emphasizes sustainability and the use of natural ingredients in their compositions. Their story began with a deep appreciation for the diverse flora around the world and a desire to capture the essence of plants in beautiful, wearable forms. Amaranthus Herbis crafts unique scents that reflect the harmony between nature and art, aiming to offer a sensory experience that transports wearers to lush landscapes and serene environments.",https://images.unsplash.com/photo-1587017539504-67cfbddac569?w=400&h=300&fit=crop,www.amaranthusherbis.com,United States,2015,niche,contact@amaranthusherbis.com,,,2025-07-18T12:32:10.942225,2025-08-28T09:04:59.768561
cmdf5d9ced9b94530e560f4,Amayori,"Amayori is a niche perfume company that specializes in creating artisanal fragrances inspired by the ancient traditions of Japan. The brand combines traditional Japanese artistry with modern perfume-making techniques to craft unique scents that tell a story and evoke memories. Their products often feature rare and luxurious ingredients sourced from Japan and are created with an emphasis on craftsmanship and quality. The story of Amayori is deeply rooted in the concept of ""monozukuri,"" or the spirit of craftsmanship, aiming to blend the beauty of nature with olfactory art.",https://www.amayori.com/cdn/shop/files/logo-header-whtie_170x.png?v=1614321705,www.amayori.com,United States,2015,niche,,,,2025-07-18T12:32:10.942225,2025-08-28T09:05:08.130263
cmd23f747b926680ba2849b,Amazing Brands,"Amazing Brands is a perfume company known for creating unique and high-quality fragrances that appeal to a diverse audience. The company focuses on innovative scent combinations and eco-friendly sourcing of ingredients, reflecting a commitment to sustainability and individuality in the fragrance industry. Their story began with a passion for perfumery, and over the years, they have cultivated a brand that emphasizes creativity and craftsmanship in scent creation.",https://images.unsplash.com/photo-15907369626-6c63ac16f3df?w=400&h=300&fit=crop,www.amazingbrands.com,United States,2015,indie,contact@amazingbrands.com,,,2025-07-18T12:32:10.942225,2025-08-28T09:05:16.500859
cmd0cd030d3019a9224f49c,Amazing Cosmetics,"Amazing Cosmetics is a beauty brand that specializes in high-quality cosmetic products, including a range of fragrances. Founded with the mission to create professional-grade beauty products that are accessible to all, Amazing Cosmetics emphasizes innovative formulas and luxurious user experiences. Their story is rooted in the belief that everyone deserves to look and feel their best, using products that enhance natural beauty while providing reliable results. They are known for their commitment to quality and their focus on exceptional customer service.",https://www.amazingcosmetics.com/cdn/shop/files/AMAZINGCOSMETICS_logo_grey_1_4148d1fa-71d3-4ac6-95fa-8de773be16c8.png?height=58&v=1657132421,https://www.amazingcosmetics.com,United States,2000,indie,,,,2025-07-18T12:32:10.942225,2025-08-28T09:05:24.836033
cmda41d2cf3b534de9762f9,Amazongreen,"Amazongreen is a boutique perfume company dedicated to creating high-quality, eco-friendly fragrances inspired by the natural world. They emphasize sustainable sourcing and craftsmanship in their perfume formulations, often utilizing organic and biodynamic ingredients. The brand is known for its commitment to environmental responsibility and aims to connect consumers with the essence of nature through their unique scent profiles.",https://images.unsplash.com/photo-1587017539504-67cfbddac569?w=400&h=300&fit=crop,https://www.amazongreen.com,United States,2015,indie,contact@amazongreen.com,,,2025-07-18T12:32:10.942225,2025-08-28T09:05:31.384566
cmd5efbde00155e1506b126,Amberfig,"Amberfig is a niche perfume company that specializes in creating unique fragrances inspired by natural elements and rich cultural influences. Founded by a team of passionate perfumers, the company's story began with a vision to blend traditional craftsmanship with modern sensibilities. Leveraging high-quality ingredients, Amberfig is dedicated to crafting scents that evoke emotions and memories, making each fragrance a personal experience for its users.",https://images.unsplash.com/photo-1587017539504-67cfbddac569?w=400&h=300&fit=crop,,,,niche,,,,2025-07-18T12:32:10.942225,2025-08-28T09:05:37.513854
cmd94fcc2d90d0cd611cea2,Ambientair,"Ambientair is a company that specializes in creating home fragrances and air care products. Founded in 2005 in Spain, the company has made a name for itself in the ambient scents market, offering a diverse range of products, including scented candles, reed diffusers, and room sprays. Ambientair focuses on providing high-quality, innovative products designed to enhance the atmosphere in residential and commercial spaces. Their philosophy emphasizes environmental sustainability and the use of natural ingredients, offering consumers a premium olfactory experience.",https://images.unsplash.com/photo-1556909114-f6e7ad7d3136?w=400&h=300&fit=crop,https://www.ambientair.com,Spain,2005,indie,,,,2025-07-18T12:32:10.942225,2025-08-28T09:05:45.948907
cmdea4e679f88bf1301e363,Ambra di Venezia,"Ambra di Venezia is a luxury perfume company that specializes in creating high-quality, artisanal fragrances inspired by the rich cultural history and natural beauty of Venice, Italy. The brand emphasizes the use of traditional Italian craftsmanship and the finest raw materials to produce unique scent profiles that evoke the essence of the city and its heritage. Ambra di Venezia aims to deliver an olfactory experience that reflects the elegance and sophistication of Venetian art and architecture.",https://images.unsplash.com/photo-15907369626-6c63ac16f3df?w=400&h=300&fit=crop,https://www.ambradivenizia.com,Italy,2016,niche,,,,2025-07-18T12:32:10.942225,2025-08-28T09:05:53.268113
cmd0b007f9790adca5b8ab0,Ambre Blends,"Ambre Blends is a niche fragrance company that specializes in creating artisanal perfume oils using natural ingredients. Founded in 2008, their products focus on unique, layered scents that are designed to blend with the wearer's natural body chemistry. Ambre Blends emphasizes sustainable sourcing and offers a range of products, including their signature warm and inviting fragrances, that appeal to customers looking for a more personalized scent experience.",https://images.unsplash.com/photo-15907369626-6c63ac16f3df?w=400&h=300&fit=crop,https://www.amb Reynoldsblends.com,United States,2008,niche,,,,2025-07-18T12:32:10.942225,2025-08-28T09:06:00.568731
cmdee9ec2ac7479380a320e,Ambregris,"Ambregris is a niche perfume house known for its luxurious and artisanal approach to fragrance creation. Founded by a team of fragrance enthusiasts and experts, the company specializes in crafting unique scents that blend natural ingredients with innovative techniques. Their offerings often reflect a deep appreciation for tradition while embracing modern olfactory trends, making each fragrance a work of art. Ambregris has garnered attention for its commitment to sustainability and ethical sourcing of raw materials, contributing to its reputation as a responsible player in the perfume industry.",https://images.unsplash.com/photo-15907369626-6c63ac16f3df?w=400&h=300&fit=crop,https://www.ambregris.com,France,2015,niche,,,,2025-07-18T12:32:10.942225,2025-08-28T09:06:09.160297
cmd57559bcaeeda9d6c4c45,Ambrosia,"Ambrosia is a boutique perfume company known for crafting unique, high-quality fragrances that combine natural ingredients with artistic expressions. Founded by a group of passionate perfumers, the company aims to evoke emotions and memories through scent, emphasizing personalized experiences for its customers. Their specialty lies in creating niche fragrances that are distinctive and often inspired by art, culture, and nature.",https://images.unsplash.com/photo-1587017539504-67cfbddac569?w=400&h=300&fit=crop,www.ambrosiaparfums.com,United States,2017,niche,contact@ambrosiaparfums.com,,,2025-07-18T12:32:10.942225,2025-08-28T09:06:15.773640
cmdae41397bb52e65a97d37,AMC Beauty,"AMC Beauty is a contemporary fragrance company that specializes in creating luxury perfumes with an emphasis on high-quality ingredients and unique olfactory experiences. Founded by a team of fragrance enthusiasts, AMC Beauty aims to democratize access to premium scents, often taking inspiration from art, culture, and nature in their compositions. With a focus on sustainable practices and a commitment to innovative design, the company has carved out a niche within the beauty industry, appealing to consumers who seek both sophistication and conscientiousness in their fragrance choices.",https://static.HugeDomains.com/images/hdv3-img/hd-header-logo-v3.svg,https://www.amcbeauty.com,United States,2019,indie,,,,2025-07-18T12:32:10.942225,2025-08-28T09:06:23.089987
cmdea2324369ce8cb05ed27,Amelgo,"Amelgo is a fragrance company that focuses on creating unique and high-quality perfumes. Established with a passion for scent and innovation, Amelgo has carved a niche in the fragrance market by emphasizing artisanal craftsmanship and using natural ingredients. Their story begins with a commitment to reflecting personal identity through scent, aiming to provide customers with a sensory experience that tells a story of individuality and luxury.",https://images.unsplash.com/photo-1587017539504-67cfbddac569?w=400&h=300&fit=crop,,,,indie,,,,2025-07-18T12:32:10.942225,2025-08-28T09:06:29.140181
cmde583e576d81b5e1d9f51,Amelia Perfumes,"Amelia Perfumes is a niche fragrance company that focuses on crafting unique and high-quality perfumes. With a passion for artistic expression through scent, they create exclusive fragrances that reflect individual personalities and emotions. The company prides itself on using natural ingredients and artisanal techniques to deliver bespoke scents. Their story is rooted in a commitment to sustainability and creativity, appealing to fragrance enthusiasts who seek authenticity in their perfume choices.",https://images.unsplash.com/photo-1587017539504-67cfbddac569?w=400&h=300&fit=crop,,,,niche,,,,2025-07-18T12:32:10.942225,2025-08-28T09:06:46.560437
cmddf1a2ebec044e377f604,America Products Company,"America Products Company specializes in the manufacture and distribution of fragrance products, including perfumes, personal care items, and home fragrances. The company has a commitment to quality and innovation, emphasizing a diverse range of scents tailored to meet the demands of different markets. Their story is rooted in a passion for scent and a dedication to creating unique olfactory experiences for consumers.",https://images.unsplash.com/photo-1582735689369-4fe89db7114c?w=400&h=300&fit=crop,,United States,,indie,,,,2025-07-18T12:32:10.942225,2025-08-28T09:06:52.673137
cmd045763e1e77fb60fcde5,American Beauty Perfumers,"American Beauty Perfumers is a fragrance company focused on creating unique and artistic scents that celebrate the essence of beauty and creativity. With a passion for artisanal craftsmanship, they blend traditional techniques with modern innovation to produce high-quality perfumes. The company's story is rooted in a desire to encapsulate the vibrant spirit of American culture through exquisite fragrances, appealing to consumers looking for distinct and expressive scents.",https://images.unsplash.com/photo-1541643600914-78b084683601?w=400&h=300&fit=crop,www.americanbeautyperfumers.com,United States,2015,indie,info@americanbeautyperfumers.com,,,2025-07-18T12:32:10.942225,2025-08-28T09:06:59.486488
cmdb827843807561dfdd873,American Beauty,"American Beauty is a fragrance brand that emphasizes charm and elegance, often capturing the essence of nostalgic Americana. Known for its wide range of products, the company combines classic and contemporary fragrance elements, making it appealing to a diverse audience. Their perfumes often evoke feelings of romance and beauty, resonating with those who seek to express their personality through scent. With a commitment to quality, American Beauty often infuses their products with natural ingredients and is associated with positive branding focused on self-expression.",https://backend.americanbeauty.com/american-beauty/wp-content/uploads/sites/9/2019/02/American-Beauty-Logo-01.png,https://www.americanbeauty.com,United States,,drugstore,,,,2025-07-18T12:32:10.942225,2025-08-28T09:07:07.667781
cmdc4f3a911a385bc47e0d9,American Coastal,"American Coastal is a perfume company that creates fragrances inspired by the beach, ocean, and coastal lifestyle. They focus on capturing the essence of seaside living through their unique and evocative scent profiles. The brand emphasizes quality ingredients and aims to evoke nostalgic memories of summer days, warmth, and relaxation by the water. Their specialty lies in producing artisanal fragrances that resonate with a sense of place and natural beauty.",https://images.unsplash.com/photo-15907369626-6c63ac16f3df?w=400&h=300&fit=crop,https://www.americancoastal.com,United States,2016,indie,,,,2025-07-18T12:32:10.942225,2025-08-28T09:07:14.084512
cmdd0011a95fc74c8d8c5e0,American Crew,"American Crew is a well-known brand in the grooming industry, primarily focusing on men's hair care and styling products, as well as fragrances. Founded in 1994 by hairstylist David Raccuglia, the company has become a leader in the men's grooming market by offering a range of products that cater to the specific needs of men. Their specialty lies in creating high-quality, salon-level products that promote healthy hair care and styling while embodying a masculine and sophisticated aesthetic. American Crew is also known for advocating men's grooming standards and providing education within the barbershop community.",https://www.americancrew.com/cdn/shop/files/icons8-instagram.svg?v=1696264452&width=20,https://www.americancrew.com,United States,1994,drugstore,,,,2025-07-18T12:32:10.942225,2025-08-28T09:07:21.649374
cmd893ec3abac378aa2522e,American Cyanamid,"American Cyanamid was a diversified American company involved in the manufacture of agricultural chemicals, pharmaceuticals, and consumer products, including perfumes and personal care items. It was primarily known for its contributions to scientific advancements in various industrial sectors and had a strong footprint in the chemicals market. However, its focus on perfume and personal care products was not as prominent and was overshadowed by its larger pharmaceutical and agricultural operations. The company eventually became part of Warner-Lambert and later Pfizer after mergers and acquisitions.",https://images.unsplash.com/photo-1587017539504-67cfbddac569?w=400&h=300&fit=crop,,United States,1907,drugstore,,,,2025-07-18T12:32:10.942225,2025-08-28T09:07:27.689453
cmded841890004441a8bcfc,American Designer Fragrances,"American Designer Fragrances is a company that specializes in creating high-quality fragrances, focusing on American culture and lifestyle. The company aims to blend contemporary trends with classic scents, catering to a diverse audience that appreciates individuality and style in their fragrance choices. Their offerings emphasize unique and bold scents inspired by American experiences, making them a prominent player in the fragrance industry.",https://images.unsplash.com/photo-15907369626-6c63ac16f3df?w=400&h=300&fit=crop,,United States,,designer,,,,2025-07-18T12:32:10.942225,2025-08-28T09:07:33.980091
cmd5fb91c59c397071dda7c,American Druggist Syndicate,"The American Druggist Syndicate is a historical company known for its involvement in the pharmaceutical and fragrance industries, primarily functioning as a wholesale distributor of perfumery and cosmetic products in the early 20th century. The company focused on providing various products to pharmacists and retailers, which included perfumes and other personal care items. While the exact details of their story and specialty have evolved over the years, their legacy remains tied to the early commercialization of fragrances in America.",https://images.unsplash.com/photo-1587017539504-67cfbddac569?w=400&h=300&fit=crop,,United States,1875,drugstore,,,,2025-07-18T12:32:10.942225,2025-08-28T09:07:40.743015
