id,name,description,image,website,country,founded,type,email,phone,address,createdAt,updatedAt
cmd81ec7d8ece634c01b481,Abdul Samad Al Qurashi,"Abdul Samad Al Qurashi is a high-end perfumery company known for its luxury Arabic fragrances. Established in 1852, the company specializes in traditional Arabian perfumes, using natural ingredients such as oud, musk, and various floral notes. The brand emphasizes craftsmanship and heritage, creating unique, artisanal scents that reflect the rich cultural history of the Middle East. Over the years, Abdul Samad Al Qurashi has expanded its offerings to include a diverse range of perfume products, catering to a global market while maintaining a commitment to quality and tradition.",https://images.unsplash.com/photo-1541643600914-78b084683601?w=400&h=300&fit=crop,https://www.asqperfumes.com,Saudi Arabia,1852,niche,,,,2025-07-18T12:32:10.942225,2025-08-28T08:28:47.569812
cmd692682d7cf4a37ab21bf,Abel,"Abel is a niche perfume company that focuses on creating natural and sustainable fragrances. Founded by Frances Shoemack in 2013, Abel aims to redefine the norms of the perfume industry by using only high-quality, plant-based ingredients and avoiding synthetic chemicals. The brand is dedicated to environmental sustainability and ethical sourcing, offering an alternative to conventional perfumes that often contain harmful substances. Their story emphasizes transparency and craftsmanship, which is reflected in their unique scent compositions that cater to those seeking artisanal fragrances.",https://images.unsplash.com/photo-15907369626-6c63ac16f3df?w=400&h=300&fit=crop,https://abelodor.com,Netherlands,2013,niche,,,,2025-07-18T12:32:10.942225,2025-08-28T08:29:14.664032
cmda1103f98fe068fbc4e8b,Abercrombie & Fitch,"Abercrombie & Fitch is an American retailer that focuses on casual wear for young consumers. Founded in 1892, the company has a rich heritage that began as an elite hunting and fishing outfitter. Over the decades, Abercrombie & Fitch has transformed into a leading lifestyle brand recognized for its trendy apparel and fragrances. They specialize in creating aspirational, laid-back perfume collections that complement their fashion lines, often marketed towards a younger audience through distinctive branding and in-store experiences that evoke a sense of premium lifestyle.",https://images.unsplash.com/photo-1587017539504-67cfbddac569?w=400&h=300&fit=crop,https://www.abercrombie.com,United States,1892,designer,,,"6301 Fitch Path, New Albany, OH 43054, United States",2025-07-18T12:32:10.942225,2025-08-28T08:29:22.210595
cmd7188b48c684a49e4aa52,Abietson,"Abietson is a niche fragrance house known for crafting high-quality, artisanal perfumes that incorporate unique and natural ingredients. Founded by a passionate perfumer with a vision to create distinctive scents that tell a story, the brand focuses on limited-edition releases and exclusive collaborations. Their specialty lies in blending traditional perfumery techniques with modern aesthetics to produce evocative olfactory experiences.",https://images.unsplash.com/photo-1541643600914-78b084683601?w=400&h=300&fit=crop,,,,niche,,,,2025-07-18T12:32:10.942225,2025-08-28T08:29:29.005549
cmd103be577e40596fb45d9,Abinoam,"Abinoam is a niche perfume company that specializes in creating high-quality, handcrafted fragrances. The brand is dedicated to using natural ingredients and promoting an artisanal approach to perfume-making. With a focus on sustainability and authenticity, Abinoam's products are designed to express individuality and provoke emotion through scent. The company emphasizes a connection between fragrance and identity, making each perfume a unique representation of the wearer's personality.",https://images.unsplash.com/photo-1556909114-f6e7ad7d3136?w=400&h=300&fit=crop,,,,niche,,,,2025-07-18T12:32:10.942225,2025-08-28T08:29:35.446487
cmd1c6521808cb324a2c830,Abraham & Straus,"Abraham & Straus was originally a department store founded in the 19th century, primarily known for its wide variety of merchandise, including cosmetics and perfumes. In the late 20th century, the brand expanded its offerings to include a fragrance line under the guidance of established perfumers. The company has a rich history tied to providing quality products with a focus on accessibility and customer service, catering notably to a diverse customer base.",https://images.unsplash.com/photo-1556909114-f6e7ad7d3136?w=400&h=300&fit=crop,,United States,1865,drugstore,,,,2025-07-18T12:32:10.942225,2025-08-28T08:29:41.571974
cmd823ec5efdcfad217a5de,Absentia Aromatics,"Absentia Aromatics is a unique perfume company that specializes in creating artisanal fragrances inspired by the beauty of nature and the complexity of human emotions. With a focus on high-quality, sustainable ingredients, their offerings are handcrafted to evoke vivid memories and rich experiences. The company has a strong commitment to both artistry and environmental responsibility, making it a notable player in the niche fragrance market. Their story began with a passion for olfactory experiences that transform everyday moments into artistic expressions.",https://images.unsplash.com/photo-1541643600914-78b084683601?w=400&h=300&fit=crop,https://absentiaalchemists.com,United States,2018,niche,contact@absentiaalchemists.com,,,2025-07-18T12:32:10.942225,2025-08-28T08:29:48.541368
cmd6a50ec01eca5fccac915,Absolument,"Absolument is a French perfume company known for its artistic approach to fragrance creation. Founded by a team of passionate perfumers and creatives, the company aims to capture the essence of emotions and experiences through unique and high-quality scents. Their specialty lies in crafting niche fragrances that often tell a story or evoke specific memories, utilizing rare ingredients and innovative compositions. The brand places a strong emphasis on authenticity and artistry, making each fragrance a work of art.",https://images.unsplash.com/photo-1556909114-f6e7ad7d3136?w=400&h=300&fit=crop,https://www.absolumentparfums.com,France,2013,niche,contact@absolumentparfums.com,,"20 Rue du Faubourg Montmartre, 75002 Paris, France",2025-07-18T12:32:10.942225,2025-08-28T08:29:55.490756
cmd4a284562a0a9c7f5b9ef,Absolut,,https://images.unsplash.com/photo-1541643600914-78b084683601?w=400&h=300&fit=crop,https://www.absolut.com,Sweden,1879,designer,,,,2025-07-18T12:32:10.942225,2025-08-28T08:30:02.643610
cmdf90f09f78dac801186c3,Abstraction Paris,"Abstraction Paris is a niche perfume house based in Paris, known for its artistic and innovative approach to fragrance creation. The brand emphasizes the interplay of art and olfaction, often drawing inspiration from artistic movements and avant-garde concepts. Each scent is crafted with a focus on originality and character, catering to a discerning audience that values unique and luxurious perfumes. Their story is rooted in a desire to transcend traditional perfume-making by using unconventional ingredients and techniques, creating compositions that tell a story or evoke a specific emotional response.",https://images.unsplash.com/photo-1582735689369-4fe89db7114c?w=400&h=300&fit=crop,https://abstraction.paris,France,2020,niche,,,,2025-07-18T12:32:10.942225,2025-08-28T08:30:11.128130
cmd40cbf50bc269e85f28c5,Abu Haashir,"Abu Haashir is a renowned perfume company specializing in the creation of luxury Arabic and oriental fragrances. The brand has a rich heritage that reflects the art of perfumery deeply rooted in Middle Eastern culture. Their product line is distinguished by the use of high-quality ingredients sourced from around the world, aiming to capture the essence of tradition while catering to modern tastes. Notably, Abu Haashir is recognized for its craftsmanship in blending traditional notes with contemporary elements, creating unique scents that resonate globally.",https://images.unsplash.com/photo-1582735689369-4fe89db7114c?w=400&h=300&fit=crop,www.abuhashir.com,United Arab Emirates,,niche,,,,2025-07-18T12:32:10.942225,2025-08-28T08:30:18.038120
cmdb223c088ed1fe72562b1,Acca Kappa,"Acca Kappa is an Italian company that specializes in the production of fine fragrances, body care products, and home fragrances. Established in 1869, the brand is recognized for its commitment to craftsmanship, high-quality materials, and an emphasis on artisanal production. Acca Kappa is particularly noted for its signature fragrance line, which blends traditional Italian perfume-making techniques with contemporary sensibilities, focusing on natural ingredients and eco-friendly practices. The brand also produces grooming products and cosmetics, highlighting its dedication to personal care and luxury.",https://www.accakappa.com/static/version1743586775/frontend/bluesky/bluesky_accakappa_default/it_IT/images/logo-accakappa__big.svg,https://www.accakappa.com,Italy,1869,niche,,,"Via P. S. D’Antonio, 18, 31100 Treviso TV, Italy",2025-07-18T12:32:10.942225,2025-08-28T08:30:29.134828
cmdc057bf60fb16ea2fafd9,Accendis,"Accendis is a fragrance house known for creating high-quality niche perfumes that engage the senses and evoke emotional connections. Founded on a passion for blending art and science, Accendis emphasizes the craftsmanship in perfumery by utilizing rare and luxurious raw materials. Their fragrances often reflect a deep appreciation for both contemporary and traditional olfactory artistry, making them stand out in the competitive perfume market. The company aims to provide a unique olfactory experience to its customers, tailored for individual preferences.",https://images.unsplash.com/photo-1556909114-f6e7ad7d3136?w=400&h=300&fit=crop,https://www.accendis.com,Portugal,2006,niche,,,,2025-07-18T12:32:10.942225,2025-08-28T08:30:45.750197
cmdb5d0359ef3dbc4ab74c1,Accessorize,"Accessorize is a UK-based fashion accessories retailer known for offering a range of products including jewelry, bags, and fragrances. Founded in 1984, Accessorize aims to provide stylish and affordable accessories inspired by global trends, with a focus on feminine and playful designs. The brand has built a reputation for its wide variety of unique and vibrant scents, utilizing appealing packaging and engaging marketing strategies. Positioned in the competitive accessories market, Accessorize strives to cater to a diverse demographic, focusing on quality and design in its fragrance offerings.",https://www.accessorize.com/on/demandware.static/-/Library-Sites-accessorize-content-global/default/dw95665514/global/logo.svg,https://www.accessorize.com,United Kingdom,1984,designer,,,,2025-07-18T12:32:10.942225,2025-08-28T08:30:53.841872
cmdc6c80bb7f6017d67fbd7,Accord Parfait,"Accord Parfait is a niche perfume house that specializes in creating unique and luxurious fragrances. Established by a team of passionate perfumers, the company combines artistry and science to formulate perfumes that are inspired by emotions and memories. The brand is known for its commitment to quality ingredients and innovative formulations, bringing a distinct touch to the fragrance market.",https://images.unsplash.com/photo-1587017539504-67cfbddac569?w=400&h=300&fit=crop,https://www.accordparfait.com,France,2017,niche,,,,2025-07-18T12:32:10.942225,2025-08-28T08:30:59.819006
cmd98f8793dd8723c261c3b,Aceite,"Aceite is a niche perfume company renowned for its artisanal approach to fragrance creation. The company specializes in crafting high-quality, unique scents using natural ingredients, drawing inspiration from nature and traditional perfumery techniques. Founded by a team of passionate fragrance enthusiasts, Aceite aims to evoke emotions and memories through intricate scent compositions. Their focus on limited production runs allows for a personalized experience, appealing to connoisseurs of fine fragrances who appreciate authenticity and craftsmanship.",https://images.unsplash.com/photo-15907369626-6c63ac16f3df?w=400&h=300&fit=crop,www.aceiteparfum.com,Spain,2015,niche,info@aceiteparfum.com,+34 912 345 678,"Calle Aroma 12, 28001 Madrid, Spain",2025-07-18T12:32:10.942225,2025-08-28T08:31:06.912943
cmdf0e1876a90c6f903d28e,Ach. Brito,"Ach. Brito is a Portuguese company specializing in traditional soaps, fragrances, and toiletries. Established in 1918, this family-owned business has built a reputation for its high-quality products and artisanal craftsmanship. The company is particularly known for its vintage-style packaging and nostalgic scents, drawing inspiration from traditional Portuguese culture. Ach. Brito’s products often reflect regional characteristics, making them beloved not only locally but also in international markets. Their commitment to quality and tradition sets them apart in the competitive fragrance industry.",https://loja.e-couto.net/pt/wp-content/uploads/2020/08/achbrito-logotipo.png,https://www.achbrito.com/,Portugal,1918,indie,,,,2025-07-18T12:32:10.942225,2025-08-28T08:31:15.522253
cmd78d747b1db98fad461f9,Achilles,"Achilles is a niche perfume company known for its unique and artistic fragrance creations. Founded by a group of passionate perfumers, Achilles combines traditional craftsmanship with modern sensibilities, offering an array of scents that tell compelling stories through their compositions. Their specialty lies in crafting limited-edition fragrances, often inspired by various cultural and historical themes, allowing them to stand out in the competitive perfume industry.",https://images.unsplash.com/photo-1587017539504-67cfbddac569?w=400&h=300&fit=crop,www.achillesfragrances.com,France,2019,niche,contact@achillesfragrances.com,,,2025-07-18T12:32:10.942225,2025-08-28T08:31:22.051229
cmd67685893b27f92217187,Acne Studios,"Acne Studios is a Swedish fashion house founded in 1996, known for its eclectic collections that combine contemporary design with an avant-garde approach. Originally focusing on denim, the company has expanded its offerings to include ready-to-wear clothing, accessories, and fragrance. The brand emphasizes creativity, craftsmanship, and a modern aesthetic, aiming to challenge traditional fashion norms. Their perfumes often reflect the same innovative spirit found in their clothing lines.",https://www.acnestudios.com/on/demandware.static/Sites-acne_us-Site/-/default/dw5665fa0a/icons/clear.svg,https://www.acnestudios.com,Sweden,1996,designer,,,,2025-07-18T12:32:10.942225,2025-08-28T08:31:30.163050
cmdaef052ae2a49220943b6,Acorelle,"Acorelle is a French company that specializes in creating natural and organic perfumes, as well as other scented products. The brand was established with a commitment to using high-quality, eco-friendly ingredients, aiming to provide alternatives to synthetic fragrances. Acorelle's story began with a focus on personal care and well-being, emphasizing the importance of reducing the use of chemical substances in perfumery. The company stands out due to its unique approach to scent creation, combining artistic expression with a commitment to sustainability and health.",https://images.unsplash.com/photo-15907369626-6c63ac16f3df?w=400&h=300&fit=crop,https://www.acorelle.com,France,2004,indie,contact@acorelle.com,,,2025-07-18T12:32:10.942225,2025-08-28T08:31:38.011128
cmd089dcfb31e1a24cdce82,Acousticjus,"Acousticjus is a niche fragrance house that specializes in crafting unique and artistic perfumes inspired by various musical and sensory experiences. Founded by a team of passionate perfumers and musicians, the brand seeks to evoke emotions and memories through scent, merging the worlds of music and fragrance. Each perfume is designed to tell a story, often accompanied by creative packaging and branding that reflects the artistic vision behind the scent.",https://images.unsplash.com/photo-1556909114-f6e7ad7d3136?w=400&h=300&fit=crop,,,,niche,,,,2025-07-18T12:32:10.942225,2025-08-28T08:31:44.268644
cmd5471055007501f149f29,Acqua Alpes,"Acqua Alpes is a luxury perfume house that draws inspiration from the pristine Alpine regions of the Alps. Established with a focus on incorporating natural ingredients sourced from this unique environment, the company emphasizes quality and craftsmanship in its fragrance creation. The brand aims to evoke the essence of the Alpine experience, encapsulating the fresh, crisp air and the breathtaking landscapes of the region within each scent. Their offerings often reflect the beauty and purity of nature, appealing to consumers who value artisanal craftsmanship and environmental consciousness in fragrance.",https://acquaalpes.com/cdn/shop/files/Shopify_Mobile_OverlayLogo_600x200px_Zeichenflaeche_1_410x.png?v=1651244871,http://www.acquaalpes.com,Italy,2012,niche,,,,2025-07-18T12:32:10.942225,2025-08-28T08:31:52.897699
cmddad8a442094320ea4504,Acqua degli Dei,"Acqua degli Dei is an Italian perfume company renowned for its high-quality fragrances that celebrate the essence of natural ingredients and the beauty of Italian landscapes. The brand draws inspiration from the island of Pantelleria, known for its rich history, vibrant culture, and unique flora. Their specialty lies in creating artisanal perfumes that evoke the spirit of nature, combining traditional craftsmanship with modern sensibilities. Each fragrance is designed to capture a moment in time, evoking emotions and memories, grounding the wearer in an experience that transcends ordinary scent.",https://images.unsplash.com/photo-1556909114-f6e7ad7d3136?w=400&h=300&fit=crop,https://www.acquadidei.com,Italy,2008,niche,,,,2025-07-18T12:32:10.942225,2025-08-28T08:32:05.026649
cmd749b5ca65383529bb1ff,Acqua del Garda,"Acqua del Garda is a niche perfume company known for its high-quality, artisanal fragrances inspired by the idyllic surroundings of Lake Garda in Italy. Established in 2014, the brand focuses on creating unique scents that capture the essence of the region’s natural beauty and cultural heritage. Their products reflect a commitment to craftsmanship and the use of premium raw materials, offering a luxurious olfactory experience that embodies the lifestyle and spirit of Lake Garda.",https://images.unsplash.com/photo-1556909114-f6e7ad7d3136?w=400&h=300&fit=crop,https://www.acquadelgarda.com,Italy,2014,niche,,,,2025-07-18T12:32:10.942225,2025-08-28T08:32:11.873152
cmdfffcce954aaee2db97af,Acqua delle Langhe,"Acqua delle Langhe is a niche perfume company that specializes in creating high-quality fragrances inspired by the natural beauty and cultural heritage of the Langhe region in Italy. The company was founded by a group of artisans with a passion for perfumery and a deep connection to their homeland. They combine traditional craftsmanship with contemporary design to produce unique scents that reflect the rich aromas and landscapes of the Langhe area, known for its wines, truffles, and stunning scenery.",https://images.unsplash.com/photo-1541643600914-78b084683601?w=400&h=300&fit=crop,https://www.acquadellelanghe.com,Italy,2017,niche,,,,2025-07-18T12:32:10.942225,2025-08-28T08:32:18.181019
cmd90b3516171a19e2f9d07,Acqua dell'Elba,"Acqua dell'Elba is an Italian perfume brand that specializes in creating high-quality fragrances inspired by the natural beauty and elements of the Elba Island in Tuscany. Founded in 2008, the brand draws on the island’s rich history and landscape, incorporating local ingredients and artisanal techniques in their perfumery. They offer a range of products including perfumes, home fragrances, and bath and body care items, reflecting the essence of the Mediterranean. The brand places a strong emphasis on craftsmanship and the heritage of the region, aiming to evoke the sensations of the island through their scents.",https://www.acquadellelba.com/app/Imgs/logotop-2.png,https://www.acquadellelba.com,Italy,2008,niche,,,,2025-07-18T12:32:10.942225,2025-08-28T08:32:25.829287
cmddfb0ea70fa3e9278afe4,Acqua di Baviera,"Acqua di Baviera is a niche perfume company specializing in high-quality fragrances that embody the essence of Italy's tradition and elegance. The brand was founded with a vision to create scents inspired by the historical significance and cultural richness of the Bavarian region, blending classic perfumery techniques with modern artistry. Acqua di Baviera is known for its artisanal approach, using rare ingredients to craft unique fragrances that tell a story and evoke emotions.",https://images.unsplash.com/photo-15907369626-6c63ac16f3df?w=400&h=300&fit=crop,[www.acquadibaviera.com](http://www.acquadibaviera.com),Italy,2011,niche,,,,2025-07-18T12:32:10.942225,2025-08-28T08:32:32.373005
cmd175664058aa2b00c415c,Acqua di Biella,"Acqua di Biella is an Italian fragrance house known for its artisanal perfumes made using traditional methods and high-quality ingredients. The company draws inspiration from the natural beauty of the Biella region and aims to capture the essence of local flora in its products. Established in 2008, Acqua di Biella embraces a philosophy of craftsmanship and authenticity, combining modern techniques with a deep respect for historical perfumery practices. They specialize in creating both classic and contemporary scents, catering to a niche market that appreciates unique and sophisticated fragrances.",https://www.acquadibiella.com/pagine/sfondi/LogoTop.png,https://www.acquadibiella.com,Italy,2008,niche,,,,2025-07-18T12:32:10.942225,2025-08-28T08:32:40.023320
cmdc12a61850073d55fc8cf,Acqua di Genova,"Acqua di Genova is a historic perfume house that originated in 1853 in Genoa, Italy. Renowned for its artisanal fragrances, the company draws inspiration from the rich maritime culture of its hometown and its vibrant botanical heritage. They specialize in creating high-quality, handcrafted fragrances that evoke the essence of the Italian Riviera, using traditional methods and premium ingredients. Acqua di Genova has been celebrated for its unique blends that cater to both male and female consumers, emphasizing elegance and sophistication in each scent.",https://images.unsplash.com/photo-1587017539504-67cfbddac569?w=400&h=300&fit=crop,https://www.acquadigenova.com,Italy,1853,niche,,,,2025-07-18T12:32:10.942225,2025-08-28T08:32:47.656279
cmdd551aaf038a263915480,Acqua di Hamburg,"Acqua di Hamburg is a luxury perfume house known for its exceptional craftsmanship and high-quality ingredients in fragrance creation. The company has deep roots in Hamburg, Germany, and specializes in producing niche perfumes that embody the spirit of the city, intertwining local culture and heritage into their scent formulations. Acqua di Hamburg combines traditional craftsmanship with modern fragrance trends, offering a curated selection of unique olfactory experiences that appeal to connoisseurs and casual users alike.",https://images.unsplash.com/photo-1541643600914-78b084683601?w=400&h=300&fit=crop,https://www.acquadihamburg.com,Germany,2012,niche,,,,2025-07-18T12:32:10.942225,2025-08-28T08:32:55.697708
cmd8c2f9513628d0b54d26c,Acqua di Noto,"Acqua di Noto is an Italian perfume company known for creating artisanal fragrances that embody the essence of Noto, a Sicilian city rich in culture and history. The brand emphasizes natural ingredients, blending traditional Italian craftsmanship with contemporary olfactory art. Their perfumes are inspired by the landscapes, flora, and cultural heritage of Sicily, aiming to evoke a strong sense of place through their unique scent compositions.",https://images.unsplash.com/photo-1582735689369-4fe89db7114c?w=400&h=300&fit=crop,https://www.acquadinoto.com,Italy,2017,niche,,,,2025-07-18T12:32:10.942225,2025-08-28T08:33:03.123439
cmd171526273a429fc485a6,Acqua di Parma,"Acqua di Parma is a luxury fragrance and personal care brand that represents the essence of Italian craftsmanship and style. Founded in 1916, the company started with the creation of Colonia, a refreshing cologne that gained immediate acclaim for its quality and unique blend of citrus and floral notes. The brand has since expanded its product offerings to include a diverse range of perfumes, home fragrances, and personal care products, all characterized by their elegance, artisanal production, and authentic Italian heritage. Acqua di Parma has become synonymous with luxury, and its sophisticated fragrances convey a deep sense of tradition blended with modernity.",https://images.unsplash.com/photo-1587017539504-67cfbddac569?w=400&h=300&fit=crop,https://www.acquadiparma.com,Italy,1916,niche,,,"Via S. Barbara, 9, 43121 Parma PR, Italy",2025-07-18T12:32:10.942225,2025-08-28T08:33:12.358255
cmdb8b8cfd6c0b0bbf25030,Acqua di Portofino,"Acqua di Portofino is a luxury fragrance brand inspired by the picturesque Italian village of Portofino. The company aims to encapsulate the essence of Italian summer, the Mediterranean lifestyle, and the enchanting scenery of its namesake. Known for its high-quality ingredients and sophisticated aromas, Acqua di Portofino creates scents that evoke memories of sunlit coasts, vibrant nature, and Italian elegance, appealing to connoisseurs of niche perfumes.",https://images.unsplash.com/photo-1587017539504-67cfbddac569?w=400&h=300&fit=crop,https://www.acquadimportofino.com,Italy,2014,niche,,,,2025-07-18T12:32:10.942225,2025-08-28T08:33:19.438583
cmdca8d37f09db259e598d0,Acqua di Sardegna,"Acqua di Sardegna is a luxury fragrance brand inspired by the enchanting landscapes and rich traditions of Sardinia. The company specializes in creating perfumes that capture the essence of the island, using high-quality ingredients to evoke the scents of the Mediterranean environment. Their story is rooted in authenticity and a deep connection to local culture, reflecting the artisanal craftsmanship and natural beauty of Sardinia in each product.",https://www.acquadisardegna.com/feedaty_logo_h15.svg,http://www.acquadisardegna.com,Italy,2012,niche,,,,2025-07-18T12:32:10.942225,2025-08-28T08:33:27.347265
